Date,Hour,Minute,Tweet text,Polarity,Sentiment
01/15/2017,11,05,"legs Haven t played with the big girls in months We had sweet love like the good old instagram com p BPSoTFTACLI",0.330000,1
01/15/2017,11,05,"We getting the word and looking for single ladies Aj nephew loj godisgood godisgreat instagram com p BPSoRUXFCDh",-0.071429,-1
01/15/2017,11,05,"heros and villains Americano instagram com p BPSoRhCggB7",0.000000,0
01/15/2017,11,05,"Look at influencers from years of data to learn what would resonate with followers newyorkcity instagram com p BPSoSNwh6jK",0.000000,0
01/15/2017,11,05,"Stuyvesant Brooklyn instagram com p BPSoQgvgK6G",0.000000,0
01/15/2017,11,05,"cmaconference paquitodrivera peppinosings Westin New York At Times Square instagram com p BPSoPbYBlRA",0.136364,1
01/15/2017,11,05,"CLEARANCE SALE Take up to 50 off including sale items Plus free shipping online Hurry instagram com p BPSoOrdgPJd",0.400000,1
01/15/2017,11,05,"mist light rain temperature up 25 F 33 F humidity down 79 59 wind 5mph 8mph",0.122222,1
01/15/2017,11,04,"I dreamed I had to portray Linda Loman in DEATH OF A SALESMAN She has my favorite line in the instagram com p BPSoOTXDbby",0.500000,1
01/15/2017,11,04,"Join the next podcast at the Innovation Lab Jason Retailgeek Goldberg SVP Commerce Content instagram com p BPSoN6rjTlo",0.000000,0
01/15/2017,11,04,"New year new you Use code boozybabe for some off your first sassclassnyc course Shoot a instagram com p BPSoNxqAp8p",0.174242,1
01/15/2017,11,04,"nyc usa detail america museumofnaturalhistory museum travel americaneagle metal instagram com p BPSoNXSAF K",0.000000,0
01/15/2017,11,04,"Viva Senor Sto Nino ThankYouLord angelaa fygg instagram com p BPSoLsFBVgb9 749NElZhtKlHGbdKZNMxjSqTmg0",0.000000,0
01/15/2017,11,04,"Disgusting RT People really paying 80 for hacked firesticks I ll do it for 20 cash if you give me the firestick lmao",-0.066667,-1
01/15/2017,11,04,"Pic 1 of 3 AUTHENTIC GEORGE HANSEN A 1960 s Mid Century Modern Collectible classic in modern instagram com p BPSoKYkhl9c",0.094444,1
01/15/2017,11,04,"BabyBoy will be here next month February 2017 York New York instagram com p BPSoJPLDQkId uAUAm c8qBPx6qxJ93ScVorLBY0",0.068182,1
01/15/2017,11,04,"Ambassador Reiichiro Takahashi addresses the crowd at a New Year party sponsored by the instagram com p BPSoJFrjLlu",0.136364,1
01/15/2017,11,04,"If anyone is still looking for a pair of airpods they have one s Hookup in Brooklyn NY swarmapp com c h4RHdev7tF3",0.000000,0
01/15/2017,11,04,"UBER Uber er Where SHE on Her Way to LGA LaGuardiaAirport instagram com p BPSoHz h8tWk i04zG6FJ5XdI2Or0HRghalpayQ0",0.000000,0
01/15/2017,11,03,"Pic 2 of 3 AUTHENTIC GEORGE HANSEN A 1960 s Mid Century Modern Collectible classic in modern instagram com p BPSoGeNBhKX",0.094444,1
01/15/2017,11,03,"Matchday Come on United mufc united guinness James s Gate Publick instagram com p BPSoECYgoFX",0.000000,0
01/15/2017,11,03,"Pic 3 of 3 AUTHENTIC GEORGE HANSEN A 1960 s Mid Century Modern Collectible classic in modern instagram com p BPSoDbDB6tE",0.094444,1
01/15/2017,11,03,"For it snow on our last day made this trip even better zakonhistravels newyorkcity newyork instagram com p BPSoC6klVR4",0.250000,1
01/15/2017,11,03,"miss you xo bwood staywarm Shoppe by BWOOD instagram com p BPNuPI gW5b",0.000000,0
01/15/2017,11,03,"Just posted a photo Fitness Valley Stream instagram com p BPSoBePAyvE",0.000000,0
01/15/2017,11,03,"Here we go Will the BIGGEST match of the weekend live up to the Hype MUNLIV PLonNBC",0.136364,1
01/15/2017,11,02,"Happy birthday to this fly kid We still got it but I don t know if we ll ever be as cool as instagram com p BPSn Dljy4",0.650000,1
01/15/2017,11,02,"Darkness cannot drive out darkness only light can do that Hate cannot drive out hate only instagram com p BPSn NmjnSe",-0.240000,-1
01/15/2017,11,02,"Su Cuerpo En Licra Jlo jenniferlopez Vs instagram com p BPSn9VsjgSn nSTJK1OSJcEI2KLQnhG2HDV1yw0",0.000000,0
01/15/2017,11,02,"Drink it or put it in a checked bag lol https twitter com HitDaBoogiez s tatus 820654403346690049",0.800000,1
01/15/2017,11,02,"Today s article is about hitting that point of being stuck how why what to instagram com p BPSn7anAlst",0.000000,0
01/15/2017,11,02,"Things got nuts at our Friday w fatheavenband and qwamband and the gang s instagram com p BPSn61blvwg",0.000000,0
01/15/2017,11,02,"I had the pleasure of attending a New Year party sponsored by the Consulate General of Japan in instagram com p BPSn6S9DZke",0.093182,1
01/15/2017,11,02,"Even though it s the dead of winter great things coming to benefit our Union Twp youth instagram com p BPSn50Jg7pq",0.300000,1
01/15/2017,11,02,"repost via from Great studio vibe last night with friends instagram com p BPSn5pSh MG",0.400000,1
01/15/2017,11,02,"Shine until tomorrow Fields in New York NY swarmapp com c 17ZhrfqokG8 pic twitter com 9GSUAU8U9I",0.136364,1
01/15/2017,11,02,"TONIGHT TONIGHT TONIGHT Queens Sunday January 15 2017 club embassynyc instagram com p BPSn4w0hUiq",0.000000,0
01/15/2017,11,01,"Sister sister on a snowy SoHo night sisters soho nycnights downtownnyc celebrate instagram com p BPSn3yYjaku",0.000000,0
01/15/2017,11,01,"toomuchsauce swag rolling blunt York and New Jersey border line instagram com p BPSn2F9DCnl",0.136364,1
01/15/2017,11,01,"Ellen DeGeneres Selects Sunday Funday with ellen degeneres instagram com p BPSn1 pjRyk",0.000000,0
01/15/2017,11,01,"filmming elfantasmademinovia movie elfantasmademinovia indiocine francisadamez instagram com p BPSn0wAB4sr",0.000000,0
01/15/2017,11,01,"bts brooklyn samui samuibrooklyn navyyard instagram com p BPSnznVjrR0",0.000000,0
01/15/2017,11,01,"THIS January Jones dropping knowledge here Couldn t agree with instagram com p BPSnzrvgelSi 74NPFTEvPJqS iWvnQC wccSdA0",0.000000,0
01/15/2017,11,01,"happybirthday Bay Plaza Movie Theater instagram com p BPSnzdkhTnK",0.000000,0
01/15/2017,11,01,"I m at Homecrest Playground in Brooklyn NY w swarmapp com c 0HouyMsG2Ao",0.000000,0
01/15/2017,11,01,"SOCCER STAR FOOTBALL MAGAZINE 18 8 62 VOL10 48 MANCHESTER UNITED SPAIN http ebay to 2jThG2V pic twitter com ePCbnFj38k",0.000000,0
01/15/2017,11,01,"1983 FA CHARITY SHIELD LIVERPOOL v MANCHESTER UNITED FOOTBALL PROGRAMME http ebay to 2jTnoS9 pic twitter com Zwzgd5Rd0D",0.000000,0
01/15/2017,11,01,"Wonder what stories this abandoned storefront could tell Bergen New Jersey instagram com p BPSnxXGgD6K",0.136364,1
01/15/2017,11,00,"GameDay NoFlyZone OhGi Park instagram com p BPSnw9zB5aul CRyWCogcMhobTYNfXWPKgCjozk0",0.000000,0
01/15/2017,11,00,"13 De Enero Jlo jenniferlopez shopping smile instagram com p BPSnwyejsVf5 oIWRfPH3qietxOrrbGrpbK4uWE0",0.300000,1
01/15/2017,11,00,"Damn I b everywhere tho Garden instagram com p BPSnviihVi7Y gg9 i4NKLKp OKVwHb7xfC0E7s0",0.000000,0
01/15/2017,11,00,"Camino a Harlem a ver si entramos a una misa GospelSaturday instagram com p BPSnvhYFraNa bvvweaG Xt9v4RxkNhIIwMdHuM0",0.000000,0
01/15/2017,11,00,"About last night at the ResortsWorldCasino Moveitlikethis Video instagram com p BPSnvYeBnHuQ GceE042iii8Kh bNmDkPymEFNo0",0.000000,0
01/15/2017,11,00,"Photographed the Crown Prince of Iran Reza Pahlavi and his family on assignment for instagram com p BPSnu Ij3R9",0.000000,0
01/15/2017,11,00,"Mandarin Oriental Fan Club Benefits https denisealevy com promotions man darin oriental fan club benefits",0.000000,0
01/15/2017,11,00,"Kepler and Fuji good friends Sunday morning basenji basenjisofinstagram nyc York instagram com p BPSnuIZhkk",0.700000,1
01/15/2017,11,00,"Fur season monstyletue York New York instagram com p BPSntXegbIo",0.136364,1
01/15/2017,11,00,"Nuthatch BW BHPortDev Park instagram com p BPSnrk Bjcx",0.000000,0
01/15/2017,11,00,"Mexican brunch at in Brooklyn NY swarmapp com c 77dSddZuJPC",0.000000,0
01/15/2017,11,00,"DontMiss RadicalRETAIL Panels at NRF17 Sunday 1 15 Tweet follow convo with US instagram com p BPSnqVgB4aG",0.000000,0
01/15/2017,11,00,"2 for 1 beers from 6pm 10pm Play games drink beers make friends gamenights drinkspecials instagram com p BPSnqAAgkmR",0.000000,0
01/15/2017,10,59,"Art is anything you can get away with andywarhol popart moma nyc The Museum of instagram com p BPSnpf1gF9T",0.000000,0
01/15/2017,10,59,"Birthday Brunch s Tea Cup Chapter II instagram com p BPSnojBhzyR",0.000000,0
01/15/2017,10,59,"Preach https twitter com xeni statuses 820428372689842176",0.000000,0
01/15/2017,10,59,"Stop in on this very Chilly Sunday for Brunch and this Steak and Eggs with 4 Bloody Mary s instagram com p BPSnnvFDZcP",-0.790000,-1
01/15/2017,10,59,"Passing by Lincoln Center this brisk Sunday morning after finding a tight parking spot and now instagram com p BPSnmQxDwUS",-0.139286,-1
01/15/2017,10,59,"Hati timelessmasterpiece215 Square Garden instagram com p BPSnl6Sgbpz",0.000000,0
01/15/2017,10,59,"Wake up It s brunch day Pic by jo5e NY Sky instagram com p BPSnk1ljWri",0.000000,0
01/15/2017,10,59,"DontMiss RadicalRETAIL Panels at NRF17 Sunday 1 15 Tweet follow convo with US instagram com p BPSnkdEBFK3",0.000000,0
01/15/2017,10,59,"woodside deseosnightclub queens cali colombian salsa guateque instagram com p BPSnkQthfl7D uOkAlM8q7IDj8INFe3mkKWaicI0",0.000000,0
01/15/2017,10,59,"Life Fitness it s bigger than just GainZ GymStones at Flatbush swarmapp com c 5IsPdwhL1LJ pic twitter com pvGIVBmUCZ",0.000000,0
01/15/2017,10,59,"Love to go nyc chrystlerbuilding grandcentralstation grandcentral Central Terminal instagram com p BPSnjQqAdvJ",0.250000,1
01/15/2017,10,59,"social media gives you the space to be vulnerable real authentic Art of the influencer instagram com p BPSni3OBdmC",0.094444,1
01/15/2017,10,59,"Ready to vacationharder here we go HORNS UP F Kennedy International Airport instagram com p BPSnhlzgHc",0.100000,1
01/15/2017,10,59,"asidesimple viveydejavivir York New York instagram com p BPSnisJgoPEn A8 5J MZYhooi HFGg6X9I8Bhc0",0.136364,1
01/15/2017,10,59,"Nice Just sold in my eBay store That makes my 3rd sketch cover sold Thanks so much for liking instagram com p BPSjqyfgHiO",0.250000,1
01/15/2017,10,58,"Why hello KBBQ back at it again with a food adventure alongside whitecoatedinsugar instagram com p BPSnhl5hCSm",0.000000,0
01/15/2017,10,58,"Why Must A Person Smell Like Ass On This Beautiful Sunday Morning",0.850000,1
01/15/2017,10,58,"my city tumblrpictures York New York instagram com p BPSngb B220",0.136364,1
01/15/2017,10,58,"He aprendido que esperar es la parte m s dif cil y si el tren no se para en tu estaci n no te instagram com p BPSne7RASMi",0.000000,0
01/15/2017,10,58,"Couldn t ask for a better crew Hoorah Extreme Sports instagram com p BPSngIvAREt",0.187500,1
01/15/2017,10,58,"Thank you Mr President York New York instagram com p BPSnef4hUusJ zJqFBeZGbHb1WZh7TrK6VjTMTY0",0.136364,1
01/15/2017,10,58,"pixelforest Museum in New York NY w swarmapp com c 1qiCNef5ZDb",0.136364,1
01/15/2017,10,58,"true",0.350000,1
01/15/2017,10,58,"Finally getting to bask lol Brooklyn instagram com p BPSnbXWAp3WA YhQ1qVKxOVDHtNcKcEywLbI6OQ0",0.400000,1
01/15/2017,10,57,"Simple statement wristparty armparty armcandy wristwear ootd wishlist swarovski instagram com p BPSna5pAXhh",0.000000,0
01/15/2017,10,57,"juuzme2016 astoria brunch brunching bottomlessmimosas boozy boozybrunch nyc instagram com p BPSna4WD px",0.000000,0
01/15/2017,10,57,"I had a wild rebuttal for this but NO P",0.100000,1
01/15/2017,10,57,"Stanley vs balloons Brooklyn instagram com p BPSnU5fgcGB",0.000000,0
01/15/2017,10,57,"Despu s no cae mal esta vueltecita por ac Road Edgewater instagram com p BPSnT sBA4V",0.000000,0
01/15/2017,10,57,"Repost from Inspired by all the brands that debut at Punto in the heart of the instagram com p BPSnT PAECK",0.000000,0
01/15/2017,10,57,"asidesimple York New York instagram com p BPSnT3XA8c 7jt fG h2bTG4GinJlDZT0KwCQ0",0.136364,1
01/15/2017,10,56,"Sunday strolls poodlesofinstagram poodle weekendvibes sundayfunday furbaby winter nyc instagram com p BPSnSHfDj2g",0.000000,0
01/15/2017,10,56,"I m at for Harry Potter and the Chamber of Secrets in Brooklyn NY swarmapp com c kmAxD4ru0Qa",0.000000,0
01/15/2017,10,56,"First Open House Today Highly sought after 29th floor 1bd 1ba plus a storage cage at the instagram com p BPSnQhtgXwY",0.136667,1
01/15/2017,10,56,"I m at Roasting House in Brooklyn NY swarmapp com c 2X0I1cdMf8K",0.000000,0
01/15/2017,10,56,"Starwood Luxury Privileges Benefits https denisealevy com promotions sta rwood luxury privileges benefits",0.000000,0
01/15/2017,10,56,"I m at Planet Fitness in Astoria NY swarmapp com c 9zK0WI1bJ00",0.000000,0
01/15/2017,10,56,"I m at West New York NJ in West New York NJ swarmapp com c 9UJLdkoZCfq",0.136364,1
01/15/2017,10,56,"RT Phil needs to take a long walk on a short pier https twitter com HoopsRumors st atus 820655471413567489",-0.025000,-1
01/15/2017,10,56,"Family is everything Manhattan instagram com p BPSnN74ByYa",0.000000,0
01/15/2017,10,56,"newyork lovecitylife York New York instagram com p BPSnNe6BZqi",0.136364,1
01/15/2017,10,56,"I m at 62nd Blvd East in West New York NJ swarmapp com c 9FAHxQJLZUz",0.136364,1
01/15/2017,10,56,"A00619 NEW Eliminates the requirement that hunters wear back tags during hunting season in the state http bitly com XFYUa9",0.068182,1
01/15/2017,10,56,"jujuis22 bella hatkoff 22 mypumpkin happiest hour Happiest Hour NYC instagram com p BPSnNAUgw97",0.000000,0
01/15/2017,10,56,"Brothers in arms Extreme Sports instagram com p BPSnM8dgzSq",-0.125000,-1
01/15/2017,10,56,"It s cold Drink coffee coffee cofeeeee matcha latte coffeetime instagram com p BPSnMisAw 0",-0.600000,-1
01/15/2017,10,56,"Little dragon big city Brooklyn instagram com p BPSnMe3gilSm DtKFpPUqVaaF4XKAlOPI4bSRxE0",-0.093750,-1
01/15/2017,10,55,"Just posted a photo Park instagram com p BPSmbwbgSd0",0.000000,0
01/15/2017,10,55,"I got this left over jerk chicken from last night trying to hold off until the games start but I can t resist",-0.200000,-1
01/15/2017,10,55,"I m finally an actor It says so in print York New York instagram com p BPSnLADAtIK",0.068182,1
01/15/2017,10,55,"Huge huge huge match this morning and we ll have it with SOUND kickoff at 11am soccer instagram com p BPSnK8IjI A",0.400000,1
01/15/2017,10,55,"socialmedia is an energy exchange Positive responses can give affirmation nrfbigshow instagram com p BPSnIdxBkIy",0.227273,1
01/15/2017,10,55,"Time for Catechism Lady of Angels Church instagram com p BPSnHNGhS0Q",0.000000,0
01/15/2017,10,55,"740 calories 1 hour on the elliptical while blasting 80s hit songs Power in Brooklyn NY swarmapp com c 0bTqHKA5YvG",0.000000,0
01/15/2017,10,54,"Just posted a photo York New York instagram com p BPSnEmMBxa8",0.136364,1
01/15/2017,10,54,"Pure de papa huevos con aji y cebosha queso mozarella y salamy A buen tiempo daddycancook instagram com p BPSnDtFgLRy",0.214286,1
01/15/2017,10,54,"It was a long night mynene mylittleman mylittlehelper instagram com p BPSm U BhE9I 7NGzForlb0oeXNB7Q3uhBP2C9Y0",-0.050000,-1
01/15/2017,10,54,"Easy like Sunday mornings on the UWS at kirshnyc pictured is our homemade french toast with instagram com p BPSm ZCALVd",0.216667,1
01/15/2017,10,53,"I m at Trader Joe s in New York NY swarmapp com c 0RxfFj1DuEf",0.136364,1
01/15/2017,10,53,"Good Morning Mi Gente we need to move Sunday service to Monday January 16th 12 4pm at DEEP RUN instagram com p BPSm867g3Qo",0.350000,1
01/15/2017,10,53,"in my sunday best katespadeny 789madison ootd fashionblog York instagram com p BPSm8u A5HB",1.000000,1
01/15/2017,10,53,"My boys York New York instagram com p BPSm8OIDKHA",0.136364,1
01/15/2017,10,53,"Still my favourite view in NYC ManderinOriental Oriental New York instagram com p BPSm77Mjn5z",0.136364,1
01/15/2017,10,53,"Morning York New York instagram com p BPSm7pZBbbM",0.136364,1
01/15/2017,10,53,"Haven t had dim sum in a whileeee Need Soup dumplings from carmaeastnyc East instagram com p BPSm6bIDfPQ",0.100000,1
01/15/2017,10,53,"We re BACK The Artistry This Sunday Jan 15th from 1pm 4pm Tune in on instagram com p BPSm5u2D2at",0.000000,0
01/15/2017,10,53,"Our new flavor is sunny and cold just like Brooklyn pinacoladeeda ripeandready instagram com p BPSm5pGB0Xs",-0.231818,-1
01/15/2017,10,53,"Fact No food in general actually RT No other Caribbean country food come close to Jamaican food TBH",0.056250,1
01/15/2017,10,53,"Current needs and mood Thank You Amy AmyMurphyStudio2017 GoodMorning Grier Studios instagram com p BPSm4gzA8iq",0.000000,0
01/15/2017,10,53,"Our latest episode with tkappers is OUT Today I sit down with Tracey Kaplan Territory Sales instagram com p BPSm3EyhWlY",0.172222,1
01/15/2017,10,53,"335 East 92nd Street Manhattan pic twitter com CLlQsCiofi",0.000000,0
01/15/2017,10,52,"New socamix real sweet tunes for Carnival2017 the treasury could down we jammin instagram com p BPSm2SuFcaK",0.168603,1
01/15/2017,10,52,"We tend to be more real on social it is a poetic language nrf17 experience nrfbigshow instagram com p BPSm1KAhpBQ",0.308333,1
01/15/2017,10,52,"So much energy in the room that it could blow the bloody roof off energy music eric gales instagram com p BPSm01aggUY",-0.300000,-1
01/15/2017,10,52,"yesterday East Side instagram com p BPSm0f7Bt0H",0.000000,0
01/15/2017,10,52,"Bro RT Wow pic twitter com 2P7SdU0VYx",0.100000,1
01/15/2017,10,52,"Too many birthdays this month to keep up Stepped out with the homie to enjoy his birthday instagram com p BPSmy82Adc9",0.450000,1
01/15/2017,10,52,"Incident on US19 NB at Wilson Av http 511ny org EventDetails T RANSCOM ORI146118601",0.000000,0
01/15/2017,10,52,"cowboysnation cowboys playoffs nfl 1republikna Republik North Arlington instagram com p BPSmydxhDlt",0.000000,0
01/15/2017,10,52,"Long distance relationships mad stupid lol Unless ya was with eachother for a good minute before it became distant",-0.012500,-1
01/15/2017,10,52,"Just posted a photo Fitness Club Fresh Meadows instagram com p BPSmwoWAQUW",0.300000,1
01/15/2017,10,52,"GOOD MORNING NYC LETS HAVE SOME FUN THIS MORNING TUNE INTO HOT 97 SUNDAY MORNING 11am instagram com p BPSmwcuBo2M",0.416667,1
01/15/2017,10,52,"Magic East Side instagram com p BPSmwYfgjyQ",0.500000,1
01/15/2017,10,51,"Yesterday s unds instagram com p BPSmeAYAHTD",0.000000,0
01/15/2017,10,51,"Art of the influencer google partnered with anthropologists to truly understand why we instagram com p BPSmrHLhUyM",0.000000,0
01/15/2017,10,51,"All the essentials this Sunday AM sesame seed highfiber GG crackers with cream cheese instagram com p BPSmp0ojzqj",0.000000,0
01/15/2017,10,51,"Happy SUNday PC coolgirlcollective Phoodieur explorerestaurantsvisually brunch instagram com p BPSmoStjbap",0.800000,1
01/15/2017,10,51,"and you can say what is or fight for it close your mind or take a risk up up newyorkcity instagram com p BPSlCeFBzZK",0.000000,0
01/15/2017,10,50,"THIS THURSDAY WE TAKING OVER MARK CALENDER AGAIN JAN19TH BIRTHDAY VIPS WE DOING IT instagram com p BPSmmkYDy81",0.000000,0
01/15/2017,10,50,"Winter days call for winter capes taylormaecloset York New York instagram com p BPSmmN5DYrC",0.136364,1
01/15/2017,10,50,"Happy Sunday everyone remember don t ever skip breakfast Love Oatmeal Sunday instagram com p BPSmmGbB4yD",0.650000,1
01/15/2017,10,50,"February 9th Painting on the Rocks 7pm Tickets are almost sold out Get yours now Link is on instagram com p BPSml SDkip",0.000000,0
01/15/2017,10,50,"Things are better if i stay So long and good night Night Brooklyn instagram com p BPSmljSBSRN",0.383333,1
01/15/2017,10,50,"Welcome to NRF innovation in retail amazing solutions in AI and robotics Javitt instagram com p BPSmiJdhHvJ",0.700000,1
01/15/2017,10,50,"HOUSE MUSIC LOVERS Join me TODAY SUNDAY Jan 15th Martin Luther King Jr Weekend No work or instagram com p BPSmiN3D7Un",0.000000,0
01/15/2017,10,50,"Just posted a photo York New York instagram com p BPSmhXGjwzjP sVT GghBpxb 5pQFc1uThp1jRc0",0.136364,1
01/15/2017,10,49,"Traveling with a dragon is interesting lol Good Morning We cuddled instagram com p BPSmgZNgxb h yEeWoBhCFXvOdMzfaZSusO0oKM0",0.666667,1
01/15/2017,10,49,"November 23 2016 86 25 251st Street Bellerose Queens 595 000 1 unit 1 008 sf one family home two stories detached",0.000000,0
01/15/2017,10,49,"Homecoming Raymond Ravens Basketball instagram com p BPSmfIhg3DW",0.000000,0
01/15/2017,10,49,"HOUSE MUSIC LOVERS Join me TODAY SUNDAY Jan 15th Martin Luther King Jr Weekend No work or instagram com p BPSmea6gOJo",0.000000,0
01/15/2017,10,49,"TONIGHT 8pm 12am 2241 1st Ave corner of 115 St Harlem NY 5 instagram com p BPSmb8vjytx",0.000000,0
01/15/2017,10,49,"I m at Garrett Leight Optical in New York NY swarmapp com c cwRTwNdYDCH",0.136364,1
01/15/2017,10,49,"Jams are partying hard at the new World Market in Industry City Plus World Market instagram com p BPSmZy5Aewp",-0.077652,-1
01/15/2017,10,49,"spiritualwarrior alignedinhiswill hallelujah Baptist Church of Teaneck instagram com p BPSmZxYAQ00",0.000000,0
01/15/2017,10,49,"Bringing out some very cool old enamelware today One Judge piece has this very cool label instagram com p BPSmZbAha0m",0.336667,1
01/15/2017,10,48,"Favorite gym toy Stuyvesant Brooklyn instagram com p BPSmYweFY7L",0.500000,1
01/15/2017,10,48,"THIS THURSDAY WE TAKING OVER MARK CALENDER AGAIN JAN19TH BIRTHDAY VIPS WE DOING IT instagram com p BPSmYRNjkYs",0.000000,0
01/15/2017,10,48,"LaLa Land Cinemas in Forest Hills NY swarmapp com c 2Fbu4AXPHLh",0.000000,0
01/15/2017,10,48,"Winter s morning run Slow and steady base miles springprep optoutside settingintentions instagram com p BPSmWWghmUK",-0.311111,-1
01/15/2017,10,48,"Wishing all at the augustwilson an amazing final performance of jerseyboysbroadway this instagram com p BPSmWAyDog2",0.300000,1
01/15/2017,10,48,"Damas y caballeros aqu les presento a mi nueva entrenadora de gym JOhn Yocovelli instagram com p BPSmVIYBErD",0.000000,0
01/15/2017,10,48,"Just posted a photo Lowes Fresh Meadows 7 instagram com p BPSmVJYjYJV1 OE5k aQzATGPkefG2WZcwFxRkU0",0.300000,1
01/15/2017,10,48,"So excited about this session nrf17 newyorkcity deloitte nrfbigshow retail socialmedia instagram com p BPSmUelhTFK",0.375000,1
01/15/2017,10,48,"The squad LITU ENT Tunnel instagram com p BPSmS9ahV2IO vxk8lT8kjjFjBMrG96k9ywy5O00",0.000000,0
01/15/2017,10,48,"Going to meet Peter at the perk Park instagram com p BPSmSUvDjKQ",0.000000,0
01/15/2017,10,47,"Breakfast Homecook Brooklyn Hill Brooklyn instagram com p BPSmRLFg3HR",0.000000,0
01/15/2017,10,47,"I m at Saturdays Surf NYC in New York NY swarmapp com c awj9RFbyg05",0.136364,1
01/15/2017,10,47,"Fluffy like the and cozy like the This super adorable shearling jacket is on sale instagram com p BPSmPVqAMW1",0.108333,1
01/15/2017,10,47,"Con la mama m s hermosa del mundo York New York instagram com p BPSmPWDAktGL LvD 4Jt4bmbnS4HHoRHE6BCBw0",0.136364,1
01/15/2017,10,47,"Our Passion johnnyrockets with duyguademoglu goksanozmandesign NewYork instagram com p BPSmL KhC5v",0.000000,0
01/15/2017,10,47,"Good morning Hoboken winter nature peace River Waterfront Walkway instagram com p BPSmL2MAQgo",0.700000,1
01/15/2017,10,47,"Bow so hard York New York instagram com p BPSmK RjP3s",-0.077652,-1
01/15/2017,10,46,"commercialrealestate porn nyc New York NoMad instagram com p BPSmKVYBDdr",0.136364,1
01/15/2017,10,46,"Not a bad view of Liberty at NYC instagram com p BPSmI2jFOONk 6Y 0H08Td L0 UtjCRuZDs2Naw0",0.350000,1
01/15/2017,10,46,"Yo I love btkids talent show These young people have such depth I don t even think the instagram com p BPSle9LgFB8",0.200000,1
01/15/2017,10,46,"Take your ass to the barber shop Tell the barber that you re sick of looking like an asshole instagram com p BPSmFn Ac1b",-0.714286,-1
01/15/2017,10,46,"NewThisDay Writing From My Photo Stream kellydumar com new blog 2017 1 15 newthisday writing from my photo stream",0.136364,1
01/15/2017,10,46,"Maternity Sessions in the park Loved shooting with this beautiful couple instagram com p BPSmD9QgGI",0.775000,1
01/15/2017,10,46,"A00800 NEW Prohibits the sale of handgun ammunition to any person unless the person can produce proof of a fire http bitly com WAMeP1",0.136364,1
01/15/2017,10,46,"Listos Repost OnAir Comenzamos de 12 2pm con lo mejor de la Moda y instagram com p BPSmDUFAIMW",0.000000,0
01/15/2017,10,45,"In Food As Medicine NYC we learned about scientific evidence regarding the amount of ALA you instagram com p BPSmCWLDLRm",0.000000,0
01/15/2017,10,45,"modeling showcase2017 girls asian american west new Yok instagram com p BPSmCSfDCWni 3fPlhWbesHXKb5kGhdsC6 NG840",0.045455,1
01/15/2017,10,45,"Introducing LivinginItalian with registereddietitian Fiorella cookingvideos for real instagram com p BPSl96fAuZP",0.200000,1
01/15/2017,10,44,"One of three Victorian blouses in shop Size 10 modern S M 48 100 poly lace is rayon instagram com p BPSl7glBO4h",0.200000,1
01/15/2017,10,44,"Let Me Give You A Reason Really Not To Like Me Don t Need You Nor Your Approval I don t instagram com p BPSl6iNjwI6",-0.100000,-1
01/15/2017,10,44,"I did some exploring this morning So many things I saw made me think about the effects of instagram com p BPSl4ShjSvE",0.500000,1
01/15/2017,10,44,"All Things New crosspointebaptistchurch com podcast 2017 1 15 all things new",0.136364,1
01/15/2017,10,44,"Collect moments not things friendschristmas collegereunion tradition Moon Harbour on instagram com p BPSl2iqhL8Z",0.000000,0
01/15/2017,10,44,"Final Sunday morning FIT class with this wonderful teacher KARA TREMEL and it is also her final instagram com p BPSl2d3h9E",0.350000,1
01/15/2017,10,43,"Mimosa a Deep South Biscuit Best Brunch Starter Ever Get your groove on with us today instagram com p BPSl0jogek0",0.500000,1
01/15/2017,10,43,"NRF K Javits Convention Center in New York NY swarmapp com c lPp7xn54CGW",0.018182,1
01/15/2017,10,43,"The ref got clipped jackdegale network Boxing Brooklyn NYC instagram com p BPSlykGAZnq",0.000000,0
01/15/2017,10,43,"Just wanted to let you know that Herbalife has lowered the membership fee for preferred instagram com p BPSlwYVgTRk",0.000000,0
