Date,Hour,Minute,Tweet text,Polarity,Sentiment
10/24/2017,18,47,"Just posted a photo Village Manhattan instagram com p BapedsplrF4",0.000000,0
10/24/2017,18,47,"TONIGHTS MOOD JOIN FOR HAPPY HOUR RIGHT NOW WHERE MY SCORPIOS AT instagram com p BapeWYCDNx2",0.542857,1
10/24/2017,18,47,"Meanwhile half way around the world on a big screen in NYC thank you We instagram com p Bapedg1DZVh",-0.083333,-1
10/24/2017,18,47,"Multi Colored Necklace from our new collection Pic via instagram com p BapUWrEj6ZN",0.136364,1
10/24/2017,18,47,"deliverydotcom sushihouseofhoboken sushilover happybirthday happy9thbirthday instagram com p BapeTujjja4",0.000000,0
10/24/2017,18,47,"Sublime Night With Seth Meyers instagram com p Bapeb2 hI8H",0.000000,0
10/24/2017,18,47,"Jake and James of Common Garden rocked their open source bioreactor as exhibitors at instagram com p BapeVsrDzri",-0.150000,-1
10/24/2017,18,47,"Stage 3 Emotional Rollercoaster Vocal Mix instagram com p BapeT82HN86",0.000000,0
10/24/2017,18,47,"Writing them lyrics instagram com p BapeYwRg0kK",0.000000,0
10/24/2017,18,47,"Episode 30 out now link in bio nycmodel nycart nycphotographer nycnightlife nyc model instagram com p BapeND4gEhq",0.000000,0
10/24/2017,18,47,"Fall feels s Island Park instagram com p BapeZ hlliF",0.000000,0
10/24/2017,18,46,"SCAPULAR MOVEMENT It s essential to be able to utilize every direction of movement instagram com p BapeRXGniaI",0.250000,1
10/24/2017,18,46,"I m at WSET International Wine Center in New York NY swarmapp com c fN8JKUPGcrQ",0.012121,1
10/24/2017,18,46,"Made our way through the concrete jungle with this beautiful girl instagram com p BapeTtegTxcq 9cKVJRLUMujygye6Z QA7mz2 U0",0.500000,1
10/24/2017,18,46,"Donde quiera que vayamos y pase lo que pase al observar las estrellas sabr que ves las mismas instagram com p BapeUudlwGB",0.000000,0
10/24/2017,18,46,"Creating love art sayitwithroses printonarose A Real Rose That last 2 Years instagram com p BapeUULF 37",0.466667,1
10/24/2017,18,46,"Day 297 Of The 365 Day Photo Be free little one be free After a long day of back to back instagram com p BapeR0AndWs",0.093750,1
10/24/2017,18,45,"Pobrecita caramba en New York New York instagram com p BapeGZWnYIt",0.136364,1
10/24/2017,18,45,"I m at Carolines on Broadway in New York NY swarmapp com c eiQb4F3DLNW",0.136364,1
10/24/2017,18,45,"We re back next month same ole same ole with cella instagram com p BapeQeoj fo",0.000000,0
10/24/2017,18,45,"A AP Rocky X GQ stylingshaiqspere com new blog 2 201 7 10 24 aap rocky x gq",0.136364,1
10/24/2017,18,45,"I JUGG IT STRAIGHT OFF THE CRATE MEET ME York New York instagram com p BapeNscFk2c",0.168182,1
10/24/2017,18,45,"I m at in New York NY swarmapp com c fYDLFQ8a6m8",0.136364,1
10/24/2017,18,45,"This motley crew of genius minds tisch instagram com p BapeNDsDgHiN 2JDNdxYC4RrLfgMHuX6wtOR5bU0",0.600000,1
10/24/2017,18,45,"Ulterior Gallery is pleased to present two solo presentations of work by artist Joseph Morris instagram com p BapeC7VD7IL",0.250000,1
10/24/2017,18,45,"Waiting to hear John Grisham and Amor Towles speak Ann the Holy Trinity Church in Brooklyn NY swarmapp com c 2W1mlVQ6s1f",0.000000,0
10/24/2017,18,45,"Essentials608 Restaurant Lounge Tuesday Ladies1stTuesday 21 Up HappyHour 5pm 8pm instagram com p BapeIr1HFdY",0.000000,0
10/24/2017,18,45,"juanluis joyeria jl l mas fuente en prendas en New York New York instagram com p BapeHUPl02Qi WMcSb4kaZb9ax oe 222W WmCU0",0.136364,1
10/24/2017,18,45,"Grilled Shrimps and Pan Seared Scallops Perfecto Scottadito 788 Union St Park Slope pic twitter com 8Xe4xCLU3O",0.000000,0
10/24/2017,18,45,"My Journey with breast cancer Part 3 My Journey with breast cancer Part 3",0.000000,0
10/24/2017,18,45,"LemonadeMaker I didn t get one pic alone w my parents but as collected instagram com p BapeKY0ldi4",0.000000,0
10/24/2017,18,44,"LAST WEEK to find these fingers in your bath Show 45 Sahana Ramakrishnan sahanabanana A instagram com p BapeKNClUC3",0.000000,0
10/24/2017,18,44,"pressplay Or login and watch the whole video Link in The Bio All I m saying Tho instagram com p BapeIeuFsOv",0.200000,1
10/24/2017,18,44,"I M BAAAAACK and wasting no time TinyBeautifulThings at National Treasure instagram com p BapeHQzBOWb",0.000000,0
10/24/2017,18,44,"I m at Swedish Residence in New York NY swarmapp com c 82CrLxcfD27 pic twitter com UKYmHkISNO",0.136364,1
10/24/2017,18,44,"FOT GRAFO fotografia fotografo catin catrina arte tradicion instagram com p BapeIcbFpUfl PYcVtZYAwZhHxg tEYlCs8TOFI0",0.000000,0
10/24/2017,18,44,"Blowout and Silk Press transformation Come get a blowout with me at Ouidad NYC Flagship Salon instagram com p BapdoXKgJCx",0.000000,0
10/24/2017,18,44,"I m at in New York NY swarmapp com c 6o6n86DjUpL",0.136364,1
10/24/2017,18,44,"Big Mac sushionjones sushionjones on Jones instagram com p BapeGA4HbkX",0.000000,0
10/24/2017,18,44,"Drinking a Tuna by at http untp beer s c519208984",0.000000,0
10/24/2017,18,43,"Posted on the corner outside the bodega out in Dyckman putting my dude AO on to the classic NYC instagram com p BapeCqIj3A6",0.083333,1
10/24/2017,18,43,"Incident on 76Bus at Hackensack Bus Terminal http 511ny org EventDetails T RANSCOM ORT25947607",0.000000,0
10/24/2017,18,43,"These are the worst social media accounts https twitter com Bar Americana status 922952603524354049",-0.483333,-1
10/24/2017,18,43,"Better than racist Starbucks Bene in Jackson Heights NY swarmapp com c g0HBXlbPVgo",0.500000,1
10/24/2017,18,43,"Mi novio de hockey es un drag n Sparky goislanders Center instagram com p BapeAaCnaAH",-0.100000,-1
10/24/2017,18,43,"rainy day lunch stories curried butternut squash soup with the fixins Assemblage NoMad instagram com p Bapd 8LjGpc",0.000000,0
10/24/2017,18,43,"This Saturday come rock with me in RichmondHill at Lituation DoYaMoneyDance instagram com p BapeAKFHWq2",0.000000,0
10/24/2017,18,43,"I m at Donburiya in New York NY swarmapp com c 8rDcIm5fe69",0.136364,1
10/24/2017,18,43,"I m at LaGuardia Airport in East Elmhurst NY swarmapp com c 8E00dmLtnMh",0.000000,0
10/24/2017,18,43,"STYLED AND SHOT BY ME MEDIUMFORMAT FILM XAVIERSCOTTMARSHALL Brooklyn instagram com p Bapd8tWADq4",0.000000,0
10/24/2017,18,43,"Join us November 5th for our NYC marathon party Complementary craftbeer cocktail or mimosa for instagram com p Bapd8ifD70T",0.000000,0
10/24/2017,18,43,"Deep crawl party s Bar Kitchen in New York NY swarmapp com c 0BipHbpKKCH",0.068182,1
10/24/2017,18,43,"Legal Issue thetrumpreport Man threatened to blow Trump s brains out feds say http dlvr it PxQ5N4 artusalawfirm Call 9733379643 pic twitter com Ejj29LsLnv",0.200000,1
10/24/2017,18,43,"My first time seeing this even though I ve lived in NYC longer than it s been here Pretty instagram com p BapdpwPFXLQ",0.250000,1
10/24/2017,18,42,"Looking ahead cred camarena New York instagram com p Bapd7l4hh f",0.136364,1
10/24/2017,18,42,"CliveOwen in MButterfly mbutterflybway broadway play nyc thebigapple travel wanderlust instagram com p Bapd6PmHMWM",0.000000,0
10/24/2017,18,42,"Ready to sparkle tonight at Private event with the lovely honeytaps instagram com p Bapd5wjhQEh",0.233333,1
10/24/2017,18,42,"Stage 2 Despite All My Rage I Am Still Just A Rat In A Cage Bullet With Buttetfly Wings instagram com p Bapd5SEnMBG",0.000000,0
10/24/2017,18,42,"Puppy thoughts Lol Village Queens instagram com p Bapd2sznbWq8 50TRjQwv5h OJKNPBkKZhzHRPs0",0.800000,1
10/24/2017,18,41,"Brunch testing riceandgold for our dim sum br much coming soon and Gold instagram com p Bapd0KNlzbq",0.150000,1
10/24/2017,18,41,"Why I can t be worried about others but people think I am being mean Nope Repost instagram com p Bapdy7zgpZH",-0.312500,-1
10/24/2017,18,41,"stapling and unstapling studiowalls creativeprocesses insidethestudio instagram com p BapdyLmDKlI",0.000000,0
10/24/2017,18,41,"Thank you for being so wonderful on so many levels beetlehousenyc love instagram com p BapdwtCDnTw",0.666667,1
10/24/2017,18,41,"Day 2 coffeeandcornbread goodeats cleaneats teaneck instagram com p BapdvW1n3sZz BbmAZUDkA JfFzOcS0 9B4ZCuc0",0.000000,0
10/24/2017,18,41,"NY TVD after party turnervolunteerday turnerlife Warner instagram com p Bapdk8Rgt3qU exQdaxAHr6cXp8DG rVs1QfZS40",0.000000,0
10/24/2017,18,41,"TODAY S rotflmao York New York instagram com p BapdszAD PU",0.136364,1
10/24/2017,18,41,"WATCH OUT FOR THE RACIST BATHROOM NAZZI I AIN T BUYING SHIT HERE in Jackson Heights NY swarmapp com c gItmUHlt5rD",-0.200000,-1
10/24/2017,18,41,"Free Invite Sat Nov 4th Roperdope Ent Invites You To APPRECIATION Huge Complimentary Event instagram com p Bapdte8FkAV",0.366667,1
10/24/2017,18,41,"Color Dorado mahogany lo ultimo para el octo o anti frizz BOTOX by instagram com p BapdtTgnOMzl baMH ldkH m2kaVlWVy1yrtW8g0",0.000000,0
10/24/2017,18,40,"on a mission photo creds gina jen Plaza State Park instagram com p Bapdsn3AC x",0.000000,0
10/24/2017,18,40,"With photographer deadndrippin femalebeettlejuice instagram com p BapdlP3HTYO XHhYfCZQRZGMKxuCyrLQcgHA640",0.000000,0
10/24/2017,18,40,"Desde el viernes pasado las clases de adultos est n canceladas los viernes por 5 semanas m s instagram com p BaYGAPBh Du",0.000000,0
10/24/2017,18,40,"BreezyPoint FarRockaway Queens Rockaway NewYork Beach photography Rockaway New York instagram com p BapdkLbHl O",0.136364,1
10/24/2017,18,40,"pouting in a loft somewhere in dumbo Jones instagram com p BapdrFaDfks",0.000000,0
10/24/2017,18,40,"Fall is here fall allstars New York instagram com p Bapdi4BAoeU",0.136364,1
10/24/2017,18,40,"Repost get repost Se acab la espera HOY el video de B SAME en mi canal de instagram com p BapdpkcjtQF",0.000000,0
10/24/2017,18,40,"SOOO happy I finally got to see my loves in Charlie and the Chocolate instagram com p BaoeobHj9h6",0.400000,1
10/24/2017,18,40,"Me and ellis thedon got other songs together this just one of em MajorTease instagram com p BapbsOYFUsa",-0.125000,-1
10/24/2017,18,40,"Sending my energy to my brother Jack Room Audio instagram com p BapdoAzHtqJS X i115 bc5etTTL8kjKt2e1E1Q0",0.000000,0
10/24/2017,18,40,"I m at Mamajuana Caf in Secaucus NJ swarmapp com c hrAA9KfWnSh",0.000000,0
10/24/2017,18,39,"I think our wedding is all packed tbh it s nothing but sound equipment doc martens and tulle instagram com p BapdeQkjUgN",0.400000,1
10/24/2017,18,39,"Not only Fashion is in my world photo photoshoot photograph photography picture ny instagram com p BapdlklFz6f",0.000000,0
10/24/2017,18,39,"If fossil fuels continue to be extracted at this rate over the next 28 years global average instagram com p BapdZypF15J",-0.050000,-1
10/24/2017,18,39,"Incident on GladstoneBranch WB at South Orange Station http 511ny org EventDetails T RANSCOM ORT25947507",0.000000,0
10/24/2017,18,39,"Look who I m coming to see at Carolines on Broadway on Broadway instagram com p BapdhKdFhhY",0.000000,0
10/24/2017,18,39,"Harvy Apartments instagram com p BapdeyzhWoHY LS9u8ajdjpERyG j8eN4rbL5aU0",0.000000,0
10/24/2017,18,39,"emo fortunecookie instagram com p BapdhGMhSu1",0.000000,0
10/24/2017,18,39,"Everyone out here hyped on the Dodgers but I m right here hyped instagram com p BapdEjLDDZQZ m0IB2bstSKnCVMpou s8vML0n80",0.285714,1
10/24/2017,18,38,"Goodness you re so pretty New York City Manhattan instagram com p BapddPtBSX5",0.193182,1
10/24/2017,18,38,"LGI at for vs in Brooklyn NY swarmapp com c 1wkmlTPQJyX",0.000000,0
10/24/2017,18,38,"because this is gonna be my new thing I guess in New York NY swarmapp com c lGd8yXGym2F",0.136364,1
10/24/2017,18,38,"T H E F I N A L E Couture instagram com p BapdbkEhrOdO AG5E1Dvf0PBnD1PDFdEcL3l7400",0.000000,0
10/24/2017,18,38,"trianguloswag com Hq instagram com p BapdbZaHXO6",0.000000,0
10/24/2017,18,38,"Rain York New York instagram com p BapdZ3hjmNg",0.136364,1
10/24/2017,18,38,"So I come home and get bombarded by this Lil puppy TaiChi such a instagram com p BapdUAoHGyFC Rndlqg8VJBdxRV0SSaXv VMdig0",0.000000,0
10/24/2017,18,38,"currentsituation laststopbx after work set up Bronx instagram com p BapdNuhBItlt iiga3S6LFwEiKdZNqnBw8H4qJ00",0.000000,0
10/24/2017,18,38,"I m at MTA Subway W 4th Street Washington Square A B C D E F M in New York NY swarmapp com c hFNkF71KmDF",0.136364,1
10/24/2017,18,38,"ALL YOU NEED IN LIFE IS MONEY POWER AND A DOPE FREESTYLE BY mikemezzl Courtesy of instagram com p Bapaeu6h3oY",0.000000,0
10/24/2017,18,37,"studio openhouse rental This cute studio comes fully furnished nestled in the heart of instagram com p BapdF2qg Cg",0.500000,1
10/24/2017,18,37,"Pre Queens drinks Drinking a Double Standard by at http untp beer s c519206649",0.000000,0
10/24/2017,18,37,"As you might know I like to express myself through my music Well here are the stages of emotion instagram com p BapdWNVnwrt",0.000000,0
10/24/2017,18,37,"Color botox hightlig by MARIA MARTINEZ Hair Studio instagram com p BapdVNqH U4M UhWlcCxjYmtfTqZ QkDQb89Zic0",0.000000,0
10/24/2017,18,37,"create evantattoo evantattooinNYC tattootrip finelinetattoo tattoo instagram com p BapdUP7nOdB",0.000000,0
10/24/2017,18,37,"The show starts in 20 minutes From Away instagram com p BapdUIpDK2M",0.000000,0
10/24/2017,18,37,"Happy Therapy Dog Tuesday Giving some pet therapy and getting lots of love in return to instagram com p BapBlN4BCbe",0.650000,1
10/24/2017,18,37,"alumnti behind the scenes by the one and only newyorkmade instagram com p BapdQsAh1zD",-0.200000,-1
10/24/2017,18,37,"Just some of my ABSOLUTE FAVORITE Garcia Artistry instagram com p BapdQdoBI0g",0.350000,1
10/24/2017,18,36,"I almost got my phone pregnant Where she at tho instagram com p BapdLQ4BsPW3 OAuBdy4IBgCHU1 PFkQveQgjQQ0",0.333333,1
10/24/2017,18,36,"trianguloswag com Hq instagram com p BapdNC9H7k3",0.000000,0
10/24/2017,18,36,"With lydiadeetz lydiacosplay peripateticfangirl deadndrippin instagram com p BapdMaZHgvTG 33ISZwr8vIPuWRUm34KhdwH5Sc0",0.000000,0
10/24/2017,18,36,"Love is love loveislove designergearymarcello foxxyfacecouture tomoffinland leather gay instagram com p BapdMaKDGvx",0.472222,1
10/24/2017,18,36,"Estreno Mundial Modo De Ataque Ft monetypegram https goo gl HJFJh5 via instagram com p BapdHrIHxQe",0.000000,0
10/24/2017,18,36,"West Side instagram com p BapdLa A2Hn",0.000000,0
10/24/2017,18,36,"Book ART x GLAM Beauty inc for your next studio session nycbeauty instagram com p BapdLFdDNRn",0.000000,0
10/24/2017,18,36,"Just posted a photo Studios instagram com p BapdK78jC6S0 z0rD0gA70ZEGkFzraRN4fQZEwk0",0.000000,0
10/24/2017,18,36,"nao feelslike New York instagram com p BapdKv2Bfay",0.136364,1
10/24/2017,18,36,"I didn t have a bathroom to renovate so I made a sponge cake with mango whipped cream instead instagram com p BapdKQAlV84",0.000000,0
10/24/2017,18,36,"TACO TUESDAYS NEW VENUE NEW LOCATION vialenyc NEXT DOOR TO MADE IN MEXICO SAME SPECIALS 1 instagram com p BapdJeKBRZ6",0.068182,1
10/24/2017,18,36,"I m at Golds Gym in Teterboro NJ swarmapp com c ftQw9v7IdaJ",0.000000,0
10/24/2017,18,36,"Legal Issue thetrumpreport Jeff Flake Republican senator quits with attack on http dlvr it PxQ2zc artusalawfirm Call 9733379643 pic twitter com xjW4B1pE5i",0.200000,1
10/24/2017,18,35,"Playtime with best good boy Duncan Little tail wagging away instagram com p Bapc1a0gbX8",0.504167,1
10/24/2017,18,35,"Repost with instatoolsapp It was a honor to work with you on Meteor Man instagram com p BapdHi3Fmug",0.000000,0
10/24/2017,18,35,"Typical nyc parkavenue Building instagram com p BapdGTBny24",-0.166667,-1
10/24/2017,18,35,"trianguloswag com Hq instagram com p BapdFnjnL11",0.000000,0
10/24/2017,18,35,"Ask and it shall be given seek and you will find knock and the DOOR will be open instagram com p BapdEl1BWtN",0.000000,0
10/24/2017,18,35,"Fallback fallsoltice Gotkicks gotgeer FUNKYFRESH instagram com p BapdEmlFYKR7 YjHw3Ftuitjg2w19TUU7feL58M0",0.000000,0
10/24/2017,18,35,"Off to meet the new UK ReedPOP Family JFK LHR WheelsUp in 60 MCMLDN17 POPLife instagram com p BapdEHzBeLT",0.136364,1
10/24/2017,18,35,"Plants and stuff inktober inktober2017 comics drawing art illustration wip process instagram com p BapdEOQlnf0",0.000000,0
10/24/2017,18,35,"Open mic showcase tonight 7 11pm 10 cover 1 drink minimum 21 age limit Lounge swarmapp com c gdn1seMVmtA",0.000000,0
10/24/2017,18,35,"Customer photo of the Nihola Family on a test ride in Prospect Park cycling bike bikes instagram com p BapdBswHNJr",0.000000,0
10/24/2017,18,35,"Signing and numbering CornersinJeremyville 4 color screenprint has launched at the instagram com p BapdBbgnVaG",0.000000,0
10/24/2017,18,35,"Yooo i ran into King Krule outside of warsawconcerts KingKrule bk Brooklyn Greenpoint NYC instagram com p BapdBd0nFMI",0.000000,0
10/24/2017,18,35,"The world is a book and those who do not travel read only one page instagram com p BapdBLJhMu n ooh7UbcalefBGVY8Fb99Hwkcso0",0.000000,0
10/24/2017,18,34,"The NBA is getting off to a really heated start Aldridge and Ibaka in a lil scuffle last instagram com p Bapc5ggl9mm",0.100000,1
10/24/2017,18,34,"",0.000000,0
10/24/2017,18,34,"askAROD Repost Thanks for your questions Keep them instagram com p Bapc3xeHhOR5 evG8FNPZEbmierIcIvczONONMo0",0.200000,1
10/24/2017,18,34,"Brooklyn In love with this place nyc New York instagram com p Bapc7MXg 07",0.318182,1
10/24/2017,18,34,"SIGNED BY MCFLY KNOWS WHAT IT TAKES This that OH GAWD WE GOT EM Shout out to the instagram com p Bapc6HWDG J",0.000000,0
10/24/2017,18,34,"Getting my hair re twisted my FroHawk long like my You put the word musiclife instagram com p Bapc6nPjzHu",-0.275000,-1
10/24/2017,18,34,"Flight cancellations afternoon in NY danemariful hodglobal Square Tower instagram com p Bapc6fKBbTr",0.000000,0
10/24/2017,18,34,"El Virus del Papiloma Humano HPV desarrolla tu SexoSentido SeXoEducate Pa que no te cuenten instagram com p Bapccg9nYRH",0.000000,0
10/24/2017,18,33,"Sauce Center instagram com p Bapc4Z nkrp",-0.100000,-1
10/24/2017,18,33,"10 24 17 7 00pm mbutterflybway Theatre instagram com p Bapc37mD2e6",0.000000,0
10/24/2017,18,33,"Litty in New York City w Park in New York NY swarmapp com c 8yI3gBpqZkH",0.136364,1
10/24/2017,18,33,"385 Powers Avenue the Bronx pic twitter com CUUkA6hlo8",0.000000,0
10/24/2017,18,32,"I need to reorder some Relief I love my It Works Products Being a product of my products instagram com p Bapcyc APNA",0.500000,1
10/24/2017,18,32,"Getting into the spooky spirit happyhalloween allhallowseve halloween instagram com p Bapcw6FHFa",0.000000,0
10/24/2017,18,32,"Great building architecturephotography love building seeninnyc timeoutnewyork instagram com p Bapcwz9DXQK",0.650000,1
10/24/2017,18,32,"almost the etem treatment https twitter com BlueSeatBlogs status 922910613063561216",0.000000,0
10/24/2017,18,32,"Kit deep cleaning and KiraKira means shiny sparkly palettes These quads from instagram com p BapcuFUnHjJ",0.000000,0
10/24/2017,18,32,"Time to get away with a best friend and great luggage To the new 7th floor bloomiesbear instagram com p Bapctgjg5 B",0.645455,1
10/24/2017,18,32,"Barbara Chase Riboud Malcolm X Complete on view until November 4th BarbaraChaseRiboud instagram com p BapctcHBEI6",0.100000,1
10/24/2017,18,32,"Fantastic Show Toyin Ojih Odutola To Wander Determined Oct 20 2017 Feb 25 2018 instagram com p Bapcs5KAMi8",0.400000,1
10/24/2017,18,32,"See you tonight charity aspca dog cat pets petsofinstagram catsofinstagram instagram com p BapcrtHgMLw",0.000000,0
10/24/2017,18,32,"I wish this video did it justice 2 days 10 different looks each plus 10 extra talent Another instagram com p BapbFbAAXjg",0.000000,0
10/24/2017,18,31,"Contrary to popular opinion i am the HNIC New Jersey instagram com p BapcOKgFrSZ",0.368182,1
10/24/2017,18,31,"Stop by and check out our new C t AKA Malbec Coming from an organic producer in the Loire instagram com p BapcpmOl309",0.136364,1
10/24/2017,18,31,"Shout out to GO FOLLOW instagram com p BapcoNanbsi0 ezguf8CHj2Fu416FelApC j BA0",0.000000,0
10/24/2017,18,31,"CarabaoCup FT Swansea 0 2 Manchester United J Lingard 21 59 instagram com p BapcXE5FeXLm C PIIbJo8 YmbrJ8 wJ2 R4qV40",0.000000,0
10/24/2017,18,31,"I received a beautiful recommendation for my language instruction today from my dear student instagram com p BapccK0HJcu",0.850000,1
10/24/2017,18,30,"Getting a little bit better at this pizza thang vegan what fieldroast daiyafoods instagram com p BapchJgBkfG",0.156250,1
10/24/2017,18,30,"Construction on PortNewarkElizabethMarineTerminal http 511ny org EventDetails T RANSCOM ORC20210207",0.000000,0
10/24/2017,18,30,"The Fumata Bianca as found in 3 Ingredient Cocktails by robertosimonson Thanks for including instagram com p BapcbPgHIAe",0.200000,1
10/24/2017,18,30,"HAY LOOK SQUARES Ryan s Squared in Jersey City NJ w swarmapp com c cY3EqXdBG5M",0.000000,0
10/24/2017,18,30,"art The Museum of Modern Art instagram com p BapcaoblByG8 tpwTjZ2OQGiYlbJH959E3hxELQ0",0.200000,1
10/24/2017,18,30,"Fall Happenings thesimplisticchic com basics fall ha ppenings",0.000000,0
10/24/2017,18,30,"NY Surf Ave 610",0.000000,0
10/24/2017,18,30,"Tomorrow is WAYBACK WHENSDAY AT CAMARADAS EL BARRIO 2241 First Ave NYC CLASSIC VIBES Come see instagram com p BapcVaKBY5B",0.208333,1
10/24/2017,18,30,"Listening to Rachel Tiven of is simultaneously exciting and frightening While the instagram com p BapcawwDlmZ",-0.100000,-1
10/24/2017,18,30,"Thanks for the shoutout elevatedlocals Repost elevatedlocals get repost NYC heads instagram com p BapcdeagK5m",0.200000,1
10/24/2017,18,30,"yay for clean flea free kittens Thanks Dawn dish soap kittens kittenbath dawndishsoap instagram com p Bapcc2OADgi",0.322222,1
10/24/2017,18,29,"Just call me baldudak nickname honeylips She said it doe istanbul Dubai Frankfurt russia instagram com p BapccQCleCM",0.000000,0
10/24/2017,18,29,"No expectation No disappointment troyvelez modeltroyvelez model fitness fitfan fit instagram com p BapccMUnuTm",0.350000,1
10/24/2017,18,29,"My daughter left me the white of a blackandwhitecookie thanksforsharing toddlerlife s instagram com p Bapcal AX37",0.000000,0
10/24/2017,18,29,"Free Invite Sat Nov 4th Roperdope Ent Invites You To APPRECIATION Huge Complimentary Event instagram com p BapcXfBloPc",0.366667,1
10/24/2017,18,29,"Halloween Cupcakes and Broomsticks http crackednailsandsplitends co uk cooking hallow een cupcakes and broomsticks ad CampaignHashtag CollectiveBias",0.000000,0
10/24/2017,18,28,"Renter s dream a backyard garden oasis to chill in JustListed this 2 Bed rental in instagram com p BapcQxRAwqq",0.000000,0
10/24/2017,18,28,"Legal Issue artusalawfirm Fergie Breaks Down In Tears Over Divorce I Wanted http dlvr it PxQ0hL njdivorcelawyers Call 9733379643 pic twitter com oTKQy32FSz",0.022222,1
10/24/2017,18,28,"Day 2 Black and white photos No people No explanation Bridge City Hall Chambers instagram com p BapcKfoDp5s",-0.083333,-1
10/24/2017,18,28,"FANTASTIC SHOW Toyin Ojih Odutola To Wander Determined Oct 20 2017 Feb 25 2018 instagram com p BapcQGSg0Hd",0.400000,1
10/24/2017,18,28,"So yea this is hilarious TAG A FRIEND FOLLOW instagram com p BapcDiYF8ee",0.500000,1
10/24/2017,18,28,"If you really want to CHALLANGE yourself in how to do a proper front squat all you need is a instagram com p BapcPtTht0S",0.100000,1
10/24/2017,18,28,"THREE ARTISTS Sitting in a tree aclodhopper com tete a tete 20 17 10 24 three artists sitting in a tree",0.000000,0
10/24/2017,18,28,"Minor Adjustments BrandonMurphy co fashion designer NYFW style womenswear instagram com p BapcN8iA8MF",-0.050000,-1
10/24/2017,18,27,"Updated Incident on GardenStateParkway NB from Exit 143A to North of Exit 145 I 280 http 511ny org EventDetails T RANSCOM ORI167101001",0.000000,0
10/24/2017,18,27,"I m really excited because we re getting to visit the Scottish Highlands thanks to instagram com p BapcLRLl1wG",0.287500,1
10/24/2017,18,27,"falling over due to the fact that im today thanks for instagram com p BapcLX6DoFUH tFXF2 5EcPdjttbxrGv6RSa4jA0",0.037500,1
10/24/2017,18,27,"when you meet a coworker who s also from Texas and loves queso cloyingly sweet frozen margaritas swarmapp com c kZwjhQVKcQh",0.350000,1
10/24/2017,18,27,"A perfect day for a naturabisse inside the pureairbubble at barneysny facial spa luxury instagram com p Bapb3DsA8Sy",0.500000,1
10/24/2017,18,27,"Drinking a Harbor Ale by at http untp beer s c519202932",0.000000,0
10/24/2017,18,27,"Empire State of mind tuesdaysinnyc Avenue New York City USA instagram com p BapcHbYjiXy",0.136364,1
10/24/2017,18,27,"Indie Indie Cagematch with Mousketeers Triple Crown Ale House Restaurant in New York NY swarmapp com c fY3DCaAU1u8",0.045455,1
10/24/2017,18,26,"Delish Diner Dinner Coffee Shop in New York NY w swarmapp com c bg4XTnIaX8V",0.136364,1
10/24/2017,18,26,"Trying to inform about the UN at Aron s Kindergarten earlier today instagram com p BapcEQLjgQCl elry9A WZLZUG7F cvHDnpjhdU0",0.000000,0
10/24/2017,18,26,"walkeronthetracks thewalkingdead fearthewalkingdead ftwd twd thewalkingdeadencounter instagram com p BapcC3bhZQo",0.000000,0
10/24/2017,18,26,"Coach Kyrell eager to coach his new 7th grade recruits welcome newarkyouth growingfamily instagram com p BapcCMohYVi",0.468182,1
10/24/2017,18,26,"So happy with all the goodies I got from http us althea kr altheakorea has great selection instagram com p BapcAT2nCA6",0.800000,1
10/24/2017,18,26,"bon jour it s talkwithdonsheatuesday ask me or talk with me about anything ya want in the instagram com p Bapb evlGgQ",0.000000,0
10/24/2017,18,26,"A07951 Passed Makes a technical correction relating to the process of selling surplus fire equipment and vehicles http bitly com YWiHmz",0.000000,0
10/24/2017,18,25,"nba Island Immigration Museum instagram com p Bapb C1ApmX",0.000000,0
10/24/2017,18,25,"Hoping sees this and DM s me New Jersey instagram com p Bapb9faB8Xw kIU61HwIYprJ9mW1Njyc VmNJc0",0.136364,1
10/24/2017,18,25,"Copy of 2 Ignored Flight Booking Hacks to Save You a Ton of Money on Airfare thatsagoodtaste com in travel fli ght saver wlh2j hrrxc s5ecz",0.000000,0
10/24/2017,18,25,"Today s mood Whatever York metropolitan area instagram com p Bapb8Ifhx27",0.000000,0
