Date,Hour,Minute,Tweet text,Polarity,Sentiment
10/24/2017,17,43,"So sorry I ve been out of action with posting content I had to take a break after what happened instagram com p BapWmLYlrZB",-0.200000,-1
10/24/2017,17,43,"Meet UFC champ in NYC nybeercompany com beer events ny c meet ufc champ tyron woodley nybeerco nybeerco budweiser chosen1",0.000000,0
10/24/2017,17,43,"Repost New England heavy hitters would be performing in our instagram com p BapXFWFh6F5",-0.031818,-1
10/24/2017,17,42,"tfw you really just want to be home already somanypeople concretejungle nyc gaysian instagram com p BapXEUNgKLn",0.200000,1
10/24/2017,17,42,"good eats at jack s wife s wife Freda instagram com p BapXBHtDkmO",0.700000,1
10/24/2017,17,42,"Lady Liberty nyc gopro Of Liberty Liberty Island New York City instagram com p BapXDTrjIzb",0.136364,1
10/24/2017,17,42,"It s that time of year sundayfunday happybirthday greatweekend zeeandaliareinny instagram com p BapXCZ7Bp3l",0.000000,0
10/24/2017,17,42,"Legal Issue artusalawfirm Mary J Blige s Ex Demands More Spousal Support Over http dlvr it PxPjb7 njdivorcelawyers Call 9733379643 pic twitter com uAjPLkcl3Y",0.350000,1
10/24/2017,17,42,"I m at New York Sports Club in New York NY swarmapp com c 8eXEJfRHOln",0.136364,1
10/24/2017,17,42,"Vance Joy show at Brooklyn Steel last night vancejoy brooklynsteel Steel instagram com p BapW sLhLVT",0.400000,1
10/24/2017,17,42,"TipTuesday Lead the way UP with your chest This fixes a number of issues that will result in a instagram com p BapW 03l W",0.000000,0
10/24/2017,17,42,"Toasting to my 6th anniversary with my longest love NYC by Marriott New York instagram com p BapW3qcjKiw",0.318182,1
10/24/2017,17,42,"new work alert NO PARKING editorial in fall issue model instagram com p BapW K4AqR",0.136364,1
10/24/2017,17,42,"Just posted a photo instagram com p BapW97GhBYo",0.000000,0
10/24/2017,17,42,"I m at Blink Fitness in New York NY swarmapp com c ife7fdnYgk5",0.136364,1
10/24/2017,17,41,"does anyone recognize the panties on this mans head my great friend brought a instagram com p BapW8MAD9xV",0.800000,1
10/24/2017,17,41,"rshmurda for tubtimewithtate 2017 nyc York New York instagram com p BapW6ARBlVB",0.136364,1
10/24/2017,17,41,"Having dinner on the ship with my best girl CrystalSerenity 94 instagram com p BapW6GGhk9p",1.000000,1
10/24/2017,17,41,"2 9 instagram com p BapW3D3lRMI",0.000000,0
10/24/2017,17,41,"Good job Jeff I applaud your courage Anybody else with balls Come forward Knowing instagram com p BapW0rEgC a",0.700000,1
10/24/2017,17,41,"10 24 17 5 41pm workview584 York New York instagram com p BapW4ncB6gV5 P7JtYOvCp7rFbMKN8ISzk wlU00",0.136364,1
10/24/2017,17,41,"Just posted a photo instagram com p BapW5CNhFlW",0.000000,0
10/24/2017,17,41,"Coffee o clock ootd VenetoNYC Brooklyn instagram com p BapW3w4F9v6",0.000000,0
10/24/2017,17,41,"She sweet as brown sugar with the candied yams honey coated complexion NAME THAT instagram com p BapW3lgDdfz",0.350000,1
10/24/2017,17,41,"Darin Goldstein bringing another title back to golfbodynyc gbnyc livethegame instagram com p BapWwB nkoG",0.000000,0
10/24/2017,17,40,"Tonight s Dinner Specials Alitas y Papas foodie foodporn foodpost foodstagram instagram com p BapW04 lFfd",0.000000,0
10/24/2017,17,40,"The King F ng Cobra Tee is available until July for men and women in the shirt shop at instagram com p BapWyisDU2J",0.400000,1
10/24/2017,17,40,"The other day Heights Brooklyn instagram com p BapWiThh04g",-0.125000,-1
10/24/2017,17,40,"Drinking a Liquid Gold by 57 http untp beer s c519188274 photo",0.000000,0
10/24/2017,17,40,"There are spooktacular sorry I had to Halloween cocktail recipes and ideas on how to instagram com p BapWvFygDVc",-0.500000,-1
10/24/2017,17,40,"sonysquarenyc nice experience NY newyork SonySquareNYC instagram com p BapWvBCAGW8H Ltp oqJMYVPJoOhEnITKSYLjy40",0.600000,1
10/24/2017,17,40,"Rockefeller on a rainy day gopro nyc Center instagram com p BapWuw jHM0",-0.100000,-1
10/24/2017,17,40,"The Fire Dragon and Frost Dragon Tees are available until July for men and women in the shirt instagram com p BapWvJbDeIT",0.400000,1
10/24/2017,17,39,"Updated Incident on 5Line Both directions at Dyre Avenue Eastchester Station http 511ny org EventDetails T RANSCOM ORT25945407",0.000000,0
10/24/2017,17,39,"Spicy II Garden Indian Restaurant instagram com p BapWtPzhI80",0.000000,0
10/24/2017,17,39,"The Sinking Feeling Tee is available until July for men and women in the shirt shop at instagram com p BapWqJvjoR8",0.400000,1
10/24/2017,17,39,"my instagram is becoming balloons of New York could be onto something instagram com p BapWpnPDpIS",0.293182,1
10/24/2017,17,39,"Omg bloom garden popup at the oculos one of my favoritefragrance this instagram com p BapWJVdg2cR",0.000000,0
10/24/2017,17,39,"A Great Intermediate Montessori Lesson clockoferas Montessori Academy instagram com p BapWnfHD68C",0.800000,1
10/24/2017,17,38,"Drinking an Insetto by Art at http untp beer s c519187853",0.000000,0
10/24/2017,17,38,"The Doom Does Not Beg Tee is available until July for men and women in the shirt shop at instagram com p BapWmVcjyd8",0.400000,1
10/24/2017,17,38,"love mops andddd my Tiffany s bracelet from preteen years 90snostalgia instagram com p BapWl0bn6KU",0.500000,1
10/24/2017,17,38,"Mystery Solved I know you told Mark that we ve known each other since the 1st Grade I only instagram com p BapWk2qHgUH",-0.062500,-1
10/24/2017,17,38,"I m at Pleasantdale in West Orange NJ swarmapp com c a4Ab6YL059T",0.000000,0
10/24/2017,17,38,"We ve teamed up once again with our inspiring friend arosyruse jasmine to collect supplies for instagram com p BapWiVgFMt4",0.500000,1
10/24/2017,17,38,"therealromello laying down the groove for the track Ignite instagram com p BapWM9lD2fVl Pt0t6iu6wHMioahjLOwtZw0FAw0",-0.155556,-1
10/24/2017,17,38,"Repost thenyjp get repost Open up wide swallow down deep The next NYJP is on Friday instagram com p BapWiLRhyrN",-0.051111,-1
10/24/2017,17,38,"The Swinger Tee is available until July for men and women in the shirt shop at instagram com p BapWhpdj160",0.400000,1
10/24/2017,17,38,"I m at My West Orange Office in West Orange NJ swarmapp com c fAFmnQMHllm",0.000000,0
10/24/2017,17,38,"Make it a great day tonyandfelix tonycortopassi s Kitchen Manhattan instagram com p BapWgY lh8L",0.800000,1
10/24/2017,17,38,"Geez traffic sucks today Rt 80 on Midland in Saddle Brook NJ swarmapp com c 9d7RlcqvaKp",-0.300000,-1
10/24/2017,17,37,"Walking Dead Rick Morty Remark DM me or claim below nickjustusart sketch sketchcover instagram com p BapWYNCgRAB",-0.200000,-1
10/24/2017,17,37,"I m at the goal line blackyoungsta trl trl mtv tpain goalline Networks instagram com p BapRAbPlbem",0.000000,0
10/24/2017,17,37,"The King Asteroz Tee is now available until July for men and women in the shirt shop at instagram com p BapWdV1DKpA",0.400000,1
10/24/2017,17,37,"This some weed head shit RT https twitter com shannyshannn s tatus 922935488507363329",-0.200000,-1
10/24/2017,17,37,"IsaTip Con tan solo cambiar un peque o detalle como darle la vuelta al ruedo del pantal n instagram com p BapWdqvF4z7",0.000000,0
10/24/2017,17,37,"Blonde in Black photography photoshoot photo style mode fashion blackoutfit instagram com p BapWdkblCtJ",-0.083333,-1
10/24/2017,17,37,"LemonadeMaker Some people can do so much with their presence and position A heartfelt instagram com p BapWU 7FTXp",0.100000,1
10/24/2017,17,37,"en Manhattan in New York instagram com p BapWO9HAmi7",0.136364,1
10/24/2017,17,37,"The end of a stormy day makes this behemoth of new construction look almost interesting instagram com p BapWa0PHclI",0.318182,1
10/24/2017,17,37,"Tale as old as time beautyandthebeast tompkinssquaredogparade nyc instagram com p BapWXJ9g1ML",0.100000,1
10/24/2017,17,37,"Why the long faces yogithegolden abbytheviszla We are at your favorite place tillyswalks instagram com p BapWaOYFfKI",0.225000,1
10/24/2017,17,37,"Repost Ever wonder how the latest Planet of the Apes trilogy recorded ape instagram com p BapWWL nby9",0.500000,1
10/24/2017,17,37,"Naturally I got the Hamilton cocktail hamiltonmusical nyc worktrip Rum House instagram com p BapWSYuhoqe",0.100000,1
10/24/2017,17,36,"SATURDAY OCTOBER 28 presents HAUNTED HALLOWEEN Come sport your scariest costumes instagram com p BapWWZxA3zS",0.000000,0
10/24/2017,17,36,"Cleared Incident on US19TruckRoute NB at New Jersey Turnpike",0.136364,1
10/24/2017,17,36,"The Collector Tee is now available until July for men and women in the shirt shop at instagram com p BapWWPUD uG",0.400000,1
10/24/2017,17,36,"This feels very much like a Blue Velvet kind of day rainyday Thanks for this video 718mango instagram com p BapWExeAyZR",0.265000,1
10/24/2017,17,36,"Some lovely profits from today s session Message me to join my trading team Six month trials instagram com p BapWT DcHT",0.500000,1
10/24/2017,17,36,"You mean Bells Are Ringing at Theatre Row is running one more week and that s it Wow instagram com p BapWOI lldv",0.095833,1
10/24/2017,17,36,"I know you like my style Saturday the dopest DayParty Continues ILiikeYourrStyyle instagram com p BapWORQAXTC",0.000000,0
10/24/2017,17,36,"https vk cc 7gnsOg",0.000000,0
10/24/2017,17,36,"Had an amazing workout with someone that has the same passion and mindset as I do Always instagram com p BapWSGTgs0k",0.300000,1
10/24/2017,17,36,"The Allons y Tee is now available until July for men and women in the shirt shop at instagram com p BapWPCeDtJ5",0.400000,1
10/24/2017,17,36,"A07008 Passed Requires the division of service disabled veterans business development to issue a report to the http bitly com ZRJPl0",-0.200000,-1
10/24/2017,17,35,"And we back instagram com p BapWQjEBwhs",0.000000,0
10/24/2017,17,35,"Yes that s a leaf stuck to frenchiepixel s adorable tongue Only one of the cutest dogs I ve instagram com p BapWPfnH0Sc",0.250000,1
10/24/2017,17,35,"View from my window The glorious and magnificent sun emerges from instagram com p BapWN nX 1N Shr8ttYBScIgDAb 5PTRNhCNOk0",1.000000,1
10/24/2017,17,35,"Halloween night after I see azealiabanks I m bringing her to my table so she can hear my dj set instagram com p BapWOYyH CG",0.000000,0
10/24/2017,17,35,"The Tiger Lily Tee is available until July for men and women in the shirt shop at instagram com p BapWDszD820",0.400000,1
10/24/2017,17,35,"I Love To Live LIVE AddlerInspires ILoveToLive Grateful Orange New Jersey instagram com p BapVLuxAYpy",0.227273,1
10/24/2017,17,35,"Creating energy for the free crepes slowandsteady wins the race FCFestival shell instagram com p BapWJKZHGjG",0.350000,1
10/24/2017,17,35,"Repost by Have you met Brandon Metz Also known as DJ Fade The Future Brandon instagram com p BapWEHCgITq",0.000000,0
10/24/2017,17,34,"Still eating with the same niggas I starved with instagram com p BapWB6VAJQP",0.000000,0
10/24/2017,17,34,"Thank you jimenez tobacco for the custom hand rolled cigars Friends we ll all be smoking to instagram com p BapWJTtlcAE",0.000000,0
10/24/2017,17,34,"So happy i got to see my best friend and my team go undefeated instagram com p BapV i7jzXQO S5tkjvtfgVPNuXMSc3zcp66ai40",0.900000,1
10/24/2017,17,34,"New York med s ster 2011 newyork oldbutgold brooklyn Bridge instagram com p BapWH9uhpW4",0.136364,1
10/24/2017,17,34,"We re proud to announce Academy s own ERIC BLAZE has just released his second Lp of impeccably instagram com p BapWIARDAM6",0.537500,1
10/24/2017,17,34,"I can t with kids lol KidsToSeeTheDentistFriends CanYouSayTheDarndestThing Out instagram com p BapV 0ej8KK",0.800000,1
10/24/2017,17,34,"You only fail if you quit http SwayzeMcGrady com New Music New Content swayzemcgrady instagram com p BapV aMh7T6",-0.056818,-1
10/24/2017,17,34,"Rooftops 2013 newyork newyorker newyork ig newyorkers newyorkart instagram com p BapWETLFZ8u",0.000000,0
10/24/2017,17,34,"These 2 trouble makers don t let the cute faces fool ya tillyswalks dogwalker dog instagram com p BapV rNFZ2M",0.150000,1
10/24/2017,17,33,"tuesday Brooklyn instagram com p BapWCFfBVts",0.000000,0
10/24/2017,17,33,"Opening next week and a NEW original piece created by me will be hanging on the instagram com p BapWAE2Fjw9",0.170455,1
10/24/2017,17,33,"JUST LISTED FOR SALE New Jersey State Auto Auction 2008 INFINITI EX35 AWD http ow ly MWhE30g6AAt pic twitter com zRNdeseWm3",0.136364,1
10/24/2017,17,33,"JUST LISTED FOR SALE New Jersey State Auto Auction 2008 INFINITI EX35 AWD http ow ly MWhE30g6AAt pic twitter com 3JZRkptm9g",0.136364,1
10/24/2017,17,33,"The Raven Tee is available until July for men and women in the shirt shop at instagram com p BapV gkDtzT",0.400000,1
10/24/2017,17,33,"Announcement For the past several months I ve been working with 20 20 on a podcast and instagram com p BapV DphqN2",-0.125000,-1
10/24/2017,17,33,"Bonsoir Cl ment J avoue que je n en sais rien Je suis actuellement l tranger Se renseigner aupr s de la salle",0.000000,0
10/24/2017,17,33,"674 St Marys Street the Bronx pic twitter com Qw2yinlAmq",0.000000,0
10/24/2017,17,33,"in Days all Hell breaks loose ALMOST 600 TICKETS SOLD ALREADY ONLY GENERAL ADMISSION instagram com p BapV7ipBcUm",-0.008974,-1
10/24/2017,17,33,"Tonight NYC w the Home Team therealdjstacks Pull Up on instagram com p BapV7alH6up",0.000000,0
10/24/2017,17,32,"The I Amazon Tee is available for men women and kids in the shirt shop at instagram com p BapV5dbDlC3",0.400000,1
10/24/2017,17,32,"Arte Povera curadoria Ingvild Goetz Hauser Wirth l New York 548 West 22nd Street 12 Sep instagram com p BapV6TjDirN",0.136364,1
10/24/2017,17,32,"Going going GOOOONE Our bbq burger is not for the faint hearted Piled high with a 1 2lb instagram com p BapV6Ipj31S",-0.170000,-1
10/24/2017,17,32,"Scott getting over his fear of sharks well sort of Rockefeller Plaza instagram com p BapVzEFjbfw",0.000000,0
10/24/2017,17,32,"My man is so sweet He knows my passions and booked this sweet instagram com p BapV4qpHOuct WU1b72BtQ bwYrk4A08QuVNDrc0",0.350000,1
10/24/2017,17,32,"chess cityhallpark nyc iphone7plus Hall Park Manhattan NYC instagram com p BapV4jNluSK",0.000000,0
10/24/2017,17,32,"I d like the sincerely thank The Creator for another trip around the instagram com p BapV4TOAPueS wGhuqiXxgdPtQpSEspADsj0BBo0",0.500000,1
10/24/2017,17,32,"UNLV Trench 60 Day 2 Who s Coming Throwback instagram com p BapV31lHZcz",0.000000,0
10/24/2017,17,32,"Bye darling New York London Nyc Hotel instagram com p BapSZ rji1o",0.136364,1
10/24/2017,17,32,"Peach yogurt smoothie with caf 2017 http DrGraybeard com Daniele instagram com p BapV1fbFiDtN bQPFRZxR6AlgDzb5SYc5OYzKPg0",0.000000,0
10/24/2017,17,32,"pumpkin vegan cake vegancake jerseycity hoboken unioncitynj otsthattimeagain loveit instagram com p BapV0Uyl7OL",0.000000,0
10/24/2017,17,31,"Bringing the power vocals tonight Tonight Show Starring Jimmy instagram com p BapVzmMhXA5a lKVpvi96Lr11oyyYe8Cb1 a7js0",0.000000,0
10/24/2017,17,31,"Horoscope for Sunday October 29 After a stressful few days today is finally a bit restful instagram com p BapVznph ng",-0.100000,-1
10/24/2017,17,31,"Updated Incident on GardenStateParkway SB from North of Exit 144 CR 510 to North of Exit 139A Chestnut St http 511ny org EventDetails T RANSCOM ORI167093701",0.000000,0
10/24/2017,17,31,"Incident on US19TruckRoute NB at New Jersey Turnpike http 511ny org EventDetails T RANSCOM ORI167099901",0.136364,1
10/24/2017,17,31,"The firstfamilyoffashion are Proud Sponsors and Supporters of The Boys Girls Club of instagram com p BapVwVaHnmm",0.800000,1
10/24/2017,17,31,"Crazy shakes with HappyMama ItsAllAboutTheSweets RoadWarriorPerks Tap Midtown instagram com p BapVw8 FL8v",-0.600000,-1
10/24/2017,17,31,"Legal Issue artusalawfirm An emotional Jeannie Mai addresses divorce on The http dlvr it PxPdnc njdivorcelawyers Call 9733379643 pic twitter com KFdYotzxic",0.100000,1
10/24/2017,17,31,"Still searching for my Kweens Illana and Abbi broadcity Brooklyn Bridge Water Front instagram com p BapVuBZDoFS",0.000000,0
10/24/2017,17,31,"Retail therapy Thank you for the gift card at in New York NY swarmapp com c l2rKTNoZKqK",0.136364,1
10/24/2017,17,31,"THIS JUST IN In an attempt to raise more money for Puerto Rico we have listed many amazing instagram com p BapVt7FFRQa",0.533333,1
10/24/2017,17,31,"tangerine mandarin blooms plants green greenhouse orange color instagram com p BapVt1PjroC",-0.200000,-1
10/24/2017,17,31,"Trello helps Fog Creek say goodbye to 55 Broadway at in New York NY swarmapp com c 0aGQZptwgsf",0.136364,1
10/24/2017,17,30,"SIEMPREYCUANDO Park instagram com p BakqsKnjurf",0.000000,0
10/24/2017,17,30,"heavy intensity rain moderate rain temperature down 71 F 70 F wind 26mph 22mph",-0.118519,-1
10/24/2017,17,30,"Aquatic theme head to toe for EMP tonight getfresh getfat getlit York New York instagram com p BapVjViFXRU",0.136364,1
10/24/2017,17,30,"Afternoon reflections Terminal instagram com p BapVkdOgY5F",0.000000,0
10/24/2017,17,30,"Oh for the love of Mike I miss this show Manhattan College instagram com p BapVpqSlUQl",0.500000,1
10/24/2017,17,30,"Pray I don t get sick Beach 86th Street instagram com p BapVpCdFJ v",-0.714286,-1
10/24/2017,17,30,"Happy early birthday to me Thanks redbull tropical yellow instagram com p BapViuBjh d",0.275000,1
10/24/2017,17,30,"Straight arm strength 1 Weighted Victorian raise 2 Weighted Maltese raise 3 Weighted instagram com p BapVnVbgQz2",0.200000,1
10/24/2017,17,30,"FYI Harlem instagram com p BapVkEWnXKV",0.000000,0
10/24/2017,17,30,"Another one for newwork fashioncampaign allwhite trenchcoat eastriver skyline instagram com p BapVlrJhTEB",0.000000,0
10/24/2017,17,29,"Yay to youtubespaceny and for having us folks in the music production for instagram com p BapVfb9laXc",0.000000,0
10/24/2017,17,29,"swipeleft Thanks so much to all those who came out to Groundswell s studio exhibition instagram com p BapVdTUHvR2",0.200000,1
10/24/2017,17,29,"Join me at 7 00 p m on FacebookLive as I prepare my ChickenThighs on a bed of KaleSalad you instagram com p BapVe5ujEIe",0.000000,0
10/24/2017,17,29,"Holding on for dear life a top of the Empire State Building instagram com p BapVi GDIE5",0.500000,1
10/24/2017,17,29,"Arte Povera curadoria Ingvild Goetz Hauser Wirth l New York 548 West 22nd Street 12 Sep instagram com p BapVgy0jWGM",0.136364,1
10/24/2017,17,29,"Legal Issue thetrumpreport Donald Trump Would Rather Get Into Twitter Fights Than http dlvr it PxPcr7 artusalawfirm Call 9733379643 pic twitter com 4RwpzKiNql",0.200000,1
10/24/2017,17,29,"Summer dress repurposed blogger fashionista fashionblogger fashionblog instagram com p BapVeEfnVcq",0.000000,0
10/24/2017,17,29,"Always been the perfect prom date angelball2017 fuckcancer York New York instagram com p BapVeTNHRDN",0.568182,1
10/24/2017,17,29,"Happy 31st Born Day to the man himself Drizzy Drake because of you I developed such a instagram com p BapVeJgDFLs",0.300000,1
10/24/2017,17,29,"Miguel New York instagram com p BapVeSrhJqC",0.136364,1
10/24/2017,17,29,"Working on something ah maze ing riseup Studios instagram com p BapVePoFlT1",0.000000,0
10/24/2017,17,28,"Holloween StayOnTop SATURDAYS ELEMENT ROOFTOP LOUNGE TOP OF THE instagram com p BapVdezhshoM JJl XHBekib2mZ K1iSg6HaVok0",0.500000,1
10/24/2017,17,28,"Nashville cats in da house at BerkleeNYC ALWAYS a pleasure to kick it with Chuck Ainlay instagram com p BapVdH9Da1t",0.000000,0
10/24/2017,17,28,"Incident on WTCLine http 511ny org EventDetails T RANSCOM ORT25946607",0.000000,0
10/24/2017,17,28,"Incident on ToLine http 511ny org EventDetails T RANSCOM ORT25946607",0.000000,0
10/24/2017,17,28,"Incident on HOBLine Both directions http 511ny org EventDetails T RANSCOM ORT25946607",0.000000,0
10/24/2017,17,28,"still over here pretending it s fall York New York instagram com p BapVa QDFBx",0.136364,1
10/24/2017,17,28,"Literally the worst dental office ever I would not recommend this place for a dog they instagram com p BapVbtWj3Cp",-1.000000,-1
10/24/2017,17,28,"C P Company hoodie with goggles available now in shop bluecity knickerbocker bushwick instagram com p BapVXuklSh5",0.400000,1
10/24/2017,17,28,"Flatiron on a rainy day Building instagram com p BapVWltjJUg",0.000000,0
10/24/2017,17,27,"This is going to make everything better tonight No tickets No problem Come on by we ve got instagram com p BapVVm0hS93",0.500000,1
10/24/2017,17,27,"Neill set some big goals for himself to reach before his birthday in January Today he came in instagram com p BapVG7GH dp",0.000000,0
10/24/2017,17,27,"imaginedragons Center instagram com p BapVD Sl8OU",-0.100000,-1
10/24/2017,17,27,"Our latest collaboration with 4thstatellc and baxtingui combining woodandsteel at instagram com p BapVQQYHySb",0.500000,1
10/24/2017,17,26,"Are you REALLY going to leave me But look at my cute face oberonthevizsla tillyswalks instagram com p BapVPPIFRPH",0.350000,1
10/24/2017,17,26,"feels Park instagram com p BapVLBFHYeV",0.000000,0
10/24/2017,17,26,"Just posted a photo Center instagram com p BapVNIunTCi",-0.100000,-1
10/24/2017,17,26,"pick for Wednesday night records planet weirdo95 instagram com p BapVInTll6y",0.000000,0
10/24/2017,17,26,"Midnight ran devour at historic Green Wood cemetery Build in 1860s this NYC landmark became instagram com p BapVMsVl7SF",-0.100000,-1
10/24/2017,17,26,"OL Manhattan instagram com p BapVMMEAs29",0.000000,0
10/24/2017,17,26,"I just love bridal York New York instagram com p BapVHihgk1q",0.318182,1
10/24/2017,17,26,"They Will Believe You When They See You LetThemSeeYou SuccessTalks GO GO instagram com p BapT VWge17",0.000000,0
10/24/2017,17,26,"wearing not eating glasses https twitter com tubbyskintz st atus 922934451939749889",0.000000,0
10/24/2017,17,26,"I m at MTA Subway Court Square E G M 7 in Long Island City NY swarmapp com c gbQdZNSM4JW",-0.050000,-1
10/24/2017,17,26,"Thank you teenvogue for highlighting the ATTAGANG film cultivated by my soul sista mookiemoo instagram com p BapVKBlDd3s",0.000000,0
10/24/2017,17,26,"I ve been using products for about a year now Specifically for my beard face I instagram com p BapVKWxlJ a",0.000000,0
10/24/2017,17,26,"NYC bodegacat itsreal York New York instagram com p BapVJJgHQvoe d JD0feF58SPbwxz4I6hJzfhZc0",0.136364,1
10/24/2017,17,26,"i guess the benefit of Ryan getting push notifications each time i tweet is that he immediately lets me know when there s a typo",0.000000,0
10/24/2017,17,26,"S06916 NEW Relates to increasing the revised rule public comment period from thirty days to forty five days http bitly com Yaqte2",0.068182,1
10/24/2017,17,25,"tuesday Bridge instagram com p BapVFZFBAUc",0.000000,0
10/24/2017,17,25,"meanwhile tuesday work model nyc naturalhair guys instagood instagram instagram com p BapVFI Hf7w",0.000000,0
10/24/2017,17,25,"When wonders why and I are so it s because we spend every Tuesday at noon instagram com p BapVEkEnKqz",0.000000,0
10/24/2017,17,25,"Go ahead and be angry You do well to be angry but don t use your anger as fuel for revenge instagram com p BapVC 9nALf",-0.566667,-1
10/24/2017,17,25,"travel traveltheworld travelblogger landscapephotography landscape captures instagram com p BapVCuyAexT",0.000000,0
10/24/2017,17,25,"Upper Echelon H ROGLYPHIX ARCHIVES winter rocnationfreeconcert 4040club instagram com p BapUHPgnDe3",0.000000,0
10/24/2017,17,25,"It s Taco Tuesday at Fools Gold This weeks taco Marinated chicken in a curry sauce topped with instagram com p BapVBt5D RQ",-0.600000,-1
10/24/2017,17,25,"NYCmissed bra auction white bell bottoms m4w southampton https newyork craigslist org lgi mis d bra auctionwhite bell bottoms 6359438204 html pic twitter com 1pj1lDI7Qc",0.000000,0
10/24/2017,17,25,"NYCmissed EsTheR HoMe https newyork craigslist org brk mis d esth er 6358426709 html pic twitter com Nn45mk2tji",0.000000,0
10/24/2017,17,25,"NYCmissed Jet Blue flight to West Palm m4w Westchester https newyork craigslist org wch mis d jet blue flight to west palm 6359384158 html",0.000000,0
10/24/2017,17,25,"NYCmissed waitress during lunch at Six 8 Nine m4w Washington Ave and Prospect Pl https newyork craigslist org brk mis d wait ress during lunch at six 6359382787 html",0.000000,0
10/24/2017,17,25,"train nyc mta outofservice iloveny York New York instagram com p BapU1BOFPha",0.136364,1
10/24/2017,17,25,"NYCmissed Gay Dominican Male personal assistant or home cleaning m4m https newyork craigslist org mnh mis d gay dominican male personal 6359333162 html",0.138889,1
10/24/2017,17,24,"it s a good day when you go to d vsco vscocam vscodaily vscogram shotoniphone instagram com p BapU 5WAkwC",0.700000,1
10/24/2017,17,24,"I m at Sports in New York NY swarmapp com c 2ZPfTJAG5NF",0.136364,1
10/24/2017,17,24,"All your ultherapy questions answered thanks to the lovely KatherineRentmeester from instagram com p BapU608l3W",0.350000,1
10/24/2017,17,24,"ProjectSARAH 10 of all proceeds from tonight s service will be donated to the Project instagram com p BapU xIFyfW",0.000000,0
10/24/2017,17,24,"Mgp The Saw artista dominicano sale al ruedo musical internacional con su nuevo instagram com p BapU9xencnP",0.000000,0
10/24/2017,17,24,"Updated Incident on 13Bus EB at Newark Broad Street Station http 511ny org EventDetails T RANSCOM ORT25946407",0.062500,1
10/24/2017,17,24,"Blade Runner 2017 streetphotography nofilter sinfiltro documentaryphotography colors instagram com p BapU95YFtzS",0.000000,0
10/24/2017,17,24,"NY State of Pink Mind My Unexpected Pinks Photography pink New Fashion Travel VLOG is instagram com p BapU9dDjzfU",0.009091,1
10/24/2017,17,24,"Horoscope for Saturday October 28 Today s is a bit cranky as she argues with Mercury instagram com p BapUD9HhdSk",0.000000,0
10/24/2017,17,24,"Grilled Shrimp Salad with our Signature Jerk Seasoning Feel the Island Spices right in your instagram com p BapU2Mal2EB",0.285714,1
10/24/2017,17,24,"wagapa",0.000000,0
10/24/2017,17,24,"This Thursday BROOKLYN Repost get repost Here s the Champs last instagram com p BapU0XFg SB",0.000000,0
10/24/2017,17,24,"city nyc travelgram en Upper West Side instagram com p BapU6QJjE2P",0.000000,0
