Date,Hour,Minute,Tweet text,Polarity,Sentiment
10/02/2017,17,07,"Starting preproduction for a debut EP music musician musicians musically instagram com p BZwpgFGll2Q",0.000000,0
10/02/2017,17,07,"Jamaica Estates NY Mon Oct 2nd PM Forecast TONIGHT Partly Cloudy Lo 31 SATURDAY Sunny Hi 41",0.000000,0
10/02/2017,17,07,"Jamaica NY Mon Oct 2nd PM Forecast TONIGHT Partly Cloudy Lo 31 SATURDAY Sunny Hi 41",0.000000,0
10/02/2017,17,07,"Jackson Heights NY Mon Oct 2nd PM Forecast TONIGHT Partly Cloudy Lo 31 SATURDAY Sunny Hi 41",0.000000,0
10/02/2017,17,07,"Scotty Hotty Square New York City instagram com p BZwpe1LDiWSS TiiawXYoR0nlDsVI51Xb1c7dPc0",0.136364,1
10/02/2017,17,07,"Hillside NY Mon Oct 2nd PM Forecast TONIGHT Clear Lo 55 TUESDAY Sunny Hi 75",0.050000,1
10/02/2017,17,07,"Highbridge NY Mon Oct 2nd PM Forecast TONIGHT Clear Lo 59 TUESDAY Sunny Hi 71",0.050000,1
10/02/2017,17,07,"Glendale NY Mon Oct 2nd PM Forecast TONIGHT Partly Cloudy Lo 31 SATURDAY Sunny Hi 41",0.000000,0
10/02/2017,17,07,"Wednesday We Back Again Meet Me laspalmasnj Music By Certified Boyz instagram com p BZwpbzDgUEM",0.000000,0
10/02/2017,17,07,"Fresh Pond NY Mon Oct 2nd PM Forecast TONIGHT Partly Cloudy Lo 31 SATURDAY Sunny Hi 41",0.150000,1
10/02/2017,17,07,"My silver fox grrbaby York New York instagram com p BZwpOyfhmF3",0.136364,1
10/02/2017,17,07,"And I won t back down riptompetty York New York instagram com p BZwpaD j 8GU 1qhlmf1bb8XMbeeV9QXIuaPpIw0",-0.006397,-1
10/02/2017,17,07,"So apparently MedalMonday is a thing This being my first I wasn t sure what to include but instagram com p BZwpeccHpOQ",0.266667,1
10/02/2017,17,07,"Forest Hills NY Mon Oct 2nd PM Forecast TONIGHT Partly Cloudy Lo 31 SATURDAY Sunny Hi 41",0.000000,0
10/02/2017,17,07,"Flushing NY Mon Oct 2nd PM Forecast TONIGHT Partly Cloudy Lo 31 SATURDAY Sunny Hi 41",0.000000,0
10/02/2017,17,07,"Far Rockaway NY Mon Oct 2nd PM Forecast TONIGHT Partly Cloudy Lo 31 SATURDAY Sunny Hi 41",0.050000,1
10/02/2017,17,07,"Esplanade NY Mon Oct 2nd PM Forecast TONIGHT Clear Lo 55 TUESDAY Sunny Hi 75",0.050000,1
10/02/2017,17,07,"Elmhurst NY Mon Oct 2nd PM Forecast TONIGHT Partly Cloudy Lo 31 SATURDAY Sunny Hi 41",0.000000,0
10/02/2017,17,07,"I read the news today oh boy The Beatles anellawetter com blog 2017 10 2 i read the news today oh boythe beatles",0.000000,0
10/02/2017,17,07,"thankyou tompetty heartbroken devastated thedaythepettydied showused gameused instagram com p BZwpdrVBlR",0.000000,0
10/02/2017,17,07,"final walk with the talented designer ClassicRoyalty circleofsisters fashionshow finale instagram com p BZwpdhlBiuC",0.350000,1
10/02/2017,17,06,"Crotona Park NY Mon Oct 2nd PM Forecast TONIGHT Clear Lo 55 TUESDAY Sunny Hi 75",0.050000,1
10/02/2017,17,06,"Be couragous Be brave Take up space in the world Don t allow others to be comfortable instagram com p BZwpc7HH8tJ",0.600000,1
10/02/2017,17,06,"Corona NY Mon Oct 2nd PM Forecast TONIGHT Partly Cloudy Lo 31 SATURDAY Sunny Hi 41",0.000000,0
10/02/2017,17,06,"Just posted a photo 207th Street instagram com p BZwpceuDsNi",0.000000,0
10/02/2017,17,06,"Brooklyn NY Mon Oct 2nd PM Forecast TONIGHT Clear Lo 59 TUESDAY Sunny Hi 71",0.050000,1
10/02/2017,17,06,"Bronx NY Mon Oct 2nd PM Forecast TONIGHT Clear Lo 55 TUESDAY Sunny Hi 75",0.050000,1
10/02/2017,17,06,"Briarwood NY Mon Oct 2nd PM Forecast TONIGHT Partly Cloudy Lo 31 SATURDAY Sunny Hi 41",0.000000,0
10/02/2017,17,06,"People with goals succeed because they know where they are going it s as simple as that instagram com p BZwpb 9FN8S",0.000000,0
10/02/2017,17,06,"Baychester NY Mon Oct 2nd PM Forecast TONIGHT Clear Lo 55 TUESDAY Sunny Hi 75",0.050000,1
10/02/2017,17,06,"Allerton NY Mon Oct 2nd PM Forecast TONIGHT Clear Lo 55 TUESDAY Sunny Hi 75",0.050000,1
10/02/2017,17,06,"Drinking a Storm King by s Pub Grill http untp beer s c510820066 photo",0.000000,0
10/02/2017,17,06,"Woodcliff NJ Mon Oct 2nd PM Forecast TONIGHT Clear Lo 55 TUESDAY Sunny Hi 71",0.050000,1
10/02/2017,17,06,"West New York NJ Mon Oct 2nd PM Forecast TONIGHT Clear Lo 55 TUESDAY Sunny Hi 71",0.078788,1
10/02/2017,17,06,"Union City NJ Mon Oct 2nd PM Forecast TONIGHT Clear Lo 55 TUESDAY Sunny Hi 71",0.050000,1
10/02/2017,17,06,"Tyler Park NJ Mon Oct 2nd PM Forecast TONIGHT Clear Lo 55 TUESDAY Sunny Hi 71",0.050000,1
10/02/2017,17,06,"Taurus NJ Mon Oct 2nd PM Forecast TONIGHT Clear Lo 55 TUESDAY Sunny Hi 71",0.050000,1
10/02/2017,17,06,"Summit Avenue NJ Mon Oct 2nd PM Forecast TONIGHT Clear Lo 55 TUESDAY Sunny Hi 71",0.050000,1
10/02/2017,17,06,"Passaic Park NJ Mon Oct 2nd PM Forecast TONIGHT Clear Lo 49 TUESDAY Sunny Hi 71",0.050000,1
10/02/2017,17,06,"Passaic NJ Mon Oct 2nd PM Forecast TONIGHT Clear Lo 49 TUESDAY Sunny Hi 71",0.050000,1
10/02/2017,17,06,"Pamrapo NJ Mon Oct 2nd PM Forecast TONIGHT Clear Lo 55 TUESDAY Sunny Hi 71",0.050000,1
10/02/2017,17,06,"North Bergen NJ Mon Oct 2nd PM Forecast TONIGHT Clear Lo 55 TUESDAY Sunny Hi 71",0.050000,1
10/02/2017,17,06,"Lo d siemprrre en New York New York instagram com p BZwpYM8g6Ab",0.136364,1
10/02/2017,17,06,"Monitor NJ Mon Oct 2nd PM Forecast TONIGHT Clear Lo 55 TUESDAY Sunny Hi 71",0.050000,1
10/02/2017,17,06,"know someone NOT tagged please tag them I had the honor this weekend to support my instagram com p BZwpWobAK4K",0.000000,0
10/02/2017,17,06,"Jersey City NJ Mon Oct 2nd PM Forecast TONIGHT Clear Lo 55 TUESDAY Sunny Hi 71",0.050000,1
10/02/2017,17,06,"Hoboken NJ Mon Oct 2nd PM Forecast TONIGHT Clear Lo 55 TUESDAY Sunny Hi 71",0.050000,1
10/02/2017,17,06,"Guttenberg NJ Mon Oct 2nd PM Forecast TONIGHT Clear Lo 55 TUESDAY Sunny Hi 71",0.050000,1
10/02/2017,17,06,"Greenville NJ Mon Oct 2nd PM Forecast TONIGHT Clear Lo 55 TUESDAY Sunny Hi 71",0.050000,1
10/02/2017,17,06,"Name that movie York metropolitan area instagram com p BZwpXCqHJ9A",0.000000,0
10/02/2017,17,06,"Ellis Island NJ Mon Oct 2nd PM Forecast TONIGHT Clear Lo 55 TUESDAY Sunny Hi 71",0.050000,1
10/02/2017,17,06,"Dundee NJ Mon Oct 2nd PM Forecast TONIGHT Clear Lo 49 TUESDAY Sunny Hi 71",0.050000,1
10/02/2017,17,06,"A tad bit extra on the concealer button West Africa instagram com p BZwpWPiANxjY ELKIbF0x1GFdJO8wJ5w1XjxFuw0",0.000000,0
10/02/2017,17,06,"Bergenline NJ Mon Oct 2nd PM Forecast TONIGHT Clear Lo 55 TUESDAY Sunny Hi 71",0.050000,1
10/02/2017,17,05,"Bergen Point NJ Mon Oct 2nd PM Forecast TONIGHT Clear Lo 55 TUESDAY Sunny Hi 71",0.050000,1
10/02/2017,17,05,"Jackie Onassis Reservoir newyork reflections instagram com p BZwpV5enz 0t G 0y3o57wQOepWbKg1tqsMpLRE0",0.000000,0
10/02/2017,17,05,"Bayonne NJ Mon Oct 2nd PM Forecast TONIGHT Clear Lo 55 TUESDAY Sunny Hi 71",0.050000,1
10/02/2017,17,05,"Archiii hija m a que no se nos olvida dalo por seguro eres una de las personas m s importantes instagram com p BZwpVPIl6ZK",0.000000,0
10/02/2017,17,05,"Me and the talented designer ClassicRoyalty circleofsisters fashionshow finale royal instagram com p BZwpTFChBES",0.700000,1
10/02/2017,17,05,"Tonight I ve got a date with Clive clivedavis music arista records date instagram com p BZwpSwXDYQx",0.000000,0
10/02/2017,17,05,"NICK DRAKE Out at 12th st nickdrake ukfolk Lps instagram com p BZwpQmDjlEF",0.000000,0
10/02/2017,17,05,"Repost En Vivo Por Mega 97 9 lamegamezcladelacinco lamegamezcla djsmalls instagram com p BZwpPonlV b",0.000000,0
10/02/2017,17,04,"York Central Park instagram com p BZwpNjang0jk paZ7N xa7rmiJ1oYE5WwDGs8vc0",0.000000,0
10/02/2017,17,04,"You got a room at the top of the world tonight You can see everything tonight this man instagram com p BZwoqKAnTHb",0.500000,1
10/02/2017,17,04,"Damn one of the greats I ve seen Petty at least 2x in concert instagram com p BZwpH9sgRyBb eBoqop9wPDw KpA dRgUo9b4k80",-0.300000,-1
10/02/2017,17,04,"I m at John F Kennedy International Airport in Queens NY swarmapp com c ddzUWNzIfHh",0.000000,0
10/02/2017,17,04,"New York I love you Heartfelt thanks Irish Arts Centre You brought the best out in us instagram com p BZwpKlLg12T",0.306061,1
10/02/2017,17,04,"Light Shadow johnthelusca New York instagram com p BZwpKjhnfIJ",0.268182,1
10/02/2017,17,04,"It s offical Its about to go down this week With help from instagram com p BZwpKd0H5Jz",-0.155556,-1
10/02/2017,17,04,"Crushing looks since birth myboy kindergarten coolkid nyckids fitkids strongkids instagram com p BZvu4wphPFy",0.400000,1
10/02/2017,17,04,"ClassicRoyalty circleofsisters fashionshow finale royal blue floorlength gown model instagram com p BZwpKJsBiLT",0.000000,0
10/02/2017,17,04,"Not a bad view for drinking and eating Let s hope this decongestant kicks I m soon swarmapp com c kJZVqaYs7DE pic twitter com QTagAy5HvS",0.350000,1
10/02/2017,17,04,"Take me back to Times Square please summerholiday bestbirthday timessquare newyork instagram com p BZwpI4olvZc",0.000000,0
10/02/2017,17,04,"I know I m SO LATE but happy internationalcoffeeday celebrating at one of my face places instagram com p BZwpI2whF9x",0.250000,1
10/02/2017,17,04,"Oct 19th at Vital Joint HOTCHY MOTCHY Joint instagram com p BZwpI3jFcPZ",0.100000,1
10/02/2017,17,03,"South entrance area Park Manhatan instagram com p BZwpHFADjqL",0.000000,0
10/02/2017,17,03,"Trivia Special Nachos Grande House made tortilla chips topped with Chili pico pickled instagram com p BZwpGS6Dc5X",0.357143,1
10/02/2017,17,03,"I will posting photos from the NYC trip this week It will be a mixture of street landscape and instagram com p BZwpF0UhRe0",0.000000,0
10/02/2017,17,03,"Cleared Construction on I78 Both directions at Exit 58 US 1 9 E Port St",0.000000,0
10/02/2017,17,03,"ClassicRoyalty circleofsisters fashionshow finale royal blue floorlength gown model instagram com p BZwpDXBh8aH",0.000000,0
10/02/2017,17,03,"My clients print is ready Silver Crane 68wx48h is just about ready to be installed instagram com p BZwpCxcHjVH",0.200000,1
10/02/2017,17,03,"Repost djbiglou get repost THIS SATURDAY NIGHT IM BACK IN THE BUILDING 95SOUTH instagram com p BZwpB DD5UA",0.000000,0
10/02/2017,17,03,"by WeAreANTI instagram com p BZwpCC1H Qj",0.000000,0
10/02/2017,17,03,"Legal Issue artusalawfirm The White House Has Slashed Refugee Admissions to Record Lows http dlvr it PrxrMw Call 9733379643 pic twitter com 6n9jiks43w",0.100000,1
10/02/2017,17,03,"Cracking weather in newyork today centralpark instagram com p BZwpAxEH1Slc sy u7LhF2iK5NlXRm0HSSRbySo0",0.000000,0
10/02/2017,17,03,"My clients print is ready Silver Crane 68wx48h is just about ready to be installed instagram com p BZwpAYpn8Hx",0.200000,1
10/02/2017,17,02,"Enjoying Your Rainy Day Wedding Pro tips and More getweddingsavvy com blog enjoying your rainy day wedding pro tips and more",0.500000,1
10/02/2017,17,02,"I ve been waiting all day waiting for the confirmation of our new instagram com p BZwo wgh NO3 ZjIGkAd6EgKXtWoI1j MAQUFC80",0.136364,1
10/02/2017,17,02,"Yeah this week is no joke Kitchen instagram com p BZwoUX5FC8s",0.000000,0
10/02/2017,17,02,"My clients print is ready Silver Crane 68wx48h is just about ready to be installed instagram com p BZwo hUHjIr",0.200000,1
10/02/2017,17,02,"Googlenyc the other side instagram com p BZwo9VThSXG",-0.125000,-1
10/02/2017,17,02,"Quick run around the block Salisbury hotel NYC instagram com p BZwo8FtDzXj",0.333333,1
10/02/2017,17,02,"Cleared Construction on 84Bus SB from Bergenline Avenue 29th Street to Bergenline Avenue 21st St",0.000000,0
10/02/2017,17,02,"I wanna glide down over Mulholland I wanna write her name in the sky I m gonna free fall out instagram com p BZwo74eAxsH",0.122222,1
10/02/2017,17,02,"yo you re a spotify artist now Can we get the old ones up",0.100000,1
10/02/2017,17,02,"Rp Repost Shituation Pavilion Hospital instagram com p BZwo7S9A2Rpc NrLuh4owhQzCXndlhCwZYDPdMU0",0.000000,0
10/02/2017,17,02,"Just posted a photo York New York instagram com p BZwo67PgzT9",0.136364,1
10/02/2017,17,01,"I m at John F Kennedy International Airport in Queens NY swarmapp com c bGbGLVOMVh2",0.000000,0
10/02/2017,17,01,"The Fifth Annual BSC Poster Symposium was a huge success Over 40 presenters from ten different instagram com p BZwo4dAF1Rz",0.175000,1
10/02/2017,17,01,"Had a lovely day at TheMet art museum nyc Metropolitan Museum of Art New York instagram com p BZwo3KaAPyB",0.318182,1
10/02/2017,17,01,"Just posted a photo York New York instagram com p BZwo3ZGDXPE",0.136364,1
10/02/2017,17,01,"NYCC this weekend I will be at New York Comic Con in the Artist Alley at Table K29 I m so instagram com p BZwo2DEH2eZ",0.193182,1
10/02/2017,17,01,"Day 2 of Inktober Robo Zealot Appears day2 inktober drawing illustration instagram com p BZwo1MCj LT",0.000000,0
10/02/2017,17,01,"Thank you for the music Thank you for the words Thank you for the lifetime of memories instagram com p BZwo0LlAp5k",0.000000,0
10/02/2017,17,01,"Just posted a photo York New York instagram com p BZwo0NLAxoV",0.136364,1
10/02/2017,17,01,"I m at New York Penn Station in New York NY swarmapp com c lUgJYbG7IBl",0.136364,1
10/02/2017,17,01,"I m at GMHC in New York NY swarmapp com c 9McH1dP0Rfi",0.136364,1
10/02/2017,17,01,"I m at in New York NY swarmapp com c cjwpMePxr2Y",0.136364,1
10/02/2017,17,00,"Just posted a photo York New York instagram com p BZwow9UgPDa",0.136364,1
10/02/2017,17,00,"Just posted a photo 207th Street instagram com p BZwowN7j 0D",0.000000,0
10/02/2017,17,00,"Essentials608 Restaurant Lounge Tuesday LadiesFirstTuesday 21 Up HappyHour 5pm instagram com p BZwovm2HQJU",0.000000,0
10/02/2017,17,00,"Chest Back KTD Fitness New Springville instagram com p BZwovgNhNl2",0.068182,1
10/02/2017,17,00,"Yassss Slay Sweet Tooth Manhattan Monster Bar instagram com p BZwosU2F2Nf",0.350000,1
10/02/2017,17,00,"Just posted a photo York New York instagram com p BZwouJmjMoQ",0.136364,1
10/02/2017,17,00,"Nike Windbreaker Sz XXXL Steal Of The Day 60 Available On Website Throwback instagram com p BZwot8pHjch",0.400000,1
10/02/2017,17,00,"What would a trip to NYC be with out popping into bakery We grabbed one of their instagram com p BZwotG4jFdv",0.000000,0
10/02/2017,17,00,"Got to kill a chypher with fredthegodsonmusic you know CT came instagram com p BZwokXggZNm0 uYoBZ40UwQyA0A2gnN6q9uPCtE0",0.000000,0
10/02/2017,17,00,"In every person there is a card of the Tarot s Major Arcana Wearing pieces from GUCCI instagram com p BZwortxD6xh",0.062500,1
10/02/2017,17,00,"Just posted a photo York New York instagram com p BZwoq3igjvL",0.136364,1
10/02/2017,17,00,"cairnterrier dog dogso nstagram pup park nycparks NYC newyork newyorkcity inwood instagram com p BZwoqzkFbI5",0.000000,0
10/02/2017,17,00,"Christmas has come early instagram com p BZwoqTMFwxa2 h1OHZRk5qjhmqi7JqxNNPBCIAA0",0.100000,1
10/02/2017,17,00,"Design Connext Student Social dexigner com news 30429 InteriorDesign",0.033333,1
10/02/2017,16,59,"Tryna balance out my Monday anxiety vibes Girls PR HQ instagram com p BZwopimANEO",0.000000,0
10/02/2017,16,59,"Current mood A Moscow Mule doesn t sound so bad right now Kenmare instagram com p BZwooFhhwC2",-0.003571,-1
10/02/2017,16,59,"Day 274 Of The 365 Day Photo Every month I sit down and take the time to write a card to my instagram com p BZwon8KHpej",-0.155556,-1
10/02/2017,16,59,"Just posted a photo York New York instagram com p BZwon1 A9qY",0.136364,1
10/02/2017,16,59,"Some days I film interviews with Real Housewives today was some of the ladies from the New instagram com p BZwonRlD2nh",0.168182,1
10/02/2017,16,59,"Gusher is playing this Saturday night Come on down to theAlphabetLounge the boys I will instagram com p BZwomuuBLCW",-0.155556,-1
10/02/2017,16,59,"The beautiful nikkiberryman enjoying the in on instagram com p BZwom1fH4pRa n2G6nlDsXLacmWCpEC3fMIkjJ80",0.675000,1
10/02/2017,16,59,"Incident on US19TruckRoute NB at New Jersey Turnpike http 511ny org EventDetails T RANSCOM ORI165245801",0.136364,1
10/02/2017,16,59,"Updated Incident on NewJerseyTurnpikeWesternSpur SB from North of Interchange 15W I 280 to South of http 511ny org EventDetails T RANSCOM ORI165243701",0.000000,0
10/02/2017,16,59,"Repost Time to shake up the airwaves En Vivo por instagram com p BZwohPsF2TM",0.000000,0
10/02/2017,16,58,"Leave everything in God s hands Amen broadway moe nothingisimpossible instagram com p BZwogzchy X",0.000000,0
10/02/2017,16,58,"lucky enough to have seen this summer for one last time RIPTomPetty gone way too soon instagram com p BZwocGuH4qN",0.111111,1
10/02/2017,16,58,"Taking care my kiddo stay away from them weirdos I won t let it get to me YoungMe instagram com p BZwohbAhMqm",0.000000,0
10/02/2017,16,58,"Music being an important part of my Life And an artist I respect instagram com p BZwofLoFi pL iWLKBxwYXjHkzIJ9Wwrroby1iY0",0.400000,1
10/02/2017,16,58,"Mickey Roadsters mdvcustomcakeboutique mdvcustomcakes yonkers westchester delicious instagram com p BZwogyCBYno",1.000000,1
10/02/2017,16,58,"The most gorgeous day so we decided to enjoy it on the lake in Prospect Park So much fun instagram com p BZwogyNg2DW",0.475000,1
10/02/2017,16,58,"It was a nice day in five towns Bottles AndMoreBottles NoBrownWaterThough Wine instagram com p BZwoggVgG0c",0.600000,1
10/02/2017,16,58,"New drawing now available in my store You only have a couple days left to get 50 off and instagram com p BZwofy0hbq9",0.134091,1
10/02/2017,16,58,"Cleared Incident on NewJerseyTurnpikeWesternSpur NB from Interchange 18W I 80 US 46 George Washington Bridge to Vince Lombardi",0.000000,0
10/02/2017,16,58,"Tracking my mood journal bipolardisorder bipolar I love NY deananddeluca nytimes instagram com p BZwofJbBG2W",0.500000,1
10/02/2017,16,58,"Weather a young stud or a 75 year old tennis player anyone can get a great workout with the instagram com p BZwoc3ajZBR",0.333333,1
10/02/2017,16,57,"Join me NOW on Hit The Follow Button and Share LISTEN VIA 1 instagram com p BZwoaU3jP2s",0.000000,0
10/02/2017,16,57,"cairnterrier nyc newyork newyorkcity nycparks park dog dogso nstagram pup Tryon instagram com p BZwoZp1l jq",0.000000,0
10/02/2017,16,57,"FOLLOW US on IG and we want to thank EVERYONE at West 4th St Station who were instagram com p BZwoWK2hrAJ",0.000000,0
10/02/2017,16,57,"Bobbi Boss Alwaays Showin Luv On My Nu Loc Installations Thank You Means A Lot Coming instagram com p BZwoWU5FM92",0.000000,0
10/02/2017,16,57,"No words Brooklyn instagram com p BZwoPcnhmSu",0.000000,0
10/02/2017,16,57,"Cleared Incident on NewJerseyTurnpikeWesternSpur SB from Northern Mixing Bowl to South of Northern Mixing Bowl",0.000000,0
10/02/2017,16,57,"Chest work khudair thelionofnysc fka thelionoflafitness instagram com p BZwoYLiHV49 FHeKcfFwmDTQLbHQENpAmDmMYg0",0.000000,0
10/02/2017,16,57,"I just finished walking 1 88 miles in 33m 22s with Endomondo endorphins https goo gl ui8EiE",0.000000,0
10/02/2017,16,57,"always keeps it popping nicolettebalmer redosgned the nook With an amazing instagram com p BZwoWE DkDq",0.600000,1
10/02/2017,16,57,"Tonight Monday Night Vibes Continues Uptown Social with Music From Yours Truly instagram com p BZwoV6hl4P5",0.033333,1
10/02/2017,16,57,"For my peeps in BK tonight Please go support my peoples at Franklin Park All tips and instagram com p BZwoUrEHTGL",0.000000,0
10/02/2017,16,57,"New York did not disappoint as I work my way around the world Highlights acehotelnewyork instagram com p BZwoUh1nWFL",0.136364,1
10/02/2017,16,57,"Lilac Crush Ombre CATFACEHAIR DESIGNED CREATED BY SHOP IN STUDIO 396 instagram com p BZwmwBlDsti",0.000000,0
10/02/2017,16,56,"146 Joe Duckworth Lakesman winner oxygenaddict com podcast 2017 9 19 episode cj74h",0.000000,0
10/02/2017,16,56,"rip tompetty York New York instagram com p BZwoQv AXUC",0.136364,1
10/02/2017,16,56,"We are looking for a buyer on 217 Madison St Lyndhurst NJ realestate http tour circlepix com home M85KNW pic twitter com qyalI0gTD0",0.000000,0
10/02/2017,16,56,"Incident on NewJerseyTurnpikeHudsonCountyExtension WB from Interchange 14A NJ 440 Bayonne Bridge to Newark Bay http 511ny org EventDetails T RANSCOM ORI165245601",0.000000,0
10/02/2017,16,56,"S06665 Engross Relates to reporting by the superintendent of financial services requires a report on the numbe http bitly com WxVeuW",0.000000,0
10/02/2017,16,56,"Repost get repost Ima huge fan of my own work Check out the details instagram com p BZwoI7bBosp",0.500000,1
10/02/2017,16,56,"I m at Little Italy Pizza IV in New York NY swarmapp com c 7TMF0aEj5b7",-0.025568,-1
10/02/2017,16,56,"Sprinkle with lemon on the grilled Gyu tan beef tongue and enjoy the instagram com p BZwoNTXn85X",0.400000,1
10/02/2017,16,55,"I m at Cantina Taqueria Tequila Bar in New York NY swarmapp com c jIS8IIrWItA",0.136364,1
10/02/2017,16,55,"Same trucks different day We are in Month 2 of the Mayor Lied The trucks are still here on instagram com p BZwoKhdA705",0.000000,0
10/02/2017,16,55,"Go to http Facebook com thetravelingta rdis FOLLOW megaconvention RT instagram com p BZwoIH6hyL0",0.000000,0
10/02/2017,16,55,"Someone pinch me we just took showcase photos College Theatre instagram com p BZwoHhoHTQd",0.000000,0
10/02/2017,16,55,"Customer Custom Crop TierNYC Brooklyn Campus Life instagram com p BZwoHHfjb8Y",0.000000,0
10/02/2017,16,54,"tutoring tutoringbus NYC instagram com p BZwoD2ShxGx",0.000000,0
10/02/2017,16,54,"Warmly greeting another newly activated kiosk pic twitter com T724EloPPl bei NYPD 17th Precinct",0.368182,1
10/02/2017,16,54,"Incident on 59Bus at Newark http 511ny org EventDetails T RANSCOM ORT25569407",0.000000,0
10/02/2017,16,54,"Flower and Bamboo Rock instagram com p BZwoAv2lRqL",0.000000,0
10/02/2017,16,53,"Do it yourself chai on and Don t let bucks and dunkin dictate instagram com p BZwn9NSAtGS",0.000000,0
10/02/2017,16,53,"vintage photo of princessdiana leaves guildhall after lunch with princecharles York instagram com p BZwn6u6F PI",0.000000,0
10/02/2017,16,53,"The Spartan Woman is at it again York New York instagram com p BZwn6JwAYtZ",0.136364,1
10/02/2017,16,53,"Mood selfie with the lil sis and mom moodfabrics Designer Fabrics instagram com p BZwn45flRi9",0.000000,0
10/02/2017,16,53,"I am very pleased to announce that on Tuesday 11 7 17 I will premiere an all new performance instagram com p BZvxonDB7Vb",0.393182,1
10/02/2017,16,53,"1075 Grand Concourse the Bronx pic twitter com b719JGX8fc",0.500000,1
10/02/2017,16,52,"Shout to Mag for coming by and conversing with me letsconverse talkisvaluable instagram com p BZuyiMWnp0D",0.000000,0
10/02/2017,16,52,"Just posted a photo Bridge City Hall Chambers Street instagram com p BZwn1wOn7X0g OdMzGkJ3L w2MbBUgbqwjeAGCU0",0.000000,0
10/02/2017,16,52,"Shout out to this brother killing them softly If you know him tag him letsconverse instagram com p BZuwEDsHI4s",0.100000,1
10/02/2017,16,52,"We re getting on the KB s today but not like this 10 02 17 workout Back Squat 1RM instagram com p BZwn0uEDnSA",0.000000,0
10/02/2017,16,52,"Make sure you have a circle of sisters letsconverse talkisvaluable circleofsisters2017 instagram com p BZutuXHHafK",0.500000,1
10/02/2017,16,52,"Shout out to and all the wonderful work she is doing to support black woman instagram com p BZutedxHF7H",0.416667,1
10/02/2017,16,52,"Recap COS so many beautiful people and beautiful conversations letsconverse instagram com p BZus40GHura",0.733333,1
10/02/2017,16,51,"Go get that new soul food From FAT Fly Freddie Lee 3 Piece A Biscuit The EP out instagram com p BZwnuaChgG6",0.468182,1
10/02/2017,16,51,"gianni versace 90s collection instagram com p BZwnuVjF8qJF vgPI alwaa7TsxJpTEuOHB4 cs0",0.000000,0
10/02/2017,16,51,"Recap COS so many beautiful people and beautiful conversations letsconverse instagram com p BZusQ1HnuWa",0.733333,1
10/02/2017,16,51,"Can t wait to wake up the sleepers Square New York City instagram com p BZwnt4nHpaI",0.136364,1
10/02/2017,16,51,"Don t tag her tho let her be Great she outchea York New York instagram com p BZwntjCgQYD",0.468182,1
10/02/2017,16,51,"S O to everybody that came thru for my bday last night the last pic says it all goodVibes instagram com p BZwntZUA9lZ",0.000000,0
10/02/2017,16,51,"Last dance with Mary Jane One more time to kill the pain RIP TomPetty instagram com p BZwnswBHZXF",0.250000,1
10/02/2017,16,51,"I m at in New York NY swarmapp com c 5XFXeSgt0jR",0.136364,1
10/02/2017,16,51,"Are you carrying frustration worry or aggravation about something instagram com p BZwnsBrHetAW Zb05pxZhRkxKUW9H y14Cv Vs0",0.000000,0
10/02/2017,16,51,"WIP JetBlack only 3 days til NYCC friends come see me at booth 228 with HCG crew instagram com p BZwnr6MnyS",0.000000,0
10/02/2017,16,51,"Leather Jacket Season Lloydering mensstreetstyle mensfashion Manhattan instagram com p BZwnpxonT6s",0.000000,0
10/02/2017,16,51,"The tallest residential building in the city I wonder if you could feel the building moving at instagram com p BZwnpvXlqaA",0.000000,0
10/02/2017,16,50,"Hyatt Place Charlotte Airport Tyvola Road https travelignite com hotel reviews 2017 10 2 hyatt place charlotte airporttyvola road",0.000000,0
10/02/2017,16,50,"A newyork day with the peterthomasrothofficial QVC team We have some serious ptr antaging instagram com p BZwnhnMjhSp",-0.333333,-1
10/02/2017,16,50,"Art Metropolitan Museum of Art New York instagram com p BZwnbqtAfLj",0.136364,1
10/02/2017,16,50,"temperature up 68 F 72 F humidity down 39 27 wind 3mph 2mph",-0.155556,-1
10/02/2017,16,50,"WELL MY MOTHER CONSTANTLY AND CONSISTENTLY TOLD ME THAT HARD WORK instagram com p BZwnk0nhr23v htqeqXrJUPUlkZMN25AmC7c3No0",-0.013889,-1
10/02/2017,16,50,"RIPTomPetty Watershed instagram com p BZwnkE5BfJB1 OYPh46bTaaOLXaZXqm69HC 5DY0",0.000000,0
10/02/2017,16,50,"Order our rolled ice cake and make your party the coolest Choose up to 4 flavors and instagram com p BZwnjSJBCtn",0.000000,0
10/02/2017,16,50,"August 2 2017 2053 East 4th Street Ocean Parkway South Brooklyn 360 000 1 unit 6 367 sf one family home",0.000000,0
10/02/2017,16,49,"Monday in the park with Geese Park instagram com p BZwnf hAfVR",0.000000,0
10/02/2017,16,49,"Facing north from East 46th Street Below is the rooftop of the Intercontinental Hotel There s instagram com p BZwngNulFRn",0.000000,0
10/02/2017,16,49,"what York New York instagram com p BZwneyLn HE",0.136364,1
