Date,Hour,Minute,Tweet text,Polarity,Sentiment
10/02/2017,19,59,"Going home 4 John F Kennedy International Airport instagram com p BZw9QErlBix",0.000000,0
10/02/2017,19,59,"I m at for Breaking Benjamin Unplugged in Montclair NJ swarmapp com c arfnmU6ZvoH",0.000000,0
10/02/2017,19,59,"THIS IS MY BACKYARD WHERE I STOMP THE GROUND KUAIFIT instagram com p BZw9OpihAiL",0.000000,0
10/02/2017,19,59,"Gun control protest Square Manhattan New York instagram com p BZw9MFyj 4Y",0.136364,1
10/02/2017,19,59,"FIRST PERFORMANCE OF MY LATEST SINGLE LAST NITE LANO S O STAGE instagram com p BZw9MACj QY",0.169643,1
10/02/2017,19,59,"FLAGGING LIGHTS MOTORCADES EMPTY PROMISES CORRUPTION AND YOU K HOW DO YOU FEEL I I ONLY instagram com p BZw9LoNnmjj",-0.050000,-1
10/02/2017,19,59,"Amar Prem amarprem nyc newyork newyorkcity usa unitedstates unitedstatesofamerica instagram com p BZw9KifDF9b",0.000000,0
10/02/2017,19,58,"Gun control protest Square Manhattan New York instagram com p BZw9I7wjgjt",0.136364,1
10/02/2017,19,58,"4 food groups at 4 horsemen Four Horsemen instagram com p BZw9IgBn 6t",0.000000,0
10/02/2017,19,58,"Never forget 9 11 Zero World Trade Center instagram com p BZw9CTMhHP0",-0.100000,-1
10/02/2017,19,58,"New sorry now out on Photography Art direction By anniebuado instagram com p BZw9GfJA9YG",-0.181818,-1
10/02/2017,19,58,"Great side conversation tonight for Archtober instagram com p BZw9GC FGRLx fvzxFD7G7wtuSSaiH5QmHYTTEo0",0.800000,1
10/02/2017,19,58,"Goons Gone Wild State University instagram com p BZw9FWylXDB",0.100000,1
10/02/2017,19,58,"Willie Wonka and the Chocolate Factory and the Chocolate Factory instagram com p BZw9FJ7DDNb",0.000000,0
10/02/2017,19,58,"My belly is full with amazing food again and my heart is full of gratitude I m blessed with instagram com p BZw9DCuA8DF",0.433333,1
10/02/2017,19,58,"Just posted a photo Plaza instagram com p BZw9CeRni1m",0.000000,0
10/02/2017,19,58,"The light of compassion opens the petals of the heart Amit Ray Unknown Artist Lane instagram com p BZw9CwRlkjW",0.150000,1
10/02/2017,19,57,"classic Dollarmentary Freestyle redmansworld com hiphop rap linkinbio instagram com p BZw89jxlE f",0.166667,1
10/02/2017,19,57,"latergram art galleries Chelsea streetart with Manhattan instagram com p BZw89hZhKGq",0.000000,0
10/02/2017,19,57,"AB Simpson s church Square Manhattan New York instagram com p BZw89KxDeXO",0.136364,1
10/02/2017,19,57,"This insane insane insane glorious jigsaw puzzle is part of the Arthur Mitchell archives instagram com p BZw7cV9AqNm",-1.000000,-1
10/02/2017,19,57,"One of six outfits I packed in my carry on for NYFW all outfits are all up in my latest post instagram com p BZw88JKAP6V",0.500000,1
10/02/2017,19,57,"At the LoveSign with the loveofmylife andressadalledone Love NewYork NewYorkCity instagram com p BZw87dugk5D",0.500000,1
10/02/2017,19,57,"The sunsets over Manhattan are pretty stellar from our rooftop instagram com p BZw87dwBrFt",0.250000,1
10/02/2017,19,57,"Fuck that challenge",-0.400000,-1
10/02/2017,19,57,"Callin All My Caribbean What Hip Hop Meets Caribbean When Friday 10 13 Where La Rouge instagram com p BZw86 RAlIg",0.000000,0
10/02/2017,19,56,"happy birthday to my concert loving bff finally 18 Meadows instagram com p BZw85 nnFo16 lXS QuT4j r4bd10QWsk99U 3I0",0.466667,1
10/02/2017,19,56,"i like to look professional on mondays Manhattan instagram com p BZw85fng pJ",0.100000,1
10/02/2017,19,56,"Just posted a photo Broadway instagram com p BZw84ncDTQ0",0.000000,0
10/02/2017,19,56,"See you there York New York instagram com p BZw80XWlY2T",0.136364,1
10/02/2017,19,55,"dyckmancornerstone cookingclass eveningprogram tweens teens youngadults healthyeating instagram com p BZw8ypMFD9g",0.000000,0
10/02/2017,19,55,"The original CMA church Square Manhattan New York instagram com p BZw8yiFD rb",0.255682,1
10/02/2017,19,55,"New week new book District NYC instagram com p BZw8xNRg9AI",0.136364,1
10/02/2017,19,55,"Just posted a video instagram com p BZw8xFnnMiY",0.000000,0
10/02/2017,19,55,"When you wanna sit down so bad and you see this smh work tired sit lml co ooo instagram com p BZw8wYIFvqR",-0.418519,-1
10/02/2017,19,55,"Construction on GardenStateParkway SB from South of Exit 143A to South of Exit 143A http 511ny org EventDetails T RANSCOM ORI165252801",0.000000,0
10/02/2017,19,55,"Last week we partnered with The Midas Awards for an evening of networking live comedy and a instagram com p BZw8u1ih1hI",0.068182,1
10/02/2017,19,55,"The Phantom of the opera Phantom Of The Opera Broadway instagram com p BZw8ui6DVdG",0.000000,0
10/02/2017,19,55,"Dine around with a great group of adp senior leaders hellowork instagram com p BZw8sibgbu3H xQbw3fcF9AnazbKVt5j6I4ui640",0.800000,1
10/02/2017,19,55,"I can slurp as loud as I want NY instagram com p BZw8sdWAazj",0.100000,1
10/02/2017,19,55,"classic Dollarmentary Freestyle redmansworld com hiphop rap linkinbio instagram com p BZw8sd7lSbz",0.166667,1
10/02/2017,19,55,"travel travelling instatravel wanderlust potd usa2017 newyork nyc 911 They ve done a instagram com p BZw8sgMF lc",0.000000,0
10/02/2017,19,55,"New York City en New York New York instagram com p BZw8rwJhOnXK x8iJJcVfpQ079z8HPeOTpW8SFE0",0.136364,1
10/02/2017,19,54,"purple swag that trill shit M M3 E36 s50 ltw e36 eli Specs 1995 BMW M3 5 Speed instagram com p BZw8gr4BpXO",-0.200000,-1
10/02/2017,19,54,"After a trough day at work just let it go Haha therochardnyc buildabar oldstyle instagram com p BZw8hUIh9Ub",0.200000,1
10/02/2017,19,54,"MTV Square Manhattan New York instagram com p BZw8qEvDVU9",0.136364,1
10/02/2017,19,54,"Can t join our BBQ Films event this Thursday evening No worries You can enjoy this instagram com p BZw8oeUA nk",0.400000,1
10/02/2017,19,54,"Construction on GardenStateParkway NB from North of Exit 160 Paramus Rd to NJ 208 to South of Exit 165A B http 511ny org EventDetails T RANSCOM ORI165252701",0.000000,0
10/02/2017,19,54,"Another one from my editorial with rykermag featuring evan tomchin and shot by instagram com p BZw8e3VhMmB",0.000000,0
10/02/2017,19,54,"videoshoot biancabonnie loveandhiphop Marina NYC instagram com p BZw8lodh4WX",0.000000,0
10/02/2017,19,54,"doinwork tattindatass again lol Alley Body Art instagram com p BZw8ltflVYK",0.800000,1
10/02/2017,19,54,"As always I am grateful to sue a lee for helping with all my Caribbean needs I have some instagram com p BZw8lHuA8Y0",0.000000,0
10/02/2017,19,53,"The devil in NYC Square Manhattan New York instagram com p BZw8jxBjILJ",0.136364,1
10/02/2017,19,53,"Hanging out with one of my favorite people Out and about in these Manhattan instagram com p BZw8gyPAvj8",0.500000,1
10/02/2017,19,53,"PINK LADY Repost loso mua Pink Accents Model Makeup Hair Wardrobe instagram com p BZw8gXClbeA",-0.100000,-1
10/02/2017,19,53,"therealkimbella TONIGHT MONDAY OCT 2 MAGICCITYMONDAYS cityscapes nyc CITYSCAPES 58 ST instagram com p BZw8fqSg7R",0.000000,0
10/02/2017,19,53,"Emmett Carson being honored at Gala radicalgenerosityawards Telling it swarmapp com c c6I0w0jIzLt pic twitter com OVwk0KMd0Y",0.000000,0
10/02/2017,19,53,"Awesome new menu at from including this insanely juicy and enormous instagram com p BZw8bhLnV0D",0.034091,1
10/02/2017,19,53,"735 Walton Avenue the Bronx pic twitter com 166f4sD4Ww",0.000000,0
10/02/2017,19,53,"Tomorrow is one dream away if I can dream it I can build it Bruce Wayne Batman instagram com p BZw8cJvlUcR",0.000000,0
10/02/2017,19,52,"REMEMBER STARTING TODAY FROM 1 8pm MONDAY THROUGH WEDNESDAY ANYTHING COUNTS LETS instagram com p BZw8ZovluWJ",0.000000,0
10/02/2017,19,52,"Central Park nyc travel enjoy lifeisgood sundaymorning manhattan centralpark nature instagram com p BZw8Zqdlp6M",0.200000,1
10/02/2017,19,52,"I m at Sottocasa Pizzeria in Brooklyn NY swarmapp com c lD1CeMsV1hi",0.000000,0
10/02/2017,19,52,"Gettin hurr currrts Lave Salon in Jersey City NJ w swarmapp com c 1J0pYtM7gBm",0.000000,0
10/02/2017,19,52,"Tomorrow is one dream away if I can dream it I can build it Bruce Wayne Batman instagram com p BZw8Y2AljDL",0.000000,0
10/02/2017,19,52,"NAN s Katrina Jefferson provides a solution to write a letter to the hotel where KennekaJenkins instagram com p BZw8YrqHAxJ",0.000000,0
10/02/2017,19,52,"Send a Get Well Soon cheer and brighten someone s day York New York instagram com p BZw8YRxgfkV",0.136364,1
10/02/2017,19,52,"This to me is just a magnificentview empirestatebuilding iphoneonly photography instagram com p BZw8YCXnVdH",0.000000,0
10/02/2017,19,52,"Pray For Las Vegas",0.000000,0
10/02/2017,19,52,"Fall Feels in the Wrapped Up Choker and 90 Degrees Tank Grey Melange City New Jersey instagram com p BZw8XlXF2pn",0.043182,1
10/02/2017,19,52,"Space Jam Baby Taz Size Kids Sm Available On Website Throwback instagram com p BZw8XGpHlzR",0.400000,1
10/02/2017,19,51,"check out my New Video NO PODRAS OLVIDAR York New York instagram com p BZpyfMwHGXW",0.136364,1
10/02/2017,19,51,"Cualquier poder si no se basa en la uni n es d bil Todosunidos Jamasseremosvencidos instagram com p BZw8VN2hX3j",0.000000,0
10/02/2017,19,51,"I wouldn t trade any second of these past two years Two years of laughs adventures Two years instagram com p BZw8J4hjKbZ",-0.125000,-1
10/02/2017,19,51,"Chegamos Madison Square A convite da sommeroficial vim fazer a cobertura do show da Katy instagram com p BZw8SnADk8b",0.000000,0
10/02/2017,19,51,"Love at First Sight regranned from janineleighphotography This little Diva Happy instagram com p BZw8Q 5D vO",0.340625,1
10/02/2017,19,51,"And u ask how do I see all I see here s ya ansa instagram com p BZw8QGFgO4vi tISoK3oUujcgx7IKMgk8AfmcRw0",0.000000,0
10/02/2017,19,51,"Always a great time catching up with our friends in SLF Rounding out their 40th anniversary instagram com p BZw8PUehTp8",0.700000,1
10/02/2017,19,51,"dippin it and doin it Fifth Avenue instagram com p BZw8OX8nQWkM sDDhqmBSF2sEN7oGCdaXTpHOeI0",0.000000,0
10/02/2017,19,50,"Repost get repost Now that s snowboard progression The homie 90z lo4life instagram com p BZw8NfMAD K",0.000000,0
10/02/2017,19,50,"Back at it people Big man doing work Getting my cardio on bodybyian bodybuilding muscle instagram com p BZw8BYaBirW",0.000000,0
10/02/2017,19,50,"Cleared Incident on 168Bus at Paramus Park Mall",0.000000,0
10/02/2017,19,50,"Tonight s reading TheLibraryIsOpen York New York instagram com p BZw8KIGH3ux",0.136364,1
10/02/2017,19,50,"Let s see if Rep Steve Scalise has a similar come to jesus moment Doubt it though LasVegasShootings",0.000000,0
10/02/2017,19,50,"Cualquier poder si no se basa en la uni n es d bil Todosunidos Jamasseremosvencidos instagram com p BZw8JK2hXQK",0.000000,0
10/02/2017,19,50,"Our heart are with you lasvegas Square New York City instagram com p BZw8HduhgCa",0.136364,1
10/02/2017,19,49,"With all the negative news going on I forgot it s inktober So I m gonna start with something instagram com p BZw8GkRBOFu",-0.300000,-1
10/02/2017,19,49,"THIS IS LITERALY THE HARDEST PROJECT OUT THE STORTY BEHIND THE MUSIC IS AMAZING THE instagram com p BZw8F0FBeHY",0.100000,1
10/02/2017,19,49,"fitness inshape beach body islands Fitness instagram com p BZw8EGfFLFX",0.000000,0
10/02/2017,19,49,"Spiced pork stew fini carlosaystable privatechef onthetable Jardin De Carlo instagram com p BZw8Dj3HlJZ",0.000000,0
10/02/2017,19,49,"It s A Solo Show Center in New York NY swarmapp com c 3jF9IrBGoBJ pic twitter com yZmOQZF1Yh",0.018182,1
10/02/2017,19,49,"Art k demir almak g n gelmi se zamandan Me hule giden bir gemi kalkar bu limandan swarmapp com c k6cwju4ihnv",0.000000,0
10/02/2017,19,49,"A world inside the computer where man has never been Never before now Tron VRFilmmaking instagram com p BZw8A4jnWwn",0.000000,0
10/02/2017,19,49,"France is well known for its traditional know how it s a fact When hundreds years old instagram com p BZw8AaCFfiq",0.050000,1
10/02/2017,19,48,"Just posted a photo instagram com p BZw77Kcj23y",0.000000,0
10/02/2017,19,48,"Fresh in Newark NJ swarmapp com c 7Ys3GkZMGJq",0.300000,1
10/02/2017,19,48,"This Fall I ll be part of the Gowanus 2017 Open Studios Saturday and Sunday October 21 and 22 instagram com p BZw77bQB y0",0.000000,0
10/02/2017,19,48,"What an fun evening dancing at the Bright Lights Shining Stars nycda gala honoring Ann instagram com p BZw76kbgc5A",0.500000,1
10/02/2017,19,48,"You better believe we re getting down up in here instagram com p BZw75kKBokrH zEaDaMo3eSUoFRZZ3I 6GbpTJI0",0.172222,1
10/02/2017,19,47,"Tomorrow is everything Our Bronx Bombers are playing in the Wild Card Playoff for the AL instagram com p BZw74Wvl31x",0.100000,1
10/02/2017,19,47,"Rest In Peace Tom Petty One of my all time faves and an absolute legend I m still in instagram com p BZw73gMj8pL",0.200000,1
10/02/2017,19,47,"H A R L E M nyc sundaymood harlem malcomX harlemstreets history gospel cocacola instagram com p BZw73JPlPPH",0.000000,0
10/02/2017,19,47,"doublejointed flyelyfe com manhattan brooklyn bushwick chronic maryjane instagram com p BZw73JXBw7j",0.000000,0
10/02/2017,19,47,"What s Patreon Why I m On It How It Benefits You https synergessence com new gallery 20 17 10 2 whats patreon why im on it how it benefits you",0.136364,1
10/02/2017,19,47,"millitant13 millitantlifestyle THE PALM TREE THAT GREW IN CONCRETE CLICK THE LINK IN instagram com p BZw72rvHVpp",0.150000,1
10/02/2017,19,47,"I m at Kingside in New York NY swarmapp com c 7jHJTulQ2ce",0.136364,1
10/02/2017,19,47,"Pictured me at Marymount utilizing my alumni access to the library Manhattan instagram com p BZw700sBp7x",0.000000,0
10/02/2017,19,47,"My OFFICIAL BDAY CELEBRATION Make sure ya come out on my birthday show some love instagram com p BZw70kalmuR",0.500000,1
10/02/2017,19,47,"Coming into JFK for a short layover Love the sunset businesstravel paysforskiing instagram com p BZw707ngwqn",0.250000,1
10/02/2017,19,47,"Could eat here everyday at in Jersey City NJ swarmapp com c gVJegsEt05e",-0.200000,-1
10/02/2017,19,47,"I m at Squish Marshmallows in New York NY swarmapp com c 5yK1krChYDo",0.136364,1
10/02/2017,19,47,"Occurred many years ago but still one of my favorite travel trips Makes this catastrophic instagram com p BZw7xXlBDwp",0.500000,1
10/02/2017,19,46,"biggiesmalls Clinton Hill Brooklyn instagram com p BZw7xS3ALjq",0.000000,0
10/02/2017,19,46,"Me And Nephew Visiting Mother Grandma in the instagram com p BZw7wmllxqCk vhcxB nNblUq4kX YJ1mp8SvEM0",0.000000,0
10/02/2017,19,46,"I love this man Francis College Brooklyn instagram com p BZw7wnchept",0.500000,1
10/02/2017,19,46,"Style by manthrough Repost themanity via manthrough instagram com p BZw7dlqAViJ",0.000000,0
10/02/2017,19,46,"Mommy and daddy got us to sit right in the chair mochanoreocavs cutecavaliers cavalierlove instagram com p BZw7vPHh4mw",0.285714,1
10/02/2017,19,46,"Miami Independent Film Festival 2018 Miami FL jamesreimanphoto com upcoming 2017 10 2 miami independent film festival 2018 miami fl",0.000000,0
10/02/2017,19,46,"Back with my boys at tonight for thenewsboysvarietyshow newsiesforever instagram com p BZw7t1GgIKO",0.000000,0
10/02/2017,19,46,"Today recording with T great ensemble Sound instagram com p BZw7tZGHIIC",0.600000,1
10/02/2017,19,46,"Thenewculturenyc York New York instagram com p BZw7r Ej3wb",0.136364,1
10/02/2017,19,46,"Family Over Money Money Over The Bitches We Toasting Bottles Of Rose No Roses Over My Niggas",0.600000,1
10/02/2017,19,46,"A08629 NEW Relates to offenses involving thefts of identity Relates to offenses involving thefts of identity http bitly com Y4EgCL",0.136364,1
10/02/2017,19,45,"New music feat fredthegodsonmusic Impeach the president clink the link in my bio instagram com p BZw7oxABX6K",0.136364,1
10/02/2017,19,45,"Late Dinner Manhattan instagram com p BZw7l79g6IiS sm G hG JL9BYZqY4ANqo62zs0",-0.300000,-1
10/02/2017,19,45,"OctProWriMo 2 We write because we MUST Haiku Passionate instagram com p BZw7lnclWwZx bnpW1d8bj83WnaOJrEOUQe5aVQ0",-0.050000,-1
10/02/2017,19,45,"Getting ready for Halloween familycirclemagazine womensdaymagazine New York instagram com p BZw7kl4gKde",0.168182,1
10/02/2017,19,45,"Lobster surf and turf bronxhavanacafe tonights specials Havana Cafe instagram com p BZw7kCTFOVS",0.000000,0
10/02/2017,19,45,"Birthday swag mrmeeseeks morty happybirthdaytome nyc Jimmy s LIVE Square instagram com p BZw7j9rHaDU",0.136364,1
10/02/2017,19,45,"Manhattan instagram com p BZw7i3ogBk",0.000000,0
10/02/2017,19,44,"Boutique instagram com p BZaShvQhArf",0.000000,0
10/02/2017,19,44,"empire state of mind fashion fashionblogger fashionista fashionist ootd style instagram com p BZw7iUOhcyF",0.000000,0
10/02/2017,19,44,"Shangri La x OneTakeDave logicalnonsense215 com news chhd2hybm kdfjsz99z7bdyf8en9yhz",0.000000,0
10/02/2017,19,44,"Shangri La x OneTakeDave logicalnonsense215 com news chhd2hybm kdfjsz99z7bdyf8en9yhz",0.000000,0
10/02/2017,19,44,"Your Cells Are Overwhelmed https synergessence com news 2017 10 2 your cells are overwhelmed",0.000000,0
10/02/2017,19,44,"breakingbenjamin unplugged Thanks to 105 5wdha Wellmont Theater instagram com p BZw7g7AHJJ05 BZci0XnI8z1eCB7BJ5Ggvw8Bs00",0.200000,1
10/02/2017,19,44,"I shot this video as I was heading back to the Billy s hotel PrayForLasVegas VegasStrong instagram com p BZw7g6KHgUM",0.000000,0
10/02/2017,19,44,"Repost get repost salute York New York instagram com p BZw7gK BZpc",0.136364,1
10/02/2017,19,44,"The actual location of the iconic Beastie Boys Paul s Boutique instagram com p BZw7gEQnpZqV y6U2soxEVxzSmjMoO7TYS4zqPA0",0.250000,1
10/02/2017,19,44,"Ready set go Thanks for the T shirt keithharing ilovenewyork instagram com p BZw7e9BhNM3",0.200000,1
10/02/2017,19,44,"She will be mine oh yes en New York New York instagram com p BZw7dSbjKGC",0.136364,1
10/02/2017,19,44,"One word Scary prayforhumansnotonlyvegas City New Jersey instagram com p BZw7dkBFz7z",-0.181818,-1
10/02/2017,19,44,"omgaggianyc streetwear streetstyle menstyle streetfashion Manhattan instagram com p BZw7c UlpoE",0.000000,0
10/02/2017,19,43,"Times Square Square Manhattan New York instagram com p BZw7alFjLNY",0.136364,1
10/02/2017,19,43,"Sweet chili shrimp bronxhavanacafe tonights specials Havana Cafe instagram com p BZw7acyFp8J",0.350000,1
10/02/2017,19,43,"oneeyedbandit Zumba I look loke I went 3 rounds with Tyson I didn t win Lol Gardens instagram com p BZw7aIrATup",0.800000,1
10/02/2017,19,43,"Tenho cara de retardado mas com certeza jogo melhor que o Jay Cutler Dolphins em MetLife instagram com p BZw7YYrFnrO",0.000000,0
10/02/2017,19,43,"In the wake of tragedy we can find solace in the little things dayoff lasvegas instagram com p BZw7YKZAo8j",-0.187500,-1
10/02/2017,19,43,"Fire York Stock Exchange instagram com p BZw7W8gDLyC",0.000000,0
10/02/2017,19,43,"To live is the rarest thing in the world Most people exist that is all Oscar Wilde instagram com p BZw7VRYhhtj",0.318182,1
10/02/2017,19,43,"From work to Harlem on a citibike instagram com p BZw7VD1FCK2b xq5Zpd p8fcXTwXzAoL8IORnOA0",0.000000,0
10/02/2017,19,43,"All My Boricuas know this Man as Needs No instagram com p BZw7UuYljL8",0.000000,0
10/02/2017,19,42,"A good reminder on a day like today So much has happened in just a few weeks Some of which we instagram com p BZw7T46HW1y",0.233333,1
10/02/2017,19,42,"Ed was absolutely amazing last night Center instagram com p BZw7T25BEGx5 3DPWY7QPKpNXnRO0TzOoRRccw00",0.166667,1
10/02/2017,19,42,"Monday mood Spread Love even if it s in small ways because Love conquers all instagram com p BZw7TXWF8Ds",0.250000,1
10/02/2017,19,42,"Beach bronde for fall Why not Color clintcoloredit bronde fall robinson salon instagram com p BZw7SnHhYjG",0.000000,0
10/02/2017,19,42,"temperature down 68 F 63 F humidity up 35 48",-0.155556,-1
10/02/2017,19,42,"Solangeeeeee hyped City Music Hall instagram com p BZw7SdJA5Hr",0.000000,0
10/02/2017,19,42,"Their Fall Winter 2017 brunch menu Brisket Frittata and Beef Short Rib Raghu Polenta instagram com p BZw7Rubhlhj",0.000000,0
10/02/2017,19,42,"Buh bye Murica Back to Blighty I go USA GoingHome GregTannahill F Kennedy instagram com p BZw7SEIgV1o",0.000000,0
10/02/2017,19,42,"The famous POK POK wings in Brooklyn I believe the secret ingredient is lightning I am instagram com p BZw7QztjVdL",0.050000,1
10/02/2017,19,42,"Sneakerjeans Powered by Side Zip Sweater Product Code Search 14870 available instagram com p BZw7QtFFwJa",0.400000,1
10/02/2017,19,42,"We are back on the roof this Friday October is here and we roll into Fall with some instagram com p BZw7LzsBjOg",0.000000,0
10/02/2017,19,42,"My way of joking is to tell the truth That s the funniest joke in the instagram com p BZw7QT7lqiI",0.000000,0
10/02/2017,19,42,"thank u baby",0.000000,0
10/02/2017,19,42,"Godspeed to the victims of Vegas our own musical genius Tom Petty instagram com p BZw7O dHkLLS m65IlE7cd64s AUNIa jppnlIQ0",0.300000,1
10/02/2017,19,42,"en NYPL The New York Public Library instagram com p BZw7O7kj Bx",0.068182,1
10/02/2017,19,42,"Style by melikkam Repost melikkam What ever you do It never gets easier you just get instagram com p BZw6 avgQBS",0.000000,0
10/02/2017,19,42,"I was in my head for this entire workout Just felt a little sad and even guilty that I was instagram com p BZw7NdolGOa",-0.296875,-1
10/02/2017,19,42,"My nephew spent his 8th birthday watching his favorite team Unfortunately he didn t get to instagram com p BZw7M8YjZfP",-0.033333,-1
10/02/2017,19,42,"F U C K O F F ahhyousickfilms model urbanphotography photooftheday photoofthenight instagram com p BZw7MvagGut",0.000000,0
10/02/2017,19,41,"Bout to go to work No need to roll my sleeves up drillzoneornozone Stuyvesant instagram com p BZw7MHxFBc9",0.000000,0
10/02/2017,19,41,"Happy best month of the year Shop instagram com p BZw7KKIlPSF",0.900000,1
10/02/2017,19,41,"Another thing I got up to this week was a classic modern plated desserts with nicolasbotomisy instagram com p BZw7JjHDCph",0.183333,1
10/02/2017,19,41,"New camera bag day newyork chromeindustries cinelliusa superstar diablotronyc York instagram com p BZw7JhojjwX",0.136364,1
10/02/2017,19,41,"Under Construction HIIT instagram com p BZw7I1pADW",0.000000,0
10/02/2017,19,41,"I m at The Whitby Hotel in New York NY swarmapp com c 96fv7pYbiLT",0.136364,1
10/02/2017,19,41,"Enchantment en Royal Caribbean International instagram com p BZw7FeIAvaEf coKuDJ7 phK EMFnEn1iqT8RCQ0",0.000000,0
10/02/2017,19,40,"Huddle DidYouKnow Segment 1 on What happened to KennekaJenkins who was found dead I A Chicago instagram com p BZw7D1dn62Z",-0.200000,-1
10/02/2017,19,40,"on feminism and the indian national movement with great panel East Side in New York NY swarmapp com c fllzVWMpTnP",0.468182,1
10/02/2017,19,40,"Vodka Gimlet Don t mind if I do happiesthour girlonfire instagram com p BZw7CithzOPN afpT OdjgQBFYpPsOvCYcJ34yI0",0.000000,0
10/02/2017,19,40,"Family tings instagram com p BZw7BdtBuOcV Vscp9WTZbWCby4GZQwxzhe4kG80",0.000000,0
10/02/2017,19,40,"The high line has some interesting buildings High Line New York instagram com p BZw7AIFAICz",0.239091,1
10/02/2017,19,40,"Happy sassy and a bit badass gym fit workout motivation fitfam bodybuilding healthy instagram com p BZw6 7jldz",0.566667,1
10/02/2017,19,40,"what do I like to do in my freetime Use my collaborative and LOUD voice to spread joy instagram com p BZw6 BvDAz",0.450000,1
10/02/2017,19,40,"First day of shooting in the can Fabulous and sexy mercetheseries Club Theaters instagram com p BZw699PFgfl",0.383333,1
10/02/2017,19,39,"and Allie Ganino pose for me at an presentation during NYFW instagram com p BZw69nOn26t",0.000000,0
10/02/2017,19,39,"Probando la Gibson q a n no puedo comprar cassanovagroup en New York New York instagram com p BZw67d2jxOa",0.136364,1
10/02/2017,19,39,"One of the greatest gifts in this world is the power to change ourselves A little posing instagram com p BZw67ISAOEf",0.406250,1
10/02/2017,19,39,"Wasn t allowed my digital camera in so no Katy Perry close ups But seats are bloody brilliant instagram com p BZw67V8haia",0.033333,1
10/02/2017,19,39,"Douglas Turner award Center for Research in Black Culture New York Public Library instagram com p BZw66hdHiAt",-0.032576,-1
10/02/2017,19,39,"Incident on 108Bus at Colonnades Apartment Complex http 511ny org EventDetails T RANSCOM ORT25571707",-0.300000,-1
10/02/2017,19,39,"As se vivi y escuch el tiroteo en el festival de m sica en Las Vegas Al menos 59 personas instagram com p BZw6p7njpTt",0.000000,0
10/02/2017,19,38,"The Sweet Tooth recipe book is out get yours at sweettoothworld com Sherrodbelike instagram com p BZw61q5FEXj",0.350000,1
10/02/2017,19,38,"fuckgunviolence fuckthenra besties walkagainstgunviolence instagram com p BZw61FXnl3wM HvtYnbLE8clc8 3sJQMFq6ILHE0",0.000000,0
10/02/2017,19,38,"Almost 200 Tickets SOLD already Trick or Treat tickets on sale now Ladies tickets are only instagram com p BZw60DaBbIl",0.000000,0
10/02/2017,19,38,"New collection wespeakmusic loveyoga ladygaga nycvintage wearableart soho beyonce jazz instagram com p BZw6yt l8sz",0.136364,1
10/02/2017,19,38,"Blessed is he who expects nothing for he shall never be instagram com p BZw6x3OFLI7",0.000000,0
10/02/2017,19,38,"Grant me the strength to change the things I can the stakeholder to change the things I can t and the retro to tell the difference",0.000000,0
10/02/2017,19,38,"Old New York Funkys Boards instagram com p BZw6v2UHevI",0.118182,1
10/02/2017,19,37,"First night in NYC timesquare newyorkcity TomAndGeorgiaTakeNewYork holiday NewYork instagram com p BZw6uyfnJbN",0.250000,1
10/02/2017,19,37,"Naik hop on hop off cruise Layan pemandangan Manhattan Brooklyn instagram com p BZw6to nG67b XhtwJI6yf3Ljm cUOJiqHu0N9Q0",0.000000,0
10/02/2017,19,37,"I promise I take direction well We have something fun and exciting in the works details instagram com p BZw6tHVhS66",0.300000,1
10/02/2017,19,37,"1AdultEntertainerInNewJersey New Jersey instagram com p BZw6tyEg3tw",0.136364,1
10/02/2017,19,37,"Bright light of my day today the gorgeous brainiac launching her amazing instagram com p BZw6rClhrVv",0.600000,1
10/02/2017,19,37,"Guess what month it is ThinkPink BreastCancerAwareness Hall ZTA instagram com p BZw6qq h5VP",0.000000,0
