Date,Hour,Minute,Tweet text,Polarity,Sentiment
10/24/2017,19,59,"Waiting for class to begin and stretching out my hammies instagram com p BaplzKeBHvDh 6ShlnEciBKws7JmLdVJ VRrswI0",0.000000,0
10/24/2017,19,59,"nygiants biggest fans Stadium instagram com p BapmtbHhAyYE ZSNJNx5cw6Jc2RmlKyslUjcaJs0",0.000000,0
10/24/2017,19,59,"My 4th niece will be born this week UncleReg",0.000000,0
10/24/2017,19,59,"My first look at ABT this fall H Koch Theater at Lincoln Center instagram com p BapmtfQjH9m",0.075000,1
10/24/2017,19,59,"My braids hope u like em choker baroque pearl necklace by buddhapunknyc soho nyc instagram com p BapmS77hOlo",0.000000,0
10/24/2017,19,59,"Just posted a photo Coffee instagram com p Bapms10Bmaf",0.000000,0
10/24/2017,19,59,"With Ed at in New York NY swarmapp com c cPVrCMGdkr2",0.136364,1
10/24/2017,19,59,"NEW MUSIC VIDEO ALERT MillionDolla New Single GOAT Filmed by Drops this instagram com p BapmsrYHL a",0.067100,1
10/24/2017,19,59,"Repost get repost Felicito a todas las chicas que participaron en el instagram com p BapmkupFK4o",0.000000,0
10/24/2017,19,59,"Global Experimental TV at its finest Join me and my team on this journey of development and instagram com p Bapl67zHoLs",0.050000,1
10/24/2017,19,59,"Post Oyster Bar in New York NY swarmapp com c 0LNeKWE32rW",0.136364,1
10/24/2017,19,59,"I m at New Sweet Home in Staten Island NY swarmapp com c 2KSEAyt3hX4 pic twitter com R2WOZNJEGz",0.243182,1
10/24/2017,19,59,"Playtime is over the 2017 18 Women s basketball roster was announced today BearsNation instagram com p BapmodfgSaK",0.000000,0
10/24/2017,19,59,"Free Smoke Freestyle Video x Rob Dillin Shot By logicalnonsense215 com news x2rklfkcp zrp4c8n6gf272tbcawyxj",0.400000,1
10/24/2017,19,59,"Free Smoke Freestyle Video x Rob Dillin Shot By logicalnonsense215 com news x2rklfkcp zrp4c8n6gf272tbcawyxj",0.400000,1
10/24/2017,19,58,"global team lead offsite dinner after a great day of strategy meetings together swarmapp com c 04S7QG38uBw pic twitter com Y5lmqKdJKQ",0.400000,1
10/24/2017,19,58,"Just posted a photo Stuyvesant Brooklyn instagram com p Bapmc6wF2EZ",0.000000,0
10/24/2017,19,58,"I would like to welcome the BFF brothers to shouts out to kaws wecreateculture instagram com p BapmmY3huBl",0.800000,1
10/24/2017,19,58,"Pmsradio with mizz mixalot dwimuzik tuesday Night fly instagram com p Bapml8oH1YV",0.800000,1
10/24/2017,19,58,"Working a late one in mission control Bat Cave petercobley com blog 2017 10 2 5 working a late one in mission control batcave",-0.300000,-1
10/24/2017,19,58,"When you find that perfect Coupler to hold your mags together instagram com p BapmkqSBZIQm PAWNIeH2ndx2YEx4QQyBgkproQ0",1.000000,1
10/24/2017,19,58,"Going back to my first love Dance dancewheneveryoucan steps instagram com p BaplLHRhH 1a M20SHRnThz9NesxXsX0y Bmt6s0",0.250000,1
10/24/2017,19,58,"shmood if we don t do it who will smoovie da don rudizrockwell millydod instagram com p Bapmj5el HH",0.000000,0
10/24/2017,19,58,"Drinking a Budweiser by Raw Bar Grill http untp beer s c519238030",-0.230769,-1
10/24/2017,19,58,"",0.000000,0
10/24/2017,19,58,"Enjoying some time w eyebrow shaping ring finger bling instagram com p Bapmh1EjK22I gLp4GmiksRZJvDFxTKGFf0C7w00",0.500000,1
10/24/2017,19,57,"Y all knew it was coming Post shooti ramen with itsallabouttheframing instagram com p BapmhJFjMag",0.000000,0
10/24/2017,19,57,"Need T Shirts Printed Email Us at print com No Minimum Order if you only need 1 or 100 instagram com p Bapmg1AHZlR",0.000000,0
10/24/2017,19,57,"drops Strictlythebest with new caribbeandanceradio com news 2017 10 2 4 out nov 17 2017 strictly the best vol 56",0.568182,1
10/24/2017,19,57,"SELF AWARENESS SELF INVESTMENT IS THE FIRST STEP TOWARDS A GEATER LIFE instagram com p BapmVGmBI0C",0.250000,1
10/24/2017,19,57,"TONIGHT Este y CADA MARTES 5pm 2am martesbohemios con live musica por instagram com p BapmYEKj8kR",0.136364,1
10/24/2017,19,57,"Repost Via Sigue nuestro canal de YouTube A ejoMundial para lo ultimo de mi instagram com p BapmXH1H68p",0.000000,0
10/24/2017,19,57,"Come and make a difference If you can t lift you can donate or even be a volunteer to help us instagram com p BapmWkqh8 I",0.000000,0
10/24/2017,19,57,"I m at in New York NY swarmapp com c fiuInnjniwT",0.136364,1
10/24/2017,19,57,"streetstyle streetfashion streetwear streetphotography fashionphotography instagram com p BapmU5AHyGP",0.000000,0
10/24/2017,19,57,"This is how you watch the WORLDSERIES in the middle of moving LETS GO DODGERS kershaw time instagram com p BapmcfPHEbA",0.000000,0
10/24/2017,19,57,"If you never learn to fight how will you ever fight for what you love instagram com p BapmbyiASjZ",0.500000,1
10/24/2017,19,57,"beloveds Mr Bradshaw was murdered family member was the case that they gave him calm instagram com p BaplzpfFbL0",0.300000,1
10/24/2017,19,57,"So proud of my baby her 1st dance show w F E T C H Peter s Church instagram com p BapmTkal8Jf",0.800000,1
10/24/2017,19,57,"Queens of the Stonage Square Garden for Queens of the Stone Age and Royal Blood swarmapp com c 8WWOShxi6DE",0.000000,0
10/24/2017,19,57,"Reyka Vodka Autumn Haymakers for the win while Ryan Serhant discusses Brooklyn and beyond instagram com p BapmalPnHez",0.800000,1
10/24/2017,19,57,"THIS WEEKEND Spooky Booziness theironhorsenyc bartenderlife booze bootyshorts beer nyc instagram com p BapmaVQFavV",0.000000,0
10/24/2017,19,56,"9 11 Memorial newyorkcity manhattan brooklyn ny nycprimeshot what i saw in nyc instagram com p BapmZwIlzPS",0.000000,0
10/24/2017,19,56,"I had the absolute honor and privilege to attend the opening of this amazing piece of theater a instagram com p BapmZUODlCn",0.400000,1
10/24/2017,19,56,"Changed to pack in more seats",0.500000,1
10/24/2017,19,56,"tuesdaynight rain dark prihalloween halloween faluckalounge faluckalounge faluckanyc instagram com p BapmXnPHXJs",-0.150000,-1
10/24/2017,19,56,"Solo imagina lo precioso que puede ser arriesgarse y que todo salga instagram com p BapmXPkj19Q8 48jJtkLZ3WMByA0LFMpgrOnAfA0",0.000000,0
10/24/2017,19,56,"Just posted a photo Lounge instagram com p BapmXOXByPm",0.000000,0
10/24/2017,19,56,"what a joy to work with this quirky ridiculously hilarious cast of incredibly talented people instagram com p BapmWSCgFtn",0.500000,1
10/24/2017,19,56,"Just posted a photo Mansion instagram com p BapmWKMjiOCV J7iw8AQCoiF TVJ5Jvo 8lkR1k0",0.000000,0
10/24/2017,19,56,"Day 24 2017 Gristmill Park Slope Brooklyn pizzamonth 31daysofpizza instagram com p BapmVxjjIp5",0.000000,0
10/24/2017,19,56,"queensofthestoneage qotsa royalblood churchofhomme gingerelvis villians Square Garden swarmapp com c lT3sPq6PrVR",0.000000,0
10/24/2017,19,56,"I m at Good Stuff Diner in New York NY swarmapp com c aXO2GlC23Bl",0.418182,1
10/24/2017,19,56,"When you just move into a new neighborhood DonnieBlack w ichvse cindyballantine instagram com p BapmGAdFcMc",0.136364,1
10/24/2017,19,56,"S00724 Passed Relates to authorizing the sale and possession of sparkling devices outside of cities with a popu http bitly com VN63XP",0.000000,0
10/24/2017,19,56,"Repost The trying to get this done Go instagram com p BapmP3rn21o o8YV0XkGs lKmkuD3ZNbykuCw0",0.000000,0
10/24/2017,19,56,"A00823 Passed Relates to a reduced food processing license fee for small scale food processors defines a small http bitly com XC57nw",-0.250000,-1
10/24/2017,19,55,"Hi I miss you So this glossy eye highlight boomerang will have to do instagram com p Baplg Fjsxz",0.000000,0
10/24/2017,19,55,"em Club Metro USA Newark instagram com p BapmK1bDQP6",0.000000,0
10/24/2017,19,55,"Another couple of 10 mins poses Of Illustrators instagram com p BapmP7SDFb4",0.000000,0
10/24/2017,19,55,"creativity goes a long way",-0.050000,-1
10/24/2017,19,55,"Catch me on s Facebook Live tomorrow at 12 30PM We re talking fall trends and instagram com p BapmOLvHkBN",0.136364,1
10/24/2017,19,55,"GUCCI FALL 2016 READY TO WEAR gucci guccimane fashion fashiontips fashionlover instagram com p BapmNvvlOiS",0.200000,1
10/24/2017,19,55,"also there s an organic juice shop being built on my block called the juicy box heh",0.000000,0
10/24/2017,19,55,"Georgie and I pinch ourself that we get to serve lead along side so many amazing people instagram com p BapmMXPjsNE",0.550000,1
10/24/2017,19,54,"Essentials608 Restaurant Lounge October 28th Event Saturday Halloween instagram com p BapmATNH1C1",0.000000,0
10/24/2017,19,54,"Cleared Incident on BLine NB from 125th Street Station to 145th Street Station",0.000000,0
10/24/2017,19,54,"Cleared Incident on CLine from 125th Street Station to 145th Street Station",0.000000,0
10/24/2017,19,54,"Bendiciones mi gente se sigue trabajando fuerte para ustedes en Bronx New York instagram com p BapmI PnMHm",0.136364,1
10/24/2017,19,54,"How could somethin so gangsta be so pretty in pictures Jay Z soho nycphotographer instagram com p BapmIxaFY2q",0.250000,1
10/24/2017,19,54,"Endlich Essen at in New York NY swarmapp com c lY6wGw794gl",0.136364,1
10/24/2017,19,54,"I m at Penny Lane in Astoria NY swarmapp com c cckhK3rItaN",0.000000,0
10/24/2017,19,54,"TONIGHT Delancey instagram com p BapmF62BtVo",0.000000,0
10/24/2017,19,54,"Agri Produce special this week is cauliflower rice Use it just like rice and it has much less instagram com p BapmEqhAkUI",0.095238,1
10/24/2017,19,54,"wants you to remember before Tity 2 Neclaces said I ll look you right in your face sing to instagram com p BapmEGhH7ge",0.242857,1
10/24/2017,19,53,"Why must I always play like this in class Oh well life is to short not to instagram com p BaplROxlMkd",0.000000,0
10/24/2017,19,53,"Cleared Incident on 2Line Both directions at 241st Street Wakefield Station",0.000000,0
10/24/2017,19,53,"STREAMS IN THE DESERT lindsaypetri org blog 2017 10 2 4 streams in the desert",0.000000,0
10/24/2017,19,53,"And everybody s watching her but she s looking at you nyfw courturefashionweek instagram com p BapjjwanQhX",0.000000,0
10/24/2017,19,53,"y all find me an apartment i m over it lol",0.800000,1
10/24/2017,19,53,"Chris Perrys results and story I don t diet did that for years and failed I don t skip instagram com p Bapl5TwAwMc",-0.500000,-1
10/24/2017,19,53,"Listenin to this Elmhurst New York instagram com p Bapl3VeHxTi",0.136364,1
10/24/2017,19,53,"Lol femalesbelike dead boyfriend Stuyvesant Brooklyn instagram com p Bapl ufB1rY9 XqrcmZOV3Ks1s 8J2xj4aR8Anw0",0.300000,1
10/24/2017,19,53,"377 Powers Avenue the Bronx pic twitter com QYBEzbBOiH",0.000000,0
10/24/2017,19,52,"211 Music Video By MillionDolla Filmed by Free Download rappers instagram com p BapllL8nxAL",0.400000,1
10/24/2017,19,52,"Honestly just love the girls at my job sjhsbrooklyn Joseph instagram com p BaplzyNgPXy2 Mkst14U2sV0FvJ5oAiNCZsduFY0",0.550000,1
10/24/2017,19,52,"Hey even CoachHolmes is happy the 2017 18 Men s basketball roster was announced today instagram com p Bapl3klgmvg",0.800000,1
10/24/2017,19,52,"Tag 3 friends who need credit repair here with another creditrepairquote to this file in instagram com p Baplnf lsnF",0.000000,0
10/24/2017,19,52,"morningbutdark glendale ny queens spooky fall instagram com p Bapl4MyHa5JS Cd9WI jaHMxEC2R0JbK3CKwU9g0",0.000000,0
10/24/2017,19,51,"Beauty bar in the rain baby s adultbeverages share and Manicures at instagram com p Bapl1Pllev3",0.000000,0
10/24/2017,19,51,"STYLED AND SHOT BY ME MEDIUMFORMAT FILM XAVIERSCOTTMARSHALL Brooklyn instagram com p Bapl0apARUF",0.000000,0
10/24/2017,19,51,"Beer ATM Put in your card and get beer abeervoyage come instagram com p BaplvfCg TL",0.000000,0
10/24/2017,19,51,"BRUUUUUUUUUUUCE Kerr Theatre instagram com p BaplxeBHOJWN Te6QcpQDNKqP7XBglx4Bc eIU0",0.000000,0
10/24/2017,19,51,"TSA PSA when you see this please follow the instructions This new process is only as instagram com p BaplnkmFyXt",0.068182,1
10/24/2017,19,51,"This FRIDAY 10 27 S O S FRIDAYS Goes DARK Join Us for the 3rd Annual Halloween F3TISH instagram com p BapluGWhvme",-0.075000,-1
10/24/2017,19,50,"Beautiful approach but two go arounds later and I was happy to get on the ground even if the instagram com p Baplt6tlG n",0.550000,1
10/24/2017,19,50,"I m at The Shakespeare Forum in New York NY swarmapp com c 2SaL0S2Yd2v",0.136364,1
10/24/2017,19,50,"Fine like wine both then and now acura NSX acura nsx acuratl acuratsx integra honda instagram com p Bapls37g7Zh",0.416667,1
10/24/2017,19,50,"regranned from d a n i e l b Checkout this mens tshirt athletic fit instagram com p BaplqTZn3p0",0.400000,1
10/24/2017,19,50,"ESTRENO MUNDIAL Ta Borracho https goo gl F4MExZ via instagram com p BapleFrn69U",0.000000,0
10/24/2017,19,50,"Darts Drinking a HopFish India Pale Ale IPA by at http untp beer s c519234877",-0.210000,-1
10/24/2017,19,50,"Continued CuzIgWontLetMePostSlides tho Terminal5 LanaDelRay 5 instagram com p BaplgcxHFTE",0.000000,0
10/24/2017,19,50,"August 24 2017 80 17 57 Street Glendale Queens 478 950 1 unit 625 sf one family home one family attached or semi detached",0.000000,0
10/24/2017,19,50,"Good one",0.700000,1
10/24/2017,19,49,"We re so happy for these two boogieknights88 ashleeka427 We love instagram com p BaplmefjWfid fe70fqkxLksHiF0Gm0zHUcesJ40",0.650000,1
10/24/2017,19,49,"TAG YOU RE IT grafittinyc gallery 1 York New York instagram com p BaplklTDbkq",0.136364,1
10/24/2017,19,49,"I love these guys so much imaginedragons livemusic prudentialcenter rockmusic instagram com p Baplj Lhz54",0.350000,1
10/24/2017,19,49,"brooklyn Heights Brooklyn instagram com p BapljaXhq d",0.000000,0
10/24/2017,19,49,"That needle that hand and that cap xxxpm m84nyc evantattoo evantattooinNYC instagram com p BapljI7H Id",0.000000,0
10/24/2017,19,49,"Lots of brick laying so far NYK Celtics",0.100000,1
10/24/2017,19,49,"s everywhere Gene Frankel Theatre instagram com p BaplgtxgCNa",0.000000,0
10/24/2017,19,49,"deliverydotcom sushihouseofhoboken sushilover sushi happybirthday happy9thbirthday instagram com p BaplgOxD1sR",0.000000,0
10/24/2017,19,49,"If you missed this openhouse don t miss the next one DM me for more info on this instagram com p BaplJL7AbZy",0.250000,1
10/24/2017,19,49,"Private behind the scenes tour of hudsonyardsnyc the largest private real estate instagram com p BanI7CxFNvV",-0.050000,-1
10/24/2017,19,49,"Guess what guys THOSE ONLINE TICKET LOTTERIES REALLY WORK SpringsteenOnBroadway Kerr instagram com p BaplUMlDzcp",0.200000,1
10/24/2017,19,48,"Ensayando taveras0 YO TE QUIERO CONOCER videos films en Paterson New Jersey instagram com p BaplXVuFp31",0.136364,1
10/24/2017,19,48,"I have an inkling that all of this is about to disappear in a hot second This is the instagram com p BapleiqB5H",0.125000,1
10/24/2017,19,48,"Current mood What better way to celebrate NationalFoodDay than eating lamb and sipping on a instagram com p Bapld7MlSuz",0.250000,1
10/24/2017,19,48,"Can wait to have you in miami FAVORITE sesh today Class instagram com p BapldflFYwW",0.500000,1
10/24/2017,19,48,"Cleared Closure on FortLeeRoad WB from Broad Ave to Highland Street",0.062500,1
10/24/2017,19,48,"The Empire State Building practicing getting all spooky for Halloween York New York instagram com p BaplWdHD1m7",0.136364,1
10/24/2017,19,48,"When you find yourself at a business conference in Newark NJ and 1 of your favorite artists is instagram com p BaplbEMlqOB",0.500000,1
10/24/2017,19,48,"The first sip to me was sweet and reminded me of a Werthers Original for whatever reas EGOIPA http untp beer s c519234115",0.325000,1
10/24/2017,19,48,"HALLOWEEN MADNESS CONTINUES ON SATURDAY COME PARTY WITH US AT YOU KNOW HOW WE instagram com p BaplZtSgig0",0.000000,0
10/24/2017,19,48,"People never think to look up so I like to watch them go about their little lives in the busy instagram com p BaplZgsHLqO",-0.043750,-1
10/24/2017,19,48,"Mo Money Music Video MillionDolla feat prod dope instagram com p BaplR1TH0l4",0.000000,0
10/24/2017,19,48,"L G B T Q Luxury Cocktails tbt Congrats for launching their first instagram com p BaplYVmhAlo",0.250000,1
10/24/2017,19,48,"You know you shouldn t put logic to magic Maybe the monsters ARE real and the only way to instagram com p BaplNhoDY3B",0.233333,1
10/24/2017,19,48,"regranned from d a n i e l b instagram com p BaplYeajtk2",0.000000,0
10/24/2017,19,48,"Just posted a video Square Garden instagram com p BaplWBsFIl7",0.000000,0
10/24/2017,19,47,"Started at the bottom and now I m here homeimprovement makeover furniture diy ididthat instagram com p BaplWr7BJ c",0.000000,0
10/24/2017,19,47,"This was a great day missing you ppl a little extra lately instagram com p BaplVWmBNQWT CGjYeYrLeaDcBHiW61pVizKK840",0.022500,1
10/24/2017,19,47,"Just posted a photo York New York instagram com p BaplVDVnM4nV 3IIYQwUJbgTgozLmPHpvYLt CE0",0.136364,1
10/24/2017,19,47,"Do you think rats rapidly evolved to blend in with subway tracks or were the tracks colored to instagram com p BaplSRwnSVE",0.000000,0
10/24/2017,19,47,"The Art Of Healing artiststalk and exhibit Allen Pavillion Presbyterian instagram com p BaplT ABZJe",0.000000,0
10/24/2017,19,47,"Date night show again with zombified347 Airlines Theatre instagram com p BaplT UDjU5s TRQVu81J6qvJIO2Fn7HycR1cMA0",0.000000,0
10/24/2017,19,47,"Esto c descontrolo en Ridgewood Queens instagram com p BaplTo nwiQ",0.000000,0
10/24/2017,19,47,"that was my immediate response lol",0.800000,1
10/24/2017,19,47,"Credit nuestra patriapr for the info graphic How will Rossell justify this one instagram com p BaplTewlVgr",0.000000,0
10/24/2017,19,47,"I was so excited Thanks for sharing this old skool moment from my days at instagram com p BaplLQrhrsX",0.225000,1
10/24/2017,19,47,"Let s GET SPOOOOOOKY at the ritznewyork for TURNt this week theonlymadd and I summon one of our instagram com p BaplR3gDTmr",0.000000,0
10/24/2017,19,47,"Buckets james jay curry lmfaooooo dumbdonaldtrump lol instagram com p BaplRBHFGjhn eW7vhWrJ9lb45W8UL akVOayQg0",0.800000,1
10/24/2017,19,47,"notwastingmytime tofocused York metropolitan area instagram com p BaplQuFAz8Em ZGaGtMRXYZbusdGfFhZ1n6NlXk0",0.000000,0
10/24/2017,19,47,"Support The Cause We All Are One Show Love Support To The Loves That s Still Here By Our instagram com p BaplLoADyv6",0.500000,1
10/24/2017,19,47,"just sent an email that could catapult my career as an artist and give me the platform I need I hope the universe grants me this one wish",0.000000,0
10/24/2017,19,46,"diggin crates records soul songstress legend ninasimone 1967 City instagram com p BaplEUbgOpr",0.000000,0
10/24/2017,19,46,"deliverydotcom sushihouseofhoboken sushilover happybirthday happy9thbirthday instagram com p BaplJqZjg4",0.000000,0
10/24/2017,19,46,"In the bathroom door sketch thehangedman instagram com p BaplJRznJQq lxveVZEdBTJsEfF3R6rNJEr5Lg0",0.000000,0
10/24/2017,19,46,"ATTAGANG FILM mookattakanwong Tatianailia York New York instagram com p Bapkw8cD0VP",0.136364,1
10/24/2017,19,46,"Repost bjj She s happy Brooklyn instagram com p BaplEWPnkHo",0.800000,1
10/24/2017,19,46,"I m at The House of Brews in New York NY swarmapp com c 7mWWxXCbhhq",0.136364,1
10/24/2017,19,46,"BronxTalk The Future of the 13th Council District http youtu be tXAM6WTC7g0 via instagram com p BaplK2uA3CA",0.000000,0
10/24/2017,19,46,"The perfect Matte color for FALL Do you agree Thank you CityColorFam instagram com p BaplOuCgmYU",1.000000,1
10/24/2017,19,46,"Her voice is just so captivating enchanting Terminal5 5 instagram com p Bapk3h1HNcZ",0.500000,1
10/24/2017,19,46,"Beauty Photo littphotos Model Alabel Chapin thelionsny Makeup instagram com p BaplNbhDVJo",0.000000,0
10/24/2017,19,46,"Under eye filler results last about a year but that s not the complete story The hyaluronic instagram com p BaplMH7jR S",0.050000,1
10/24/2017,19,46,"rainydays in williamsburg brooklyn w the beesknees hustlebutterdeluxe tattoos instagram com p BaplD2KBdR",0.000000,0
10/24/2017,19,45,"Dodgers in 7 Chase Utley MVP Lol Really hoping to be wrong Go Stros",0.166667,1
10/24/2017,19,45,"This weeks nationalpizzamonth special is a Shakshuka Pizza from Chef Einat Admony topped instagram com p BaplHMMHtnV",0.357143,1
10/24/2017,19,45,"Afternoon light New York instagram com p BaplFGMDFoA",0.268182,1
10/24/2017,19,45,"Wow what a way to be a neighbor Starbucks monopoly on selling coffee on the block instagram com p BaplEzED5JY",0.100000,1
10/24/2017,19,45,"TONIGHT FOLLOW ME TO THE BAR WITH THEM 2 DRINK SPECIALS letsdoitwhynot djladystar instagram com p BaplFRtlRBc",0.000000,0
10/24/2017,19,45,"He asked me what did I think ILL ASK THE REAL CRITICS IS IT or Repost from instagram com p Bapk4FdF3Ky",-0.150000,-1
10/24/2017,19,45,"High Fiber Funkys Boards instagram com p BaplDxUHQ0o",0.160000,1
10/24/2017,19,45,"Black Squid Ink Ravioli filled with Lobster Shrimp Scallops saffron cream sauce with sun dried tomatoes Scottadito 788 Union St pic twitter com YDDRFi5DPK",0.011111,1
10/24/2017,19,44,"Get yourself someone that looks at you the way I look at ice cream Stone Creamery instagram com p BaplBsFhx3J",0.000000,0
10/24/2017,19,44,"A NIGHT TO DISMEMBER This Thursday October 26th from 9 PM until and instagram com p BaplBI6nc0J",0.000000,0
10/24/2017,19,44,"Join me at Empire City Casino in Yonkers Wednesday from 5 9pm I ll be doing a Live Chat at instagram com p Bapk7DoBVBT",0.136364,1
10/24/2017,19,44,"How did I miss National TV Talk Show Host Day yesterday Clearly I will dedicate the day to The instagram com p Bapk ZHH26C",0.100000,1
10/24/2017,19,44,"I m Just Going to Eat My Feelings Away In Monster Cookies feelings instagram com p Bapk AXng j",0.000000,0
10/24/2017,19,44,"year to year transformationtuesday gayboy boyswithbeards boytoman Heights instagram com p Bapk C F l",0.000000,0
10/24/2017,19,44,"time to get a real training me nyc selfie crossfit workout newyork newyorkcity instagram com p Bapk9tAhfOi",0.200000,1
10/24/2017,19,44,"As the weather begins to change make sure you bundle up with new BearsNation Gear instagram com p Bapk8HEAcBo",0.318182,1
10/24/2017,19,44,"It s NIBBLES the spanador tillyswalks dogwalker dog dogsofinstagram instadog instagram com p Bapk8MDFttw",0.000000,0
10/24/2017,19,44,"BronxTalk The Future of the 13th Council District http youtu be tXAM6WTC7g0 via instagram com p Bapk2jTglC9",0.000000,0
10/24/2017,19,43,"Clams going to be charcoal oven roasted Expo Center instagram com p Bapk5Ksj9OS",-0.100000,-1
10/24/2017,19,43,"I m at The in New York NY swarmapp com c ckCVvl0b8p9",0.136364,1
10/24/2017,19,43,"Cleared Incident on GardenStateParkway NB at South of Exit 145 I 280",0.000000,0
10/24/2017,19,43,"Cleared Incident on GardenStateParkway NB from South of Exit 144 CR 510 to North of Exit 145 I 280",0.000000,0
10/24/2017,19,43,"Tim is a shit photographer James Murphy Come to this Friday for my one off instagram com p Bapk2oaByTB",-0.200000,-1
10/24/2017,19,43,"Here for the ARNY meet up VRARA Accelerator NYC in New York NY swarmapp com c kPPOJ14giwH",0.136364,1
10/24/2017,19,43,"Clearing my head at in Paramus NJ swarmapp com c 6TUlRgtBtJW",0.000000,0
10/24/2017,19,43,"springsteenonbroadway waitingforbruce prettygoodseats luckyme Kerr Theatre instagram com p Bapk0KLBPdt",0.000000,0
10/24/2017,19,43,"No foul",0.000000,0
10/24/2017,19,42,"Facts newyork instagram newyork ig ig great shots nyc nycbooth focused instagram com p BapkyxcHSUL",0.800000,1
10/24/2017,19,42,"Just posted a video Buchwald Associates instagram com p Bapkv ln6fo",0.000000,0
10/24/2017,19,42,"I m at in Jersey City NJ swarmapp com c 8hseQehVPyT",0.000000,0
10/24/2017,19,42,"bnw planet 2017 bnwlife bnw bnw planet bnwphotography bnw of our world instagram com p BapkymDHNRq",0.000000,0
10/24/2017,19,42,"When your only creative elements are and volcanic sand a good problem to have instagram com p BapkyfCHgaW",0.400000,1
10/24/2017,19,42,"2 Piece Combo Size XL 60 DM 2 Purchase Throwback instagram com p BapkyC5nQmc",0.000000,0
10/24/2017,19,42,"musinhas se atraem em DUMBO Brooklyn instagram com p BapkyMTl9Yb",0.000000,0
10/24/2017,19,42,"Drinking a Wrench NEIPA by Industrial Arts Brewing at http untp beer s c519231744",0.000000,0
10/24/2017,19,42,"hypnocam is giving us life at the opening party at NYC s rosewoodtheater This instagram com p Bapkh0rA7pV",0.000000,0
10/24/2017,19,42,"Jack Plasky reppin for the Manhattan toddlers Can t wait to meet this little guy bubshki instagram com p BapkuzYlWgP",-0.187500,-1
10/24/2017,19,42,"BronxTalk The Future of the 13th Council District http youtu be tXAM6WTC7g0 via instagram com p Bapknq4ggDb",0.000000,0
10/24/2017,19,42,"every day is arms day Gym Teterboro instagram com p BapksObFQE9",0.000000,0
10/24/2017,19,41,"Hii Levelz Video x Abasi Taylor logicalnonsense215 com news 3ch3bjt33 lxtds5cz6eh4lsyyr7tag",0.000000,0
10/24/2017,19,41,"Hii Levelz Video x Abasi Taylor logicalnonsense215 com news 3ch3bjt33 lxtds5cz6eh4lsyyr7tag",0.000000,0
10/24/2017,19,41,"Chef John Vila and I hosting a James Beard Dinner at Treadwell Park NYC honored Park instagram com p Bapkp1gnns0",0.000000,0
10/24/2017,19,41,"lunch polishfoodtruck financialdistrict nyc pierogi kielbasa pyzy bacon boczek yummy instagram com p BapjmrjBwww",0.000000,0
10/24/2017,19,41,"I m at John F Kennedy International Airport in Queens NY swarmapp com c asXeth9gmFP",0.000000,0
10/24/2017,19,41,"Serene subway shot portraitphotography portrait subway subwayshot underground instagram com p BapkkymFnoi",0.000000,0
10/24/2017,19,41,"RR York New York instagram com p Bapko4phFrm",0.136364,1
10/24/2017,19,41,"Tonight tonight tonight soexcited luckyme Kerr Theatre instagram com p BapkohyhtJd",0.000000,0
10/24/2017,19,41,"goopy gyne bagha byne bengali fantasy adventure comedy 1969 instagram com p BapjkV2j EnR 5HyFRf1op7fOzfgiMO2NIjcKGw0",0.000000,0
10/24/2017,19,41,"Human Garden 8 model manusouza photo curatethis1x jacksoncarvalho com instagram com p Bapkl Jnofd",0.000000,0
10/24/2017,19,41,"No time for Adulting today CantAdultToday College New instagram com p Bapkmfqgsh31 FGCTYjfxzVyiPwHk3 sJcyX600",0.136364,1
10/24/2017,19,41,"Drinking a Double Dry Hopped Forever Simcoe by at http untp beer s c519231089",-0.033333,-1
