Date,Hour,Minute,Tweet text,Polarity,Sentiment
09/27/2017,19,59,"Kinky Boots fitzixo kinkyboots nyc broadway girlsnight cyndilauper Boots on Broadway instagram com p BZkFRM8HCRJ",0.000000,0
09/27/2017,19,59,"Finally made it to a show after so much travel It s CoraCrawley from DowntonAbbey on instagram com p BZkFM7ZDm10",0.100000,1
09/27/2017,19,59,"Wow This was amazing bdaymonth Oyster Bar instagram com p BZkFQGqAsX",0.350000,1
09/27/2017,19,59,"The last home game of the season when with a simple choice The chicken parm instagram com p BZkFOXHnQVL",-0.250000,-1
09/27/2017,19,59,"I M GOING TO PLANET B PILGRIM NEW YORK http PILGRIMNYC COM artinamerica cinema filmedit instagram com p BZkFNyTnSIU",0.136364,1
09/27/2017,19,59,"Scenic views from my terrace NYC York New York instagram com p BZkFNZRgXr4",0.136364,1
09/27/2017,19,59,"Transformation growth And so it begins thework goingdeeper release energy healing instagram com p BZkFNP5BR w",0.000000,0
09/27/2017,19,59,"And one more from the greekfestival northbeach portwashington morningblues shoutout instagram com p BZkFM7zHgEv",0.500000,1
09/27/2017,19,59,"How did I end up here A little chat and cut at the premiere of Curb Your Enthusiasm Season 9 instagram com p BZkFL3QgoiL",-0.187500,-1
09/27/2017,19,58,"House plants shot by with nikond90 edited in lightroom Vernon New York instagram com p BZkFI8ulWZw",0.136364,1
09/27/2017,19,58,"newyork newyorkcity stunning views usa nycphotographer centralpark nighttime insta instagram com p BZkFJXAHvHl",0.500000,1
09/27/2017,19,58,"usa newyork nyc rooftop greatview atnight strata work Fifth Rooftop Bar instagram com p BZkFIvvnGgA",0.000000,0
09/27/2017,19,58,"i wrote this for you preorders ONLY 2 left are now available for perfectly instagram com p BZkFHIIF3HX",0.350000,1
09/27/2017,19,58,"Checked in Field for the braves vs mets game w http MLB com For the last damn time",-0.200000,-1
09/27/2017,19,58,"Hey local peeps I m going to be at the Harvest Fair at Our Lady Queen of Peace School this instagram com p BZkFFA7h2mP",0.350000,1
09/27/2017,19,58,"Already thinking about what to do with your kids this upcoming weekend Make a brunch or dinner instagram com p BZkFEUanQ7z",0.000000,0
09/27/2017,19,58,"Join us next summer June 21 23 in New York City for the AIA 2018 Show AIA newyork NYC instagram com p BZkFE3eBMSG",0.068182,1
09/27/2017,19,57,"Out wit my daughter my niece to see IT We Lit http ashantiroyalty instagram com p BZkFDClD0UP",0.000000,0
09/27/2017,19,57,"normal estar aqui a menos de um dia e j estar completamente apaixonada por essa cidade em instagram com p BZkFB80jqxW",0.150000,1
09/27/2017,19,57,"Getting started at tonight s event Farms instagram com p BZkFBqRjYwz",0.000000,0
09/27/2017,19,57,"What failure looks like I did not accomplish what i actually wanted to do instagram com p BZkE ZVjeT3",-0.158333,-1
09/27/2017,19,57,"Construction on MLine Both directions from Forest Hills 71st Avenue Station to Essex Street Station http 511ny org EventDetails T RANSCOM ORT25496207",0.000000,0
09/27/2017,19,57,"Trippie Redd In Too Deep https soundcloud com trippie hippie 2 in too deep produced by goosetheguru",0.000000,0
09/27/2017,19,57,"Cada viernes Repost get repost Los viernes son de Victor Maldo en 809 instagram com p BZkFAynDyO7",0.000000,0
09/27/2017,19,57,"Yooo b I swear these new songs got my set on another level This Friday catch instagram com p BZkE 4bj3pq",0.136364,1
09/27/2017,19,57,"Amazing job by mollyty rf is lucky to have these two Long Hall instagram com p BZkE MGF mJ",0.294444,1
09/27/2017,19,57,"N O R E Ft Pharrell Uno M s https soundcloud com massappealrecs unomas",0.000000,0
09/27/2017,19,57,"Korean in New York NY swarmapp com c 0KQ5oWS00Zs",0.136364,1
09/27/2017,19,57,"Sunshine Pinball League Laundry Pinball Emporium in Brooklyn NY swarmapp com c aHtqFNoNw3C",0.000000,0
09/27/2017,19,57,"Super psyched to catch at the tonight doing his tribute to davidbowie instagram com p BZkE8ZZg Rq",0.333333,1
09/27/2017,19,56,"Love these colorfulfilters of the bluesky the nycskyline nyc nycphotographer ilovenyc instagram com p BZkE8K1Foe6",0.500000,1
09/27/2017,19,56,"Na RT TheCivilRight Lets start the ForTheDegreeChallenge",0.000000,0
09/27/2017,19,56,"LINK IN BIO The continued obsession continues more on the vlog instagram com p BZkE4STAGPn",0.500000,1
09/27/2017,19,56,"Stay Tuned raneseventytwo York New York instagram com p BZkE23pgDut",0.136364,1
09/27/2017,19,56,"Lil Xan Betrayed https soundcloud com lil xan betray ed",0.000000,0
09/27/2017,19,56,"Lagerfeld through the contrstruction site plexiglass Island City Lic instagram com p BZkE1kNlyFh",0.000000,0
09/27/2017,19,55,"It s a chain but dang good and healthy Kitchen in New York NY swarmapp com c lG6NLu3Xq02",0.445455,1
09/27/2017,19,55,"Come with me and you ll be in a world of pure imagination Bodega Man Willy WeGotCandy instagram com p BZkExzDF gL",0.214286,1
09/27/2017,19,55,"cakyelovecity wensdayoff dotworrybehappy High Line instagram com p BZkExtLlXzUz G23fqyuJgw7 1uVa y9AksGu8M0",0.160000,1
09/27/2017,19,55,"Winter round and proud Spa Full Grooming and Self Service Dog Wash instagram com p BZkExkLlJu8",0.316667,1
09/27/2017,19,55,"I m at Moriarty s Bar Restaurant in Yonkers NY swarmapp com c cIuTncgSpLQ",0.000000,0
09/27/2017,19,55,"Pretty in pink prettyinpink jcrewstyle bandana handkerchief instagram com p BZkEwbJB Q1",0.075000,1
09/27/2017,19,55,"Burgers and Bordeaux promotion at Le Cirque Time to eat at the instagram com p BZkEupThrCwy kbR4BiOMwlMrOF9 tWX8DQqzD40",0.000000,0
09/27/2017,19,55,"No More x Choices logicalnonsense215 com news tfc3stf8l zd2w8azwdd8rdyj4gl38a",-0.250000,-1
09/27/2017,19,55,"No More x Choices logicalnonsense215 com news tfc3stf8l zd2w8azwdd8rdyj4gl38a",-0.250000,-1
09/27/2017,19,55,"Idk but shit is od good The shit with brandy is hard everything really maybe like 3 tracks I ll take off",0.041667,1
09/27/2017,19,55,"This saturday 09 30 809loungesaturday Dont mis our birthday pack 3bottles x 300 include instagram com p BZkEtqLDa2F",0.000000,0
09/27/2017,19,54,"Meet the fabulous founder and amazing ladies of Jetzy instagram com p BZkEs3ulsjaE a9PSm5 hhIjtkrF1rG5iYlJYTY0",0.500000,1
09/27/2017,19,54,"Always love meeting hearing from other game changers in the influencer marketing space instagram com p BZkEs Nh5Hw",-0.008333,-1
09/27/2017,19,54,"Mad respect 2 all tha dj z who have been jackin my Fruit Fly EP on Rebel Eye NYC Get your instagram com p BZkEq6yATWn",0.087500,1
09/27/2017,19,54,"2017 9 27 We can get fresh local stuff And organic stuff as",0.150000,1
09/27/2017,19,54,"I m at Penny Lane in Astoria NY swarmapp com c hX2GKSjORJB",0.000000,0
09/27/2017,19,54,"Christ The King Shooting Guard r mcleod1 came through for a vertimax session today All instagram com p BZkEqLTB1XK",0.000000,0
09/27/2017,19,54,"ippudo ramen Westside instagram com p BZkEp24BWuC 9oJseFYbGxTUUi7c1A84l8bhhc0",0.000000,0
09/27/2017,19,54,"pretending to study for chemistry wishing I were watching tame impala and pretending to be a instagram com p BZkEpD2gIr",-0.216667,-1
09/27/2017,19,54,"Wow Just met and spoke with doctachow He is VERY impressive and has some HUGE goals Thanks instagram com p BZkEobrlQmQ",0.425000,1
09/27/2017,19,54,"I m at in New York NY swarmapp com c 5wDTzdrrg39",0.136364,1
09/27/2017,19,54,"Look who stopped by the office today The lovely Ms Dorinda Medley received instagram com p BZkEmmIAEVf",0.500000,1
09/27/2017,19,53,"Suspeito que esta noite n o ser f cil York New York instagram com p BZkElxQg OU6 kYTV71P2ZM0Z3lHvv8RZY Kkg80",0.136364,1
09/27/2017,19,53,"Now carrying in the shop A perfect stocking stuffer for those starting to plan instagram com p BZkElj Atbs",0.500000,1
09/27/2017,19,53,"bossbabe whorulestheworld girlsdo Heights Condo Association instagram com p BZkEkxahHes",0.000000,0
09/27/2017,19,53,"Check out our blog for posts about maximizing your cleaning potential residentialcleaning instagram com p BZj1cUTFw4v",0.000000,0
09/27/2017,19,53,"Bergen county court house Sept 27 00 am 2017 Daniele Matteo instagram com p BZkEjmvhlBJv 7rkSXcD1emPxU1tGiOnVok gc0",0.000000,0
09/27/2017,19,53,"Spotify Fall Family Carnival fall is coming instagram com p BZkEjlugl V",0.000000,0
09/27/2017,19,53,"flattummyco No more wishing for a flat tummy FlatTummyTea is having a sale right now up to instagram com p BZkEhxmg8pC",0.003571,1
09/27/2017,19,53,"ESTRENO MUNDIAL dowbamontana Mangue Una Tabla Video Oficial https goo gl tVS8AN via instagram com p BZkEgaYHOns",0.000000,0
09/27/2017,19,53,"ippudo Westside instagram com p BZkEgc2B4UA2 gAUoCmFu3H4wfyZQWdcKAKc1Ao0",0.000000,0
09/27/2017,19,53,"1115 Morris Avenue the Bronx pic twitter com bty6pThvM1",0.000000,0
09/27/2017,19,53,"Profile of a fireman holding one of countless US flags along the route for the Stephen Siller instagram com p BZkEe vDJmJ",0.000000,0
09/27/2017,19,52,"I think if you ask nicely they ll give you 280 to work with",0.600000,1
09/27/2017,19,52,"Waddup",0.000000,0
09/27/2017,19,52,"Use code LOVEART curioos com anoellejay pro mo anoellejay curioos instagram com p BZkEdpLHVZO",0.000000,0
09/27/2017,19,52,"thephantomoftheopera majestictheatre broadway newyork nyc theatre Phantom Of The instagram com p BZkEc3HDs6u",0.000000,0
09/27/2017,19,52,"Mayor Bill de Blasio thank you for having me and thank you for what you do for our instagram com p BZkEbmXhS5z",0.000000,0
09/27/2017,19,52,"Las mejores jugadas de este a o Yo creo que s mlb mlbhighlights mejoresjugadas baseball instagram com p BZkEaU3DOg5",0.000000,0
09/27/2017,19,52,"Live Life don t let it Live You onset instagram com p BZkEaDujGt",0.136364,1
09/27/2017,19,52,"Just posted a photo East Side instagram com p BZkEZ4GHKdV",0.000000,0
09/27/2017,19,51,"LGM York Mets Citi Field Queens instagram com p BZkEWxrB8b7",0.000000,0
09/27/2017,19,51,"Rebel setup or impulse control test I don t take that many selfies and see the point but come instagram com p BZkEUCEHM54",0.500000,1
09/27/2017,19,51,"Last home game for 2017 Hope always springs eternal Let s Go Mets Mets Braves baseball instagram com p BZkETtnHbCB",-0.200000,-1
09/27/2017,19,51,"SLANewYork happy hour Cheers Creek Bar and Lounge nyc in New York NY swarmapp com c 2bsKanECXNG",0.468182,1
09/27/2017,19,51,"Birthday cocktails at newyorkcity nyc newyork usa theplaza travel instagram com p BZkERzVl x",0.000000,0
09/27/2017,19,51,"I m at Citi Field for Atlanta Braves vs New York Mets in Flushing NY swarmapp com c 7SjkPMVomdm",0.136364,1
09/27/2017,19,51,"That smile is gonna kill me pizzabuckaroo East Side Manhattan NYC instagram com p BZkEQpigR63",0.300000,1
09/27/2017,19,50,"One last day of summer Mets letsgomets Field instagram com p BZkEPZfHMB7",0.000000,0
09/27/2017,19,50,"Yoga coming to Gavia Cycling studio mid November stay tuned for schedule info yes that is one instagram com p BZkEO1RFp m",0.000000,0
09/27/2017,19,50,"I m at Xi an Famous Foods in New York NY swarmapp com c cAMmLqNbiB2",0.318182,1
09/27/2017,19,50,"uw21 makeyourmark urbanworld urbanworldfilmfestival everydayppl hotpepperjelly instagram com p BZkENshB8Xq",0.000000,0
09/27/2017,19,50,"Hours after the doctor says modify your diet you try vegan pizza just to see if you can go instagram com p BZkENaaF09H",0.000000,0
09/27/2017,19,50,"I m at John F Kennedy International Airport in Queens NY swarmapp com c cDUvzPHaJ88 pic twitter com oP3Z9Kqe3u",0.000000,0
09/27/2017,19,50,"Acaba de publicar una foto en Hotel Riu Plaza New York Times Square instagram com p BZkEMkanjRI YEG2eB6gn9VVjaoCBE0AY3z6mU0",0.136364,1
09/27/2017,19,50,"travel made me grow up Washington Square Park instagram com p BZkEL 5Hv6n",0.000000,0
09/27/2017,19,50,"Hoboken Riverside bw 212 en Hoboken Terminal and Railyard instagram com p BZkEKlPjBvQ3 3BWzFuS1SpXAwCErL5oyIeKars0",0.000000,0
09/27/2017,19,50,"June 19 2017 97 02 160 Avenue Howard Beach Queens 580 500 1 unit 1 724 sf one family home one story permanent living quarter",0.000000,0
09/27/2017,19,50,"Absolutely delicious very smooth for a 9 brew Hall of Fame 394 2017 http untp beer s c508660078 photo",0.760000,1
09/27/2017,19,50,"Top 3 TV and Internet Providersc hm ccfxxx http faqeo com Top3TVAndInter netProviders rgid 17592 sub gclid gclid CKb9t nGxtYCFY5XDQodLRcPmQ",0.500000,1
09/27/2017,19,50,"Just posted a photo Brooklyn Barge instagram com p BZkEJryAfyW",0.000000,0
09/27/2017,19,50,"never hosting a dinner party again Metropolitan Museum of Art instagram com p BZkEJQyAhIzg n 7PRIwW657M59M76XLEJY8fss0",0.000000,0
09/27/2017,19,49,"Find yourself a bartender that will put not 1 but 2 preseason games on instagram com p BZkEIpVB1DJ",0.000000,0
09/27/2017,19,49,"rooftopnyc rooftopcinemaclub greatmoments unforgettable instagram com p BZkEInDHD6x",0.800000,1
09/27/2017,19,49,"Best thing about both teams having crappy seasons cheap tickets murriedlifenyc instagram com p BZkEIl lkyA",0.700000,1
09/27/2017,19,49,"Get tix for ToastOfFrance today at http toastoffrance eventbrite com Toast of France October instagram com p BZkEIQjhHIg",0.000000,0
09/27/2017,19,49,"Person you should smile more you look nice Me Shut up Beach 95 Street instagram com p BZkEHomFihr",0.466667,1
09/27/2017,19,49,"snapplefacts truestory greatestfeeling ididthat instagram com p BZkEHXalLnx",0.000000,0
09/27/2017,19,49,"When was the last time you saw a key like this Hoopty 45 2001BuickRegal GM instagram com p BZkEHQElUU8",0.000000,0
09/27/2017,19,49,"Bergen county court house Sept 27 00 am 2017 Daniele Matteo instagram com p BZkEGyHB6GmE FbMEV3l8O bGmosoUV1lmVHikk0",0.000000,0