Date,Hour,Minute,Tweet text,Polarity,Sentiment
01/15/2017,14,03,"Just popped by to say hi to Van Gough Monet Warhol and Picasso instagram com p BPS8qq7h7kLa fiZAllscIx dedVROLbPUGWo8g0",0.000000,0
01/15/2017,14,03,"Man this is my family rite chea Happy Birthday again tells Uncle Maine Luvs ya instagram com p BPS8p7iAGxA",0.800000,1
01/15/2017,14,03,"dolo como te explico cu nto te amo yo barcelonasc instagram com p BPS8pkJgnqNM pIoxsENf4PJFfctuYtonuxV5Ts0",0.000000,0
01/15/2017,14,03,"All The Way Up CCGMix Trailer Video dropping something light to start off 2017 instagram com p BPS8ozwhAru",0.400000,1
01/15/2017,14,03,"happysunday funday 169 instagram com p BPS8oPEl2SN",0.000000,0
01/15/2017,14,03,"Huevos d as dalishus Brunch Williamsburg PCXVIII Mimosas alariseyrise Youbetterwork instagram com p BPS8ociAyf",0.000000,0
01/15/2017,14,03,"Rare Form Cascadia DIPA now available on tap http brmn us 1fxR51W BeerMenus",0.350000,1
01/15/2017,14,03,"I m at 92nd Street Y May Center in New York NY swarmapp com c 1p2JjGnZMnw",0.018182,1
01/15/2017,14,03,"Just waiting Tremont Ave instagram com p BPS8n2Vgq9C",0.000000,0
01/15/2017,14,03,"Always brunching Bonnie instagram com p BPS8nk9j9WF",0.000000,0
01/15/2017,14,03,"I m a coffee addict Had the chocolate donut espresso this morning It was goooooood Yum instagram com p BPS8nVqhx3t",0.000000,0
01/15/2017,14,03,"Just posted a photo York New York instagram com p BPS8nKEDbxn",0.136364,1
01/15/2017,14,03,"When on a quick trip get brunch with your roommate who s also in town at in Brooklyn NY swarmapp com c 0srWR64pGP9",0.333333,1
01/15/2017,14,03,"BREAKING NEWS GIANTSNATION WEBLEEDBLUE fvckyourcowboys York New York instagram com p BPS8mvog6cZ",0.136364,1
01/15/2017,14,02,"Dumplings for breakfast Soo Chow instagram com p BPS8loShuY6",0.000000,0
01/15/2017,14,02,"High Line instagram com p BPS8lqdA JJE JJV0VD5nrXKku3wikd9pSsRwXU0",0.160000,1
01/15/2017,14,02,"I m at in Brooklyn NY w swarmapp com c 8GDA4WC9o7y",0.000000,0
01/15/2017,14,02,"Lovely day for a ride Park instagram com p BPS8lM6h87G",0.500000,1
01/15/2017,14,02,"Tues Jan 17th 2017 Tune in for from 7pm 10pm with on the 1 s 2 s instagram com p BPS8jIHDqVJ",0.000000,0
01/15/2017,14,02,"Come on in and enjoy Football Sunday with us Buckets of Beer 5 for 20 and plenty of finger instagram com p BPS8jJgDrCP",0.400000,1
01/15/2017,14,02,"Radio City newyorkcity radiocityhall radiocity City Music Hall Rockettes instagram com p BPS8jWbjACj",0.000000,0
01/15/2017,14,02,"The best thing about NYC is the food instagram com p BPS8hunjX8U",1.000000,1
01/15/2017,14,02,"Brunch in the sunlight Latte wife in Astoria NY swarmapp com c adyk6L0P3BF pic twitter com QIqTEupYkz",0.000000,0
01/15/2017,14,02,"Just posted a photo The Hub instagram com p BPS8hESDV7A",0.000000,0
01/15/2017,14,02,"Fan love You ladies are beautiful Thank you for coming out to support NewEdition instagram com p BPS8gdugxkC",0.675000,1
01/15/2017,14,01,"HOUSE MUSIC LOVERS Join me TODAY SUNDAY Jan 15th Martin Luther King Jr Weekend No work or instagram com p BPS8ddtA JG",0.000000,0
01/15/2017,14,01,"The Melograno 75 gin pomegranate yellow chartreuse lemon cava s instagram com p BPS8d9ZAPe9",0.000000,0
01/15/2017,14,01,"That face you make when you finally get fed LegoVagabond Lego MiniFig ToyPortrait Brunch instagram com p BPS8eBpgGuy",0.000000,0
01/15/2017,14,01,"representing for princebdaybash clarendonlinkup2017 fashionstatementaffair instagram com p BPS8bWNBw9R",0.000000,0
01/15/2017,14,01,"My Ogee myfriendsarebetterthanyours East Side instagram com p BPS8dvxjs4l4 dt hYOI6Rujx TXZ1Bj5Jxppwg0",0.000000,0
01/15/2017,14,01,"When your best friends surprise you for your birthdaycelebration Love my besties instagram com p BPS8ciZl2pJ",0.750000,1
01/15/2017,14,01,"Hi SoHo I missed you instagram com p BPS8csdAY5I",0.000000,0
01/15/2017,14,01,"Good afternoon fighters lifetimefitness Time Athletic at Sky instagram com p BPS8cH6D 5U",0.700000,1
01/15/2017,14,01,"Feliz Domingo para todos Recuerden nunca negocies tu felicidad instagram com p BPS8bmhjEhaK 7knfmCFRBtr14jfsZbssw3i55Q0",0.000000,0
01/15/2017,14,01,"regrann from shizzlesherlock yuH KnOw HoW LonG mi A TeLl UnNu SeH ShErLocK dI W0rLd LoCk instagram com p BPS8aYJhhpe",-0.050000,-1
01/15/2017,14,01,"What a week Pumped to be feeling almost again and for all the yoga classes that begin this instagram com p BPS8ZNeFnV",0.000000,0
01/15/2017,14,01,"Raw pic bts from today s shoo Model beauty88 Photographer Hair instagram com p BPS8Z52BQ3n",-0.230769,-1
01/15/2017,14,01,"my Holy Father Who is in Haven PLEASE PLEASE give us more of it in thy holy house instagram com p BPS8aE AP8P",0.500000,1
01/15/2017,14,01,"I m at Times Square in New York NY swarmapp com c 5D2rbKZVGAr",0.136364,1
01/15/2017,14,01,"REAL STEAK FRIES STEAK AND SALAD UMMMMM Basin Brooklyn New York instagram com p BPS8ZWvBWT6",0.168182,1
01/15/2017,14,01,"I m at Laurelton in Queens NY swarmapp com c l6yFN9g42tI",0.000000,0
01/15/2017,14,01,"Happy big birthday to Lisa Anne Barsanti Hoyt Tuscan Gun Popup instagram com p BPS8Yw3AHpn",0.400000,1
01/15/2017,14,01,"Green Park http ln is www instagram com p qWkJR",-0.200000,-1
01/15/2017,14,00,"I m at Springfield Gardens NY in Springfield Gardens NY swarmapp com c aoyhajfLgqs",0.000000,0
01/15/2017,14,00,"It s the freaking weekend baby I m having a burger a sandwich and fries ajnocitomusic instagram com p BPS8W0thODL",0.000000,0
01/15/2017,14,00,"Day 11 30 JustShowUp Water Skier pilates Street Pilates instagram com p BPS8VegjXXu",0.000000,0
01/15/2017,14,00,"customized 1of1 BWOOD made in NY nasa bsa B DEVIOU Shoppe by BWOOD instagram com p BPGZ2CsB0FZ",0.000000,0
01/15/2017,14,00,"writersresist loudertogether writerscommunity bryantpark The New York Public Library instagram com p BPS8VFfF0y",0.068182,1
01/15/2017,14,00,"Left the gym now hitting some korean bbq with my lady kirstirooks York New York instagram com p BPS8UtfhXFx",0.068182,1
01/15/2017,14,00,"My wife picked up some delicious French pastries Michel French Bakery in Elmwood Park NJ swarmapp com c 9i1Jpm5HqgQ",0.333333,1
01/15/2017,14,00,"I m at Holland Tunnel in New York Jersey City NJ swarmapp com c 3mBAKHUvqE4",0.136364,1
01/15/2017,14,00,"Great gym in Valley Stream Open about a year ago if you l I ve in the area definitely check instagram com p BPSoBePAyvE",0.266667,1
01/15/2017,14,00,"Shout my lil homie Jinx for stopping by and purchasing our cbsplus street wear snapback CORONA instagram com p BPS8TzKhqBU",0.000000,0
01/15/2017,14,00,"Soup there it is Stock in New York NY swarmapp com c ghfTz8VChrm",0.136364,1
01/15/2017,14,00,"Off to our next location sundayfunday East Side instagram com p BPS8Q3ZDLFkM EGn5 AcwFpvBPlX3KC9T178Ym40",0.000000,0
01/15/2017,14,00,"Puttin in the hard work now York New York instagram com p BPS8Qd7B0FJ",-0.077652,-1
01/15/2017,13,59,"On my way to BK NY in Jamaica NY swarmapp com c cDBT5x5oi8g",0.000000,0
01/15/2017,13,59,"Just posted a photo Slope Historic District instagram com p BPS8QDYgKVF",0.000000,0
01/15/2017,13,59,"started tracking a new LP today live with auletta ryanisokayiguess instagram com p BPS8PgRDQ2n",0.136364,1
01/15/2017,13,59,"Top of The Rock with my Of The Rock NYC instagram com p BPS8PdOgNx1O yFrOfLndmYH2p0FYqJLehTGOIo0",0.500000,1
01/15/2017,13,59,"I m on a boat Museum instagram com p BPS8OmlDFSd",0.000000,0
01/15/2017,13,59,"Welcome to Batman s home City New York instagram com p BPS8NuIgd3Y",0.468182,1
01/15/2017,13,59,"nfr2017 Javitt Center New York City New York instagram com p BPS8ND7jo7N",0.057576,1
01/15/2017,13,59,"HAPPY BIRTHDAY POPS York New York instagram com p BPS8M shf8U",0.468182,1
01/15/2017,13,59,"Stocking up on junk food Marketplace instagram com p BPS8MFJFyWxw nH3Bp59hBhp8F7Cp Igqlr4gco0",0.000000,0
01/15/2017,13,59,"BACK AT IT AGAIN MY DAUGHTER IS A AS SHE DANCING W HER AUNTY beautyandflaws HAITIAN instagram com p BPS8Iajjxwg",0.000000,0
01/15/2017,13,59,"Cheese flight with cheese foodadventures murrayscheesebar nofilter s instagram com p BPS8K6kA14s",0.000000,0
01/15/2017,13,59,"well first slide beyond the title slide pic twitter com NYPjmjzyL8",0.250000,1
01/15/2017,13,59,"nocaptionneeded York New York instagram com p BPS8K04gqyh",0.136364,1
01/15/2017,13,59,"TBT bwoodknows getyouadog nyc Tonight Show Starring Jimmy Fallon instagram com p BPK3xobAzsr",0.000000,0
01/15/2017,13,59,"My morning under the Brooklyn Bridge brooklynbridge newyork waterstreet dumbo instagram com p BPS8J4HjLNy",0.000000,0
01/15/2017,13,59,"Front row center kinkybootsbway with ayeyorios Thank you so much this is amazing instagram com p BPS8JzdAbga",0.233333,1
01/15/2017,13,59,"back from the dead LTD York New York instagram com p BPLpi3Bg3Eh",-0.021212,-1
01/15/2017,13,59,"Obama s chapter in the history books is going to be much like his r sum when he was elected president thin http nyp st 2jydUIM",-0.100000,-1
01/15/2017,13,58,"and representing for princebdaybash clarendonlinkup2017 instagram com p BPS8IVph4LY",0.000000,0
01/15/2017,13,58,"This the dream team Only missin a few star playas yazzthegreatest jahiwinston myles truitt instagram com p BPS8HgQgMd1",-0.100000,-1
01/15/2017,13,58,"reflection nyc nyc York New York instagram com p BPS8GvMjEiQ",0.136364,1
01/15/2017,13,58,"BACK AT IT AGAIN MY DAUGHTER IS A AS SHE DANCING W HER AUNTY beautyandflaws HAITIAN instagram com p BPS7 dQDTGa",0.000000,0
01/15/2017,13,58,"We love our customers and the unique ways you keep us in your lives throughout the years instagram com p BPS7VlIjJ0v",0.437500,1
01/15/2017,13,58,"Moonshiners Funkys Boards instagram com p BPS8CGrhdlb",0.000000,0
01/15/2017,13,58,"I m at Mudspot in New York NY swarmapp com c 0MUnE0vlcPQ",0.136364,1
01/15/2017,13,58,"Listen to SINS OF THE FATHER by DEF MERCHANT MIXES RECORDINGS np on instagram com p BPS7nZ7g1FD",0.000000,0
01/15/2017,13,57,"I don t care that you re on the phone you still gotta kiss me love miamor nyc instagram com p BPS8BQdAYwW",0.500000,1
01/15/2017,13,57,"Who remembers this wonderful book childhood Department Store instagram com p BPS8AObBe2X",1.000000,1
01/15/2017,13,57,"Capture of the H B M Frigate Macedonian by the U S S On October 25th 1812 circa 1845z instagram com p BPS6ky8ALaD",0.000000,0
01/15/2017,13,57,"I m at New York Marriott Marquis in New York NY swarmapp com c 1IYc1mOgWac pic twitter com DUJWsPSLMa",0.136364,1
01/15/2017,13,57,"New story for Model pierce88 with Stylist grooming Me instagram com p BPS7 tBAEm1",0.136364,1
01/15/2017,13,57,"Cleared Special Event on PrudentialCenterROCK",0.357143,1
01/15/2017,13,57,"I m at Charlotte Patisserie in Brooklyn NY swarmapp com c dLpyGO3smoo",0.000000,0
01/15/2017,13,57,"Father and Son nyfrombehind timessquare whoistheholyspirit Times Square instagram com p BPS760Kh0ur",0.000000,0
01/15/2017,13,57,"THE MUSIC OF KARL JENKINS AT CARNEGIE HALL I am show ready instagram com p BPS79ulAucUi 58FFbCUY Zk8sMnYwjcw5rTZpo0",0.200000,1
01/15/2017,13,57,"Sunday service Church in Guttenberg NJ swarmapp com c keANHsrmSDT",0.000000,0
01/15/2017,13,57,"nycsubway mtasubways ilovenyc iloveny citylife citylifestyle NYC nyclifestyle nycliving instagram com p BPS78pcgkYz",0.000000,0
01/15/2017,13,57,"I m at Benny s Burritos in New York NY swarmapp com c jbTFOs2SwCp",0.136364,1
01/15/2017,13,57,"AirPods Grand Central in New York NY swarmapp com c ja5tjM5whXw",0.212121,1
01/15/2017,13,57,"Well this is it It s been a wild ride jerseyboys Thanks for having me on board Much love to instagram com p BPS78T3gkx5",0.266667,1
01/15/2017,13,57,"NYCmissed N train Saturday morning m4m SoHo http newyork craigslist org mnh mis 596036 2845 html",0.000000,0
01/15/2017,13,56,"Back on my fam cam 2 more of the beautiful ladies of my family My instagram com p BPS75MYgUupp HVInShSOphj9ukGHGgomXFHso0",0.450000,1
01/15/2017,13,56,"And just like that we are back at it again Coming back to Hoboken after football season instagram com p BPS74WkF9HD",0.000000,0
01/15/2017,13,56,"Traveling New York Hotel instagram com p BPS73ltjUeD",0.136364,1
01/15/2017,13,56,"A sudar un poco con Danny Ochoa Zumbaton para fundacionlosni osdelsol Settlement swarmapp com c 2O47ov3y1LK",0.000000,0
01/15/2017,13,56,"very first slide of my deck actually",0.162500,1
01/15/2017,13,56,"Bday 2 awesome Italian food in jersey A Modo Mio instagram com p BPS72omF5FNZ 08sNIau3v4LtFtlUSj BrGOUqA0",0.500000,1
01/15/2017,13,56,"2017 is looking bright as f k BlackExcellenceBrunch instagram com p BPS728jgq0z",0.700000,1
01/15/2017,13,56,"I m at Grand Central Terminal in New York NY swarmapp com c kySepYoxgnO",0.212121,1
01/15/2017,13,56,"Found warmth in a black queen for when I get cold New York instagram com p BPS72D Ayl7",-0.210101,-1
01/15/2017,13,56,"Day dreaming about the next time I ll get to collaborate with the wonderful artists who came instagram com p BPS71cqAF8j",0.500000,1
01/15/2017,13,56,"It always Christmas somewhere R Guggenheim Museum instagram com p BPS71i8jaXp",0.000000,0
01/15/2017,13,56,"Tarte tatin fucking crushed it Ave Brooklyn instagram com p BPS71EEBfgvb NuHt3 C7vpU8OF2btVuMD JcrE0",-0.100000,-1
01/15/2017,13,56,"Coming to you live with love 86th and Lexington instagram com p BPS70JsBibm",0.318182,1
01/15/2017,13,56,"I m at baba cool cafe in Brooklyn NY swarmapp com c 2BBafHcI6JI",0.350000,1
01/15/2017,13,56,"frozensmore dominiqueanselbakery dominiqueanselisagenius Ansel Bakery instagram com p BPS7znoBmwS",0.000000,0
01/15/2017,13,56,"A00959 NEW Relates to annual and special fire district elections and repeals certain provisions of the town law http bitly com UzdT3f",0.235931,1
01/15/2017,13,55,"TONIGHT I will be paying tribute to the late anncorio via her instruction from her album How instagram com p BPS7yxOjMPg",-0.300000,-1
01/15/2017,13,55,"Candy Soda Ice Cream brooklyn parkslope Slope instagram com p BPS7yt1j4i8",0.000000,0
01/15/2017,13,55,"We are all Americans Love yourself don t hate yourself loveyourself weareallthesame instagram com p BPS7x0CBAle",-0.150000,-1
01/15/2017,13,55,"and last party before BabyHaile gets here babyshower dadtobe Brooklyn smokeemifyougotem instagram com p BPS7xxkAJBp",0.000000,0
01/15/2017,13,55,"Amazing sight Traveling Tower 1 World Trade Centre Ground Zero New York City instagram com p BPS7xPYDbao",0.368182,1
01/15/2017,13,55,"Friends are Family instagram com p BPS7w0UjN Qb m7peByVRL7l61IgzsG8WWpgG w0",0.000000,0
01/15/2017,13,55,"Grand Central Station Agern Restaurant The calm before the tasting menu at agernrestaurant instagram com p BPS7wn6hgLL",0.266667,1
01/15/2017,13,55,"HOMEMADE JUICE REMEDIES I LOVE IT I WILL PUT IT INTO USE MY G instagram com p BPS7wNTDOqt",0.500000,1
01/15/2017,13,55,"Update Incident on 6Line from 125th Street Station to 42nd Street Grand Central Station http 511ny org EventDetails T RANSCOM ORT20822807",0.250000,1
01/15/2017,13,55,"BACK AT IT AGAIN MY DAUGHTER IS A AS SHE DANCING W HER AUNTY beautyandflaws HAITIAN instagram com p BPS7tXtDIge",0.000000,0
01/15/2017,13,55,"Just posted a photo of Jersey City instagram com p BPS7vMRFxMG",0.000000,0
01/15/2017,13,55,"Manhattan instagram com p BPS7uVmAMbW",0.000000,0
01/15/2017,13,55,"mothernaturesson whitealbum johnlennon georgeharrison paulmccartney ringostarr rishikesh instagram com p BPS7aCNhQjb",0.000000,0
01/15/2017,13,55,"Swordfish Metropolitan Museum of Art New York instagram com p BPS7tpAhUSa",0.136364,1
01/15/2017,13,55,"So good to be with you Love u babe friends love music amannda York New instagram com p BPS7s ghIwn",0.459091,1
01/15/2017,13,55,"Park instagram com p BPS7s0ehAsG",0.000000,0
01/15/2017,13,55,"ESTE SABADO 21 te espero Sabado 21 enero party oficial de Leruffo s b day bash Estan todos instagram com p BPS7sNCD7jv",0.000000,0
01/15/2017,13,55,"So close Yet so far York New York instagram com p BPS7r29jXBgC V4n0 R QCh yYJH 9OcHUKE7mI0",0.118182,1
01/15/2017,13,54,"1937 x NorrisStreetShadd logicalnonsense215 com news hlx3sphk6 h3rwn8tamz6gpepsgdx9m",0.000000,0
01/15/2017,13,54,"1937 x NorrisStreetShadd logicalnonsense215 com news hlx3sphk6 h3rwn8tamz6gpepsgdx9m",0.000000,0
01/15/2017,13,54,"we got the Knights on deck lol 207th Street instagram com p BPS7rPwAaCY",0.800000,1
01/15/2017,13,54,"Just posted a photo Gospel Assembly of Queens FGAQ instagram com p BPS7qotlfgH",0.000000,0
01/15/2017,13,54,"Local Bar Astoria instagram com p BPS7qm1jwRV",0.000000,0
01/15/2017,13,54,"In two weeks Learn more from the link in our bio IDDCmustlovebeards 48 instagram com p BPS7qZtBFad",0.500000,1
01/15/2017,13,54,"the white melting away off katharinagrosse rockawaycolors katharina grosse Rockaways instagram com p BPS7qKjBQde",0.000000,0
01/15/2017,13,54,"I m at La Vita Mia in Astoria NY swarmapp com c kaHTHbMQPKm",0.000000,0
01/15/2017,13,54,"OH DANDY Men s Mid Century BROOKS BROTHERS tweed Fedora by Herbert Johnson London New Bond instagram com p BPS7moxBt0B",0.068182,1
01/15/2017,13,54,"she was fearless and crazier than him She was his queen And God help anyone who dared to instagram com p BPS7mqjAh43",0.000000,0
01/15/2017,13,54,"Psycho Norman Bates hitchcock cinema scary igersterrassa Park instagram com p BPS7mD2hyNw",-0.500000,-1
01/15/2017,13,54,"nycsubway mtasubways ilovenyc iloveny citylife citylifestyle NYC nyclifestyle nycliving instagram com p BPS7mE4ANvV",0.000000,0
01/15/2017,13,54,"I m at AMC Loews Kips Bay 15 for Hidden Figures in New York NY swarmapp com c cCElEQFGBeR",-0.015152,-1
01/15/2017,13,54,"From my birthday dinner last night Facebook is wonderful on birthdays I received well wishes instagram com p BPS7kzTFXN7",0.500000,1
01/15/2017,13,53,"El Greco Also I love the wall carpet TheMetropolitanMuseumOfArt Jesus ElGreco NewYork instagram com p BPS7jnjByIp",0.500000,1
01/15/2017,13,53,"writersresist York Public Library in New York NY swarmapp com c amHgAchTnQK",0.068182,1
01/15/2017,13,53,"Shine On Health New 28 Day Challenge Prepare One Meal A Day At Home shineonhealthcoaching com blog 1 2017 1 15 shine on health new 28 day challenge prepare one meal a day at home",0.136364,1
01/15/2017,13,53,"BACK AT IT AGAIN MY DAUGHTER IS A AS SHE DANCING W HER AUNTY beautyandflaws HAITIAN instagram com p BPS7h2EDVZS",0.000000,0
01/15/2017,13,53,"I m at in New York NY swarmapp com c 2XZATyrqlnV",0.136364,1
01/15/2017,13,53,"MY PARTNER TOLD ME THIS IS GOOD FOR DEPRESSED PPL I DIDN T EVEN KNOW THAT THEY MADE A JUICE instagram com p BPS7hsADlJj",0.700000,1
01/15/2017,13,53,"Once of the most iconic opening shots in cinema for me the 1st shot of Raging Bull this is instagram com p BPS7f9XlA82",0.500000,1
01/15/2017,13,53,"I m at Drama Book Shop in New York NY swarmapp com c dJvBLZyFUxr",0.136364,1
01/15/2017,13,53,"Finally joining the world of offsetguitars Step one install masterybridge fenderjaguar instagram com p BPS7gGHAfn3",0.000000,0
01/15/2017,13,53,"Matinee time sgtstubbythemusical offbroadway sundaysoffbroadway imwithstubby Luke s instagram com p BPS7fQqj0Kg",0.000000,0
01/15/2017,13,53,"Hey mama usa instagram com p BPS7ddHlj8x",0.000000,0
01/15/2017,13,53,"Glazed by Marilyn Minter Museum instagram com p BPS7dyQDYCq",0.000000,0
01/15/2017,13,53,"Stella McCartney collezione autunno inverno 2017 2018 il party a New York con Julianne Moore Naomi Watts fashionblog it post 452727 st ella mccartney collezione autunno inverno 2017 2018 il party a new york con julianne moore naomi watts e maggie gyllenhaal utm source dlvr it utm medium twitter newyork pic twitter com vtXo2hcwm5",0.136364,1
01/15/2017,13,53,"324 East 93rd Street Manhattan pic twitter com XPVMdWS0Od",0.000000,0
01/15/2017,13,53,"Getting ready for gym and packing up essentials in my gym bag Loving this natural active armor instagram com p BPS7cr7gXWs",0.191667,1
01/15/2017,13,52,"Another 1st with Soul Cycle class to prepare for two show Sunday DRENCHED instagram com p BPS7ccpB61I",0.000000,0
01/15/2017,13,52,"Absolutely Even in the midst of imperfection His blessings abound thankyouGOD instagram com p BPS7cnGgU23",0.200000,1
01/15/2017,13,52,"Drinking a Hofbr u Dunkel Dunkel Gold by at http untp beer s c406581593",0.000000,0
01/15/2017,13,52,"Setting up for episode 96 it s gonna be a good one York New York instagram com p BPS7Zyrgo 5",0.418182,1
01/15/2017,13,52,"Starting tomorrow I ll be leading my first meditation class 8 8 30 am at This instagram com p BPS6MoXg3fP",0.125000,1
01/15/2017,13,52,"Cousins lunch at the Chess House Food Chess House instagram com p BPS7XuXg5hSZ QyW6jV3R6xTrz9EJhFinlbqX1s0",0.000000,0
01/15/2017,13,52,"Waiting for the Pipilloti Rist Pixel Forest exhibit Museum in New York NY swarmapp com c lDrzVQjTUIA",0.136364,1
01/15/2017,13,52,"NYC manhattan brooklyn newyorkcity architecture drawing timessquare crownheights instagram com p BPS7WwHBlWo",0.000000,0
01/15/2017,13,52,"statenisland nycsnow statenislandferry the peaceful sound of snow falling on an empty street instagram com p BO7cZgmFXvw",0.183333,1
01/15/2017,13,52,"I m at in Jersey City NJ swarmapp com c igvBVL4lp4G",0.000000,0
01/15/2017,13,52,"My milkshake brings all the boys to the yard Tap Craft instagram com p BPS7VbglsFRs Uod eCS4W6bpnH 7KAiwY2rlf80",0.000000,0
01/15/2017,13,51,"I m all over http GhostNation BetterThanYouTube com New Jersey instagram com p BPS7VjNg4BT",0.136364,1
01/15/2017,13,51,"BuenosDias NegroYBlanco como Arlington New Jersey instagram com p BPS7UpWh2YL",0.136364,1
01/15/2017,13,51,"This Manhattan penthouse from one of my recent house tours is a purple lover s dream instagram com p BPS7S2kgM3v",0.000000,0
01/15/2017,13,51,"I m at in New York NY swarmapp com c f3j9i5OkiyZ",0.136364,1
01/15/2017,13,51,"repost I m 2 for 2 on gigs played at nublu with a shoestring guitarstrap In addition instagram com p BPS7RT lpMb",0.000000,0
01/15/2017,13,51,"WHEN I GO BACK TO THE GYM OR THE BASKETBALL COURTS THIS SPRING I WILL BUY THIS BEFORE I GET MY instagram com p BPS7RHMDcJb",0.000000,0
01/15/2017,13,51,"Always take the scenic route Brooklyn instagram com p BPS7QP jUQD",0.000000,0
01/15/2017,13,51,"hockey hockeygame cuteguys iceskating welovehockey Sports and Events Center instagram com p BPS7PJmDa Y",-0.100000,-1
01/15/2017,13,51,"Birthday celebration 1 such a happy surprise from my love instagram com p BPS7OmgDMuy8 JbcLQFFu 29HXUOzJifHrOr8 A0",0.433333,1
01/15/2017,13,50,"Just posted a photo Metropolitan Museum of Art New York instagram com p BPS7OJlAyR7",0.136364,1
01/15/2017,13,50,"http woodshoppe nyc pink Shoppe by BWOOD instagram com p BPNY936AOSK",-0.100000,-1
01/15/2017,13,50,"Que opinan de este comentario que dijo Hector Lavoe sobre el merengue music genre song instagram com p BPS7Nifh0mB",0.000000,0
01/15/2017,13,50,"Everytime anybody comes alone and trys hang with me at club York New York instagram com p BPS7NmqD7Sk",0.136364,1
01/15/2017,13,50,"I m at Starbucks in New York NY swarmapp com c ceT9s9iOhQc",0.136364,1
01/15/2017,13,50,"Zero Museum Workshop Images Artifacts from 9 11 instagram com p BPS7NKhDKL6l IevcWOLxX7cjAp10jYXWnWfviQ0",0.000000,0
01/15/2017,13,50,"Those few moments in life when you get to meet a living legend oneandonly you could only instagram com p BPS7M9 ha5Z",-0.100000,-1
01/15/2017,13,50,"Tarte tatin Ave Brooklyn instagram com p BPS7MobheREN c2ibUHEOhuDWvFv fk9Q1WlBjg0",0.000000,0
01/15/2017,13,50,"WE R DEVIOUS bwood Shoppe by BWOOD instagram com p BPS64lUhftv",0.000000,0
01/15/2017,13,50,"brunch with Berns Mona Leo Nina Patrick et al in New York NY w swarmapp com c 1E2BKMIhoKy",0.136364,1
01/15/2017,13,50,"Ozoni at a New Year party sponsored by the Consulate General of Japan in New York and supported instagram com p BPS7Idmjfou",0.107576,1
01/15/2017,13,50,"O Washington Square park est localizado no Greenwich Village e por estar rodeado pelo campus da instagram com p BNiYvLTBfon",0.000000,0
01/15/2017,13,50,"icecream yum love The Nella chocolate igdaily foodgasm instaphoto igers instadaily instagram com p BPS7HmxjFq5",0.500000,1
01/15/2017,13,50,"Waterfall trail New York Botanical Garden instagram com p BPS7HqHAej2",0.136364,1
01/15/2017,13,49,"Had to teach the spawn about the dangers of playing near a refrigerator because they clearly instagram com p BPS7GVQF2eM",0.100000,1
01/15/2017,13,49,"Trabalhando duro no blog Alguma sugest o de lugares que voc s gostariam de saber mais Ah instagram com p BNsgvxRhnNx",0.000000,0
01/15/2017,13,49,"November 23 2016 189 Beach 97th Street Hammels Queens 630 000 2 units 2 346 sf two family home two family frame",0.000000,0
01/15/2017,13,49,"9 11 memorial pic twitter com AIhJ6OwVor",0.000000,0
01/15/2017,13,49,"baby shower time Grand in Brooklyn NY w swarmapp com c b1ivkwalsYf",0.500000,1
01/15/2017,13,49,"HOUSE MUSIC LOVERS Join me TODAY SUNDAY Jan 15th Martin Luther King Jr Weekend No work or instagram com p BPS7EXmD9Yf",0.000000,0
01/15/2017,13,49,"Tudo sobre Nova York seus encantos e segredos Roteiros dicas e itiner rios personalizados instagram com p BN9fXxrhK5a",0.000000,0
01/15/2017,13,49,"Pregnant battery in my MacBook Air Grand Central in New York NY swarmapp com c 8PiPyfAQatw",0.242424,1
01/15/2017,13,49,"Relembrando um dia lindo de sol no Central Park porque hoje est frio nublado e escorregadio instagram com p BOIY6aBhKj0",0.000000,0
01/15/2017,13,49,"sunday centralpark nyc winter january2017 Park instagram com p BPS7CVVD FA",0.000000,0
01/15/2017,13,49,"After yesterday s shoot The Beard might be gone but seeing this lil cutie made me feel better instagram com p BPS7ByVjofP",0.500000,1
01/15/2017,13,49,"Typical Brooklyn scenery nyc travel architecture Brooklyn instagram com p BPS7BdIBc c",-0.166667,-1
01/15/2017,13,49,"I USED TO SUFFER FROM ASTHMA I WISH THEY WOULD VE HAD THIS WHEN I WAS YOUNGER INSTEAD OF instagram com p BPS7BQXD GJ",0.000000,0
01/15/2017,13,49,"5 4 3 2 1 Action Museum of American Art instagram com p BPS6XzZAsX8",0.050000,1
01/15/2017,13,49,"N o me canso dessa beleza Can t get enough of this beauty newyork novayork instagram com p BON Z2zBd0k",0.000000,0
01/15/2017,13,49,"HOUSE MUSIC LOVERS Join me TODAY SUNDAY Jan 15th Martin Luther King Jr Weekend No work or instagram com p BPS7APbgkV7",0.000000,0
