Date,Hour,Minute,Tweet text,Polarity,Sentiment
10/02/2017,14,11,"Tonight See you there NYC There s also a livestream Xo instagram com p BZwVYwdF3nR1 mqPcABjE7jZQQwvsziDJmfj5I00",0.000000,0
10/02/2017,14,11,"It s hard to find a hat that fits when you have a pumpkin head catladybox Hill instagram com p BZwVTKshfls",-0.291667,-1
10/02/2017,14,11,"This is Dyego He was my first couchsurfing guest 3 years go Hailing from saopaulo brazil he instagram com p BZwVX0BhBX8",0.250000,1
10/02/2017,14,11,"Saturday Apple Fest returns Who will reign supreme bobbingforapples instagram com p BZwVTCzjior",0.000000,0
10/02/2017,14,11,"thieverycorporation fordamphitheater vocals curlyhair singer instagram com p BZwVXIQlJ2w",0.000000,0
10/02/2017,14,11,"Holiday Inn Express Suites Chattanooga Lookout Mtn https travelignite com hotel reviews 2017 10 2 holiday inn express suites chattanooga lookout mtn",0.000000,0
10/02/2017,14,10,"Welcome to our Chocolate Factory with a musical tribute to R Kelly Sweet vibes from instagram com p BZwVSKiA4dU",0.383333,1
10/02/2017,14,10,"RESTOCK Air Max 1 Anniversary 140 sizes 8 13 available tmrw alltherightkicks instagram com p BZwVPLSBE Q",0.400000,1
10/02/2017,14,10,"The Daily Look Flora anndemeulemesster SS18 PFW AlphaDia outerwear modernmonday instagram com p BZwVPWFn 7k",0.000000,0
10/02/2017,14,10,"Drinking a Samuel Adams OctoberFest by at njairports http untp beer s c510782309",0.000000,0
10/02/2017,14,10,"New York New York Sunday October 8th The official countdown has begun 8 days to go to instagram com p BZwVNMFj7UU",0.136364,1
10/02/2017,14,10,"newprojects monday York New York instagram com p BZwVNu7ljgw",0.136364,1
10/02/2017,14,10,"Get a coach leather hangtag with your purchase of a large Coach fragrance jfkterminal1 instagram com p BZwVNBZn BE",0.214286,1
10/02/2017,14,09,"It clearly says donotleanondoor but I did it anyway nycsubway mta So you remember those instagram com p BZwVLmdFGkT",0.100000,1
10/02/2017,14,09,"hiiiiii pay attention to me dr boo York New York instagram com p BZwVMHrFyFW",0.136364,1
10/02/2017,14,09,"SUNDAY October 8th Come Support instagram com p BZwVKyRFlLsb eqo0Pffx7e7hnVhY2eYhj58ii40",0.000000,0
10/02/2017,14,09,"My heart is devastated after this horrible massacre of Las Vegas my instagram com p BZwVJ5NlA0GV o0O7haz27XZXYVHno9qAyiIcM0",-1.000000,-1
10/02/2017,14,09,"Love that nigga Treps4Eva Queens instagram com p BZwD8jancMH",0.500000,1
10/02/2017,14,09,"This city I love financialdistrict on weekends so quite instagram com p BZwVI1RBXbU",0.500000,1
10/02/2017,14,09,"That time a strapped a camera to a bird New York instagram com p BZwVHppBeDP",0.136364,1
10/02/2017,14,09,"Noah s and Dylan s expressions are the same exact face I make when I remember the Giants are 0 4 instagram com p BZwU7QigEtb",0.125000,1
10/02/2017,14,09,"Hash thieverycorporation bass bassplayer entertainer character concert instagram com p BZwVFuQF3vH",-0.150000,-1
10/02/2017,14,08,"Roses and bento box lunch Sushi Sake Bar instagram com p BZwVFPhn1cO",0.000000,0
10/02/2017,14,08,"Anyone recognize this place engagement cake looking for a amazingcake we have free design instagram com p BZwVFBbhrCN",0.400000,1
10/02/2017,14,08,"El mundo necesita m s amor tolerancia y salud mental unitedwestand lasvegas mexico instagram com p BZwVE QHfRO",-0.100000,-1
10/02/2017,14,08,"Empieza tu transformaci n hoy mismo haga su orden ya BIENVENIDO OCTUBRE Octubre se viste instagram com p BZwVE6PjBQV",0.000000,0
10/02/2017,14,08,"trivia at 7P M tonight and nfl game with SOUND ON happyhour and 5 Coney Island Pilsner instagram com p BZwVCBYliyr",0.000000,0
10/02/2017,14,08,"Just posted a video City New Jersey instagram com p BZwVACchOYve mlyl0wdF8PMeqMUD5W2AU0kWvI0",0.136364,1
10/02/2017,14,08,"The city that never sleeps NYC trip Last walk through centralpark one of my favorite spots in instagram com p BZwVBxvHiuk",0.250000,1
10/02/2017,14,08,"It s hard to see the truth through the light ChampagneRivers feat roransom instagram com p BZwVBb HSuK",0.054167,1
10/02/2017,14,08,"Sharing the music love with this lovely Nashvillian monk thanks for coming up and doing instagram com p BZwU aIgHm9",0.400000,1
10/02/2017,14,08,"Amazing Greek lunch and future planning session with my literary agent Jane Dystel of instagram com p BZwU ucBsD",0.175000,1
10/02/2017,14,07,"Sermon for Oct 1 2017 https frhumphries com blog 2017 10 2 sermon for oct 1 2017",-0.225000,-1
10/02/2017,14,07,"The Pope didn t get picked of Liberty Ellis Island instagram com p BZwU673jjin",0.000000,0
10/02/2017,14,07,"Having around lyriq babylife babyfun Ridge New Jersey instagram com p BZwUxQSDGOn",0.136364,1
10/02/2017,14,07,"Podcast Episode 13 is now available wisconsin tango com blog 2017 10 2 podcast episode 13 is now available",0.400000,1
10/02/2017,14,07,"Chun Shack instagram com p BZwU4P2jGGa",0.000000,0
10/02/2017,14,07,"still from my most recent Self tape audition instagram com p BZwUzR2h3Gh",0.250000,1
10/02/2017,14,07,"HOY VEN A VOTAR TODO ESE STRESS tabacoyron official 501 West 214St New York Ny 10034 HAPPY instagram com p BZwU3kKlwqH",0.468182,1
10/02/2017,14,06,"I Believe I Heard a Rumor literateape com blog 2017 9 26 i believe",0.000000,0
10/02/2017,14,06,"I Believe I Heard a Rumor literateape com blog 2017 9 26 i believe",0.000000,0
10/02/2017,14,06,"I m at MTA Subway Flushing Ave J M in Brooklyn NY swarmapp com c 6eddJH010Ga",0.000000,0
10/02/2017,14,06,"Tonight at 10pm we have a massive lineup for Frantic FREE show hosted by Aaron Berg Dean instagram com p BZwUw8CnKO",0.200000,1
10/02/2017,14,06,"prob the one only time either of us will ever walk down the aisle in a wedding instagram com p BZwS9ZkByYR",-0.077778,-1
10/02/2017,14,06,"capitallink Shipping conf lunch Dorian LPG as a bunker fuel for vessels pic twitter com vZAk6CZWU3",0.000000,0
10/02/2017,14,06,"Harlem instagram com p BZwUwVtBV7t",0.000000,0
10/02/2017,14,05,"Incident on NJ4 EB from Hackensack Av to Queen Anne Rd http 511ny org EventDetails T RANSCOM ORI165237301",0.000000,0
10/02/2017,14,05,"Legal Issue jerseycitylawyer Thou Shalt Not Hold Real Property In A Corporation http dlvr it PrwKNC Call 9733379643 pic twitter com KIY7cBDKzi",0.200000,1
10/02/2017,14,05,"Legal Issue jerseycitylawyer Second Circuit Holds Lower Causation Standard Applies To http dlvr it PrwKJj Call 9733379643 pic twitter com 5YXPDawRoQ",0.066667,1
10/02/2017,14,05,"NEW OFFICIAL VIDEO OUT NOW ON YOUTUBE x NI MODO MOVIESHIT BADGUYS instagram com p BZwUrAPhZ7f",0.136364,1
10/02/2017,14,05,"Work in progress newproject conartistcollective lowereastside residency mixedmedia clay instagram com p BZwUgy F 7q",0.000000,0
10/02/2017,14,04,"Forget your buried woes and let go of old defeats Make sure to instagram com p BZwUhdxl3avn AE5DaS 0ONiuU4yMo4YKjaUV0A0",0.300000,1
10/02/2017,14,04,"Just posted a photo Square New York City instagram com p BZwToYHgFfTd UldYMPloKQhesdrgGhfc0ZTiFs0",0.136364,1
10/02/2017,14,04,"Brussels sprouts kale cauliflower in a beet tahini sauce Omg instagram com p BZwULmtH6RZO DunGWZKyXRIfQvMCJYK A4a96g0",0.000000,0
10/02/2017,14,04,"Thankful to see another day of life and if for that reason alone I will smile Photography instagram com p BZwUm kn7yE",0.300000,1
10/02/2017,14,04,"Here it is the OFFICIAL spot aka not lifted from a friend s tv lol The director sent it to me instagram com p BZwUl8HBzTY",0.800000,1
10/02/2017,14,04,"VIDEO TO GODAK GREEN OUT ON YOUTUBE RN MY REMIX TO instagram com p BZmhTOPhoy15 Z8nGl7lfHhuRD1YYbTsGATLKHE0",-0.200000,-1
10/02/2017,14,04,"Atlas and Me selfies newyorkcity newyork america usa lifestyle life travel journey instagram com p BZwUlYSH9YW",0.000000,0
10/02/2017,14,04,"included my song Garden Song on their HeyDay Sounds spotifyplaylist Head to instagram com p BZwUj9MnFRe",0.000000,0
10/02/2017,14,04,"I m at in Rosedale NY swarmapp com c jqLIe1yy2M4",0.000000,0
10/02/2017,14,04,"Soulful Sips Social Delivery The New Yorker Festival is hosting talks with some of our instagram com p BZwUjLwHjj8",0.084848,1
10/02/2017,14,04,"Fire escape NYC Manhattan Chelsea Fall AutumnWalks Off York New York instagram com p BZwUhvRFV88",0.136364,1
10/02/2017,14,03,"saturdaynight autumn en 9 11 Memorial instagram com p BZwUeiBBrAxm Osn03MGHljIbbV0s3Vd52Mtl k0",0.000000,0
10/02/2017,14,03,"When the trumpet calls from You step into Monday Madness tonight LYK Flats instagram com p BZwUgtvAkpZ",0.000000,0
10/02/2017,14,03,"I was thrilled to be invited to a Hot Pot Wine Party by mrstaimclain and I know instagram com p BZwUfvOFSvu",0.425000,1
10/02/2017,14,03,"Monday night football 60 cent wings all night gastropub katchastoria katch instagram com p BZwUe1rF4B4",0.000000,0
10/02/2017,14,03,"QueOnda Brunito York New York instagram com p BZwUZUnAKjmA oIlgIlf3 aCBsUVrJiy4Z3WKw0",0.136364,1
10/02/2017,14,03,"Cleared Construction on I78 EB at East of Exit 58 US 1 9 E Port St",0.000000,0
10/02/2017,14,03,"Cleared Construction on I78 WB at Exit 58 US 1 9 E Port St",0.000000,0
10/02/2017,14,03,"Cleared Construction on US19 Both directions at North of I 78",0.000000,0
10/02/2017,14,03,"I m at Lincoln Square in New York NY swarmapp com c kgSEcEGIzvD",0.136364,1
10/02/2017,14,03,"Nikki shows how to approach a Monday with a smile dog dogs dogsofig dogsofnyc instagram com p BZwUZ9bhCaF",0.300000,1
10/02/2017,14,02,"circleofsisters fashionshow backstage with the designer bryankosburn got to open his epic instagram com p BZwUY9chapT",0.050000,1
10/02/2017,14,02,"Lunch at diner with the beyond amazing heathercarluccimedium who s telling me how her instagram com p BZwUZGggxf0",0.600000,1
10/02/2017,14,02,"when he hits you with those baby blues 8months angelboy blueeyes oursonshine instagram com p BZwUYIKnUmS",0.000000,0
10/02/2017,14,02,"I swear this is one of my most favorite spots to knit people watch swarmapp com c bWMLBBlF5sl pic twitter com zb2ST5OAiF",0.500000,1
10/02/2017,14,02,"80 s moment for an off Broadway artist play actress offbroadwayshow offbroadwaytheatre nyc instagram com p BZwUWjbFcoV",0.000000,0
10/02/2017,14,02,"Our Brand New Genderswag Equality Banner arrived last week So awesome Doing great things instagram com p BZwUWhSjfD3",0.484091,1
10/02/2017,14,02,"ANOTHER 1 My Bro Feat Ya boy Fuck up the city SHOT BY panoramicfilms On instagram com p BZwUWcyhAhR",-0.400000,-1
10/02/2017,14,02,"The Vast Right Wing Hypocrisy Deplorables on NFL vs Social Media thepeoplesview net main 2017 10 2 conservatives on nfl vs social media the vast right wing hypocrisy",0.100595,1
10/02/2017,14,02,"One of the greatest titles in the world is parent and one of the instagram com p BZwUUQNH1n9E kOQbAgtb 6TYIJhL G pb4Skg0",1.000000,1
10/02/2017,14,02,"Had lunch with Unice Arce by the water today So great to catch up and see my instagram com p BZwUUPYH6fb",0.800000,1
10/02/2017,14,02,"Super proud moment to see my student killing the floor alongside s son at his instagram com p BZwUT2Wg7DD",0.566667,1
10/02/2017,14,02,"MOMA is waiting for you louiseburgeoisartexhibition is a must Keep in mind she became famous instagram com p BZwUTbhBIV9",0.500000,1
10/02/2017,14,01,"Surrounded by sociopaths and wouldn t have it any other way instagram com p BZwUSTuFlFb",-0.125000,-1
10/02/2017,14,01,"Just another day at the office monday Metropolitan Museum of Art New York instagram com p BZwUQ GlPU0",0.136364,1
10/02/2017,14,01,"Can t stop listening to most recent album York New York instagram com p BZwUPmJFB68",0.212121,1
10/02/2017,14,01,"Construction on I78 Both directions at Exit 58 US 1 9 E Port St http 511ny org EventDetails T RANSCOM ORI165237201",0.000000,0
10/02/2017,14,01,"NY New York instagram com p BZwUPJmDrWk",0.136364,1
10/02/2017,14,01,"This is at my office door today En la puerta de mi oficina catalunyalliure catalanreferendum instagram com p BZwUNckAw72",0.000000,0
10/02/2017,14,01,"Thank God I know what a blessing is Square Park instagram com p BZwULMcjqdj",0.000000,0
10/02/2017,14,01,"Monday just Monday at in New York NY swarmapp com c gSQyGFkB6Y3",0.136364,1
10/02/2017,14,00,"NEW ARRIVAL Bison BPT 67 67 Pizza Preparation Refrigerator 1100 lightlyused pizza pizzeria instagram com p BZwUKKaD hp",0.136364,1
10/02/2017,14,00,"Tips to Hire the Best Hawaii Wedding Photography Service https mauibeachandweddingceremonies com wedding planne r blog 2017 10 2 best hawaii wedding photography",1.000000,1
10/02/2017,14,00,"Ojai Sugar Sustainable Skincare https blushingmatters co beauty ojai",0.000000,0
10/02/2017,14,00,"Gone shootin SoHo instagram com p BZwUJUYARJl",0.000000,0
10/02/2017,14,00,"About the other night ChartHouse Toast to the GoodLife Champagne on ice That s what I instagram com p BZwUBKcnNdj",-0.125000,-1
10/02/2017,14,00,"I m at Cakor Restaurant in Bronx NY swarmapp com c 6IS8pDi757F",0.000000,0
10/02/2017,14,00,"Postseason baseball vs wildcard Stadium instagram com p BZwUI3Tl8oE",0.000000,0
10/02/2017,14,00,"I m at American Museum of Natural History in New York NY swarmapp com c jBMye5QYw1w",0.078788,1
10/02/2017,14,00,"Back to back days in the gym Feeling good again It s amazing how your mentality changes after instagram com p BZwUHcQju4D",0.325000,1
10/02/2017,14,00,"Bury Me With The LO On 2nd printing now available True York City history of youth collectives instagram com p BZwUHdphts3",0.250000,1
10/02/2017,14,00,"I m at Fields Good Chicken in New York NY swarmapp com c cCZQKhMGZea",0.078788,1
10/02/2017,14,00,"Translucent Setting Powder that Mattifies SEPHORA Beauty Aplifier Vs Milani Prep Set Go A instagram com p BZwUEkvFvRD",0.000000,0
10/02/2017,14,00,"Meet Anna Fitzpatrick She plays PUGSLEY ADDAMS in our musical THE ADDAMS FAMILY that opens on instagram com p BZwUEyqhDD9",0.000000,0
10/02/2017,14,00,"miromonamour mange deux repas par jour fait maison Et ouais mon chien a son propre compte instagram com p BZwUD7pjnNe",0.000000,0
10/02/2017,14,00,"Nissan Juke SOAK dexigner com news 30427 Design pic twitter com 2PjFGS6IAT",0.000000,0
10/02/2017,13,59,"Today s lunch is a true scavenger lunch no breakfast no time to instagram com p BZwUAtLn8MVx uBCVMfa ZcTVWFDTl FunuoUOg0",0.350000,1
10/02/2017,13,59,"Ready to wed ccandbkd rocktober 12days nofilter brideandgroom latergram York New York instagram com p BZwT 30g9jI",0.168182,1
10/02/2017,13,59,"I just want to be in Barcelona Center instagram com p BZwT8YTApVdI wnsI4kTANRs0kJlgX6EZQd5oDY0",-0.100000,-1
10/02/2017,13,59,"Repost get repost SOLD OUT Thank you all Don t fret if you haven t instagram com p BZwT4ZhFj27",0.000000,0
10/02/2017,13,58,"For the first time I agree with DONALD TRUMP this shooting it s an instagram com p BZwT7 blCBCR jBqYiwghVu2kFXtXZBiorH79cA0",0.250000,1
10/02/2017,13,58,"beatlife push2 pushgang mindframedarealonthebeat realshit chopsandsamplesallsay instagram com p BZwT06pFfa5",0.000000,0
10/02/2017,13,58,"When Bam Bam holds your sax for you so you re better able to body the plate of pasta he just instagram com p BZwT07FHBrr",0.500000,1
10/02/2017,13,58,"Updated Construction on I78 WB at Exit 58 US 1 9 E Port St http 511ny org EventDetails T RANSCOM ORC19857501",0.000000,0
10/02/2017,13,58,"I m at Dr Falk in West Orange NJ swarmapp com c 2NyrLuRwsMc",0.000000,0
10/02/2017,13,58,"Wedding Fair Great Victoria Hotel Sunday 15th October 2017 http shybphotography com news 2017 10 2 wedding fair great victoria hotel sunday 15th october 2017",0.750000,1
10/02/2017,13,58,"Do NOT try this at home w o being guided by a professional who has completed Dr Lois LI LII instagram com p BZwT3fTjHdc",0.100000,1
10/02/2017,13,57,"Episode 13 out NOW Go now to the link in Bio and tune the fuck in Giants Jets yankees instagram com p BZwTzVZF9DH",-0.400000,-1
10/02/2017,13,57,"IN THE ZONE 4XMG STUDIOS MAKING MUSIC BETTER ONE SESSION AT A TIME 4xmg 4XMGStudios instagram com p BZwTsPEH9EI",0.500000,1
10/02/2017,13,57,"At trl Relaunch Client Rocking Clothing Co Styled By terrellish instagram com p BZwTsadDpqo",0.000000,0
10/02/2017,13,57,"ridinghome last night listening to some work from the Kitchen inmyfeelings COD instagram com p BZwTxO6nhiN",0.000000,0
10/02/2017,13,57,"Legal Issue jerseycitylawyer A Chart Summarizing CA s State And Local Paid Sick Leave http dlvr it PrwFPn Call 9733379643 pic twitter com tEoTTKYMpi",-0.171429,-1
10/02/2017,13,57,"Legal Issue jerseycitylawyer Germany s New Hate Speech Act in Force What Social Network http dlvr it PrwFNZ Call 9733379643 pic twitter com sIVRvjZfme",-0.107576,-1
10/02/2017,13,57,"Legal Issue jerseycitylawyer Appellate Division Clears Way for Business Entities to http dlvr it PrwFMK Call 9733379643 pic twitter com vh68JLOqTK",0.200000,1
10/02/2017,13,57,"Pink and yellow florals for baby Sophia s first birthday Planning instagram com p BZwTv0ljscl",0.050000,1
10/02/2017,13,57,"Legal Issue jerseycitylawyer Can Cloned Video Games Survive the Battle Royale http dlvr it PrwFKT Call 9733379643 pic twitter com GIpFYx2jWE",0.200000,1
10/02/2017,13,57,"It s not too late to sign up for Mecca s Kitchen Healthy Meal Prep Plan Sign up now and start instagram com p BZwTnayhai",0.100000,1
10/02/2017,13,57,"Tonight Hollywood Monday vivakbnyc RSVP torch instagram com p BZwTptRhE04",0.000000,0
10/02/2017,13,56,"I m at MTV TRL Studios in New York NY w marissa swarmapp com c 82JWFkIcyoE",0.136364,1
10/02/2017,13,56,"I m pleased to share the joy We open in just 17 days freefallfrostbite Premieres October instagram com p BZwTs3MBSeU",0.433333,1
10/02/2017,13,56,"Cleared Incident on GardenStateParkway SB at South of Exit 147 Clinton Ave",0.000000,0
10/02/2017,13,56,"I m at Atkins Kent in West Orange NJ swarmapp com c cIMwLNFd0La",0.000000,0
10/02/2017,13,56,"I m at Upper West Side in New York NY swarmapp com c e8vAez0UfVt",0.068182,1
10/02/2017,13,56,"BronxZoo day Wonder if the animals will talk to us like that Zookeeper instagram com p BZwTouiglfO",0.000000,0
10/02/2017,13,56,"We love to make our avocado toasts extra by adding some fresh crab phoodieur instagram com p BZwTn1ln ns",0.266667,1
10/02/2017,13,56,"Melty vegan froyo with almond butter chocolate chips Juicery instagram com p BZwTnu2lmSz",0.000000,0
10/02/2017,13,55,"Right now at Pace U officialpacecommercialdance annereinking Woohoo University instagram com p BZwTkKxnQL5",0.285714,1
10/02/2017,13,55,"This SUNDAY OCT 8th ONENightstand LADIES Free Before 11pm NO work NO school instagram com p BZwTjxtl1y7",0.400000,1
10/02/2017,13,55,"rozayy S S 18 amconycfw amconyc fashiondesigner fashionstylist runway instagram com p BZwTjzljDFz",0.000000,0
10/02/2017,13,55,"circleofsisters fashionshow backstage this spectacular gown by instagram com p BZwTiieBCpu",0.600000,1
10/02/2017,13,55,"Loving the cute look of our wayuu bracelets and pretty karine in NYC Support instagram com p BZwThU4Frjm",0.450000,1
10/02/2017,13,55,"Don t go chasing waterfalls Contact me at ryan com to book your shoot and purchase instagram com p BZwTgqHFAyn",0.000000,0
10/02/2017,13,55,"In art as in life awkwardness can be a virtue curator artcollector collector realism instagram com p BZwTfehjIsw",0.000000,0
10/02/2017,13,55,"Just posted a photo Harlem instagram com p BZwTfqJgRIJq fnHoLX1QRCjl R2XH6xv2kAK0A0",0.000000,0
10/02/2017,13,54,"Go ahead Try and take it roscoe puppiesrule Dog Run instagram com p BZwTedzno8e",0.000000,0
10/02/2017,13,54,"Deep fried dreams come true at the great State Fair of Texas richlandstudentmedia com chronicle post s 2017 10 2 deep fried dreams come true at the great state fair of texas",0.462500,1
10/02/2017,13,54,"So excited to announce that thetextiles are part of this 10 14 running marathon music instagram com p BZwTeD nKVl",0.375000,1
10/02/2017,13,54,"2 more weeks I will surely miss working in this location No more instagram com p BZwTbT6nV ea VJnj 9mMGTruuEIG4jwC4ELGg00",0.250000,1
10/02/2017,13,54,"Look up There s a potato chip bag flying in the Cuchifritos Gallery ceiling Repost instagram com p BZwTaColJoH",0.000000,0
10/02/2017,13,54,"Hole 3rd Ave instagram com p BZwTYCMAZKV",0.000000,0
10/02/2017,13,53,"Repost davidlawrencebyrd Dim Sum wrecking crew Habour Seafood Restaurant instagram com p BZwTSI2DC P",0.100000,1
10/02/2017,13,53,"As you can see in this day and age were living in your life can be taken im an instant so be instagram com p BZwTL0wF5Z5",0.000000,0
10/02/2017,13,53,"Need a little pick me up Enjoy our French press coffee from our Uptown location alittletaste instagram com p BZwTW Ljwdp",0.070833,1
10/02/2017,13,53,"Bronx Bombers Size L Available On Website Throwback instagram com p BZwTRdTHvLP",0.400000,1
10/02/2017,13,53,"We have a training special going here at NYSC buy one session instagram com p BZwTSpAnU81e 7 0V4Hh3J2D37dcjuunkz8d tw0",0.357143,1
10/02/2017,13,53,"Sneakerjeans Powered by Featuring Asymetric Camouflage Jacket Product Code Search instagram com p BZwTT3VFKx9",0.000000,0
10/02/2017,13,53,"August 2 2017 118 33 180th Street St Albans Queens 320 000 1 unit 1 350 sf one family home two stories detached",0.000000,0
10/02/2017,13,53,"May your Mondays be filled with color and caffeine Square Garden instagram com p BZwTTI8AnxG",0.400000,1
10/02/2017,13,53,"Beautiful day to eat some yams",0.850000,1
10/02/2017,13,53,"Got to visit my checkmatbjj teammates here in nyc at Fabio Clemente s gym today for a morning instagram com p BZwTSgWF0am",0.000000,0
10/02/2017,13,53,"Legal Issue thetrumpreport The Donald Trump Inside Your Own Head The Nation http dlvr it PrwCP8 artusalawfirm Call 9733379643 pic twitter com 9u3gAdkXnD",0.400000,1
10/02/2017,13,53,"We re baaaaackkk yours truly are bringing back SUCKA FREE to LES If you were instagram com p BZwTRj0nJgi",0.200000,1
10/02/2017,13,53,"1054 Walton Avenue the Bronx pic twitter com Z1dvEmr7uq",0.000000,0
10/02/2017,13,52,"Had to glow up my libra twin touchedbyblue Get your styled by STYLZ APPOINTMENTS instagram com p BZwTPvKlTl5",0.000000,0
10/02/2017,13,52,"Wearing my new vinceskirt w new booties and bag decided to do autumn colors w black instead instagram com p BZwTQSlhz O",0.035354,1
10/02/2017,13,52,"Just posted a photo Of The Rock NYC instagram com p BZwTNWIjOVW",0.000000,0
10/02/2017,13,52,"I m at West Side Highway in New York NY swarmapp com c l0ERSpJKwwq",0.136364,1
10/02/2017,13,52,"mybirthdayweek day2 celebrate pre birthday 1st oct with babydaddy instagood nyc",0.000000,0
10/02/2017,13,52,"Think history the present and a whole lot of fashion in between The Cooper Hewitt Museum instagram com p BZwTM0iAXjz",0.100000,1
10/02/2017,13,52,"Candlewood Suites Fargo N Dakota State Univ https travelignite com hotel reviews 2017 10 2 candlewood suites fargo n dakota state univ",0.000000,0
10/02/2017,13,52,"Right now our communities are being attacked yet despite it we have always found light in the instagram com p BZwTLyinZxx",0.342857,1
10/02/2017,13,52,"Picked up the trailer from enox nick this morning and soon emmycfellows and I will be heading instagram com p BZwTH61HPqK",0.000000,0
10/02/2017,13,52,"Caught that good light lyndseyariel com lyndseyariel makeup motd selfie mua instagram com p BZwTFbtF 38",0.550000,1
10/02/2017,13,51,"Silencers are not silent http wapo st 2wu4Sm1",0.000000,0
10/02/2017,13,51,"Death of a Golden Shower angel wip York New York instagram com p BZwTEtdl0px",0.218182,1
10/02/2017,13,51,"I m at Times Square in New York NY swarmapp com c cDsPfe0Vszj",0.136364,1
10/02/2017,13,51,"Shadow play moodygrams streets vision agameoftones spjstreets streets vision5k instagram com p BZwTCL9B2nQ",0.000000,0
10/02/2017,13,51,"You are cordially invited to join us for what will be an historic event for AFROLATINOS We are instagram com p BZwS2rjnGJZ",0.000000,0
10/02/2017,13,50,"Death of a Golden Shower Angel wip York New York instagram com p BZwS3wklGfF",0.218182,1
10/02/2017,13,50,"A day of festivities at the renaissancefaire Cloisters instagram com p BZwTA3oA7fH",0.000000,0
10/02/2017,13,50,"La mima m rde Medical Center East Orange in East Orange NJ w swarmapp com c 4eokHPSJrm7",-0.050000,-1
10/02/2017,13,50,"Just us or does a cozy blanket and some hot chocolate sound amazing right now New instagram com p BZwTBBUF9h8",0.245346,1
10/02/2017,13,50,"Another view that is Reggie and Aaron Boone chatting to right of logo Postseason Yankees instagram com p BZwS oLH13",0.285714,1
10/02/2017,13,50,"Nigga we started this shit I m from the x just add a b bronx New York instagram com p BZwS wjHKOe",-0.031818,-1
10/02/2017,13,50,"Whatever you want in this world write it down Are you looking for a new instagram com p BZwS UMDoVs",-0.009596,-1
10/02/2017,13,50,"I know I look pregnant but that goes with the territory nolimits endparalysis easystand instagram com p BZwS1pRHP6z",0.333333,1
10/02/2017,13,50,"Legal Issue jerseycitylawyer PA Supreme Court Malice Not A Prerequisite to Bad Faith http dlvr it PrwBHt Call 9733379643 pic twitter com jKP9z7kUpX",-0.250000,-1
10/02/2017,13,50,"Legal Issue jerseycitylawyer See You In Court Changes to the Law On Groundless http dlvr it PrwBGP Call 9733379643 pic twitter com aIGsaNVFTZ",0.200000,1
10/02/2017,13,50,"Legal Issue jerseycitylawyer Time to Update Your Privacy Statement for GDPR http dlvr it PrwBFJ Call 9733379643 pic twitter com RKID6TXeZY",0.200000,1
10/02/2017,13,50,"Legal Issue jerseycitylawyer Streamlining Federal Environmental Reviews for http dlvr it PrwB8N Call 9733379643 pic twitter com jiRpizJwLS",0.200000,1
10/02/2017,13,50,"Just posted a photo York Public Library and Bryant Park instagram com p BZwS86qHwgO",0.000000,0
10/02/2017,13,50,"The slop sink is my favorite place to talk shop at the studio Art Studios instagram com p BZwS8geBkd8",0.500000,1
10/02/2017,13,50,"Good Afternoon IG Today we have NEW ARRIVALS Blue Green Circle Pattern with Big Sleeve instagram com p BZwS8UvhNyl",0.127273,1
10/02/2017,13,50,"SevenThirty Hospital Center in New York NY swarmapp com c jfAGt3hoUaA",0.018182,1
10/02/2017,13,50,"Half Mast Square Manhattan New York instagram com p BZwS782Fioy",-0.015152,-1
10/02/2017,13,50,"Wednesday October 4th MegaWednesdays at republica nyc Doors 6p 5 HappyHour til 9p Everyone instagram com p BZwS4NIhz0L",0.000000,0
