Date,Hour,Minute,Tweet text,Polarity,Sentiment
10/24/2017,19,21,"Needed one of these today in NYC Thank you tinygentleasians for giving me a sweet smile on this instagram com p BapiT6ojoOe",0.325000,1
10/24/2017,19,21,"Boom Kebabci in Wood Ridge NJ swarmapp com c lHtBmUAULyy",0.000000,0
10/24/2017,19,21,"CELEBRATE TOCANYC producer and And outputclub s bartender instagram com p BapiTSbhMeX",0.000000,0
10/24/2017,19,21,"XATWOPACKTUESDAYS XATWOPACKTUESDAYS XATWOPACKTUESDAYS instagram com p BapiOr6jmlW",0.000000,0
10/24/2017,19,21,"What a great start to my afternoon sipping tea at highnoon while drinking high noon tea at instagram com p BapiLTxgKHf",0.480000,1
10/24/2017,19,20,"Taking in a different view for tonight s game newyorkislanders islanders nhl hockey instagram com p BapiR9cH22P",-0.200000,-1
10/24/2017,19,20,"My fav color York New York instagram com p BapiRiLnfP4",0.136364,1
10/24/2017,19,20,"Incident on BLine NB from 125th Street Station to 145th Street Station http 511ny org EventDetails T RANSCOM ORT25948107",0.000000,0
10/24/2017,19,20,"Incident on CLine from 125th Street Station to 145th Street Station http 511ny org EventDetails T RANSCOM ORT25948107",0.000000,0
10/24/2017,19,20,"city citywalk newyorkcity newyork photooftheday photographer photographie photography instagram com p BapiPaagWl9",0.000000,0
10/24/2017,19,20,"Just posted a video Bridge instagram com p BapiO5pjDuY",0.000000,0
10/24/2017,19,20,"Just posted a photo York New York instagram com p BapiOSdlkdCq vcxPJJ9getSqASeXR92IERA9kg0",0.136364,1
10/24/2017,19,20,"I m at Marco s Pizzeria Deli in Jersey City NJ swarmapp com c 1h97QQRyeAf",0.000000,0
10/24/2017,19,20,"Misterious Empire State nyc Building instagram com p BapiHmUgUsd",0.000000,0
10/24/2017,19,20,"it s quite a few friends and family member i know this happened to https twitter com dreeyuhh statu s 922956285645131779",-0.200000,-1
10/24/2017,19,20,"Legal Issue thetrumpreport Bob Corker s Powerful Words About Donald Trump The http dlvr it PxQJrl artusalawfirm Call 9733379643 pic twitter com UDcmyDAo36",0.250000,1
10/24/2017,19,20,"Legal Issue Artusa Law Firm FAMILY COURT LAWYERS IN JERSEY CITY NJ http dlvr it PxQJpc Call 9733379643 pic twitter com yfp72PTpn6",0.000000,0
10/24/2017,19,20,"Let the magic begin milkshakes Tap Lower East Side instagram com p BapiMKxFHeq",0.500000,1
10/24/2017,19,20,"Cold World x The Village Prod By Khris Kurse logicalnonsense215 com news mdb54eza6 7t9s9lms68le2rwbhgkfp",-0.600000,-1
10/24/2017,19,20,"Cold World x The Village Prod By Khris Kurse logicalnonsense215 com news mdb54eza6 7t9s9lms68le2rwbhgkfp",-0.600000,-1
10/24/2017,19,20,"Heading into an I LOVE NY event at Tavern on the Green iloveny ilovenyc ilovenycity instagram com p BapiBy3HRVe",0.150000,1
10/24/2017,19,19,"Just posted a photo York New York instagram com p BapiKghl2ra1 SwSIli ReTZLNmU F8mzMXKjOY0",0.136364,1
10/24/2017,19,19,"On Tuesdays we like to throw our weight around like bosses HIIT instagram com p BapiJHYgrfj",0.000000,0
10/24/2017,19,19,"sternfoto brooklyn shotoniphone7 iphone7 Park instagram com p BapiFDGlxzW",0.000000,0
10/24/2017,19,19,"sometimes just not in the morning and or when i m tired https twitter com chvnelno5 stat us 922958276991467520",-0.400000,-1
10/24/2017,19,19,"Fiat lux finally councillortopping com home 2017 10 2 5 fiat lux finally",0.000000,0
10/24/2017,19,19,"empirestatebuilding in a foggy night is really beautiful instagram com p BapiG5 F28Q9 yH6lf0TH3qi3Hsh1vdbDj6eONA0",0.850000,1
10/24/2017,19,19,"Model creationnorcopy brooklynhairstylist lahairstylist essencemag thecutlife jupoppin instagram com p BapiCooA1Dv",0.000000,0
10/24/2017,19,19,"Help the homeless hungry by grabbing dinner out tonight at CHiPS nightout newbie instagram com p BapiDWNhyrA",0.000000,0
10/24/2017,19,18,"I knew a guy who has a dick that use to squirt cum just like this facet mylifeisperfect instagram com p BapiCx1gW4U",0.000000,0
10/24/2017,19,18,"I m at CKO Kickboxing in Maplewood NJ swarmapp com c gIfpVVSvS2e",0.000000,0
10/24/2017,19,18,"Downeast Cider free cider tasting at City Swiggers tonite Tuesday October 24 6pm 9pm 320 instagram com p BapiBuslR q",0.400000,1
10/24/2017,19,18,"CE Prime Steak Sushi in Great Neck NY swarmapp com c c1CJSnHRWVV",0.800000,1
10/24/2017,19,18,"Hair brushes available for our client Hair Studio instagram com p Baph4KrHunD0 3XQOoTpmPqdd4xAVVeT7WtTUjk0",0.400000,1
10/24/2017,19,18,"Carbon Hyde X Millo TRUNK SHOW This Thursday Don t miss out carbonandhyde trunkshow instagram com p Baph9konnQt",0.000000,0
10/24/2017,19,18,"STOP RENTING Don t miss this great investment 1BR s starting 725 000 openhouse instagram com p Baph2w HNpU",0.400000,1
10/24/2017,19,18,"We Believe in Academic Excellence ncchs com news 2017 10 2 4 we believe in academic excellence",0.000000,0
10/24/2017,19,18,"Drinking a Foo Foo by at http untp beer s c519222022",0.000000,0
10/24/2017,19,18,"Just posted a video Bronx Bronx New York instagram com p Baph rKFwg7b Qqs mL36AikmRmrkPDbqHRvQ80",0.136364,1
10/24/2017,19,18,"uniqlousa The Art and Science of LifeWear 15 Years of Innovation lifewear uniqlo instagram com p Baph3N6hqDQ",0.000000,0
10/24/2017,19,18,"York metropolitan area instagram com p Baph66XB5sT",0.000000,0
10/24/2017,19,18,"Repost get repost Crudo of Scallops Part of our featured tasting this instagram com p Baph80qF69K",0.000000,0
10/24/2017,19,18,"https twitter com SailorKhandi status 922963776734973952",0.000000,0
10/24/2017,19,17,"Hmm blogging is a full time job you have to be creative when no one can take your content instagram com p Baph7pjgSWX",0.425000,1
10/24/2017,19,17,"ON MY OWN VISUAL OUT NOW www STVSH718 com I want to thank all my fans friends supporters instagram com p Baph4ZkBsKr",0.300000,1
10/24/2017,19,17,"Dinner left over veggie past w mixed vegetables and the homemade instagram com p Baph67UAwCZ3 dF7yALrAMGIp9e3laLM3a5WU980",-0.083333,-1
10/24/2017,19,17,"spotted on our pre WS walk BoyleStrong NJDevils hockeylife theadventuresofalexatheyorkie instagram com p Baph4bnl KR",0.000000,0
10/24/2017,19,17,"The Race Music Video Feat 3rdbasejigg Shot By StillBlazingWorldwide instagram com p Baph3Z0AUal",0.000000,0
10/24/2017,19,17,"ICYMI Legal Issue Artusa Law Firm HUDSON COUNTY FAMILY COURT JERSEY CITY NJ http dlvr it PxQJ1b Call 9733379643 pic twitter com ZZJLuauGXs",0.000000,0
10/24/2017,19,17,"CUPO LIMITADO Repost elsecretodeunfuturomejor get repost CONFERENCIA TALLER instagram com p Baph2hxjpgh",0.000000,0
10/24/2017,19,17,"Middleneck Clams Salt Meadow Lamb N duja Tarbais Bean Dogfish Head Seaquench ale Baby instagram com p Baph2DejEZQ",0.000000,0
10/24/2017,19,16,"open up a beer and you say get over here and play a video game 5 instagram com p Baph0J3Bfvh",-0.200000,-1
10/24/2017,19,16,"This one s on my wall now tbt newyork brooklyn manhattan art sensesfail vacation wtc instagram com p Baph0ZBFjmd",0.000000,0
10/24/2017,19,16,"Construction on PortNewarkElizabethMarineTerminal http 511ny org EventDetails T RANSCOM ORI167105407",0.000000,0
10/24/2017,19,16,"It might not be our NY teams but who can resist the World Series Food Drink specials all instagram com p BaphzlIB30N",0.000000,0
10/24/2017,19,16,"Happy Autumn Season to All NYC C s Kitchen Manhattan instagram com p BaphzTVDrFh",0.800000,1
10/24/2017,19,16,"Central Park was almost empty today centralpark runner myrun nyc emptycity fountain instagram com p Baphyf5hdae",-0.050000,-1
10/24/2017,19,16,"Dinner in between shifts Mike s Subs in Newark NJ swarmapp com c aiD6wXap19j",0.000000,0
10/24/2017,19,16,"i m on top of the world hey lol he ll be smiling from the stage instagram com p BaphyEiFShpj fw6WFp0AJicoDF24O9QY2Jbf0g0",0.650000,1
10/24/2017,19,16,"I m at Noho in New York NY swarmapp com c 5ZtGQoTK332",0.136364,1
10/24/2017,19,16,"Today our Wind Ensemble and Symphonic Winds worked with Dr Joshua Roach from The College of New instagram com p BaphvtcguNL",0.136364,1
10/24/2017,19,16,"If you don t think that I m the shit it s just you ain t heard me instagram com p BaMk 3sh4Yzp rXekiaey1a6YrtLnwujvkhWk I0",-0.200000,-1
10/24/2017,19,16,"The chief Rabbi of Rome Riccardo Di Segni Professor Adam Mintz and Natalia Indrimi of Centro instagram com p Baphlprlqop",0.000000,0
10/24/2017,19,15,"This is what a Giants fan and Metallica fan looks like metallica nygiants football instagram com p Baphfe2D8rT",0.000000,0
10/24/2017,19,15,"Glass frame available Hair Studio instagram com p BaphtFOH0SaS paz szf Lh PyRJC 4wrfhThTM0",0.400000,1
10/24/2017,19,15,"Central Park San Mateo Just a few blocks from Midtown Place Visit instagram com p BaphsPUlTLX",-0.100000,-1
10/24/2017,19,15,"Excited for a night of cool jazz at with my little instagram com p BaphsDYAMJOd 48zIfBccMg1LRSjaF48Vd11 UM0",0.179167,1
10/24/2017,19,15,"Book the homie demetrius187 for all your photo and video needs He s nasty wit it Repost instagram com p Baphr0nACOu",-1.000000,-1
10/24/2017,19,15,"nyc jerseycity October Waterfront instagram com p BaphrMeFlr1",0.000000,0
10/24/2017,19,15,"When a turtleneck has a ruffle on it you buy it shop this look on my blog today instagram com p Baphq9Cntz5",0.000000,0
10/24/2017,19,15,"A little person was thrilled with her dinner roti canai and leftover fish curry Much less instagram com p BaphqMAgw17",0.081944,1
10/24/2017,19,15,"timelapse note8camera lic queens queensbridge empirestatebuilding chryslerbuilding instagram com p BapheAiACkc",0.000000,0
10/24/2017,19,15,"Rum punch and music can t go wrong with that now laststopbx instagram com p Bapho8hhcvAc sskbJHl4cR6AKZENm9baEZYQG80",-0.500000,-1
10/24/2017,19,15,"How perfect is it that they re playing Taxi Driver and I m feeling just like Pacino felt about instagram com p Bapho1yHKKj",1.000000,1
10/24/2017,19,15,"When you have to share a picture with 9 other people at least I instagram com p BSvs82fjVPH6 rdymTdKVd npwJBGbAm64n37Zs0",-0.212500,-1
10/24/2017,19,15,"STILL LITTY Rnb Hiphop DJ SNAP CRACK SERIES VOL 27 STILL LITTY Quick play press here instagram com p Baphe5yFCix",0.333333,1
10/24/2017,19,15,"Missing New York like crazy West Side instagram com p BaphoO8gDg3",-0.221212,-1
10/24/2017,19,15,"Yours Truly Tour Phone Hall instagram com p BW5H0l9B3MX5 rXfQppIvODf oaJdIA25DEOybo0",0.000000,0
10/24/2017,19,15,"There is something in the NewYork air that makes sleep useless Simone Beauvoir quote instagram com p BaphmAGnbY6",-0.500000,-1
10/24/2017,19,15,"Legend wait for it ary BullyRay Ballroom instagram com p BUA0u5nAGFe0 i9ISN0pZXfr6ZwaudqoZ9BjVvI0",0.000000,0
10/24/2017,19,15,"regram daring minds Type I CAN DO IT If you agree alexjhoeller York New York instagram com p BaphmbLFjiQ",0.136364,1
10/24/2017,19,14,"Noble Tribeca instagram com p BT44gNLgSPxS 1FfhIuVY0M3MfslFIw7DXr6G1s0",0.600000,1
10/24/2017,19,14,"White space and green plants are my favorite Found one of the coolest photo studio spaces in instagram com p BaphfQGghQX",0.100000,1
10/24/2017,19,14,"Ribbon Sushi Bar Grill in New York NY swarmapp com c gbKaNzMQgqE",0.136364,1
10/24/2017,19,14,"Updated Incident on GardenStateParkway NB from South of Exit 144 CR 510 to North of Exit 145 I 280 http 511ny org EventDetails T RANSCOM ORI167101001",0.000000,0
10/24/2017,19,14,"I m at LaGuardia Airport in East Elmhurst NY swarmapp com c 7pIDgz49aco",0.000000,0
10/24/2017,19,14,"Last night took an L but tonight I bounce back idecided instagram com p BQoUZKGAmmhu rupLyp8t5Af50jG AYbfGnLjZo0",0.000000,0
10/24/2017,19,14,"onlyinnewyork metrocard newyork newyorkproblems instagram com p BaphR0UHZlVD eq7ivhtGroRKbg2RIO5XM438LE0",0.000000,0
10/24/2017,19,14,"TBH post was the coolest guy I meet so far I thank him for giving instagram com p BOC1q1 Dqkuz kouKYxdGRmdikUvifZ4E J5oIE0",0.100000,1
10/24/2017,19,14,"Just posted a photo Bronx Bronx New York instagram com p Baphi5sl1Alj cfLcJyX53u0J7it3XLqMBvFIdw0",0.136364,1
10/24/2017,19,14,"Hoy conmemoramos el D a de El 24 de octubre se ha celebrado como el D a de las Naciones instagram com p BaphZ CAse2",0.000000,0
10/24/2017,19,14,"Great new addition to the hornitostequila brand instagram com p BaphiMzBisKq O5 guxkuYTFJ4KaTZKOneO1Vk40",0.468182,1
10/24/2017,19,14,"J E R E M I H it suck that he was able to sign my CD but he did instagram com p BNHnqiGDn9C5 9N 2G2BAaYN6FgBIKeVbUJyzQU0",0.500000,1
10/24/2017,19,14,"A AP till a nigga die if you didn t know well you know now instagram com p BNQGK1DDDgKu D1jfgrt8s6 75By Y8MeuUkwQ0",0.000000,0
10/24/2017,19,14,"just ate some delicious chomps with laura friends dinner woo s in Brooklyn NY swarmapp com c lXfkS8f1bON",1.000000,1
10/24/2017,19,14,"The collection is growing in my torbooks office morty spock aryastark District NYC instagram com p Baphf0bBMb7",0.000000,0
10/24/2017,19,14,"Do what you can and delegate the rest to the universe You don t have to do things alone You instagram com p BaphfxZn1aI",0.000000,0
10/24/2017,19,14,"Hey teens Remember to come out to Real Talk tomorrow at 7 00pm You definitely don t want to instagram com p BaphZcLFP1P",0.100000,1
10/24/2017,19,13,"Welcome to the world jackalexandershear Biggest congratulations to radish and instagram com p BaphWVZg2Gv",0.800000,1
10/24/2017,19,13,"Ayyyyyeeeeee Cashew Ricotta pizza pizzalover foodgram foodporn foodie foodislife instagram com p BaphaqlBJsN",0.000000,0
10/24/2017,19,13,"Cleared Incident on GardenStateParkway SB from Exit 143A to North of Exit 139A Chestnut St",0.000000,0
10/24/2017,19,13,"I have not wandered around Chinatown eyes wide open in a very long instagram com p Baphcj nkanS 3tM neI0F0gTUZ96SnhLAwsRVM0",-0.055000,-1
10/24/2017,19,13,"ESTRENO MUNDIAL La Envidia Tienen Miedo https goo gl d5JQjN via instagram com p BaphWteHFM6",0.000000,0
10/24/2017,19,13,"nightmoves commute nyc York New York instagram com p BaphQ6XFgyY",0.136364,1
10/24/2017,19,13,"vagaciones en Coney Island Beach Boardwalk instagram com p Baphb48Aiiei JQ tMJiQ853XAAUbOpxw51xmqQ0",0.000000,0
10/24/2017,19,13,"Getting inspired by this great woman wendywilliams eofstudents instagram com p Baphb9BFxJQl ndZ4sXzQ5hFDClpvGVbrMPxJPw0",0.800000,1
10/24/2017,19,13,"Just posted a photo Village Manhattan instagram com p BaphbZBFnp9",0.000000,0
10/24/2017,19,13,"gotmyflushot getyourflushot nofluforme stayinghealthy Department of instagram com p Bapha1SDxOi",0.000000,0
10/24/2017,19,13,"MODEL CALL Back by Popular Demand We re preparing for this year s Pre Holiday instagram com p BaphUIxg X",0.300000,1
10/24/2017,19,13,"TRAINING CAMP MONDAYS 9am HealthClub Someone asked me your class it s just for instagram com p Bapgw94lZ4l",0.000000,0
10/24/2017,19,13,"Just posted a photo Village Manhattan instagram com p BaphWTeAiJh",0.000000,0
10/24/2017,19,13,"2018KiaStinger with a pink bow for breastcancerawareness Kia instagram com p BaphZU0FnQf",-0.100000,-1
10/24/2017,19,13,"Professional Development Workshop with tonight at New York Office in New York NY swarmapp com c g4zhoLkCBuW",0.124242,1
10/24/2017,19,13,"What Do I Order LOW CARB CHIPOTLE victoriarenfroe com fitness whatdo iorderchipotle What Do I Order At Chipotle Click here to see",0.000000,0
10/24/2017,19,13,"Legal Issue artusalawfirm The Real s Jeannie Mai Breaks Her Silence On Divorce http dlvr it PxQGdY njdivorcelawyers Call 9733379643 pic twitter com A0HGZH2Kh8",0.200000,1
10/24/2017,19,13,"At Book tour may live tweet Ann the Holy Trinity Church in Brooklyn NY swarmapp com c 84QaSXK70gD",0.136364,1
10/24/2017,19,13,"381 Powers Avenue the Bronx pic twitter com IGO0DkFT9C",0.000000,0
10/24/2017,19,13,"autumnshowsushowbeautifulitistoletthingsgo autumn goodevening lettering typography instagram com p BaphSfABE4f",0.000000,0
10/24/2017,19,13,"TRICOVIT SET SHAMPOO AMPOLLAS Y TABLETAS DISPONIBLE PARA instagram com p BaphXQtHkAI7 jqYtzwHD kQVdtgMzUhE448M500",0.000000,0
10/24/2017,19,12,"I m at Food Emporium in New York NY swarmapp com c 3E7DnuP2OdY",0.136364,1
10/24/2017,19,12,"World trichology conference new York York New York instagram com p BaphUvZn7Fe",0.136364,1
10/24/2017,19,12,"Weird shot in my phone of the bathroom trippy instagram com p BaphV7vHpv c aRqwl4OE63sUOLWDRwr7VRJ12I0",-0.500000,-1
10/24/2017,19,12,"Updated Incident on GardenStateParkway NB at South of Exit 145 I 280 http 511ny org EventDetails T RANSCOM ORI167104001",0.000000,0
10/24/2017,19,12,"Body Love with Primal Kitchen https theanolan com theanolan body love with primal kitchen via thea primal kitchen body love",0.500000,1
10/24/2017,19,12,"at in New York NY swarmapp com c 6nA1z6GkbKa",0.136364,1
10/24/2017,19,12,"Super excited to be invited to the by the headmonster Noel Lee instagram com p Bapf62WFWX5",0.354167,1
10/24/2017,19,12,"Just posted a photo Village Manhattan instagram com p BaphTD0FRto",0.000000,0
10/24/2017,19,12,"Shitty weather flying into JFK made me miss my non stop flight to Accra Now I have a crappy instagram com p BaphR4WAv42",0.000000,0
10/24/2017,19,12,"fall friends Hill Historic District instagram com p BaphHXNlEfg",0.000000,0
10/24/2017,19,12,"Giant bottle Drinking a Kentucky Breakfast Stout KBS by at http untp beer s c519219506 photo",0.000000,0
10/24/2017,19,12,"blessed Communications Uptown Offices in New York NY swarmapp com c 4uBssS47di5",0.136364,1
10/24/2017,19,12,"Closure Install w Beyond Bundles hairslayernellz queensstylist styleseatpro Shop instagram com p BaphQJmBF 9",0.000000,0
10/24/2017,19,11,"streetstyle Autumn steppin to the same tune since 8AM tuesday NaiPalm thememusic instagram com p Bapd9nxFypw",0.000000,0
10/24/2017,19,11,"Getting my NY pizza fix before I head off to Asia at in New York NY swarmapp com c 5IRFYMGaxH6 pic twitter com KikxEGbjja",0.136364,1
10/24/2017,19,11,"So tasty Drinking a Double Dry Hopped Mylar Bags by Drewery http untp beer s c519219451 photo",-0.033333,-1
10/24/2017,19,11,"This Thursday Catch Me Hosting At nyc For My Bro oneezy ovo Birthday Along With flkmusic instagram com p BaphK9sAxRs",0.000000,0
10/24/2017,19,11,"Celebrating Kristen Mike wedding mildjs musicinliveproductions hoytwedding instagram com p BaphLypgylB",0.000000,0
10/24/2017,19,10,"Thank you nymag50 ny50 s Delicatessen instagram com p Bapg r lt3z",0.000000,0
10/24/2017,19,10,"Just posted a photo The Musical instagram com p BaphHjiFvMC5 0D5nPCkXewpLOmnfIcg S DWhQ0",0.000000,0
10/24/2017,19,10,"Cleared Incident on 5Line Both directions at Dyre Avenue Eastchester Station",0.000000,0
10/24/2017,19,10,"Closest ill ever get to the show One day One day timessquare NewYork instagram com p BaphHTHB3qa",-0.500000,-1
10/24/2017,19,10,"als gotta get some ice cream",0.000000,0
10/24/2017,19,10,"Si es que est todo inventado 2017 hipsters versus 879 B C King ashurnasirpal II instagram com p BZrp xFAWQx",0.000000,0
10/24/2017,19,10,"Pre dart drink City Pub in Hoboken NJ swarmapp com c cFgKMNOQwyH",0.000000,0
10/24/2017,19,10,"Hey Ladies Come out and support H B Milnes PTA with this AMAZING instagram com p BaphGxblY7ms qp3HpfMyOPDF3sr6Mr8yc0KWNk0",0.600000,1
10/24/2017,19,10,"Facebook memories does the most York New York instagram com p BaphE87jsB7",0.318182,1
10/24/2017,19,10,"At the foodsummit this week I learned that in the last 3 years 2 3 of adults instagram com p Bapgf5zgnbL",0.000000,0
10/24/2017,19,10,"Download or stream my new album 4THLOK Feat bigtwinsqb instagram com p Bapbnd9AkwU",0.136364,1
10/24/2017,19,10,"Visit Shop Support Local Stylemeister Pop up Shop at Midoma Thursday 26th instagram com p BaphDsVFaIf",0.000000,0
10/24/2017,19,10,"boweryballroom 9 14 17 Josh flying he can do it all mondocozmo latergram instagram com p Bapg OinbNW",0.000000,0
10/24/2017,19,10,"I m at in New York NY swarmapp com c gBHD6uuitLZ",0.136364,1
10/24/2017,19,10,"Game time bitchezzz nyislanders bitchezzz Center instagram com p BaphCMiFuQJR IWeQ1AEVfU7UJ39viexMZJm70o0",-0.250000,-1
10/24/2017,19,09,"SQUAD Had a GREAT time running through CentralPark on my last shoot with the Greenberg instagram com p BaphBPchWNL",0.400000,1
10/24/2017,19,09,"Just posted a photo Bronx Bronx New York instagram com p BaphBPSFy7S3 MNkt3Q0CNwOzoOMo4bbkjtwDHs0",0.136364,1
10/24/2017,19,09,"Updated Construction on US9W Both directions from The Esplanade to South of Palisades Interstate Parkway http 511ny org EventDetails T RANSCOM ORC20170701",0.000000,0
10/24/2017,19,09,"Hogar Dulce Hogar dominicanrepublic santiagocity nyc style urban gangster music instagram com p Bapg ylFvLH",0.000000,0
10/24/2017,19,09,"Beloved s who ve inboxed abt this short here s the link an a clip soul remover on you tube instagram com p BapgElAlsTP",0.350000,1
10/24/2017,19,09,"Curried saltfish w asparagus and brussel sprouts roasted in coconut oil dinner ilovetocook instagram com p Bapg99UHYSF",0.000000,0
10/24/2017,19,09,"YUM OH at in New York NY swarmapp com c 4xn1wSR2Frv pic twitter com sIYgOLRQNb",0.136364,1
10/24/2017,19,09,"Just posted a photo Bronx Bronx New York instagram com p Bapg8e0Fuj1d fG09NqSS0iSImY1Ab Z44Qs N80",0.136364,1
10/24/2017,19,09,"Haven t eaten much since breakfast so I am ready for this s New York in New York NY swarmapp com c hPER7wSHPjT",0.168182,1
10/24/2017,19,09,"Sometimes you gotta get in the shot by any means necessary Being silly on set for instagram com p Bapg7W hzPl",-0.250000,-1
10/24/2017,19,09,"Imagine Dragons Brooklyn THIS band never cease to amaze me and make instagram com p Bapg59uhRqM",0.000000,0
10/24/2017,19,08,"Construction on US46 Both directions at Garden State Parkway http 511ny org EventDetails T RANSCOM ORI167104201",0.000000,0
10/24/2017,19,08,"Incident on 2Line Both directions at 241st Street Wakefield Station http 511ny org EventDetails T RANSCOM ORT25947907",0.000000,0
10/24/2017,19,08,"Number pick up for Sunday s race my last race before the marathon at RUNCenter in New York NY swarmapp com c 4nDKi0rvGsE",0.068182,1
10/24/2017,19,08,"Thanks for all the love Your pictures are mouthwatering Repost from eats There s an ENTIRE instagram com p Bapg3 9DwYk",0.233333,1
10/24/2017,19,08,"Another one of the Marcy 6 months before the last post it looks like a winter one York instagram com p BapgtO0Hfi7",0.000000,0
10/24/2017,19,08,"i will be in bed by 10pm tonight",0.000000,0
10/24/2017,19,08,"And live jazz too uptowngeekdad fineandrare and Rare instagram com p Bapg1o8lGIc",0.218182,1
10/24/2017,19,08,"Delicia que rico love Thai food Thai Restaurant Brooklyn instagram com p Bapg0YUAePNt yaO7bOuHeSc3KtMGIU1aG0n4U0",0.500000,1
10/24/2017,19,08,"ashotworthtaking hornitos blackbarrel gansevoort delicious instagram com p BapgzXiB6Z99 YaArR4ltX7Z9S FS32ef1DJB4s0",1.000000,1
10/24/2017,19,08,"Oh hell yeah Here We Come Garden instagram com p Bapgzj gCPe",0.000000,0
10/24/2017,19,07,"NOLAROUTES is the unique design formed by the New Orleans streetcar rail instagram com p Bapf oBnQdP",0.255682,1
10/24/2017,19,07,"I should have been a cowboy Or maybe a biker Bellboy Life is hard http liketk it 2tbvr instagram com p BapgxpkAmlv",-0.291667,-1
10/24/2017,19,07,"Updated Construction on US46 Both directions at Garden State Parkway http 511ny org EventDetails T RANSCOM ORC20194101",0.000000,0
10/24/2017,19,07,"Cleared Incident on NewJerseyTurnpikeEasternSpur SB from North of Interchange 17E NJ 3 Lincoln Tunnel to North of Interchange 15W",0.000000,0
10/24/2017,19,07,"Getting Flu Shot Aid in Flushing NY swarmapp com c eoj4yq2TaRa",0.000000,0
10/24/2017,19,07,"CHECO7XDP Lower Manhattan instagram com p Bapgs9LgqWE",0.000000,0
10/24/2017,19,07,"gringostaco sayuncle lou s Tacos instagram com p BapgVU1HeaT",0.000000,0
10/24/2017,19,07,"E46th St gangs all here Such a cool new studio with an amazing community instagram com p BapgwDWH0oH",0.271591,1
10/24/2017,19,07,"Mark Those Calendars 10 27 Pre Halloween Party Music By instagram com p BapgtDvg2Sp",0.000000,0
10/24/2017,19,07,"I m at The Belvedere Hotel in New York NY swarmapp com c 2cVC04i2iRh",0.136364,1
10/24/2017,19,07,"custom bad boy baseball jersey",-0.700000,-1
10/24/2017,19,07,"York New York instagram com p BapgkXmFCV1",0.136364,1
10/24/2017,19,07,"Drinking a Boat Beer by at http untp beer s c519217621",0.000000,0
10/24/2017,19,06,"",0.000000,0
10/24/2017,19,06,"I ve asked my students to do more teaching this year A student like Arleen is about that life instagram com p BapgrNwjvfa",0.500000,1
10/24/2017,19,06,"The burn in your lungs the metal taste in your mouth the fatigue in your legs just means instagram com p Bapgq ZgsUz",0.000000,0
10/24/2017,19,06,"DSA QNS Meeting QueensistheFuture House Astoria Conservatory for Music and Art in Astoria NY swarmapp com c 0AnGGmaRedt",0.000000,0
10/24/2017,19,06,"Flatbush Brooklyn instagram com p BapgqAkn39O",0.000000,0
10/24/2017,19,06,"This is the only guy I know who poses for a photoshoot sleep but still swaged out instagram com p BapgoqqhxGn",0.000000,0
10/24/2017,19,06,"New Blog Post Read the post by clicking the link in my bio Don t put off one more thing until instagram com p BapgiXelb43",0.318182,1
10/24/2017,19,06,"Incident on GardenStateParkway NB at South of Brookdale Service Area http 511ny org EventDetails T RANSCOM ORI167104101",0.000000,0
10/24/2017,19,06,"I m at The Rock Health Fitness Club in Astoria NY swarmapp com c bh0ZRvD2ySJ",0.000000,0
10/24/2017,19,06,"Celebrating my heritage Historic District instagram com p Bapgn6yjatJ",0.000000,0
10/24/2017,19,06,"Today i sold a 2018KiaOptima with an appointment i made with someone last week I have been instagram com p BapgmS8lvom",0.000000,0
10/24/2017,19,06,"roasted celery root with blistered robiola bisina and smoked oil I roasted the instagram com p BapgnBCjUCD",0.000000,0
10/24/2017,19,06,"Waiting on this paycheck like pic twitter com 16n69AEnuu",0.000000,0
10/24/2017,19,06,"Second time seeing dearevanhansen lovethiscity NYC youwillbefound grateful Box instagram com p BapgklFBsrX",0.000000,0
10/24/2017,19,05,"PEGAO EN LA CALLE YA Entregala https goo gl vjLNvH via instagram com p Bapgb6KnHAU",0.000000,0
10/24/2017,19,05,"FULL SERVICE SALON ESPECIALIDAD EN BOTOX KERATINA COLOR HIGHTLIG instagram com p BapghIyHKyQr 23ik niXeN9DWnDRfcvK1rpv0Y0",0.350000,1
