Date,Hour,Minute,Tweet text,Polarity,Sentiment
10/02/2017,10,56,"Updated Construction on NJ440 Both directions from North of 30th St to North of W 63rd St http 511ny org EventDetails T RANSCOM ORC20008601",0.000000,0
10/02/2017,10,56,"Cleared Construction on NewJerseyTurnpike NB from North of Interchange 14 I 78 US 1 9 to North of Interchange 15E US 1 9",0.000000,0
10/02/2017,10,56,"Pilates Basics Concentration nathanielleepilates com new events 201 7 10 5 pilates basics",0.136364,1
10/02/2017,10,56,"Hello Loves Here is your Tarot energy card for today Monday Five of Wands Today you will instagram com p BZv Dc1HGPL",0.000000,0
10/02/2017,10,56,"Alexandra the Great with Alexandra Pereyre de Nonancourt champagnelaurentperrier wwls instagram com p BZv CrSFZY7",0.800000,1
10/02/2017,10,56,"Hip Hop Legends 125th Street instagram com p BZv DKnA8Ru",0.000000,0
10/02/2017,10,56,"ALERT Buy ANY slice of pizza today and get a FREE cookie Here s to the sweet tooth in instagram com p BZv ALABIdz",0.375000,1
10/02/2017,10,56,"vegas York New York instagram com p BZv AZnleGd",0.136364,1
10/02/2017,10,55,"Sleepily heading back to LA F Kennedy International Airport instagram com p BZv 69Dt9r",0.000000,0
10/02/2017,10,55,"Sweet Baby Jesus can you please keep the Carousel going I don t want to get off instagram com p BZv 6z BcIq",0.350000,1
10/02/2017,10,55,"I m at Burly Coffee in Brooklyn NY swarmapp com c 05kBeUjqCOf",0.000000,0
10/02/2017,10,55,"Construction on NJ440 Both directions from North of 30th St to North of W 63rd St http 511ny org EventDetails T RANSCOM ORC20008601",0.000000,0
10/02/2017,10,55,"I m at Ed Sullivan Theater show in New York NY swarmapp com c 3vGYh79ac6W pic twitter com KNN1NfbKTf",0.136364,1
10/02/2017,10,55,"Repost from cynthia mua perry What an incredible night I recently had the amazing instagram com p BZv N3H5Fu",0.500000,1
10/02/2017,10,55,"That s my 87 year old dad playing table tennis with my 31 year old nephew My dad won the point instagram com p BZv 8tslV 8",0.100000,1
10/02/2017,10,55,"We ve been lucky to call studiablo a friend for many years If you ve ever met him you know instagram com p BZv 8CXlCBg",0.416667,1
10/02/2017,10,55,"NEW VLOG IS LIVE Watch to learn more about protos in the fashion industry Link in bio vlog instagram com p BZv 7zAg3yp",0.257576,1
10/02/2017,10,55,"About last night was sensational in desperatemeasures instagram com p BZv 6B6joFr",0.333333,1
10/02/2017,10,55,"I m at Elevated Acre in New York NY w swarmapp com c 82GkinosCxN",0.136364,1
10/02/2017,10,55,"STEP BONE CUT ACADEMY NY NY NY Shiji NY",0.000000,0
10/02/2017,10,54,"The city that never sleeps NYC trip Last walk through centralpark one of my favorite spots in instagram com p BZv 1GUn9 O",0.250000,1
10/02/2017,10,54,"We upcycle soda bottles and turned them into plant pods green CASAMiddleSchool instagram com p BZv 3dEBIL1",-0.200000,-1
10/02/2017,10,54,"Asking Most High for this these perilous disturbing times and with it the courage strength to instagram com p BZv sYOhIrC",0.053333,1
10/02/2017,10,54,"Congrats on your first day Roz RosalindBrewer Starbucks They even get the COO name wrong instagram com p BZv 2mAH1Jt",-0.125000,-1
10/02/2017,10,54,"Music Industry We want to hear from you Come hang at an open discussion about where we re at instagram com p BZv 2YchKMA",0.000000,0
10/02/2017,10,54,"SHE DOES NOTHING BUT CHILL ALL DAY THO City New Jersey instagram com p BZv w9tn6QR",0.136364,1
10/02/2017,10,54,"Walking into this week like mondaymood York New York instagram com p BZv 0slAHkP",0.136364,1
10/02/2017,10,54,"We need more of this today losvegas love prayersforvegas Slope Historic District instagram com p BZv we1Bvti",0.333333,1
10/02/2017,10,54,"Buen dia mi gente Que dios melo bendiga Goodmorning world nyc runs on coffee baby instagram com p BZv ygaFpay",0.000000,0
10/02/2017,10,53,"It s getting wild Join for WildCard action tomorrow night with instagram com p BZv rp4FEeJ",0.100000,1
10/02/2017,10,53,"Thanks PR for this fab womeninwine wine symposium Mills Event instagram com p BZv rlEno4u",0.200000,1
10/02/2017,10,53,"1024 Walton Avenue the Bronx pic twitter com mDqrpTckRt",0.000000,0
10/02/2017,10,52,"Mansa King saynomore New Jersey instagram com p BZv p8JFzDo",0.136364,1
10/02/2017,10,52,"Frieze Masters 2017 Booth D11 5 8 October 2017 11am 7pm Art Fair instagram com p BZv nLoDqvX",0.700000,1
10/02/2017,10,52,"What a strange and beautiful place I call home ilovenyc subway underground noise instagram com p BZv g7kneeZ",0.400000,1
10/02/2017,10,52,"Whisky for days and Fireball for the Jaguar jaguars jacksonvillejaguars jacksonville instagram com p BZv lgoFckt",0.000000,0
10/02/2017,10,52,"GOOD MORNING EVERYONE DaRepresentative DjNice PartyWithTeamNice Brooklyn Manhattan instagram com p BZv lj4DGXg",0.700000,1
10/02/2017,10,52,"A little smile to start the day smile smirk cooltony hospital stillhere imok instagram com p BZv kiVH0bY",0.137500,1
10/02/2017,10,52,"Just posted a photo West Side instagram com p BZv kwgHCp0",0.000000,0
10/02/2017,10,52,"Repost get repost Inicia el mes de octubre con las mejores herramientas para instagram com p BZv j9DDge0",0.000000,0
10/02/2017,10,52,"YOUR HYPE WILL NEVER LAST rulaz line NY York New York instagram com p BZv dHkAmcE",0.068182,1
10/02/2017,10,52,"Back at the studio today prepping for fall leaves with brilliant autumn colors instagram com p BZv i HhdAy",0.450000,1
10/02/2017,10,51,"Abby Grandad ridding the Carousel She loves her grandad broadway moe instagram com p BZv f0zBcV",0.000000,0
10/02/2017,10,51,"Some faculty and administrators sporting their Blue for NationalBlueShirtDay to kick off the instagram com p BZv OUnjNlS",0.000000,0
10/02/2017,10,51,"parkingmix Presents El Desquite Part 2 Domingo 8 de Octubre Live onstage instagram com p BZv hpvFn4k",0.136364,1
10/02/2017,10,51,"So this is where they keep the books nyc York Public Library in New York NY swarmapp com c j3A2kMtg0fH",0.068182,1
10/02/2017,10,51,"Repost yadiraregional yyc get repost en New York New York instagram com p BZv gZ6jdqO",0.136364,1
10/02/2017,10,51,"ut f p cket West Side instagram com p BZvD8uoHkgX",0.000000,0
10/02/2017,10,51,"Happy People of DG3 Monday Today we are spotlighting Nichola Dawes one of our Account instagram com p BZv gEKlcPG",0.800000,1
10/02/2017,10,51,"Legal Issue jerseycitylawyer European Court Limits Workplace Email Monitoring http dlvr it PrtPH2 Call 9733379643 pic twitter com JcJ1h0bHqI",0.100000,1
10/02/2017,10,51,"August 2 2017 110 71 199th Street St Albans Queens 280 000 1 unit 1 896 sf one family home two stories detached",0.000000,0
10/02/2017,10,51,"caroftheday well transportoftheday a spiderman trike I wonder if it shoots webs instagram com p BZv cjEgFp7",0.000000,0
10/02/2017,10,50,"got a quick half hour workout before work this morning feeling instagram com p BZv ZF7gJp67 ImyqO3H6IMow3DERRIqwbeCHCw0",0.083333,1
10/02/2017,10,50,"After my run yesterday a walk on the pier Piers instagram com p BZv Y3IgFDhD LzIWOC4D9eDI4MxxywHTU7BoCY0",0.000000,0
10/02/2017,10,50,"A School BFF and Home BFF sandwich Bar instagram com p BZuC308ncqD",0.000000,0
10/02/2017,10,50,"They re not gonna get us Askew Entertainment instagram com p BZv VbhjItK",-0.100000,-1
10/02/2017,10,50,"We re still flying high from Saturday s concert So special Birds eye view of the nest from instagram com p BZv PAqnBpJ",0.258571,1
10/02/2017,10,50,"Yes He is That s why we as followers of Christ are victors not instagram com p BZv VHQhiXT6 KuFVApGYIjHfeMK6 JNO9qbMAY0",0.000000,0
10/02/2017,10,50,"Peewee Nyob Stylin in performance at APR S AVANT GARDE FESTIVAL WITH DAY DE DADA 10 1 on instagram com p BZv VFEBqpk",0.000000,0
10/02/2017,10,49,"So excited to announce My Other Job has been nominated for SEVEN NY Summerfest awards Thrilled instagram com p BZv PqRD7an",0.283333,1
10/02/2017,10,49,"Only place I want to be right now followthatduck nyc flatiron morningmotivation instagram com p BZv OdsgBsQ",0.142857,1
10/02/2017,10,49,"Ive always loved the wooden water towers in NYC I can see about a dozen of them from my hotel instagram com p BZv NQGjo K",0.350000,1
10/02/2017,10,49,"customradiatorcover customcabinetry New York instagram com p BZv M26BQv",0.136364,1
10/02/2017,10,48,"Our thoughts are with our friends fellow music fans and of course the victims in Las Vegas instagram com p BZv M7LhKm",0.000000,0
10/02/2017,10,48,"Good morning New York at in New York NY swarmapp com c dgaoqO4iWDp",0.324242,1
10/02/2017,10,48,"I love when 2 Bass tones play nice together zackerywallsmadethetrack international instagram com p BZv LwpHJfr",0.237500,1
10/02/2017,10,48,"Morning stroll through Central Park centralpark instagram com p BZv JIChpJ 7 9eQ7t2wwfzHgCVW6kXbo2VMXQY0",0.000000,0
10/02/2017,10,48,"My brother partner came through this morning to get a fresh up need them tracks get at us instagram com p BZv HrcnTHR",0.300000,1
10/02/2017,10,48,"Amazing time in NYC timessquare bigapple citythatneversleeps Square Manhattan New instagram com p BZv GqFgfJT",0.368182,1
10/02/2017,10,48,"Lady Bug BumbleBee Unlimited This was another Patrick Adams vehicle on Red Greg records This instagram com p BZv GLal1kF",0.000000,0
10/02/2017,10,47,"Brooklyn presents thejellybk 2nite 7 30PM doors Get your monthly instagram com p BZv Ezdlgd6",0.000000,0
10/02/2017,10,47,"Oh happy days Needing some shopping therapy right now shopping shoppingtherapy instagram com p BZv Ep2n84K",0.542857,1
10/02/2017,10,47,"Happy Monday happy kraftoberfest We ll be tapping some killer Octoberfest style beers instagram com p BZv C5mjWqK",0.800000,1
10/02/2017,10,47,"I m at Newark Liberty International Airport in Newark NJ swarmapp com c kwTH6XlkBYl",0.000000,0
10/02/2017,10,47,"What an awesome week at pgatour USA pgatourentertainment instagram com p BZv AcMBi 1",1.000000,1
10/02/2017,10,47,"Video Vixen Lash City instagram com p BZv ARAlYml",0.000000,0
10/02/2017,10,47,"How I be feeling sometimes Heights Utica Avenue instagram com p BZv9 fgA1Scc GBKS6ci3uL1TlQ6HrU1hGeuvwU0",0.000000,0
10/02/2017,10,47,"thanks again for the kind words on instagram com p BZv9 baBZ9y",0.400000,1
10/02/2017,10,47,"w w w",0.000000,0
10/02/2017,10,47,"Ugh Monday ctfu funny funnyaf funnyshit dead weak lol lmao lmfao instafunny wtf instagram com p BZv9 IqgTTO",0.095833,1
10/02/2017,10,46,"Mood Heights Manhattan instagram com p BZv99p lboL",0.000000,0
10/02/2017,10,46,"aliza TONIGHT MONDAY OCT 2 MAGICCITYMONDAYS cityscapes nyc CITYSCAPES 58 ST MASPETH NY instagram com p BZv97tkAWbZ",0.000000,0
10/02/2017,10,46,"Mood Heights Manhattan instagram com p BZv966dlOog",0.000000,0
10/02/2017,10,46,"Fiorella s Top Healthy fats you should have Every day they are heart healthy skin repairing instagram com p BZr0C dA3aJ",0.500000,1
10/02/2017,10,46,"LayOver F Kennedy International Airport in Queens NY swarmapp com c 6ji8TrrUUWl",0.000000,0
10/02/2017,10,46,"I m gonna diss you in public savagethoughts comingsoon waitonit A whole slew of them instagram com p BZv94vYjrDG",0.100000,1
10/02/2017,10,45,"Part 2 of 3 recorded Sunday morning Do Not Book Club ALS on 1300 instagram com p BZv91PQgX Jv EfrZ8tuRIlcRftPChV6 X9lvN40",0.000000,0
10/02/2017,10,45,"Flower bouquets perfect post workday reward Thanks to everyone who volunteered at 216 this instagram com p BZv90SggAua",0.600000,1
10/02/2017,10,45,"S O the CEO of STR8TEAMENT BigHookz on the rise with new single Come Up feat instagram com p BZpp3pUHIAY",0.032468,1
10/02/2017,10,45,"Jensen in New York this morning for the live of Ryan and Kelly on ABC SPNFamily instagram com p BZv9uA5njxJ",0.136364,1
10/02/2017,10,45,"Music of the Ocean Waves runisee50 com runisee50com d ailyviews andthought 2017 10 2 music of the ocean waves",0.000000,0
10/02/2017,10,45,"breakfast instagram com p BZv9wCDlfTM",0.000000,0
10/02/2017,10,44,"Impressive Estructures oneworldtradecenter nyc newyork immersive 360 360photography instagram com p BZv9sU6FCZN",1.000000,1
10/02/2017,10,44,"Empower others and be their support This is true leadership empowerment support leadership instagram com p BZv9rlNB6f3",0.350000,1
10/02/2017,10,44,"It s a brand new month Im so ready to make new goals and achieve them I also want to help a instagram com p BZv9nlThwda",0.157576,1
10/02/2017,10,44,"Legal Issue jerseycitylawyer Your Daily Dose of Financial News http dlvr it PrtL2M Call 9733379643 pic twitter com CSMeYUnIgV",0.066667,1
10/02/2017,10,44,"Legal Issue jerseycitylawyer The Continuing Saga Of Standing In Data Breach Class http dlvr it PrtKwt Call 9733379643 pic twitter com YvvLOKGKe0",0.200000,1
10/02/2017,10,44,"This morning I woke up worrying about all the things I didn t get done in September I instagram com p BZv9ootDLRV",0.000000,0
10/02/2017,10,43,"gandhi birthanniversary gandhijayanti 2october peace coexist renew roy debanjan instagram com p BZv9ncHBZFj",0.000000,0
10/02/2017,10,43,"I m excited to watch this MAX clip after I check in Colombe Torrefaction in New York NY swarmapp com c kfDyVG4F0Pw",0.255682,1
10/02/2017,10,43,"If you re in the area feel free to drop off for PuertoRicoRelief PuertoRico instagram com p BZv9i68H9W7",0.400000,1
10/02/2017,10,43,"Melodrama Park New York City instagram com p BZulXIwBpXBv pSbXFQIf63uByyuut 7ERk469s0",-0.081818,-1
10/02/2017,10,42,"No Trojan horse here This Agamemnon butterfly isn t hiding from anything with its gorgeous instagram com p BZv9fYFgcQ9",0.700000,1
10/02/2017,10,42,"34 more days makeitnice nycmarathon Park instagram com p BZv9dmiFWzU",0.500000,1
10/02/2017,10,42,"Repost rollingstone get repost Happy birthday Sting Known as instagram com p BZv9cv1lfFSj nYO6uH3VOupGQH544oNQwUIfTA0",0.800000,1
10/02/2017,10,42,"Legal Issue thetrumpreport Marshawn Lynch sends message to Donald Trump The http dlvr it PrtJq1 artusalawfirm Call 9733379643 pic twitter com XKYLLh50xM",0.200000,1
10/02/2017,10,42,"New Jersey instagram com p BZv9afKlM",0.136364,1
10/02/2017,10,41,"Spot the odd one out Thanks for not giving me the bragging rights Jaguars Another brilliant instagram com p BZv9WO3lJCo",0.311111,1
10/02/2017,10,41,"Repost get repost Pre Panamanian Day Parade Party Despues de las instagram com p BZv9VdWluxT",-0.250000,-1
10/02/2017,10,41,"Did it before Can do it again fightlikeagirl instagram com p BZv9VY6gK5L2 jgndJZXBbc62uTHzrBKUwZanZI0",0.000000,0
10/02/2017,10,41,"I m at National September 11 Memorial Museum in New York NY swarmapp com c hXTf9eA9TUu pic twitter com jWryTmG2Rz",0.136364,1
10/02/2017,10,41,"Obrigada Senhor pelo final de semana intenso e tremendo Te servindo em NewYork instagram com p BZv9B8mBFQK",0.000000,0
10/02/2017,10,41,"Acabei de liberar um post no blog falando tudo sobre a bolsa de palha queridinha do ver o Link instagram com p BZv9Si1l4mW",0.000000,0
10/02/2017,10,40,"capitallink Shipping conf banking panel discuss whether lender withdrawal is permanent or not pic twitter com 0bzvolGx2K",0.000000,0
10/02/2017,10,40,"Pastrami and Eggs s Sandwich Shop instagram com p BZv9QeED eM",0.000000,0
10/02/2017,10,40,"Tea Hot Skim Donuts Baskin Robins in New York NY swarmapp com c fTP83exJtZV",0.193182,1
10/02/2017,10,40,"Done Thanks",0.200000,1
10/02/2017,10,40,"TOUR UPDATE NO PHILLY NO SACRAMENTO i love yall ill get to yall cities soon TIXS instagram com p BZv9OdiBNxg",0.000000,0
10/02/2017,10,40,"Leisure travel newyork style nyc Astoria New York instagram com p BZv9M2jgQ3Y",0.136364,1
10/02/2017,10,40,"BLACKTHORN51 80 12 51st Ave queens Support your local artists THE NETWORK WAVe instagram com p BZv9LwYn e8",0.000000,0
10/02/2017,10,40,"Closed nyc York New York instagram com p BZv9Lv8Bhx7",0.018182,1
10/02/2017,10,39,"A moment to celebrate a piece of artwork an intangible heritage of humanity which resembles instagram com p BZv8 1Djus7",0.000000,0
10/02/2017,10,39,"Truly blessed but really truly to have the friends and the family that I have Thank you to instagram com p BZv9IM4hvC3",0.200000,1
10/02/2017,10,39,"The month of October is about to change my entire life",0.000000,0
10/02/2017,10,39,"Bronx Bronx New York instagram com p BZv9GuuDOZFQ WbW8QDWD0ZB0K7llgek4H60Pjk0",0.136364,1
10/02/2017,10,39,"eastvillage lowereastside les ny nyc newyork newyorkcity nycstreetart nycart instagram com p BZv9Ft7DmsU",0.000000,0
10/02/2017,10,39,"REPOST FROM cynthia mua perry What an incredible night I recently had the amazing instagram com p BZv9Eypn3gF",0.500000,1
10/02/2017,10,39,"We re live today from TimesSquare at the Global Real Estate Summit NYC with co hosts instagram com p BZv9D1Pldok",0.112121,1
10/02/2017,10,39,"daisypress on with me now on morningmotivation instagram com p BZv9D8YDk1HT DtC4ioBC dwdBhs 6x97HLvyws0",0.000000,0
10/02/2017,10,38,"New day new week new month nyc dumbo Brooklyn Bridge Water Front instagram com p BZv9DVTFi7M",0.136364,1
10/02/2017,10,38,"Repost get repost PANAFUSION http PARKINGMIX COM PRESENTAN SABADO 7 DE OCTUBRE instagram com p BZv9CqOlHUb",0.000000,0
10/02/2017,10,38,"Mmmmm legionsupplements timetostopbeingsofat composerlife Isitsupposedtobethiscolor instagram com p BZv9AkvHB8V",0.000000,0
10/02/2017,10,38,"Are your plans in line with God s plan for your life Food for thought Amen instagram com p BZv9Adjnp X",0.000000,0
10/02/2017,10,38,"Como pai de uma adolescente de 16 anos como pastor do evangelho de Cristo e como filho de Deus instagram com p BZv9ADBj0nT",0.000000,0
10/02/2017,10,38,"NewYork home of the best bagels so damngood Thx travelethan for the rec instagram com p BZv8 d1gmS1",1.000000,1
10/02/2017,10,38,"Putting that work in at the beach early in the morning instagram com p BZv8 94l4Ne",0.100000,1
10/02/2017,10,38,"Subway people catacombs Square Manhattan New York instagram com p BZv8 I jyyq",0.136364,1
10/02/2017,10,38,"Thanks facebook for clearing that up for me IKnowWhatUnfollowMeans instagram com p BZv89wNF Ly",0.200000,1
10/02/2017,10,38,"An interview of a lifetime It s about to happen Aftra Foundation Theater instagram com p BZv89UmD2dI",0.000000,0
10/02/2017,10,38,"Neat in New York instagram com p BZv88XlA8ba",0.136364,1
10/02/2017,10,37,"The Empire State Building York New York instagram com p BZv87zPjtGY",0.136364,1
10/02/2017,10,37,"Happy Birthday Nathan Sketch instagram com p BZv86pOBgkV",0.800000,1
10/02/2017,10,37,"York New York instagram com p BZv841hlVlb",0.136364,1
10/02/2017,10,37,"Reunited and it feel so good Missed this little lady more than words can say home babygirl instagram com p BZv81dWg1d3",0.337500,1
10/02/2017,10,37,"She s headed back to Chicago as we speak but love love love love love Christine with all my instagram com p BZv80 oniuv",0.416667,1
10/02/2017,10,36,"oney ark ondays tribemark back at it blemchallenge forthepussychallenge instagram com p BZv80xrjvF",0.000000,0
10/02/2017,10,36,"Long sleeve drop 1 is available now 48 atsuyoetakiko atelieratsuyoetakiko laratee instagram com p BZv8zabn2ft",0.175000,1
10/02/2017,10,36,"Meowga Monday Nope boycottmondays Yass thunderthecat catsofjersey instagram com p BZv8yHoBJ3v",0.000000,0
10/02/2017,10,36,"Construction on MLine Both directions at Chambers Street Station http 511ny org EventDetails T RANSCOM ORO1657507",0.000000,0
10/02/2017,10,36,"SnapChat Filter Fun Thank you fall perfecthairweather District instagram com p BZv8xPMlu2D",0.300000,1
10/02/2017,10,36,"and you could come and join me on my cloud impossibleproject polaroidoriginals instagram com p BZv8wrUnFf5",0.000000,0
10/02/2017,10,36,"LIVE TRAVEL ADVENTURE BLESS And don t be sorry Jack Kerouac wordstoliveby instagram com p BZv8v2YFMt9",-0.181818,-1
10/02/2017,10,36,"Decorating phase 1 is complete Thanks to my baby for coming home this weekend instagram com p BZv8vmQD8Wf",0.150000,1
10/02/2017,10,36,"I m at Starbucks in Elmhurst NY swarmapp com c 9kQsJVJp6e7",0.000000,0
10/02/2017,10,35,"Havana Twists Updo LUXURYHAIRLOUNGENYC FAUXLOCSNYC CROCHETFAUXLOCSNYC CROCHETBRAIDSNYC instagram com p BZv8tRMleDJ",0.000000,0
10/02/2017,10,35,"Acaba de publicar una foto en Bronx N Y C instagram com p BZv8tMUBomK3 NvuvmXiSPVazeDqvHpWb6Ju16c0",0.000000,0
10/02/2017,10,35,"Construction on JLine Both directions from Crescent Street Station to Jamaica Center Parsons Archer Station http 511ny org EventDetails T RANSCOM ORO1657407",-0.100000,-1
10/02/2017,10,35,"Waiting forvthe ferry on a Monday morni g Astoria queens queenscapes Astoria New instagram com p BZv8qkWgs1",0.136364,1
10/02/2017,10,35,"Exploring Chilloween options Any advice instagram com p BZv8nhEFOKB",0.000000,0
10/02/2017,10,35,"Hubby putting that work in early morning beach training titanium beast instagram com p BZv8nr9hfOw",0.100000,1
10/02/2017,10,35,"SO PROUD of our patients They are out there slaying it in all realms instagram com p BZv8muMhvyo",0.800000,1
10/02/2017,10,34,"Still all about the fashion Vintage stitching KEVAIND art culture fashion style instagram com p BZv8lSIFT R",0.000000,0
10/02/2017,10,34,"renaissancefaire elf pointyears mchevatewa couldn t have spent our first renfaire better 3 instagram com p BZv8kI9l2I5",0.216667,1
10/02/2017,10,34,"Yo Ni Nah voy a decir York New York instagram com p BZv8UIqjfi9",0.136364,1
10/02/2017,10,34,"Soup of the Day Potato Leek 5 longislandcity nycfood lunchmenu queens Bakery and instagram com p BZv8ji4hS3f",0.000000,0
10/02/2017,10,34,"In Tribute to All Immigrants Afro Cuban beats by Battle Of Santiago chilepepperfestival instagram com p BZv8jCFhJMk",0.000000,0
10/02/2017,10,34,"Bro it s one interview already sounding crazy",-0.600000,-1
10/02/2017,10,34,"York New York instagram com p BZv8gGtg6klG 86MAKBQL2jhDyN0WJswLrdmoSM0",0.136364,1
10/02/2017,10,33,"Only Thing We Matching Is Spliffs instagram com p BZv8c2bnKuJ",0.000000,0
10/02/2017,10,33,"p en The Metropolitan Museum of Art New York instagram com p BZv8cnYBhX3",0.136364,1
10/02/2017,10,33,"I m just an average nigga from the bottom who shows everyone love October 28th I need y all to instagram com p BZv8ZLtBYAS",0.175000,1
10/02/2017,10,33,"1020 Walton Avenue the Bronx pic twitter com C6bNIHQaAt",0.000000,0
10/02/2017,10,33,"Crochet Bobbi Boss Nu Locs LUXURYHAIRLOUNGENYC FAUXLOCSNYC CROCHETFAUXLOCSNYC instagram com p BZv8XzMF j3",0.000000,0
10/02/2017,10,32,"Construction on NJ495 EB at Lincoln Tunnel http 511ny org EventDetails T RANSCOM ORI165228807",0.000000,0
10/02/2017,10,32,"Updated Incident on NewarkLibertyInternationalAirport at Daily Parking P1 P3 http 511ny org EventDetails T RANSCOM ORI165226108",0.000000,0
10/02/2017,10,32,"Construction on GLine Both directions from Bedford Nostrand Avs Station to Court Square Station http 511ny org EventDetails T RANSCOM ORO1657307",0.000000,0
10/02/2017,10,32,"HEMAN BWOOD 3M feel the force nostalgia sustainable fashion cosmic unisex Shoppe instagram com p BZrKyP1ldNk",0.000000,0
10/02/2017,10,32,"RyanJanekWolowski Panda hood mascot mask spirithalloween SpiritHalloween 55 Broadway instagram com p BZv8RNJHMoE",0.000000,0
10/02/2017,10,32,"RT I can t stand people that hit me up just looking for a reaction Leave me alone",0.000000,0
10/02/2017,10,32,"He officially declared Monday s are for the mitts doitwithflair flairismyspiritanimal instagram com p BZv8QaDFjGY",0.000000,0
10/02/2017,10,31,"Alex mondays menstyle mensfashion Studios instagram com p BZv8PjNF2Ub",0.000000,0
10/02/2017,10,31,"Work Department of Buildings in New York NY swarmapp com c bj4IHvpnpPe",0.136364,1
10/02/2017,10,31,"Acaba de publicar una foto en Bronx N Y C instagram com p BZv8O2HB92dm ZRKq6DDpUiJFH3kD10aVsWnO9k0",0.000000,0
10/02/2017,10,31,"postcardfromnewyork New York instagram com p BZv8O3nHtdQ",0.136364,1
10/02/2017,10,31,"Seagull walking on roof at astorialanding nycferry Astoria queens queenscapes boromag instagram com p BZv8OCMAQeQ",0.000000,0
10/02/2017,10,31,"Construction on FLine Queens bound at 75th Avenue Station http 511ny org EventDetails T RANSCOM ORO1657207",0.000000,0
10/02/2017,10,31,"Hace unos d as mi amiga Rita retorno a las Vegas a disfrutar c mo s lo ella lo sabe hacer en instagram com p BZv8MpKDJdJ",0.000000,0
10/02/2017,10,31,"Somehow the puppy rolled in maple syrup on our walk Can t decide whether to give her a bath or instagram com p BZv8JfQAZyN",0.000000,0
10/02/2017,10,30,"SpoiledBodi is currently looking for Social Media Interns from Fall 2017 Spring 2018 if you or instagram com p BZv8IOOnPEV",0.016667,1
10/02/2017,10,30,"Collection by newyorkcity vintagefashion bohemian bohochic 1970s instagram com p BZv8GYOgsdE",0.000000,0
10/02/2017,10,30,"regranned from Video and description by We take a look instagram com p BZv8E6hnGS3",0.000000,0
10/02/2017,10,30,"Legal Issue jerseycitylawyer FTC Goes After Misleading Organic Product Claims http dlvr it PrtBg0 Call 9733379643 pic twitter com VKr66bBGgV",0.200000,1
10/02/2017,10,30,"Was serenaded last night edsheeran Center instagram com p BZv8DKBlxeI",-0.050000,-1
10/02/2017,10,30,"FREE Dining room hutch and buffet 555 81st Street Brooklyn NY 11209 trashnothing com public post 25 156686 dining room hutch and buffet 555 81st street brooklyn ny 11209 r tw rp NYCFreecycle trashnothing",0.200000,1
10/02/2017,10,30,"10 14 17 Early Bird Tix On Sale Please RSVP embassynyc Bar Lounge Hosted By instagram com p BZv8B7Vj2i0",0.100000,1
10/02/2017,10,30,"Have you tried yet our new shape of baguettes The rustic baguettes a bit shorter and a bit instagram com p BZv8B98FFyr",0.136364,1
10/02/2017,10,29,"Mara Kaye Brooklyn Blue Monday Washed Out By Moonlight Tonight She Sings Other People s instagram com p BZv7 OHALh4",-0.062500,-1
10/02/2017,10,29,"AMG GTS freshly wrapped in frozen black metallic instagram com p BZv7 2 Hf8n",0.066667,1
10/02/2017,10,29,"Cleared Special Event on NewJerseyTurnpikeHudsonCountyExtension EB from Interchange 14 I 78 to Interchange 14C Toll Plaza",0.357143,1
10/02/2017,10,29,"Construction on FLine BothDir BothDir at 4th Avenue Station http 511ny org EventDetails T RANSCOM ORO1657107",0.000000,0
10/02/2017,10,29,"Who likes road bicycles Superstar is the bicycle ride with monocoque chassis for the evolved instagram com p BZv78uJhGUa",0.000000,0
