Date,Hour,Minute,Tweet text,Polarity,Sentiment
02/03/2017,18,06,"Most discussed topic in New York right now Uber http toplocalnow com us new york ci ty topics uber",0.264610,1
02/03/2017,18,06,"Mississippi man labeled just fat by doctors had 130 pound tumor caused by ingrown hair http nydn us 2l198rj",0.000000,0
02/03/2017,18,06,"JoinTheMovement BigDawgPitbulls belaireluxe instagram com p BQETgqnD yM",0.000000,0
02/03/2017,18,05,"Suciagang TAKING OVER TONIGHT ill be rocking with my homie join instagram com p BQETfrujra0",-0.500000,-1
02/03/2017,18,05,"York New York instagram com p BQETeihFEpaA Edbuxl4hkc 3z521cmMF3QO44k0",0.136364,1
02/03/2017,18,05,"Update Incident on 13Bus at Clifton http 511ny org EventDetails T RANSCOM ORT21077007",0.000000,0
02/03/2017,18,05,"Friday favorites 2 3 17 ctilburymakeup the naturally beautiful date look kit obsessed w the instagram com p BQEQvBugcin",0.175000,1
02/03/2017,18,05,"El Trapper Favorito Del Underground Reaparece Con Un Fuerte Tema Titulado I Grew instagram com p BQETdQMgpVu",0.000000,0
02/03/2017,18,05,"Bite Me gf df vegan Lane Coffee Bryant Park instagram com p BQETdkbjXezu Qin4EaxdqRkBVuyLya4ylh4J00",0.000000,0
02/03/2017,18,05,"Es viernes y el cuerpo lo sabe elmabreu Square Yonkers instagram com p BQETdaFDD2l",0.000000,0
02/03/2017,18,05,"macandcheese yummy carbofuel maclobsta newyork soho instagram com p BQETc4HFrqy",0.000000,0
02/03/2017,18,05,"Beautiful showroom featuring table design interiordesign LIC instagram com p BQETcp0lK74",0.850000,1
02/03/2017,18,05,"F r ne currywurst nach NYC geflogen kann man machen food foodporn streetfood berlin instagram com p BQETcNFlqEB",0.000000,0
02/03/2017,18,05,"nyfw2017 fallpresentation model rachelfox 1 hair nikiwalkerkennedy instagram com p BQETZiJAg5z",0.000000,0
02/03/2017,18,05,"Thank you for inviting me to speak to the Leadership instagram com p BQETZj4ArXxz N0UjnSFR1PvCDo7Aay1tKK241Q0",0.000000,0
02/03/2017,18,05,"Pregame captain s talk McClancy girls varsity take on Kearney instagram com p BQETZFZggWCs JE5ZbX QXPGnoNxbfYSHtiXCFE0",0.000000,0
02/03/2017,18,04,"WHY WAIT XATEAMEARLY AIR JORDAN 1 ALL STAR OG instagram com p BQETXLJAz2f",0.000000,0
02/03/2017,18,04,"This struck me as hilarious googlewhatisbodega nyc York New York instagram com p BQETW6vgma",0.318182,1
02/03/2017,18,04,"Work friends Media Group instagram com p BQETWyTF1R",0.000000,0
02/03/2017,18,04,"Almost competed my entire 33 degree run to Em s Bet you they ll lay bleeding and yell instagram com p BQETTDfgJyz",0.000000,0
02/03/2017,18,04,"Incident on 320Bus at Port Authority Bus Terminal http 511ny org EventDetails T RANSCOM ORT21078007",0.000000,0
02/03/2017,18,04,"Trey Nostalgia x ALLTHAT Shorties 13 Losing their cherries Forbidden fruit I M watching instagram com p BQETVp5ApPh",0.000000,0
02/03/2017,18,04,"Happy Friday http liketk it 2qj6S liketoknow it liketkit York New York instagram com p BQETU8TjSpM",0.468182,1
02/03/2017,18,04,"Staying Productive and Not Busy ryannoltemeyer com blog staying p roductive and not busy",-0.050000,-1
02/03/2017,18,04,"Just posted a photo New York instagram com p BQETVF1Aa I",0.136364,1
02/03/2017,18,04,"View from Work Rooftop view canonrebelt5 canonphotography instagram com p BQETSurgK2vn UJCXE0qDjKNsjWZPVqKVsDhoa40",0.000000,0
02/03/2017,18,04,"The greatest gift we can receive is to have the chance just once in our lives to make a instagram com p BQETSdMgDOa",1.000000,1
02/03/2017,18,03,"loot of the trip newyork adidas adidaswm adidaswhitemountaineering instagram com p BQETRKlFBQO",0.000000,0
02/03/2017,18,03,"MANCHESTER UNITED GIANT SUPERHERO PLAYERS POSTER Football Soccer http ebay to 1o1ecJG pic twitter com 8wXQT1u6yU",0.000000,0
02/03/2017,18,03,"Amazing day today bumbleandbumbleuniversity Bbcurlingironartistry instagram com p BQETRJaA6EU",0.600000,1
02/03/2017,18,03,"I can show you better than I can tell you SMDVISION PHOTOGRAPHY 2017 smdvisionsphotography instagram com p BQETRDYgBm1",0.500000,1
02/03/2017,18,03,"Happy Birthday to Larry Haack one of the most amazing pain in the ass in my life Not instagram com p BQETQxqAa1V",0.633333,1
02/03/2017,18,03,"Manchester United Men s Red Tee Shirt Size S Licensed Product http ebay to 29BoVFs pic twitter com DayirNTGlq",0.000000,0
02/03/2017,18,03,"Just acquired Cannondale SuperSix EVO 105 bicycle s Sheepshead Cycle in Brooklyn NY swarmapp com c d2hRTOLKess",0.000000,0
02/03/2017,18,03,"When your bf is asking what s for dinner Head Staten Island New York instagram com p BQETPjHlSYH",0.136364,1
02/03/2017,18,03,"OMW FRIDAY York New York instagram com p BQETPYAF6Dj",0.136364,1
02/03/2017,18,03,"Friday night gainz 34 Fitness Center in New York NY swarmapp com c bcKPKFXE70I",0.018182,1
02/03/2017,18,03,"Cleared Incident on 99Bus at Hillside",0.000000,0
02/03/2017,18,03,"INNSIDE NYC Friday Happy Hours with your KUNJAN COLLECTIVE DJ Select innsidebymelia instagram com p BQETOwggeDL",0.800000,1
02/03/2017,18,03,"Just posted a photo Beehive instagram com p BQETN XgzAA",0.000000,0
02/03/2017,18,03,"All Hallows vs Scalan I know I am at the wrong game lol instagram com p BQETMT AQYOb fW1lbqA2UYM2JEWQfe70zMEgCQ0",-0.033333,-1
02/03/2017,18,03,"Drinking an Estrella Damm by 46 http untp beer s c412983965",0.000000,0
02/03/2017,18,03,"America we have the money but the jerks want to spend it on the wall other selfish instagram com p BQETLokge4I",-0.312500,-1
02/03/2017,18,03,"Shawarma ousside howbow dah mamounsfalafel 7 SeoHungry s St Marks instagram com p BQETK80jWQ9",0.000000,0
02/03/2017,18,03,"Just posted a photo Beehive instagram com p BQETLAhgmKb",0.000000,0
02/03/2017,18,03,"I m at John F Kennedy International Airport in Queens NY NY swarmapp com c k4lTzIclK9l",0.000000,0
02/03/2017,18,02,"Woot Devils Zumba fitness night Center for Calgary Flames vs New Jersey Devils swarmapp com c 7NCvaTuzNE9",0.018182,1
02/03/2017,18,02,"Really loving the weather today let s hope it keeps up this weekend Check out on instagram com p BQETINGAR7r",0.600000,1
02/03/2017,18,02,"So wonderful to see s products all the way over here in the Bronx So amazing instagram com p BQETD4uAQPs",0.800000,1
02/03/2017,18,01,"I told Chuck to make a stink about Stephen Bannon s appointment to the National Security instagram com p BQETCCmAkaL",0.000000,0
02/03/2017,18,01,"Who knew delicious cheesecake grows on a tree YumO FoodPorn Dessert DateWMyChicka instagram com p BQETAzVF9 g",1.000000,1
02/03/2017,18,01,"Cleared Incident on 94Bus at Union Twp",0.000000,0
02/03/2017,18,01,"Chrome on chrome bdaymonth chromenails nyc happyhour earlypresent instagram com p BQES zkjnyR",0.000000,0
02/03/2017,18,01,"I m at in New York NY swarmapp com c 6FZfrA3FpSW",0.136364,1
02/03/2017,18,01,"Are You Ready To Slip Into Something A Little Darker Studio Square Regal Cinemas have instagram com p BQES8kRA69Q",0.006250,1
02/03/2017,18,00,"Thank you so much for taking this portrait of me in which Beyonc photoshopped instagram com p BQES7VwFGs2",0.200000,1
02/03/2017,18,00,"FiFine USB Condenser Mic K056 K058 Review Test By Bandrew Scott geeksrising com blog 2017 2 2 fifine usb condenser mic k056 k058 review test",0.000000,0
02/03/2017,18,00,"8 000 trees in 2016 thehaititreeproject org news 2017 2 3 8000 trees in 2016",0.000000,0
02/03/2017,18,00,"Vape like you stole it that f kin new new Come thru Staten islands finest full service instagram com p BQES7NclYXk",0.207576,1
02/03/2017,18,00,"found this wonderful video of a Benefit show to help the victims of the earthquake in Ecuador instagram com p BQES7ENlwzH",1.000000,1
02/03/2017,18,00,"Happy Friday Lovers It s Black History Month and I want to start it off with a sexy little instagram com p BQES5f6g6 r",0.236458,1
02/03/2017,18,00,"Good goals so lets do it street nyc goals makelovenotwar York New York instagram com p BQES6k9lusn",0.418182,1
02/03/2017,18,00,"I m at Eden Flower in New York NY swarmapp com c 7J4Ivi3nZLg",0.136364,1
02/03/2017,18,00,"A resistance latte at 663 cafes and 374 brands of coffee in 37 states are donating instagram com p BQES6H AuhW",0.000000,0
02/03/2017,18,00,"WALKINS WELCOMED ALL NIGHT 882 Broadway brooklyn Opentill MIDNIGHT 7 Days Call 718 453 6140 instagram com p BQES5ZEAdEB",0.000000,0
02/03/2017,18,00,"COZZETTE BEAUTY Ethereal Africana Makeup Photog by using Cozzette Beauty instagram com p BQES4ovAQxI",0.000000,0
02/03/2017,18,00,"Seafood Heaven thestonecatcher blessedlife BlessedKing instagram com p BQES4l0DXkRp 16grwnz pXkSDV 8Am8nhzR51s0",0.000000,0
02/03/2017,18,00,"Out my window East Manhattan instagram com p BQES4TzjkRW",0.000000,0
02/03/2017,18,00,"To my family friends followers and fellow riders Please join me in welcoming Clara as the instagram com p BQES1xzjl6w",0.000000,0
02/03/2017,18,00,"I m at Old Navy in New York NY swarmapp com c 1u8I0OH4OFY",0.118182,1
02/03/2017,18,00,"BakedMacaroni Siciliana Look at all that crustiness we get from our WoodBurningPizzaOven instagram com p BQES0zHAdLu",0.000000,0
02/03/2017,17,59,"More industrial compositions this time above my head at newarkpennstation instagram com p BQESz 9lIzp",0.250000,1
02/03/2017,17,59,"Making a ValentinesDay promo with my actor girlfriend Kuhn oneononenyc actorlife instagram com p BQESyBOFbrC",0.000000,0
02/03/2017,17,59,"Michael Davis violist nycmusicians backstage greenroommoments s Pub at The Public instagram com p BQESt8RFQpe",0.000000,0
02/03/2017,17,58,"Mexico City Mumbai Smoke Mirrors Eddie Abreu has a way with cocktails and smoke instagram com p BQESsTHlfrJ",0.000000,0
02/03/2017,17,58,"Brand new backdrop and getting ready for a week long shoot in the studio instagram com p BQESsaeAQF2",0.095455,1
02/03/2017,17,58,"Hi to you too Jack meow blacktie fancypants schmancy catsmeow kitty cats instagram com p BQESry3D3nF",0.000000,0
02/03/2017,17,58,"PL Nate Pierre LOUIS avoids the bigtree Nick Richard njhoops blackphotography http ln is www instagram com p B6qPU",0.000000,0
02/03/2017,17,58,"I m at The Coffee Shop Lounge in New York NY swarmapp com c hScg2OC08aR",0.136364,1
02/03/2017,17,58,"nyclibrary great piece of architecture Libreria publica de NY York Public Library and instagram com p BQESo7GFCdz",0.400000,1
02/03/2017,17,58,"I m at Sunnyside Yard in Sunnyside NY swarmapp com c 6k0ojxAWrOP",0.000000,0
02/03/2017,17,58,"Check out essence davenport New Business hennatattoos b We just out here doing what instagram com p BQESnMcjgEy",0.136364,1
02/03/2017,17,58,"Brian Sanders cellist nycmusicians greenroommoments s Pub at The Public instagram com p BQESm7cFnEq",0.000000,0
02/03/2017,17,58,"Aren t these vintage Butterfly Wing Pendant adorable Valentine s Gifts 11 days to vday instagram com p BQESmDtja0p",0.500000,1
02/03/2017,17,58,"I m at Museum of Modern Art MoMA in New York NY w swarmapp com c cSdOQZJwd0O",0.168182,1
02/03/2017,17,57,"This is what happens when an ADHD person decides to go grab a quick instagram com p BQESj6Ugmi8X xAa4zl4NsAPV q08WX9RXTCyro0",0.333333,1
02/03/2017,17,57,"COZZETTE BEAUTY Ethereal Africana Makeup Photog by using Cozzette Beauty instagram com p BQESi4wALvi",0.000000,0
02/03/2017,17,57,"flashbackfriday Nueva Luz Volume 1 1 Premier Issue Winter 1985 part 1 nuevaluz sophierivera instagram com p BQESiW gPgH",0.000000,0
02/03/2017,17,57,"I m at Cooper s Union in Hoboken NJ swarmapp com c l7xBOmimVAX",0.000000,0
02/03/2017,17,57,"Drinking a N Ice Chouffe by Beer And Cheese http untp beer s c412979844 photo",0.000000,0
02/03/2017,17,57,"modest barrys barrysbootcamp fitness New Collection is ModestAF sexyaf hotaf s instagram com p BQESho8DJAy",0.118182,1
02/03/2017,17,57,"Kinda veered of the path last week but I mmmmm bbbaaaaccckkkk BarberShopSippin NewBelgium instagram com p BQEShL0FH6Q",0.000000,0
02/03/2017,17,57,"It s up to you New York newyorkcity nypl empirestatebuilding todayonthescene catalogroom instagram com p BQESfsSjVsg",0.136364,1
02/03/2017,17,57,"The best meals always end with biscotti onlyatrosso Photo credit instagram com p BQESe97FXpi",1.000000,1
02/03/2017,17,56,"Ramalama bang bang Flash bang Big bang equinoxmademedoit committosomething bodyodyody instagram com p BQESdhTj5s3",0.000000,0
02/03/2017,17,56,"Yay for light skies after 5PM Daylight savings is only a month away Anyone else super excited instagram com p BQEScirF7cG",0.277083,1
02/03/2017,17,56,"snake nofilter sidewalks of Crown Heights instagram com p BQEScbFA1XJ",0.000000,0
02/03/2017,17,56,"A03706 NEW Provides that no person 62 years of age or older shall be denied occupancy in multiple dwellings no http bitly com WjCflY",0.101010,1
02/03/2017,17,56,"A little La Festa del Barolo primer with Franco Massolino While the Barolo Normale delivers instagram com p BQEScAmg1Zh",-0.187500,-1
02/03/2017,17,56,"When your new friends from Brazil are visiting NYC atlantiscruise allureoftheseas rio brazil instagram com p BQESbrvlNK0",0.136364,1
02/03/2017,17,56,"I m at MTA Subway 79th St 1 in New York NY swarmapp com c fyK6YRYv1S9 pic twitter com GKEglJFDTf",0.136364,1
02/03/2017,17,56,"Can t wait to get to club republic990 tonight so a2bwill a2bmills ca buy me mad free drinks instagram com p BQESan2FbIQ",-0.112500,-1
02/03/2017,17,56,"Say What 25 off Moroccan Oil Products tjsalon timothyjohnssalon moroccanoil instagram com p BQESaW FRXY",0.000000,0
02/03/2017,17,56,"I m at in New York NY swarmapp com c bVIkR5SFLQx",0.136364,1
02/03/2017,17,56,"everythingnewyorkcity We opened it 2 years ago and brought instagram com p BQESY3eA3xdo Nl6KKuYNm nC9vKWnFH07N4M0",0.000000,0
02/03/2017,17,56,"New Blog Post Echo Park divanunarchives com home 2017 1 31 echo park",0.136364,1
02/03/2017,17,56,"newlook NYC usa weekend York New York instagram com p BQESXJAFro",0.136364,1
02/03/2017,17,55,"Friday Truffle Shuffle parmesantrufflefries weekendgoals fingerfood Proper instagram com p BQESWnDFrbQ",0.000000,0
02/03/2017,17,55,"Making Chicken Biryani for the roommates this weekend IndianGroceries BiryaniIngredients instagram com p BQESWCAFL2z",-0.600000,-1
02/03/2017,17,55,"Restock Of Rachel Long Sleeve Get em While They re Hot 30 Click The Link In The Bio or In instagram com p BQESSOsgNu",0.100000,1
02/03/2017,17,55,"Law of Attraction and how it works for me melsaavedra com new blog 2017 2 3 law of attraction and how it works for me",0.136364,1
02/03/2017,17,55,"More examples of our design drawings We draw for our clients 3d drawing design 3dmodel instagram com p BQESRbxjDMU",0.500000,1
02/03/2017,17,55,"One of my fav spanish tapas morcilla aka bloodsausage yummy This version lamanonyc is instagram com p BQESRO7g36k",0.000000,0
02/03/2017,17,55,"Este y todos los Mi rcoles La presentaci n de Janet La Internacional de 4 10pm en Brown Sugar http ln is www instagram com p BMAh0",0.000000,0
02/03/2017,17,55,"Im scared McGoo s in Bronx NY swarmapp com c bjjaD3KrryT",0.000000,0
02/03/2017,17,55,"It s not even GameDay yet and we re prepping Super Bowl heroes SuperBowl2017 instagram com p BQESQSGDaoA",0.333333,1
02/03/2017,17,55,"When I tell you our young men love the ties and suits I mean it We spoke about C H O I C instagram com p BQESQMYgdeW",0.095833,1
02/03/2017,17,54,"I m at 231st broadway in bronx NY swarmapp com c 7fSQK0AqyVM",0.000000,0
02/03/2017,17,54,"Grandmama Allison The 100th day of school fortgreene 100days grandma instagram com p BQESPbJgMyi",0.000000,0
02/03/2017,17,54,"Incident on CLine SB from 59th Street Columbus Cir Station to Canal Street Station http 511ny org EventDetails T RANSCOM ORT21077707",0.000000,0
02/03/2017,17,54,"Snowshoe Basics What You Need to Know Before You Go mstadventures com blog 2017 2 3 snowshoe basics what you need to know before you go",0.000000,0
02/03/2017,17,54,"On set shooting a pilot so blessed to have acting work and be a working actor Thanks for instagram com p BQESN9KF0YM",0.100000,1
02/03/2017,17,54,"Amanda explains HenriMatisse inspired artwork groupcollaboration instagram com p BQESN7rgPQF1 44g72cNBs5k1D6vURFbqSb8rEI0",0.000000,0
02/03/2017,17,54,"This is so me especially at the end meet me at villa tequila bar tonight 586 Raritan Rd instagram com p BQESN04Avmv",0.000000,0
02/03/2017,17,54,"Pre Matildapalooza hair and make up complete Let s dooooo this matildabroadway instagram com p BQESMxBjvV1",0.100000,1
02/03/2017,17,54,"Gonna chill and watch my man Steve wilkos Bbq instagram com p BQESMXcAsPy",0.000000,0
02/03/2017,17,54,"flowers wip oilpainting vintagecolor instagram com p BQESMEDAPv6",0.000000,0
02/03/2017,17,54,"Tonight we setting the city on CARIBBEAN GLOW RAVE at SOB s Music by instagram com p BQESLnIlpEw",0.000000,0
02/03/2017,17,54,"ESTRENO MUNDIAL Mirate en el espejo Video Oficial instagram com p BQESLU8g5xk",0.000000,0
02/03/2017,17,54,"Chocolate Cake and Other Keys To Happiness ventipop com home chocolate cake and other keys to happiness",0.287500,1
02/03/2017,17,54,"It mean something gotta figure it out the Writing s mean instagram com p BQESJlkFQOUy 1o BB4Wes1kn4buvDGThPwI00w0",-0.312500,-1
02/03/2017,17,54,"Uncle s little girl going out too Looking flawless instagram com p BQESJjNlEMOI ZaiXZzIgAYeBdLh4Sa27rGmF2k0",0.406250,1
02/03/2017,17,54,"More stuff for the narrative illustration class York City College of Technology instagram com p BQESJNFDjjU",0.500000,1
02/03/2017,17,53,"Police Identify Suspect in Fatal Tompkins Avenue Bodega Shooting TOMPKINS AVENUE AND HART STREET NYC NewYorkCity blockast com id 589509b5bd2 9fb1cb7015e31",0.000000,0
02/03/2017,17,53,"This look was so cute African AfricanAmerican BlackExcellence BlackAndEducated instagram com p BQESFq8AFy",0.250000,1
02/03/2017,17,53,"Back like I never left s Finger Joint in New York NY swarmapp com c 4NEmJPgb9BO",0.045455,1
02/03/2017,17,53,"art godzilla cowboybebop painting follow Liberty International Airport instagram com p BQESE7TAB72",0.000000,0
02/03/2017,17,53,"welcome to a peekinsidemyday York New York instagram com p BQESE4GDmBu",0.468182,1
02/03/2017,17,53,"Sundance 2017 Review Axolotl Overkill areelofonesown com home 2017 2 3 sundance 2017 review axolotl overkill",0.000000,0
02/03/2017,17,53,"34of365 headingforthetrain eveningcommute gct grandcentral grandcentralstation instagram com p BQESETMAwbu",0.000000,0
02/03/2017,17,53,"Adi s homeschool science class which is all girls btw made slime today Orthodox instagram com p BQESD7Egqiv",-0.200000,-1
02/03/2017,17,53,"Closing time at the library The lines stretch back another instagram com p BQESCTilIpPk 252MMP1fMIO98B47pV35ZMX1oI0",0.000000,0
02/03/2017,17,53,"pic twitter com LhjeBeqo9i",0.000000,0
02/03/2017,17,53,"1405 Park Avenue Manhattan pic twitter com WOGec7wWmY",0.000000,0
02/03/2017,17,52,"Before today s shoot I had the opportunity to get a new headshot by the amazing instagram com p BQESAdGgAUa",0.368182,1
02/03/2017,17,52,"PolkPR WeekInReview Have you seen her We had some special commuters Deep instagram com p BQESACRg9q1",0.178571,1
02/03/2017,17,52,"petercampus revealed Photo projections now 30 years old are on view behindthecurtain in instagram com p BQER94JgO9b",0.100000,1
02/03/2017,17,52,"battleofendor is another starwars piece that now available through Its a big instagram com p BQER9uIApAj",0.200000,1
02/03/2017,17,52,"1st Friday party today at work They left me with an entire pitcher of Margarita What to do instagram com p BQER7Z4jTSU",0.000000,0
02/03/2017,17,52,"I m at Newark Liberty International Airport in Newark NJ swarmapp com c 3RKIULbAd9z",0.000000,0
02/03/2017,17,51,"F Kennedy International Airport instagram com p BQER5KtDcvP",0.000000,0
02/03/2017,17,51,"Glaze test was a success color pale beauty porcelain ceramic products makeup sculpture instagram com p BQER5F2AqLw",0.045000,1
02/03/2017,17,51,"Oh boy have times changed Now we find it s way more easier than instagram com p BQER4zaF4pxy acSUVBSosff3bHYpwo8kD4kzzY0",0.500000,1
02/03/2017,17,51,"Spending my Friday night getting some answers Center of Jackson Heights instagram com p BQER4QnlXLj",-0.100000,-1
02/03/2017,17,51,"Beautiful older Rioja Like Burgundy from Tempranillo We don t drink nearly enough of these instagram com p BQER3WjFTbr",0.338889,1
02/03/2017,17,51,"If any of you have any doubts as to who I love more you or my dog the answer is my dog Yes instagram com p BQER1sfA1uU",0.500000,1
02/03/2017,17,51,"NYC instagram com p BQER1rgAA b",0.000000,0
02/03/2017,17,51,"Did a lil refresh at one of my favorite projects at Walker Tower today New throw pillows in instagram com p BQERzOQFC5X",0.318182,1
02/03/2017,17,51,"Whoever it was that came up with Life Is Just A Bowl Of Cherries would have most likely also instagram com p BQERzCvFohD",0.250000,1
02/03/2017,17,51,"As o con m s fr o NYC ilovenewyork travel manhattan instagram com p BQERyxmjgO6f vzRJfGMemPJ5dD38t VRtCqEWE0",0.000000,0
02/03/2017,17,51,"I m a nasty woman https nikkimarieapparel com blog 2017 2 3 im a nasty woman",-1.000000,-1
02/03/2017,17,51,"We look for it in a girl or a boy We look for it on cars or clothes We look for it everywhere instagram com p BQERyqiAaCE",0.000000,0
02/03/2017,17,50,"nyfw2017 fallpresentation model hawadiawara hair nikiwalkerkennedy instagram com p BQERyUggTTZ",0.000000,0
02/03/2017,17,50,"WakeUpToTheJoyOfYou Mat USA instagram com p BQERyU9gJ6Y",0.000000,0
02/03/2017,17,50,"Partaking in Jesse s first New York pizza experience So good You know it s good when the instagram com p BQERxq8g5rr",0.446591,1
02/03/2017,17,50,"Chinatown nyc Town Manhattan New York City instagram com p BQERxdkgWIK",0.136364,1
02/03/2017,17,50,"NEW YORK PARIS Going home for two days then coming back haha New York men s was an instagram com p BQERw BFmvv",0.118182,1
02/03/2017,17,50,"I miss you but you always in my heart patriciafield instagram com p BQERw7cljdd",0.000000,0
02/03/2017,17,50,"Tonight back on my videodj ish certifieddope meetmeoutsidehowboutdat instagram com p BQERwr l6AM",0.000000,0
02/03/2017,17,50,"Tasting now Until 8pm diplomaticorum instagram com p BQERu7VgHie",0.000000,0
02/03/2017,17,50,"And then as the last good bye has been said and done the universe tells you it was a hell of instagram com p BQERuRylOn6",0.350000,1
02/03/2017,17,50,"Self doubt is a bitch Sometimes it s so easy to give in to that voice in your head and start instagram com p BQCPYjqgycF",0.433333,1
02/03/2017,17,50,"fern frond detail nature plants plantsofinstagram New York instagram com p BQERuFxgnP3",0.136364,1
02/03/2017,17,50,"Celebrating my bday at Stage 48 tonight alongside aggyabby also the official instagram com p BQERs ujuxe",0.000000,0
02/03/2017,17,50,"Share pile for day 1 of narrative illustration Too many to tag York City College of instagram com p BQERrz8j3AZ",0.500000,1
02/03/2017,17,50,"Ran into TheLeague and andriod at GCT heading to a meeting for instagram com p BQERr6jj9Ef",0.000000,0
02/03/2017,17,50,"We got lucky and had a celebrity sighting on our trip to the top of the Empire State Building instagram com p BQERrlmjzIc",0.416667,1
02/03/2017,17,49,"BOSS in a leather and cashmere looking fashion runway instagram com p BQERqfdARRY",0.000000,0
02/03/2017,17,49,"February 3 2016 1529 East 55th Street Old Mill Basin Brooklyn 495 000 1 unit 1 875 sf one family home",0.100000,1
02/03/2017,17,49,"APERITIVO sbagliato e Vino in New York NY swarmapp com c 3YKj5HYcHU2",0.136364,1
02/03/2017,17,49,"TONIGHT Nights instagram com p BQERm2MDTkL",0.000000,0
02/03/2017,17,49,"Layering and OTK boots are the perfect way to style a slip dress during the colder months What instagram com p BQEQciFArO8",1.000000,1
02/03/2017,17,49,"I m at The Rock NYC in Rockaway Beach NY swarmapp com c 4XK1ikM5HpM",0.000000,0
02/03/2017,17,49,"taking first turn in the Friday office rap battle instagram com p BQERi 4Fp0N0 sJ0lycsSqCS1CBNXecKZh8RD2M0",0.250000,1
02/03/2017,17,49,"Zanetti y Danielson nycmusicians nofilterneeded s Pub at The Public instagram com p BQERk90lvHk",0.000000,0
02/03/2017,17,49,"Great new stuff from Pro tip get these new combos over ice cream instagram com p BQERkXUD8CN",0.357576,1
02/03/2017,17,48,"I m gonna make this short and sweet I know you see tht girl in the post I see her instagram com p BQERjmhj4Iv",0.175000,1
02/03/2017,17,48,"Before the 1k crowd thankyou Jimmy hankrizy chinesenewyear mta party red http ln is www instagram com p mtZQc",0.000000,0
02/03/2017,17,48,"Extra hype for First Saturday tomorrow nite at Brooklyn Museum of Art and the instagram com p BQERi9RAwXq",0.125000,1
02/03/2017,17,48,"Air Prestige Class Lounge instagram com p BQERhw6DmfS",0.000000,0
02/03/2017,17,48,"And a philanthropist I might add to whoever printed this name tag York New York instagram com p BQERgoOFee1",0.136364,1
02/03/2017,17,48,"And that s a wrap Just opened our second floor and toasted this amazing and growing team instagram com p BQERgXbDwQZ",0.300000,1
02/03/2017,17,48,"Emilio Tribal pianist nycmusicians s Pub at The Public instagram com p BQERezBFYHw",0.000000,0
02/03/2017,17,48,"Ninja Turtles and Pizza what more can you want williamsburg munchies brooklyn sunflower instagram com p BQEReWjglpt",0.500000,1
02/03/2017,17,48,"Dinner in Chelsea I must say it s easy to fall in love with NYC Chelsea Restaurant instagram com p BQEReL gKUv",0.466667,1
02/03/2017,17,48,"Thank Goodness It s Friday O sol fechando com chave de ouro nossa semana Todo mundo pronto instagram com p BQEHwdMgoTk",0.000000,0
02/03/2017,17,48,"Working before the food beastmode instadaily fitness fitfam Do Fitness and Wellness instagram com p BQERdvag4eR",0.000000,0
02/03/2017,17,48,"W 53rd St New York NY kph 0m http maps google com maps q 40 7620 50 73 980660",0.136364,1
02/03/2017,17,48,"TITLE TITLE CAT IN THE HAT NEW AGE VISIONARY ENTERTAINMENT presents wallarttuesdays instagram com p BQERcjlD4fv",0.136364,1
02/03/2017,17,47,"Just posted a photo Rink at Rockefeller Center instagram com p BQERcWsgMm0",-0.100000,-1
02/03/2017,17,47,"Tapestry GreenwichVillage WestVillage NewYork NYC American RoniMazumdar SuvirSaran instagram com p BQERa92lfHi",0.000000,0
02/03/2017,17,47,"I love all my fans and supporters New Jersey instagram com p BQERaVuAJZr",0.318182,1
