Date,Hour,Minute,Tweet text,Polarity,Sentiment
02/03/2017,16,30,"I m at at Fonda Nolita in New York NY swarmapp com c 0swUlrxPObk",0.136364,1
02/03/2017,16,30,"jasmine flowers centralpark bridge winter nature newyork newyorker nycshare NYC instagram com p BQEIjj9Avlu",0.000000,0
02/03/2017,16,29,"First and Eighth Grades Ice Skating gmws org blog 2017 2 3 first and eighth grade ice skating",0.250000,1
02/03/2017,16,29,"Thank you do you wanna see what s inside the mlnyfw bag I m gonna post it to instagram com p BQEIgR gVwv",0.000000,0
02/03/2017,16,29,"egypt MET NYC Manhattan Metropolitan Museum of Art New York instagram com p BQEIf4wlNo",0.136364,1
02/03/2017,16,29,"Huntley Muir dexigner com directory deta il 27099 ArtStudios pic twitter com 2Qyr5SvxZr",0.000000,0
02/03/2017,16,29,"Incident on NewJerseyTurnpikeEasternSpur SB from Interchange 18E I 80 US 46 George Washington Bridge to South http 511ny org EventDetails T RANSCOM ORI147410501",0.000000,0
02/03/2017,16,29,"Gloomy Friday Afternoon williamsburg brooklyn coldfriday instagram com p BQEIeBUgF2ii niNA8 2RZlVBEqGZb w6xDXRpI0",0.000000,0
02/03/2017,16,29,"casanova 2x I got u BrooklynForever DONTRUNRMX LINKINMYBIO exclusive behind the scenes instagram com p BQEIdoPDO2I",-0.400000,-1
02/03/2017,16,29,"Going up watching the exposition Agnesmartin expo inshot instagram com p BQEIdmAgo40A tiMyZIWmO6zEgOi1LfPRbBPy7I0",0.000000,0
02/03/2017,16,29,"It s the weekend so keepcalm drinkbeer craftbeer beer drink bk nyc brooklyn weekend instagram com p BQEIdP6l4Lp",0.000000,0
02/03/2017,16,29,"myuleofthirds Winter longisland Washington Yacht Club instagram com p BQEIccPFiiD",0.000000,0
02/03/2017,16,29,"Like sands through the hourglass so are th SHIIIIIT Health instagram com p BQEIcYLAbpR",0.000000,0
02/03/2017,16,29,"The Starry Night ThisIsWhatICameFor The Museum of Modern Art instagram com p BQEIcTdg9ch",0.200000,1
02/03/2017,16,29,"I m at Museo Metropolitano de Arte in New York NY swarmapp com c 6yPiVP3sJO5",0.136364,1
02/03/2017,16,29,"Closing In 2017 30 X 22 watercolor and crayon on Fabriano Tiepolo art instagram com p BQEIbF D72f",0.000000,0
02/03/2017,16,29,"Repost with for bridesmaid dresses that is absolutely GENIUS instagram com p BQEIax4DElC",0.200000,1
02/03/2017,16,29,"Antes de seguir NYC Manhattan Museum of Natural History instagram com p BQEIaSjFcJ8",0.100000,1
02/03/2017,16,28,"top of the rock nyc bokeh photoshoot colors sky view travel photography photographer instagram com p BQEIZ6sA2or",0.500000,1
02/03/2017,16,28,"FACTS Get a beat from if you want to make a hit Shoot me an email at instagram com p BQEIZYDF9pK",0.000000,0
02/03/2017,16,28,"preverb Indigo Sound instagram com p BQEIYzxjLz5",0.400000,1
02/03/2017,16,28,"YugoDesigualVideoShoot VideoClip Disponible en mi canal de Youtube INDIOMARTV muy pronto instagram com p BQEIYqoFSoJ",0.000000,0
02/03/2017,16,28,"My feet fly w stars It s all just a matter of perception instagram com p BQEIXRhAZSC8 9p6d2X06azPj9xpR4ydQ 0r9JQ0",0.800000,1
02/03/2017,16,28,"Valentine s Gift Sets s Party Time LLC instagram com p BQEIWjQjWVh",0.000000,0
02/03/2017,16,28,"I m at in New York NY swarmapp com c 8CKvfr3tTZP",0.136364,1
02/03/2017,16,28,"On FEB 9th DauntlessMedia founder will be joining thedigilogue s Thought instagram com p BQEIVaMAnIM",0.000000,0
02/03/2017,16,28,"Sparkles loveisdeadmovie preproduction indie filmmaking hustle Secret Theatre instagram com p BQEIUcfAHc5",-0.200000,-1
02/03/2017,16,28,"Join us on Sunday 2 5 for Superbowl All appetizers 1 2 OFF Wings 20 Beer Pitchers Happy instagram com p BQEITxeAl8E",0.800000,1
02/03/2017,16,27,"Valentine s Day Gift Sets s Party Time LLC instagram com p BQEIR2gDVmK",0.000000,0
02/03/2017,16,27,"3 C nyc centralpark Park instagram com p BQEIRpzFIm3",0.000000,0
02/03/2017,16,27,"Party like a rockstar TrillDrill chiefivey s All Right instagram com p BQEIRKXjvAw",0.285714,1
02/03/2017,16,27,"Where to begin Tippler instagram com p BQEIQs0Annk",0.000000,0
02/03/2017,16,27,"Hey guys tune in to my Facebook page at 5 15 p m today I will be interviewed by a friend I instagram com p BQEINfcg4VL",0.000000,0
02/03/2017,16,27,"Friday feeling instagram com p BQEIP5GlRWV",0.000000,0
02/03/2017,16,27,"Sweet 16 to my Daddy I love you like Rihanna to Drake bby York New York instagram com p BQEIPl4FLzI",0.328788,1
02/03/2017,16,27,"Here s a joke for ya lol State Building instagram com p BQEIPf9FJ2s",0.800000,1
02/03/2017,16,27,"Hacia pal de dias que no salia afuera de tal manera que hasta la luz instagram com p BQEIOLHALC2o o klU7vqaqfhwKpJsAQVqxmZx00",0.000000,0
02/03/2017,16,27,"rehearsal clip warm ups 2 12 nyc lovestory music band art hiphop rnb trap instagram com p BQEIM9cFukW",0.600000,1
02/03/2017,16,27,"See you soon Orlando Liberty International Airport in Newark NJ swarmapp com c bacFBNSPl1Y",0.000000,0
02/03/2017,16,27,"Save the Date Next Sunday Feb 12th I m hosting christybomb s Heartbomb Solo show with instagram com p BQEIMccAUFm",0.000000,0
02/03/2017,16,27,"I m at in Elmont NY swarmapp com c evJ58tj5uAB",0.000000,0
02/03/2017,16,27,"Ready for game night Come join us at the bar bobssteaknyc bigsteak bigdrinks instagram com p BQEIL vFHgt",-0.100000,-1
02/03/2017,16,27,"Just posted a photo Square New York City instagram com p BQEIL3yAwM1",0.136364,1
02/03/2017,16,27,"Julian Glander dexigner com directory deta il 27098 DigitalDesigners pic twitter com VOEiG9sBQr",0.000000,0
02/03/2017,16,26,"Just posted a photo s Party Time LLC instagram com p BQEILWDjRiP",0.000000,0
02/03/2017,16,26,"Keep trim with our Skinny Caesar Romaine lettuce Parmesan 5 Grain Crouton Fat Free instagram com p BQEIKiqFbOs",0.400000,1
02/03/2017,16,26,"Grateful to represent at the event today Lucky to have such an amazing instagram com p BQEIJQIlvSZ",0.311111,1
02/03/2017,16,26,"Riding to the airport and watching the NYC skyline what an awesome sight In NJ in Linden NJ swarmapp com c 7JtfHCUUdLe",1.000000,1
02/03/2017,16,26,"Best Manhattan I ve had in my life at Union Square Cafe the other night First Danny Myer instagram com p BQEIIENDwJM",0.375000,1
02/03/2017,16,26,"Leonard by illee in IlLeeGreenpoint on view at ArtProjectsNY through Feb 18 closingsoon instagram com p BQEIH AjVei",0.000000,0
02/03/2017,16,26,"Manhattan WORLD OBSERVATORY instagram com p BQEIHpMgPbM",0.000000,0
02/03/2017,16,26,"Valentine s Day Balloons s Party Time LLC instagram com p BQEIHg7jbZx",0.000000,0
02/03/2017,16,26,"Parklife Park instagram com p BQEIHUiAWrn",0.000000,0
02/03/2017,16,26,"do you believe in Kitchen sourcery I do now",0.000000,0
02/03/2017,16,26,"dinos amnh NYC Museum of Natural History instagram com p BQEIFk8lSPK",0.100000,1
02/03/2017,16,26,"FEAT Davido DIDE PRODUCED BY GUITAR BY instagram com p BQEIE9lDP6a",0.000000,0
02/03/2017,16,25,"Que no termine m s WORLD OBSERVATORY instagram com p BQEICwRA11yE LURoBv2dqh WXcbviWdZgcR52E0",0.000000,0
02/03/2017,16,25,"Incident on NewJerseyTurnpikeWesternSpur SB from North of Interchange 15W I 280 to South of Interchange 15W http 511ny org EventDetails T RANSCOM ORI147410401",0.000000,0
02/03/2017,16,25,"top of the rock nyc bokeh photoshoot colors sky view travel photography photographer instagram com p BQEIBu7ggN",0.500000,1
02/03/2017,16,25,"GOD",0.000000,0
02/03/2017,16,25,"Ya bail Bertha Vuitton New York 5th Avenue us in New York NY swarmapp com c 5RdyRZs6pAP",0.136364,1
02/03/2017,16,25,"For the hatas FebruarysVeryOwn NY instagram com p BQEH DXDkWEa n7TbUDFLj64cCy7OiP16o1Iaco0",0.000000,0
02/03/2017,16,25,"Thank you to all of our incredible farmers and customers for the encouragement and support over instagram com p BQEH8nvlBic",0.900000,1
02/03/2017,16,25,"I am here today to show support to one of my CJBOYZ My condolence to him and his family for instagram com p BQEH89vAZgm",0.000000,0
02/03/2017,16,25,"Already got some friends hanging out LifeIsGood Thirsty Scholar NYC instagram com p BQEH8zwDLH5",0.000000,0
02/03/2017,16,24,"Sitting in the dugout Field instagram com p BQEH7qCjMinj iN465PBMFTCHHgooGkzP MpL4s0",0.000000,0
02/03/2017,16,24,"Black queens feature 2 of 3 KEVAIND FASHION STYLE ART CULTURE PHOTOGRAPHY NIKON instagram com p BQEH6uDlC j",-0.166667,-1
02/03/2017,16,24,"Lunch Burger Latergram Comfort instagram com p BQEH6f6FDbV",0.000000,0
02/03/2017,16,24,"long suede bomber S XL satin cap available at stop by and get fly instagram com p BQEH6peATWO",0.383333,1
02/03/2017,16,24,"Part three intentionally grayscale low light lux The Young Pope epi six The parlay of instagram com p BQEH2YhA4Kk",0.166667,1
02/03/2017,16,24,"Esta Noche los espero mis amigos EN EL VIERNES DE RUMBA de instagram com p BQEH4zJj8sDg N8faInPBrzWH6yV wFT7APHiLE0",0.000000,0
02/03/2017,16,24,"Just when you thought it was over The JJ Show is back See what instagram com p BQEH4ldFxKea 1QEZn6GfGnznkmna psM CFCpg0",0.000000,0
02/03/2017,16,24,"Women of Fifth Avenue newyorkcity streetphotography streetphotographer streetphoto instagram com p BQEH4CAgdgt",0.000000,0
02/03/2017,16,24,"I m at The Centurion Lounge LaGuardia in Flushing NY swarmapp com c iZGY48bU4KR",0.000000,0
02/03/2017,16,23,"Talking on the bullpen phone Field instagram com p BQEH08qDiz1p LYHYF9DcDILRXY9e fA9caPWf80",0.000000,0
02/03/2017,16,23,"masked fabulous backstage robertgeller nyfwm fashionshow malemodels x instagram com p BQEH0rvAuGk",0.400000,1
02/03/2017,16,23,"I m at LaGuardia Airport in East Elmhurst NY swarmapp com c 9UmTFsROaPt",0.000000,0
02/03/2017,16,23,"pieceoftheday necklaceoftheday jewelryoftheday jewelry designer artist staynasty etsy instagram com p BQEHzs2FbYJ",0.000000,0
02/03/2017,16,23,"Shadows in silence inshot latepost memoryreel instagram com p BQEHz4YAohoE UHcSvcj twYJepzWahBQfnxa6A0",0.000000,0
02/03/2017,16,23,"Cleared Incident on NJ20 NB at US 46 Split",0.000000,0
02/03/2017,16,23,"Grand Street subway station art manhattan newyork newyorkcity subway mta art instagram com p BQEHy9YAOcZ",0.500000,1
02/03/2017,16,23,"nyc newyork load in Here next two nights soldout tour springsteen instagram com p BQEHyhKAUas",0.000000,0
02/03/2017,16,23,"Iannelli Diamonds and the Hazan Brothers doing business together for over 20 instagram com p BQEHyhLg XL",0.000000,0
02/03/2017,16,23,"randyhetrick of trxtraining giving a keynote address at the WellnessSummit at instagram com p BQEHvrggmxf",0.000000,0
02/03/2017,16,23,"I m at Extra companies in Linden NJ swarmapp com c frKsFMIc4xo",0.000000,0
02/03/2017,16,23,"VALENTINE S PROMOTION BOOK YOUR APPOINTMENT AT 201 428 1550 D Light Spa instagram com p BQEHx49Djsi",0.400000,1
02/03/2017,16,23,"Kayden is finally growing out his hair and he wanted a tapered style Ok that was his mom s instagram com p BQEHxeZAZkG",0.250000,1
02/03/2017,16,23,"Heading home Airport in East Elmhurst NY swarmapp com c kzUdWOVMeFm",0.000000,0
02/03/2017,16,23,"Flaws makes you beautiful only if you accept them poopstyle sabiBoy Brooklyn instagram com p BQEHw1RghO7",0.425000,1
02/03/2017,16,23,"I won this super exclusive Cartier hat at my training this week Such an amazing company to work instagram com p BQEHwFdAeAN",0.311111,1
02/03/2017,16,23,"Thank Goodness It s Friday Acesse o blog para a programa o do final de semana em Nova York instagram com p BQEHwdMgoTk",0.000000,0
02/03/2017,16,23,"Raimond Van Der Goun Manchester United 63 Upper Deck 2001 Football Trade Card http ebay to 2l6ljyJ pic twitter com voLeR8Izmk",0.000000,0
02/03/2017,16,23,"Denis Irwin Manchester United 64 Upper Deck 2001 Football Trade Card http ebay to 2l6fscX pic twitter com ACoFEnrkLW",0.000000,0
02/03/2017,16,23,"Burning bridges Bridge instagram com p BQEHujHgwnL",0.000000,0
02/03/2017,16,22,"You may love football but that doesn t mean you have any business trying to play the sport instagram com p BQEHtj7DPdo",0.093750,1
02/03/2017,16,22,"Before we know it summer s going to be here getting nice and toned using the pamstrongfitness instagram com p BQEHtQFF226",0.600000,1
02/03/2017,16,22,"Yo Big Sean bodied that flex freestyle sheesh",0.000000,0
02/03/2017,16,22,"A protestor seen during the Friday Prayer Khutba Sermon at New York John F Kennedy http ln is www instagram com p y8PfB",-0.044318,-1
02/03/2017,16,22,"We are taught to never forget the events of 9 11 01 Today I had the privilege to visit the instagram com p BQEHsfPD3Gr",0.000000,0
02/03/2017,16,22,"Stage Pack Peavey available come at Reaction Musical 127 New Main St Yonkers NY 10701 instagram com p BNHjGRmDRfA",0.175758,1
02/03/2017,16,22,"Stage Pack Peavey available come at Reaction Musical 127 New Main St Yonkers NY 10701 yonkers instagram com p BNPb5oujS5X",0.175758,1
02/03/2017,16,22,"Bar Boulud nycrestaurantweek instafood foodporn food frenchrestaurant yummy Boulud instagram com p BQEHqRMlKR",0.000000,0
02/03/2017,16,22,"Brooklyn bridge De caminata por NYC Creo que es una de las ciudades m s retratadas del mundo y instagram com p BQEHqKjFee7",0.000000,0
02/03/2017,16,22,"modguy98 and I on the field taking a private tour Field instagram com p BQEHpn7DqOK1 PwdxbhlLOpFB3Pxf5T3d49x aY0",0.000000,0
02/03/2017,16,22,"Me on my way to HappyHour Friday s Afterwork 1 Shots 3 Beers 5 Drinks 6 instagram com p BQEHpXdDC1O",0.000000,0
02/03/2017,16,22,"I m proud to be at a conservatory that actively promotes empathy instagram com p BQEHoXQAVsjX qby1GPcLqjiQwTUeJa7ceoxs3s0",0.333333,1
02/03/2017,16,22,"A view of NYC Manhattan The green circle is Trumps building and the Yellownis the Empire State instagram com p BQEHnlUgLXI",-0.200000,-1
02/03/2017,16,22,"Empire State of mind ballinonabudget alwaysatourist nyc instagram com p BQEHnXSlyp2P DB40w6r kZQy7uGmkut PAvrfA0",0.000000,0
02/03/2017,16,22,"I misspoke you lost the election http toplocalnow com us new york ci ty",0.136364,1
02/03/2017,16,21,"From my walking around NYC in lingerie series over the Xmas holidays apparently anything instagram com p BQEHmBLDRL5",0.050000,1
02/03/2017,16,21,"Bad Bouje February s Finest hosted by Official birthday celebration for instagram com p BQEHldMjGNJ",-0.700000,-1
02/03/2017,16,21,"This is us aquarius blessed Heights Manhattan instagram com p BQEHlaejad",0.000000,0
02/03/2017,16,21,"Conga Quinto set with double stand available come at Reaction Musical 127 New Main St Yonkers instagram com p BPvbWg2DqMG",0.140606,1
02/03/2017,16,21,"Chance nica e s agora em fevereiro Imagine juntar as melhores ferramentas e as ltimas instagram com p BQEHkNplXYb",0.000000,0
02/03/2017,16,21,"Put yourself first jdoxology competitionprep ifbb ifpp npc inspiration training preach instagram com p BQEHkF Ax0t",0.250000,1
02/03/2017,16,21,"Just posted a photo Bay instagram com p BQEHj7SAiCC7 7fHa4mjB iLxDXy9MXaxWv 70Y0",0.000000,0
02/03/2017,16,21,"Do you actually like how you move Have you ever even asked yourself the question Do I instagram com p BQEHj3OAu F",0.000000,0
02/03/2017,16,21,"first piece of BabyHaile furniture has been assembled the first of many dadtobe instagram com p BQEHjrYDy q",0.333333,1
02/03/2017,16,21,"last piece Size medium pull up Open till 8P Clearport instagram com p BQEHjfag02S",0.000000,0
02/03/2017,16,21,"Ramen day Tonkotsu chashu pork ramen with soy bean egg corn radish scallion kale and instagram com p BQEHfORjaNU",0.000000,0
02/03/2017,16,21,"Repost with Black Girl Magic Model QueensAura MUA instagram com p BQEHhvmFnC2",0.166667,1
02/03/2017,16,21,"making beautiful music figure8recording anjelica iamanjelica newmusic beautifulmusic instagram com p BQA OTehzxf",0.850000,1
02/03/2017,16,21,"Noite fant stica na CEVA Home Church com a equipe do cianissi apresentando a pe a O jardim do instagram com p BQEHgP4FVxJ",0.000000,0
02/03/2017,16,21,"Late Bloomer 34 5 x 26 abstract art instaart beautifulday Brandon Moon talented instagram com p BQEHgdOjpBj",0.200000,1
02/03/2017,16,21,"Inspired by toiletart stuttgart Nero 3 instagram com p BQEHfkFFblZ",0.000000,0
02/03/2017,16,20,"Keep throwing those hands instagram com p BQEHbLhll8U",0.000000,0
02/03/2017,16,20,"Thank you for the yummy dessert last night at nougatine jeangeorges instagram com p BQEHbMRjYyx",0.000000,0
02/03/2017,16,20,"When you re going through old boxes of memorabilia realize you been down since day 1 WuTang instagram com p BQEHaZJFRNV",-0.027778,-1
02/03/2017,16,20,"Activo para la calle a buscar los money Concourse instagram com p BQEHaNDjm24",0.000000,0
02/03/2017,16,20,"mixing bluegoldthemovie documentary New Jersey instagram com p BQEHZ3iD2p9",0.068182,1
02/03/2017,16,20,"Part two intentionally grayscale low light lux The Young Pope epi six The parlay of power instagram com p BQEHYOjgnat",0.166667,1
02/03/2017,16,19,"Not for Facebook Fridays NotForFacebookFridays nightofathousandstevies nots 2009 photo by instagram com p BQEHX37g14g",0.000000,0
02/03/2017,16,19,"Just posted a photo Village Manhattan instagram com p BQEHXlsFZOJT x40bChKetdZ4SauPnrv0kPLhmw0",0.000000,0
02/03/2017,16,19,"Bh Motzei shabbos Join us for Avos uBonim 6 30 7 30pm Food Fun Learning and Prizes father instagram com p BQEHW5JgRib",0.300000,1
02/03/2017,16,19,"Essa semana tivemos a sorte de conversar cara a cara com os meninos do instagram com p BQEHWVqF nl",0.000000,0
02/03/2017,16,19,"Prevent Colds this Season with these Foods immuneboosting chickenbroth kefir and more instagram com p BPh16YKAxjA",0.500000,1
02/03/2017,16,19,"2 12 be there NYC music comedy improv art beats instrumentals bday nyc art instagram com p BQEHVbdlp91",0.000000,0
02/03/2017,16,19,"If you re going to embark on a collaboration with a musical avant wizard you can t go wrong instagram com p BQEHUYJl26Z",-0.250000,-1
02/03/2017,16,19,"Just posted a photo York New York instagram com p BQEHSjXligic H2MAWlU1OEdRCCWivorAa4Capk0",0.136364,1
02/03/2017,16,19,"TONIGHT NYC I m featuring for this boozy beauty on the taping of her half hour special She s instagram com p BQEHSRdF1vQ",0.095238,1
02/03/2017,16,19,"What s left of my cheesy garlic herbs crackbread brooklyn foodporn foodie fortgreene instagram com p BQEHRnUgT K",-0.250000,-1
02/03/2017,16,18,"documentary bluegoldthemovie mixing New Jersey instagram com p BQEHQPLja4R",0.068182,1
02/03/2017,16,18,"The best birthday cake haha Village instagram com p BQEHPvhDWBk",0.600000,1
02/03/2017,16,18,"Hey Hell s Kitchen let us cater your Super Bowl party 10 off all online Super Bowl orders instagram com p BQEHOJ7gqqt",0.333333,1
02/03/2017,16,18,"Just posted a photo York New York instagram com p BQEHOFxF6EQC miQoJSKJz1a2yqFH5baeCx4HHU0",0.136364,1
02/03/2017,16,18,"Incident on NJ4 WB from River Rd to NJ 17 http 511ny org EventDetails T RANSCOM ORI147410101",0.000000,0
02/03/2017,16,18,"Sangria saturday officially makes it debut to our Brooklyn location Join us tomorrow Feb 4th instagram com p BQEHNT7gCWp",0.000000,0
02/03/2017,16,18,"When a guy as smart as gives you the time of day you sit him down give him a mic instagram com p BQEHMnFjOzu",0.029365,1
02/03/2017,16,18,"90s realness fendi Versace Thrift Shop instagram com p BQEHMdqgnwK",0.000000,0
02/03/2017,16,18,"luchavilla the best naptime partner ever Avenue instagram com p BQEHL5CgUMB",1.000000,1
02/03/2017,16,18,"Take A Big Picture View Maria Panichelli Amy Kirby On Networking Hiring And Not Sweating The Small http dlvr it NHGk2q law legal pic twitter com 7DkKNMT4AK",-0.016667,-1
02/03/2017,16,18,"I m at La Piscine in New York NY swarmapp com c 1mO3SIJOcDu",0.136364,1
02/03/2017,16,18,"Friday February3 InternationalFireMaleRevue 20th Year Anniversary Tour Ladies instagram com p BQEHIl2jA1",0.000000,0
02/03/2017,16,18,"Friday fun shooting this lookbook York New York instagram com p BQEHJbFAV g",0.218182,1
02/03/2017,16,17,"Sorting Hat traffic cone 7th Ave B Q Lines instagram com p BQEHJOig4xM",0.000000,0
02/03/2017,16,17,"Ephemeral infinity Sparks of beauty traveling through time DENIBI Fall Winter 2017 instagram com p BQDyICDD2 7",0.000000,0
02/03/2017,16,17,"It was a tough morning she could barely stand or walk couldn t eat felt terrible But this instagram com p BQEHHB2g1of",-0.446296,-1
02/03/2017,16,17,"Update Incident on NJ21 NB from Exit 12 Dayton St to Exit 14 US 46 http 511ny org EventDetails T RANSCOM ORI147403301",0.000000,0
02/03/2017,16,17,"Update Incident on GardenStateParkway SB from South of Essex Toll Plaza to South of Exit 147 Clinton Ave http 511ny org EventDetails T RANSCOM ORI147406101",0.000000,0
02/03/2017,16,17,"Part one intentionally grayscale low light lux The Young Pope epi six The parlay of power instagram com p BQEHEw3gHKP",0.166667,1
02/03/2017,16,17,"Sorry for the delay but we have several winners to announce Andrew L From Fort lee NJ Cindy instagram com p BQEHEqdgH4J",-0.250000,-1
02/03/2017,16,17,"Just posted a photo World Trade Center instagram com p BQEHDVWAwyC",-0.100000,-1
02/03/2017,16,17,"Tarzan Jane 2years bronxzoo nyc Zoo instagram com p BQEHDJtjPOK",0.000000,0
02/03/2017,16,17,"Jack Sachs dexigner com directory deta il 27097 AnimationDesigners pic twitter com fM0S6pFKCr",0.000000,0
02/03/2017,16,17,"S04101 NEW Allows credit unions savings banks savings and loan associations and federal savings associations http bitly com XktGb0",0.136364,1
02/03/2017,16,17,"TOMORROW COME PARTY WITH TEAM ENTREPRENEURS MUCH MORE AT THE instagram com p BQEHCXuDy8k",0.500000,1
02/03/2017,16,16,"Thrilled to celebrate my girlfriend author lauriealbanese her new book stolenbeauty with my instagram com p BQEHCBYgxu8",0.368182,1
02/03/2017,16,16,"February3 Presents DiamondFiestaFridays Mixing It Up X963FM instagram com p BQEG kQjAAV",0.000000,0
02/03/2017,16,16,"Here s my new office for the next few months Hello Broadway anastasia broadway instagram com p BQEHAKEjNo",-0.021212,-1
02/03/2017,16,16,"It s a Busy weekend for us Team that works together stays instagram com p BQEG vrDNK4r fxjZ17ELMEac4uKMA4KMWp8pLA0",0.100000,1
02/03/2017,16,16,"for shot at stylist instagram com p BQEGpicF9fo",0.000000,0
02/03/2017,16,16,"Nyc Bridge instagram com p BQEG IA1xp",0.000000,0
02/03/2017,16,16,"Update Incident on GardenStateParkway NB from Exit 143A to Exit 153A NJ 3 http 511ny org EventDetails T RANSCOM ORI147403801",0.000000,0
02/03/2017,16,16,"Buuuurrrriiiitooooo Great Burrito in Edgewater NJ swarmapp com c lWYkY4jaE9z",0.800000,1
02/03/2017,16,15,"Romance H Koch Theater at Lincoln Center instagram com p BQEG6eIg1vz",-0.100000,-1
02/03/2017,16,15,"Update Incident on NJ20 NB at US 46 Split http 511ny org EventDetails T RANSCOM ORI147409701",0.000000,0
02/03/2017,16,15,"Cleared Incident on GardenStateParkway NB at South of Exit 149 CR 506",0.000000,0
02/03/2017,16,15,"Spiral inshot latepost memoryreel memoriesaregolden instagram com p BQEG3nkggKyW tpEU Fg3QziruJhJPRmZbx5eDE0",0.000000,0
02/03/2017,16,15,"Happy 80th Birthday anthonyhadenguest Repost with LAST NIGHT instagram com p BQEG303AC7g",0.400000,1
02/03/2017,16,15,"Today i need everyone to tune into my bro LIVEAT5MIX on the show instagram com p BQEG3WAlNbi",0.000000,0
02/03/2017,16,14,"Views ballinonabudget alwaysatourist nyc statueofliberty usa instagram com p BQEGzMLFkQ43 u3yRwZRHh1srEGTfbVLyLU6kss0",0.000000,0
02/03/2017,16,14,"I m at Two Ton Brewing in Linden NJ swarmapp com c brB7b7kaoSY",0.000000,0
02/03/2017,16,14,"lookin for One Bad Bishhh to Be The Lead Of The Next movie Drop Names Of Someone instagram com p BQEGzGKl8Jq",-0.350000,-1
02/03/2017,16,14,"shwarznegger trump job Ditmars Blvd Subway Station N Q Lines instagram com p BQEGxw2AFEb",0.000000,0
02/03/2017,16,14,"Painkiller out now ft Soundgod Enjoy runtown sarkodie instagram com p BQEGwrUgjxZ",0.400000,1
02/03/2017,16,14,"might have the hippest coolest community and marketing instagram com p BQEGv7EF1Gt6 DAJQs52 Y6E4UaQd58PENBcMNs0",0.000000,0
02/03/2017,16,14,"Immigration chasing lawyers just 1 upped ambulance ones TravelBan swarmapp com c g6EdKSRSfin pic twitter com yb2jcBIj5l",0.000000,0
02/03/2017,16,14,"Long nails don t care by Tamara black will always be 1 brookkynnails queensnails s instagram com p BQEGu8wAE2b",-0.108333,-1
02/03/2017,16,14,"Just shot with Denis of this afternoon He put on my mask hopped in a tub for instagram com p BQEGup8AWUw",0.000000,0
02/03/2017,16,14,"To hire Justin http Facebook com baitshop99 model modeling modelingagency midtown Manhattan instagram com p BQEGt48AA79",0.000000,0
02/03/2017,16,14,"I MEVERYWHERE JUST GOT MY TIMEOUT Magazine THE AVE A SNAPBACK MADE IT TO THE TIME OUT instagram com p BQEGtnaDf6t",0.000000,0
02/03/2017,16,13,"https twitter com faithevans sta tus 827619325280452609",0.000000,0
02/03/2017,16,13,"One of the best color grades I ve done Feb 24 the bro ortizcm will be releasing his instagram com p BQEGrVRANi3",1.000000,1
02/03/2017,16,13,"Just posted a photo ConneXion instagram com p BQEGrFcgU2l",0.000000,0
02/03/2017,16,13,"Yachty Loud Studios instagram com p BQEGq0nA2D8",0.100000,1
02/03/2017,16,13,"mixing bluegoldthemovie documentary New Jersey instagram com p BQEGqfRjdqz",0.068182,1
02/03/2017,16,13,"Update Incident on US19TruckRoute Both directions from Raymond Blvd to Tonnelle Circle http 511ny org EventDetails T RANSCOM ORI147404301",0.000000,0
02/03/2017,16,13,"when you get a break during rehearsal 2 12 lovestory music improv comedy nyc instagram com p BQEGmgVlkMk",0.000000,0
02/03/2017,16,13,"I m at Manny s in Brooklyn NY swarmapp com c hyfjYTp4yoe",0.000000,0
02/03/2017,16,13,"This is when the party started lastnight cocktails drinks instagram com p BQEGnqggAg2",0.000000,0
02/03/2017,16,13,"I ve added 6 more appointments to my dallas trip email me to snatch them up instagram com p BQEGnWVj3DA",0.500000,1
02/03/2017,16,13,"Been reading a lot about apple toddies this week Time to have one after my trek on this frigid instagram com p BQEGnHHgLxj",-0.900000,-1
02/03/2017,16,13,"I m at Extra companies in Linden NJ swarmapp com c k3xIMXhC6qz",0.000000,0
02/03/2017,16,13,"147 East 103rd Street Manhattan pic twitter com pvgyaTTf7y",0.000000,0
02/03/2017,16,13,"Done setting up for the trade show K Javits Convention Center in New York NY swarmapp com c 57J58GsSJqZ",0.018182,1
