Date,Hour,Minute,Tweet text,Polarity,Sentiment
07/15/2017,17,18,"Best Burger I had in a very long time at Hudson Eats Must Try instagram com p BWlP aUlgGN",0.467500,1
07/15/2017,17,18,"StylePhile what s lunch without dessert icecream made right in front of me bae was instagram com p BWlP9P5Avwh",0.285714,1
07/15/2017,17,18,"ME ON THE TRAIN EARLIER In Brooklyn instagram com p BWlP9W2AZxFp 4le98qLD5bDPNcTftfX1zIoUNE0",0.000000,0
07/15/2017,17,18,"TTENTION FREE wowfulls with ice cream LAUNCHING NEW flavor Ice instagram com p BWlA9nIleAa",0.268182,1
07/15/2017,17,18,"Today s Venue 3sixD BronxMusic LionKing tsidii Music Heritage Center instagram com p BWlP78chNe4",-0.100000,-1
07/15/2017,17,18,"Freestyle saturday simple Normal com cyphermusic laindustriahd vivalaganga instagram com p BWlP7dyBlWU",0.075000,1
07/15/2017,17,18,"Coronelli X Burg SIPTHENECTAR THEREVENANT NARCOTECHS York New York instagram com p BWlP7YCgszT",0.136364,1
07/15/2017,17,18,"I m at Courtyard New York Manhattan Times Square West in New York NY swarmapp com c 5d5WBFbBVq0",0.136364,1
07/15/2017,17,17,"Manhattan Matrix nyc urbanrealestate photography perspective interesting manhattan instagram com p BWlP6YQhoFS",0.500000,1
07/15/2017,17,17,"I m at in New York NY swarmapp com c 7pDH7wlkqdI",0.136364,1
07/15/2017,17,17,"That bond tho daughter bestie selfie snapchat snapchatfun summer summerfun instagram com p BWlP18TjvgE",0.000000,0
07/15/2017,17,17,"While in downtownjc Avenue Pedestrian Mall instagram com p BWlP1yUhSqS",0.000000,0
07/15/2017,17,17,"Thanks for replenishing elizabetharden makeupartist makeup nyc cosmetics instagram com p BWlP1nGgkkK",0.200000,1
07/15/2017,17,16,"I m at Bergenfield NJ in NJ swarmapp com c gcrUymG7Qr8",0.000000,0
07/15/2017,17,16,"Hard work beats talent when talent doesn t work hard More work in progress contemporaryart instagram com p BWlPx04lLxr",-0.027778,-1
07/15/2017,17,16,"Fim de corrida aqui em New York acabamos em P11 End of the race here in New York we finished instagram com p BWlPxLsgvOU",0.136364,1
07/15/2017,17,16,"OPENING NOWish 6 8pm Show 43 SOFT ANIMAL Curated by Daniella Hansen Location Be Fluent instagram com p BWlPw2 l84O",0.100000,1
07/15/2017,17,16,"And we re up theview hallettspoint astoria queens NYC engineering construction instagram com p BWlPxDjFUaJ",0.000000,0
07/15/2017,17,16,"What the fuck to wear tonight Same face tb with inthebestpossibleway York New York instagram com p BWlPw9yn7KL",-0.087879,-1
07/15/2017,17,16,"Essentials608 Summer RedCarpet Event Today SheBAD BallerAlert LiveMusic instagram com p BWlPwVKDyi0",0.000000,0
07/15/2017,17,16,"Pink honey ruimilk pinkhoney icecream cottoncandy cottoncandyicecream instagram com p BWlPwy4g hA",-0.100000,-1
07/15/2017,17,16,"OPENING NOWish 6 8pm Show 43 SOFT ANIMAL Curated by Daniella Hansen Location Be Fluent instagram com p BWlPwQ7FZ4T",0.100000,1
07/15/2017,17,16,"impeach45 Queens instagram com p BWlPwCpFKHM",0.000000,0
07/15/2017,17,16,"Lunchin CarbsAreLife Frisco s Grille instagram com p BWlPs1TgUxmY z3trnPZGqfuF5jfb3rCFatswEo0",0.000000,0
07/15/2017,17,16,"The Chardonnay is exquisite House New York instagram com p BWlPwAFhlGrD C9qWT HyPZxl FEY2bPi5Pscc0",0.568182,1
07/15/2017,17,16,"Ryan Chin 2020 grad with another hit in the game baseballswag compete college instagram com p BWlPvclADr3",-0.400000,-1
07/15/2017,17,16,"I Can t wait for tonight Glow with instagram com p BWlPux1nFMn",0.000000,0
07/15/2017,17,16,"Happy 10th Birthday Ariana hope you guys had an awesome time at you Cupcake Decorating Party instagram com p BWlPu sATG9",0.900000,1
07/15/2017,17,16,"Beer it s ready instagram com p BWlPuuYDKD2",0.200000,1
07/15/2017,17,16,"IIFA2017 IndianInternationalFilmAwards india York New York instagram com p BWlPuV0Htzo",0.136364,1
07/15/2017,17,16,"doitlooklikeIneededafilter Brooklyn instagram com p BWlPud9FSz6",0.000000,0
07/15/2017,17,16,"Georgia O Keeffe Living Modern at the was amazing instagram com p BWlPuEsgkyuA XU4iccvGY CBIZNkcBQJXHdzO40",0.400000,1
07/15/2017,17,16,"Happy Saturday Come enjoy 25 buckets of canned beer on our patio craftbeer cannedbeer instagram com p BWlPtd3lSIS",0.600000,1
07/15/2017,17,16,"clubfix tajlounge party nycparty nyc newyorkcity nycnightlife nightlife sexy beautiful instagram com p BWlPtYnFf5H",0.675000,1
07/15/2017,17,16,"pic twitter com 0hoTHtAMqD",0.000000,0
07/15/2017,17,16,"Nap time weeklyfluff latergram havanese havaneseofinstagram instagram com p BWlPs7EhsPk",0.000000,0
07/15/2017,17,16,"Quickly becoming one of my favorite parts of the new hood west4th NYC Fourth Street instagram com p BWlPsszhfuC",0.271591,1
07/15/2017,17,16,"This cool chick I met ABBY Quarter Tavern instagram com p BWlPs2xF986",0.350000,1
07/15/2017,17,16,"Quick snack before hittin the train soupandasangwich at in New York NY swarmapp com c e5lehq5IfRR pic twitter com V3LC6XgIOw",0.234848,1
07/15/2017,17,16,"Just posted a video Nicholas Park instagram com p BWlPsFAlb7PV ebhRpaNkQnYObsQdaEJBJ2khuk0",0.000000,0
07/15/2017,17,16,"Excited to announce my Official 100ThingsNewark Book Release Party Tuesday August 15 2017 instagram com p BWlPsrsgmTf",0.375000,1
07/15/2017,17,15,"Drinking a Pale Ale by s Beer Culture http untp beer s c478439558",-0.210000,-1
07/15/2017,17,15,"Saturday s are for Smorg East River Park instagram com p BWlPrBplFlw",0.000000,0
07/15/2017,17,15,"New Flavor alert Strawberry Strawberry Basil Swirl Our super refreshing collab with instagram com p BWlPrXylfM",0.323232,1
07/15/2017,17,15,"42 Mo better Blues York New York instagram com p BWlPqnVl cp IeDPleIVkRdDXNdy41PYcETUDc0",0.318182,1
07/15/2017,17,15,"It never gets easier you just go faster amen Greg McLeod riding 50 miles today was instagram com p BWlPqk3B8GL",0.000000,0
07/15/2017,17,15,"HELLO N GOOD AFTERNOON IG ABOUT 2 WATCH THE 5 10PM SHOWING instagram com p BWlPp1JAgICQ Lq7 cVPmGQe8P1G8ZpkYmXJDs0",0.700000,1
07/15/2017,17,15,"Just posted a photo Heights Brooklyn instagram com p BWlPpBDDJfG",0.000000,0
07/15/2017,17,15,"Work Liberty International Airport in Newark NJ swarmapp com c f33KWkXmVDw",0.000000,0
07/15/2017,17,15,"With Me in New York NY swarmapp com c gGAGsWnb24z",0.136364,1
07/15/2017,17,15,"Soaking it all in University Rose Hill instagram com p BWlPnt4B2Qfv ugkNIzMmJGnlMbXGlXbO MtXfM0",0.600000,1
07/15/2017,17,15,"Ice cream for the win shannoneats Bitch instagram com p BWlPlf4BQVe",0.800000,1
07/15/2017,17,15,"Coney Island Creek 5K Rave around Kaiser Park today Island Creek instagram com p BWlPlh8BuEB",0.000000,0
07/15/2017,17,14,"Brooklyn Hip Hop Fest LOXRaisedMe Brooklyn instagram com p BWlPiEeF9wA",0.000000,0
07/15/2017,17,14,"Remy Mary and Arthur s puppy loves me so much he almost swallowed instagram com p BWlPjUAAchcY PlcgtediuXyu6CsTznheFzJWpo0",0.200000,1
07/15/2017,17,14,"You and Trying to pick a movie to watch together will literally take as long as an entire movie",-0.025000,-1
07/15/2017,17,14,"Next Rooftop Day Party Saturday July 22nd 4pm 11pm at 251 W 48th St 8th Ave instagram com p BWlPjPVj2Zt",0.000000,0
07/15/2017,17,14,"Incident on GardenStateParkway NB at Bergen Toll Plaza http 511ny org EventDetails T RANSCOM ORI158856501",0.000000,0
07/15/2017,17,14,"Just posted a photo Garden instagram com p BWlPiSKlKZp",0.000000,0
07/15/2017,17,14,"With my girls Wild Wings Gateway Mall instagram com p BWlPh9hANrEL LtnrPrp8MIHpPh0ihhNeTy6A5Q0",0.100000,1
07/15/2017,17,14,"Elite KNIGHTS Basketball Team SUMMER Athletics Program FREE Athletic Program FREE Basketball instagram com p BWlPh blqOR",0.400000,1
07/15/2017,17,14,"Fun filled weekends always put a smile on my face Hope you all are having a super Saturday instagram com p BWlPhP1HQaU",0.333333,1
07/15/2017,17,14,"Oh you know just practicing self control and door manners nyc dog pets love puppy instagram com p BWlPegnF5l9",0.500000,1
07/15/2017,17,13,"Who s next barber barbershop hair jerseycity Flavor Kutz instagram com p BWlPdHalQBg",0.000000,0
07/15/2017,17,13,"Yesterday after we stuffed our faces with vegan grilled cheeses at Orchard Grocer the rain instagram com p BWlPc0 goOp",0.000000,0
07/15/2017,17,13,"NYC Washingtonsquarepark cuba brunch moresangria russo daniel rodriguez2 instagram com p BWlPcJShSN9",0.000000,0
07/15/2017,17,13,"Happy mid summer Saturday Stay present please There is no past or future Dig for great instagram com p BWlPbCGjfmN",0.287500,1
07/15/2017,17,13,"SQUAD Crab instagram com p BWlPaUVgPDS",0.000000,0
07/15/2017,17,13,"brooklyn w a giggles and Delana nyc girlsdayout bkart Park instagram com p BWlPZtoDWrW",0.000000,0
07/15/2017,17,13,"Repost A picture is worth one thousand words popotattoo double instagram com p BWlPZBbg OL",0.150000,1
07/15/2017,17,13,"Just posted a photo New York Times Square instagram com p BWlPY Ely0v yJiMYk20M EXQRdRg3JRSagM7s0",0.136364,1
07/15/2017,17,13,"I m at 1108 Oak Point Ave in New York NY swarmapp com c hpxjVhh7SUo",0.136364,1
07/15/2017,17,13,"People for miles York New York instagram com p BWlPXuHhkJF",0.136364,1
07/15/2017,17,13,"FREE Summer Workshop for Teen girls 13 18yrs Applications available at the instagram com p BWlPXTQgvdZ",0.266667,1
07/15/2017,17,13,"569 West 182nd Street Manhattan pic twitter com DG0NvdaCTI",0.000000,0
07/15/2017,17,12,"Drinking a Forever Ever by Dogs http untp beer s c478436553",0.000000,0
07/15/2017,17,12,"bts of video shoot with mbanks914 dsnbx innerscopeimages demetrius187 Harlem instagram com p BWlPUohDdn9",0.000000,0
07/15/2017,17,12,"Volume Up I love the 3 bucks 2 bags 1 me compilation video a lot York New York instagram com p BWlPT40BT6H",0.318182,1
07/15/2017,17,12,"DEJA TU STRESS YANKEESSUCKFUYIN LETS GO REDSOXNATION York New York instagram com p BWlPS6GgxLs",0.136364,1
07/15/2017,17,12,"Exactly one more month beyond excited for this one as it s my first music festival ever to instagram com p BWlJW4EDwy",0.343750,1
07/15/2017,17,12,"They so quiet it s cute nyceprix Cruise Terminal instagram com p BWlPQrSnzctM Z ht8dal1BBji3gQUjCg5wdS4k0",0.250000,1
07/15/2017,17,12,"of Liberty Ferry in New York NY w mc swarmapp com c 1GLugsAqAPz",0.136364,1
07/15/2017,17,12,"Esta Noche Morelinvita PRESENTA KLK CON KLK instagram com p BWlPQhxhElW8 j Qz xpLMAzh9qpmu2DmkS6OO40",0.000000,0
07/15/2017,17,12,"Eli s 3rd bday Bridge Park Pier 6 instagram com p BWlPPDUFqO5",0.000000,0
07/15/2017,17,12,"Just posted a photo M S World instagram com p BWlPQOIlW36",0.000000,0
07/15/2017,17,12,"Just posted a photo World Trade Center instagram com p BWlPQGWDBrLu d5YvV2HuATQVi2vL3jYw3VH2l80",-0.100000,-1
07/15/2017,17,12,"Good Fortune Asian Supermarket GoodFortune AsianSupermarket GoodFortuneAsianSupermarket instagram com p BWlPPerh9Rd",0.350000,1
07/15/2017,17,11,"25 years later and I still call them by their last names Ms Nix and Mr Hanson Oh the instagram com p BWlPN Eg2MQ",0.000000,0
07/15/2017,17,11,"Dom DeMarco is the most legendary pizzaiolo in New York if not the entire country His instagram com p BWlPNCnB3qE",0.409091,1
07/15/2017,17,11,"I m at NYC in New York NY swarmapp com c 9D99vZY0hOb",0.136364,1
07/15/2017,17,11,"Pull up la marina in a Yacht Marina instagram com p BWlPLphDS49",0.000000,0
07/15/2017,17,11,"Saturday Summer Nights Party At Space Rooftop Lounge Located 637 west 50th street New York NY instagram com p BWlPLoBFJ1l",0.136364,1
07/15/2017,17,11,"Rocking the race track at in Red Hook brassband brassandbeats formulaE racecars instagram com p BWlJ 3EAMH9",0.000000,0
07/15/2017,17,11,"Catch ya in a few weeks USA So excited to be heading back to instagram com p BWlPJt7hsAdm ZnMY1QdxI2 6z1TiDhKFnmzOac0",0.058333,1
07/15/2017,17,11,"READY FOR IIFA2017 bollywood meets hollywood shilpashetty ashwariyarai diljitdosanjh instagram com p BWlPJr5HYDg",0.200000,1
07/15/2017,17,11,"The music is waiting Britt Co Rockwood Music Hall July 27th 7 PM Photo by instagram com p BWlPJHnAFlM",0.000000,0
07/15/2017,17,11,"Found this pic of J me via chillwildlife Terrace Brooklyn instagram com p BWlPIpNlEiC",0.000000,0
07/15/2017,17,10,"BACKSTAGE WIT MY BROTHER KING PIRAGUA ONE OF THE ILLEST instagram com p BWlPHQTgyPnH x9UyVikCh5QZhLQJ y7XCMeRG80",0.000000,0
07/15/2017,17,10,"Drinking a Nooner Pilsner by s Beer Culture http untp beer s c478434558",0.000000,0
07/15/2017,17,10,"Great weather for a NY Mets win letsgomets Field instagram com p BWlPGxAgIrm",0.800000,1
07/15/2017,17,10,"These colorful cakepops are so girly girlygirl girlythings girlycakes sweetsixteenparty instagram com p BWlPG0ZgJ8l",0.300000,1
07/15/2017,17,10,"thelox stylesp jadakiss sheeklooch bkhiphopfest 2017 GrownFolksHipHop fortheculture instagram com p BWlPEx Dh9G",0.000000,0
07/15/2017,17,10,"W28st nyc manhattan w28st Hotel New York instagram com p BWlPF MB3FT",0.136364,1
07/15/2017,17,10,"Just posted a photo Square New York City instagram com p BWlPFgklHxA",0.136364,1
07/15/2017,17,10,"clubfix nycnightlife nightlife party wcw music promoter event promo club lounge nyc instagram com p BWlPFFZFjcb",0.000000,0
07/15/2017,17,10,"BastilleDay Picnic with beautiful Elena and her friends thecloisters ilovenewyork iphone6 instagram com p BWlN8ErAIAl",0.850000,1
07/15/2017,17,10,"Repost flyboygun10 get repost Radio Station instagram com p BWlPDm4jjsh",0.000000,0
07/15/2017,17,10,"OG SHIT HIGHBRIDGE WESTSIDE BX VA Bronx Bronx New York instagram com p BWlPD8kAVDi",-0.031818,-1
07/15/2017,17,10,"Just got my Red Knights Decks Designed by If you Loved The Gold instagram com p BWlPCLSjCE8",0.350000,1
07/15/2017,17,10,"Saturday adventures with the twins Hermione is unstoppable Great to see Xenia and Patrick instagram com p BWlO U2DLW",0.800000,1
07/15/2017,17,09,"Day Trippin TeamGreen BeGreatAnyway doitlooklikeigotleftoffbadandbougie instagram com p BWlO98egb4L",0.000000,0
07/15/2017,17,09,"Tonight if you wanna party uptown well is the place instagram com p BWlO90GAuXp3 sA8VnjHB80j Kvp5sckIGupgT80",0.000000,0
07/15/2017,17,09,"Arrived a bit late but what the hell lol newyorklover adventurer paganfestival NY instagram com p BWlO9B0hdm5",0.250000,1
07/15/2017,17,09,"JACQUES GREENE PS1 Contemporary Art Center in Long Island City NY swarmapp com c f9fzv1H6XEJ",0.005556,1
07/15/2017,17,09,"Good Fortune Asian Supermarket GoodFortune AsianSupermarket GoodFortuneAsianSupermarket instagram com p BWlO8FHhQl8",0.350000,1
07/15/2017,17,09,"U amiguita se ora de 3 d cadas Jajaja 30 treinta 1 friends Te quiero Mucho instagram com p BWlO6tfAXf7",0.000000,0
07/15/2017,17,09,"Coming soon suzanamae instagram com p BWlO5ixlrtv",0.000000,0
07/15/2017,17,09,"I m at and Friends in New York NY swarmapp com c 4VUex6t1UQh",0.136364,1
07/15/2017,17,09,"Se preparem vou postar fotos de NYC at o resto da minha vida Bridge instagram com p BWlO5W5D8RA",0.000000,0
07/15/2017,17,08,"Hanging out w my boy harlem charkotapher motivation instagram com p BWlO4b8h7fC",0.000000,0
07/15/2017,17,08,"Representing 1stphorm and love for NY as tagged naturalbodyinc ozonepark queens nyc instagram com p BWlO3v3gS61",0.500000,1
07/15/2017,17,08,"Tonight at bizarrebushwick gonna be like this Come through for a funky ass party and feel free instagram com p BWlO3mOnQIJ",0.400000,1
07/15/2017,17,08,"Made it to NYC Brooklyn instagram com p BWlO2zMBGc1",0.000000,0
07/15/2017,17,08,"Such a special bridal shower jadesaidyes Terrarium making and champagne here at Twig instagram com p BWlO2VbA037",0.178571,1
07/15/2017,17,08,"Caps In The City Photo by Park instagram com p BWlO0O3l2Sz",0.000000,0
07/15/2017,17,08,"Together with seeing Felix Gonz lez Torres nyc instagram com p BWlO1Q FJSC",0.000000,0
07/15/2017,17,08,"holy gelato Batman in New York NY w jefff swarmapp com c 8qW17U5nIgv",0.136364,1
07/15/2017,17,08,"Big city life York New York instagram com p BWlO025D ic4 UrWCRAxLIfj9zqf33pDTZZwao80",0.068182,1
07/15/2017,17,08,"Bazaar band live tonight at 9 originaltalent Beast Next Door Cafe Bar instagram com p BWlO0KAgC7s",0.068182,1
07/15/2017,17,08,"Sophia Davis of Fashion News at Fashion on the Hudson in Harlem fashiononthehudson fashion instagram com p BWlOzOUl27x",0.000000,0
07/15/2017,17,08,"Me and the broski Kenny matching with the Nirvana steez at Summer Stage NYC instagram com p BWlOzIYFTPf",0.000000,0
07/15/2017,17,08,"2 000 Voices for Peace Choir at Madison Square Garden singing with Hezekiah Walker instagram com p BWlOyYuhmOm",0.000000,0
07/15/2017,17,08,"Kumquat green tea Wish in New York NY swarmapp com c 9ZuzkUxtCjU",-0.031818,-1
07/15/2017,17,08,"Best Saturdays Party At Located 48 west 21st Street New York NY 10010 Doors open instagram com p BWlOxyAFSGZ",0.284091,1
07/15/2017,17,08,"Solo Child Magazine on the runway socialchange fashiononthehudson fashion magazine instagram com p BWlOxqAF3Ex",0.000000,0
07/15/2017,17,08,"Good Fortune Asian Supermarket GoodFortune AsianSupermarket GoodFortuneAsianSupermarket instagram com p BWlOxwOhMyI",0.350000,1
07/15/2017,17,07,"The lovely Prince Powder Pouffe and friends at BastilleDay Picnic thecloisters instagram com p BWlOxCMAiwV",0.500000,1
07/15/2017,17,07,"This is my new song called With Love I m Looking Up I wrote it in a time when I needed some instagram com p BWlOteagi5H",0.318182,1
07/15/2017,17,07,"Just posted a photo Central Terminal instagram com p BWlOvygj7CA",0.000000,0
07/15/2017,17,07,"zen detox saturday tranquility relaxing resting eqx equinox sports club spa interior instagram com p BWlOvXBhTqI",0.000000,0
07/15/2017,17,07,"whenwedonthavethekids lol Cocina Boricua instagram com p BWlOu3EFCwr 0VWewh9GONm9rGAlJthpu3Pvko0",0.800000,1
07/15/2017,17,07,"Brooklyn history was also built by slavery The North is not immune Park instagram com p BWlOrl4j vG",0.000000,0
07/15/2017,17,07,"If you attended last year think 2016 x 5 The turn out was MASSIVE Hate that we didn t get instagram com p BWlOuD D43V",-0.266667,-1
07/15/2017,17,07,"brooklyn roasting coffee in a vintage scenery night Roasting Company instagram com p BWlOs mg2B5",0.000000,0
07/15/2017,17,07,"Great seats baking in the Brooklyn sun Send us over cast please instagram com p BWlOsuyDQYxR 9M0WMGtoQtJ TUGU3 7WU2jXDQ0",0.800000,1
07/15/2017,17,07,"Full disclosure this was taken at intermission after Kyle whispered I don t know what s instagram com p BWlOsZNH3ZR",0.350000,1
07/15/2017,17,07,"Ran up on Joe lol Nigha aint see us pull up FOLLOW gi joe 22 And instagram com p BWlOrVXFQZr",0.800000,1
07/15/2017,17,06,"Corn bacon and bourbon dish for a friends pool party of Harrison instagram com p BWlOp4uAaDi",0.000000,0
07/15/2017,17,06,"Photo cred maggiebear1112 New York instagram com p BWlOptbnulV4 5h0m9tC55DTNbd0cEU02dH2fy00",0.136364,1
07/15/2017,17,06,"Last Picture Of Today Front View of this Vibrant Yellow Neoprene instagram com p BWlOpbchpt6x flosUz6bX 3X50YodtHbUjleVE0",0.055556,1
07/15/2017,17,06,"artichoke salmonroe nyc BobbyFlay Gato smallplates instagram com p BWlOoVul3T",0.000000,0
07/15/2017,17,06,"Get your very own customizable and adjustable Motorcycle Mall levers MCM Racing Starting at instagram com p BWlOnHAAypO",0.390000,1
07/15/2017,17,06,"Just posted a photo Broadway Show at Neil Simon Theater instagram com p BWlOm5AFpsyL l6i0TGHH3b0KS9Gvu3zAVT2IPY0",0.000000,0
07/15/2017,17,06,"Jorg Immendorff ny1pic s Auction House instagram com p BWlI dKh9iT",0.000000,0
07/15/2017,17,06,"I m at 189 Schermerhorn in Brooklyn NY swarmapp com c d6gNLpZqUgU",0.000000,0
07/15/2017,17,06,"Dancing in the most amazing classroom ever Those windows are my dream window Oh wow I ll miss instagram com p BWlOk2gHDwU",0.400000,1
07/15/2017,17,06,"Yonkers NY Sat Jul 15th PM Forecast TONIGHT Clearing Lo 69 SUNDAY Sunny Hi 89",0.000000,0
07/15/2017,17,06,"Woodside NY Sat Jul 15th PM Forecast TONIGHT Partly Cloudy Lo 31 SATURDAY Sunny Hi 41",0.000000,0
07/15/2017,17,06,"Williamsbridge NY Sat Jul 15th PM Forecast TONIGHT Clearing Lo 69 SUNDAY Sunny Hi 89",0.000000,0
07/15/2017,17,06,"Comprar revistas y tirarse en parques picoftheday centralpark green prince bluesky nyc instagram com p BWlOj13nwsW",-0.200000,-1
07/15/2017,17,06,"West Farms NY Sat Jul 15th PM Forecast TONIGHT Clearing Lo 69 SUNDAY Sunny Hi 89",0.000000,0
07/15/2017,17,06,"We live in a society that wants to put women against each other and it s our job to resist the instagram com p BWlOjocl3bL",0.070455,1
07/15/2017,17,06,"Wakefield NY Sat Jul 15th PM Forecast TONIGHT Clearing Lo 69 SUNDAY Sunny Hi 89",0.000000,0
07/15/2017,17,06,"Van Cott NY Sat Jul 15th PM Forecast TONIGHT Clearing Lo 69 SUNDAY Sunny Hi 89",0.000000,0
07/15/2017,17,06,"University Heights NY Sat Jul 15th PM Forecast TONIGHT Clearing Lo 70 SUNDAY Sunny Hi 89",0.000000,0
07/15/2017,17,06,"Staten Island NY Sat Jul 15th PM Forecast TONIGHT Clearing Lo 70 SUNDAY Sunny Hi 89",0.000000,0
07/15/2017,17,06,"Spuyten Duyvil NY Sat Jul 15th PM Forecast TONIGHT Clearing Lo 70 SUNDAY Sunny Hi 89",0.000000,0
07/15/2017,17,05,"South Richmond Hill NY Sat Jul 15th PM Forecast TONIGHT Partly Cloudy Lo 31 SATURDAY Sunny Hi 41",0.000000,0
07/15/2017,17,05,"Rochdale Village NY Sat Jul 15th PM Forecast TONIGHT Partly Cloudy Lo 31 SATURDAY Sunny Hi 41",0.000000,0
07/15/2017,17,05,"Rochdale NY Sat Jul 15th PM Forecast TONIGHT Partly Cloudy Lo 31 SATURDAY Sunny Hi 41",0.000000,0
07/15/2017,17,05,"Riverdale NY Sat Jul 15th PM Forecast TONIGHT Clearing Lo 69 SUNDAY Sunny Hi 89",0.000000,0
07/15/2017,17,05,"Ridgewood NY Sat Jul 15th PM Forecast TONIGHT Clearing Lo 71 SUNDAY Sunny Hi 89",0.000000,0
07/15/2017,17,05,"Queens NY Sat Jul 15th PM Forecast TONIGHT Partly Cloudy Lo 31 SATURDAY Sunny Hi 41",0.000000,0
07/15/2017,17,05,"Parkside NY Sat Jul 15th PM Forecast TONIGHT Partly Cloudy Lo 31 SATURDAY Sunny Hi 41",0.000000,0
07/15/2017,17,05,"I was going to work on a bunch of patterns today but I fell asleep and took a nap instead This instagram com p BWlOhVEHeej",0.000000,0
07/15/2017,17,05,"New York NY Sat Jul 15th PM Forecast TONIGHT Clearing Lo 70 SUNDAY Sunny Hi 89",0.136364,1
07/15/2017,17,05,"Mosholu NY Sat Jul 15th PM Forecast TONIGHT Clearing Lo 69 SUNDAY Sunny Hi 89",0.000000,0
07/15/2017,17,05,"Morrisania NY Sat Jul 15th PM Forecast TONIGHT Clearing Lo 69 SUNDAY Sunny Hi 89",0.000000,0
07/15/2017,17,05,"Manhattan NY Sat Jul 15th PM Forecast TONIGHT Clearing Lo 70 SUNDAY Sunny Hi 89",0.000000,0
07/15/2017,17,05,"Linden Hill NY Sat Jul 15th PM Forecast TONIGHT Clearing Lo 71 SUNDAY Sunny Hi 89",0.000000,0
07/15/2017,17,05,"StrykeQuestEsq Door Tavern NYC instagram com p BWlOgJTB8f9",0.000000,0
07/15/2017,17,05,"Jamaica Estates NY Sat Jul 15th PM Forecast TONIGHT Partly Cloudy Lo 31 SATURDAY Sunny Hi 41",0.000000,0
07/15/2017,17,05,"Jamaica NY Sat Jul 15th PM Forecast TONIGHT Partly Cloudy Lo 31 SATURDAY Sunny Hi 41",0.000000,0
07/15/2017,17,05,"Jackson Heights NY Sat Jul 15th PM Forecast TONIGHT Partly Cloudy Lo 31 SATURDAY Sunny Hi 41",0.000000,0
07/15/2017,17,05,"Hillside NY Sat Jul 15th PM Forecast TONIGHT Clearing Lo 69 SUNDAY Sunny Hi 89",0.000000,0
07/15/2017,17,05,"Highbridge NY Sat Jul 15th PM Forecast TONIGHT Clearing Lo 70 SUNDAY Sunny Hi 89",0.000000,0
07/15/2017,17,05,"Glendale NY Sat Jul 15th PM Forecast TONIGHT Partly Cloudy Lo 31 SATURDAY Sunny Hi 41",0.000000,0
07/15/2017,17,05,"Fresh Pond NY Sat Jul 15th PM Forecast TONIGHT Partly Cloudy Lo 31 SATURDAY Sunny Hi 41",0.300000,1
07/15/2017,17,05,"Forest Hills NY Sat Jul 15th PM Forecast TONIGHT Partly Cloudy Lo 31 SATURDAY Sunny Hi 41",0.000000,0
07/15/2017,17,05,"Flushing NY Sat Jul 15th PM Forecast TONIGHT Partly Cloudy Lo 31 SATURDAY Sunny Hi 41",0.000000,0
07/15/2017,17,05,"Far Rockaway NY Sat Jul 15th PM Forecast TONIGHT Partly Cloudy Lo 31 SATURDAY Sunny Hi 41",0.100000,1
07/15/2017,17,05,"Repost Now Serving alementary Hackensack NJ followthesmoke Jersey local instagram com p BWlOewnF2RR",0.000000,0
07/15/2017,17,05,"Esplanade NY Sat Jul 15th PM Forecast TONIGHT Clearing Lo 69 SUNDAY Sunny Hi 89",0.000000,0
07/15/2017,17,05,"Elmhurst NY Sat Jul 15th PM Forecast TONIGHT Partly Cloudy Lo 31 SATURDAY Sunny Hi 41",0.000000,0
07/15/2017,17,05,"Desperate times 1984 Theatre instagram com p BWlOd6PAJpl",-0.600000,-1
07/15/2017,17,05,"Crotona Park NY Sat Jul 15th PM Forecast TONIGHT Clearing Lo 69 SUNDAY Sunny Hi 89",0.000000,0
07/15/2017,17,05,"Repost Look 5 resort18 lookbook nelsontavareznt fashiondesigner instagram com p BWlOd3njym6",0.000000,0
07/15/2017,17,05,"Corona NY Sat Jul 15th PM Forecast TONIGHT Partly Cloudy Lo 31 SATURDAY Sunny Hi 41",0.000000,0
07/15/2017,17,05,"Brooklyn NY Sat Jul 15th PM Forecast TONIGHT Clearing Lo 71 SUNDAY Sunny Hi 89",0.000000,0
07/15/2017,17,05,"I m at in Brooklyn NY swarmapp com c ifkL1s8m1Mk",0.000000,0
07/15/2017,17,05,"Bronx NY Sat Jul 15th PM Forecast TONIGHT Clearing Lo 69 SUNDAY Sunny Hi 89",0.000000,0
07/15/2017,17,05,"Briarwood NY Sat Jul 15th PM Forecast TONIGHT Partly Cloudy Lo 31 SATURDAY Sunny Hi 41",0.000000,0
07/15/2017,17,05,"Baychester NY Sat Jul 15th PM Forecast TONIGHT Clearing Lo 69 SUNDAY Sunny Hi 89",0.000000,0
07/15/2017,17,05,"Finally Saturday and My Homie Knows weekends saturday homeboy drinks rumba instagram com p BWlOcU8hir1",0.000000,0
07/15/2017,17,05,"Allerton NY Sat Jul 15th PM Forecast TONIGHT Clearing Lo 69 SUNDAY Sunny Hi 89",0.000000,0
07/15/2017,17,05,"3pm show with Thrilldriver Music Hall instagram com p BWlOcUvlAM3",0.000000,0
07/15/2017,17,05,"Woodcliff NJ Sat Jul 15th PM Forecast TONIGHT Clearing Lo 69 SUNDAY Sunny Hi 89",0.000000,0
07/15/2017,17,05,"West New York NJ Sat Jul 15th PM Forecast TONIGHT Clearing Lo 69 SUNDAY Sunny Hi 89",0.136364,1
07/15/2017,17,04,"Union City NJ Sat Jul 15th PM Forecast TONIGHT Clearing Lo 69 SUNDAY Sunny Hi 89",0.000000,0
07/15/2017,17,04,"Tyler Park NJ Sat Jul 15th PM Forecast TONIGHT Clearing Lo 69 SUNDAY Sunny Hi 89",0.000000,0
07/15/2017,17,04,"Taurus NJ Sat Jul 15th PM Forecast TONIGHT Clearing Lo 69 SUNDAY Sunny Hi 89",0.000000,0
07/15/2017,17,04,"Summit Avenue NJ Sat Jul 15th PM Forecast TONIGHT Clearing Lo 69 SUNDAY Sunny Hi 89",0.000000,0
07/15/2017,17,04,"Gabriel s Christening J Pine Restaurant instagram com p BWlObGHhlAzN VZcOGybkdAW2wxUcKo9se4YDCw0",0.000000,0
